saved_logs/1000trials/0.6local-pop-2023-03-28/1/autoscheduler/2080ti/resnet_50-B1-float32.json
{"i": [["[\"4b23b0dc1d1164f464c7f5544479ae4d\", [1, 28, 28, 512], [1, 1, 512, 1024], [1, 1, 1, 1024], [1, 14, 14, 1024]]", "cuda -keys=cuda,gpu -arch=sm_75 -max_num_threads=1024 -model=2080ti -thread_warp_size=32", [-1, 16, 64, 49152, 2147483647, 1024, 8, 32], "", 0, []], [[], [["SP", 3, 0, 1, [1, 1, 1, 1], 1], ["SP", 3, 5, 14, [1, 7, 1, 1], 1], ["SP", 3, 10, 14, [1, 7, 1, 1], 1], ["SP", 3, 15, 1024, [1, 1, 4, 2], 1], ["SP", 3, 20, 1, [1, 1], 1], ["SP", 3, 23, 1, [1, 1], 1], ["SP", 3, 26, 512, [1, 4], 1], ["RE", 3, [0, 5, 10, 15, 1, 6, 11, 16, 2, 7, 12, 17, 20, 23, 26, 21, 24, 27, 3, 8, 13, 18, 22, 25, 28, 4, 9, 14, 19]], ["FSP", 5, 0, 0, 3], ["FSP", 5, 4, 1, 3], ["FSP", 5, 8, 2, 3], ["FSP", 5, 12, 3, 3], ["RE", 5, [0, 4, 8, 12, 1, 5, 9, 13, 2, 6, 10, 14, 3, 7, 11, 15]], ["CA", 3, 5, 11], ["CHR", 2, "shared", [3]], ["CA", 3, 4, 14], ["CHR", 1, "shared", [4]], ["CA", 2, 5, 14], ["CI", 1], ["FU", 7, [0, 1, 2, 3]], ["AN", 7, 0, 5], ["FU", 7, [1, 2, 3, 4]], ["AN", 7, 1, 4], ["FU", 7, [2, 3, 4, 5]], ["AN", 7, 2, 6], ["FU", 4, [0, 1, 2, 3]], ["SP", 4, 0, 32, [1], 1], ["AN", 4, 1, 2], ["FFSP", 4, 0, [3, 2, 1, 0], 1, 1], ["AN", 4, 1, 6], ["FU", 2, [0, 1, 2, 3]], ["SP", 2, 0, 4, [1], 1], ["AN", 2, 1, 2], ["FFSP", 2, 0, [3, 2, 1, 0], 1, 1], ["AN", 2, 1, 6], ["PR", 5, 0, "auto_unroll_max_step$0"]]]], "r": [[0.000452832], 0, 1.7927, 1680127131], "v": "v0.6"}
{"i": [["[\"4b23b0dc1d1164f464c7f5544479ae4d\", [1, 28, 28, 512], [1, 1, 512, 1024], [1, 1, 1, 1024], [1, 14, 14, 1024]]", "cuda -keys=cuda,gpu -arch=sm_75 -max_num_threads=1024 -model=2080ti -thread_warp_size=32", [-1, 16, 64, 49152, 2147483647, 1024, 8, 32], "", 0, []], [[], [["SP", 3, 0, 1, [1, 1, 1, 1], 1], ["SP", 3, 5, 14, [1, 2, 1, 1], 1], ["SP", 3, 10, 14, [1, 14, 1, 1], 1], ["SP", 3, 15, 1024, [2, 32, 8, 1], 1], ["SP", 3, 20, 1, [1, 1], 1], ["SP", 3, 23, 1, [1, 1], 1], ["SP", 3, 26, 512, [4, 2], 1], ["RE", 3, [0, 5, 10, 15, 1, 6, 11, 16, 2, 7, 12, 17, 20, 23, 26, 21, 24, 27, 3, 8, 13, 18, 22, 25, 28, 4, 9, 14, 19]], ["FSP", 5, 0, 0, 3], ["FSP", 5, 4, 1, 3], ["FSP", 5, 8, 2, 3], ["FSP", 5, 12, 3, 3], ["RE", 5, [0, 4, 8, 12, 1, 5, 9, 13, 2, 6, 10, 14, 3, 7, 11, 15]], ["CA", 3, 5, 11], ["CHR", 2, "shared", [3]], ["CA", 3, 4, 14], ["CHR", 1, "shared", [4]], ["CA", 2, 5, 14], ["CI", 1], ["FU", 7, [0, 1, 2, 3]], ["AN", 7, 0, 5], ["FU", 7, [1, 2, 3, 4]], ["AN", 7, 1, 4], ["FU", 7, [2, 3, 4, 5]], ["AN", 7, 2, 6], ["FU", 4, [0, 1, 2, 3]], ["SP", 4, 0, 64, [1], 1], ["AN", 4, 1, 2], ["FFSP", 4, 0, [3, 2, 1, 0], 1, 1], ["AN", 4, 1, 6], ["FU", 2, [0, 1, 2, 3]], ["SP", 2, 0, 8, [1], 1], ["AN", 2, 1, 2], ["FFSP", 2, 0, [3, 2, 1, 0], 1, 1], ["AN", 2, 1, 6], ["PR", 5, 0, "auto_unroll_max_step$1024"]]]], "r": [[0.000428867], 0, 2.46954, 1680127132], "v": "v0.6"}
{"i": [["[\"4b23b0dc1d1164f464c7f5544479ae4d\", [1, 28, 28, 512], [1, 1, 512, 1024], [1, 1, 1, 1024], [1, 14, 14, 1024]]", "cuda -keys=cuda,gpu -arch=sm_75 -max_num_threads=1024 -model=2080ti -thread_warp_size=32", [-1, 16, 64, 49152, 2147483647, 1024, 8, 32], "", 0, []], [[], [["SP", 3, 0, 1, [1, 1, 1, 1], 1], ["SP", 3, 5, 14, [1, 1, 1, 7], 1], ["SP", 3, 10, 14, [1, 1, 1, 7], 1], ["SP", 3, 15, 1024, [1, 512, 1, 1], 1], ["SP", 3, 20, 1, [1, 1], 1], ["SP", 3, 23, 1, [1, 1], 1], ["SP", 3, 26, 512, [1, 8], 1], ["RE", 3, [0, 5, 10, 15, 1, 6, 11, 16, 2, 7, 12, 17, 20, 23, 26, 21, 24, 27, 3, 8, 13, 18, 22, 25, 28, 4, 9, 14, 19]], ["FSP", 5, 0, 0, 3], ["FSP", 5, 4, 1, 3], ["FSP", 5, 8, 2, 3], ["FSP", 5, 12, 3, 3], ["RE", 5, [0, 4, 8, 12, 1, 5, 9, 13, 2, 6, 10, 14, 3, 7, 11, 15]], ["CA", 3, 5, 11], ["CHR", 2, "shared", [3]], ["CA", 3, 4, 14], ["CHR", 1, "shared", [4]], ["CA", 2, 5, 14], ["CI", 1], ["FU", 7, [0, 1, 2, 3]], ["AN", 7, 0, 5], ["FU", 7, [1, 2, 3, 4]], ["AN", 7, 1, 4], ["FU", 7, [2, 3, 4, 5]], ["AN", 7, 2, 6], ["FU", 4, [0, 1, 2, 3]], ["SP", 4, 0, 16, [1], 1], ["AN", 4, 1, 2], ["FFSP", 4, 0, [3, 2, 1, 0], 1, 1], ["AN", 4, 1, 6], ["FU", 2, [0, 1, 2, 3]], ["SP", 2, 0, 104, [1], 1], ["AN", 2, 1, 2], ["FFSP", 2, 0, [3, 2, 1, 0], 1, 1], ["AN", 2, 1, 6], ["PR", 5, 0, "auto_unroll_max_step$16"]]]], "r": [[0.00030814], 0, 1.96161, 1680127133], "v": "v0.6"}
{"i": [["[\"4b23b0dc1d1164f464c7f5544479ae4d\", [1, 28, 28, 512], [1, 1, 512, 1024], [1, 1, 1, 1024], [1, 14, 14, 1024]]", "cuda -keys=cuda,gpu -arch=sm_75 -max_num_threads=1024 -model=2080ti -thread_warp_size=32", [-1, 16, 64, 49152, 2147483647, 1024, 8, 32], "", 0, []], [[], [["SP", 3, 0, 1, [1, 1, 1, 1], 1], ["SP", 3, 5, 14, [1, 7, 1, 1], 1], ["SP", 3, 10, 14, [7, 2, 1, 1], 1], ["SP", 3, 15, 1024, [1, 1, 256, 2], 1], ["SP", 3, 20, 1, [1, 1], 1], ["SP", 3, 23, 1, [1, 1], 1], ["SP", 3, 26, 512, [4, 2], 1], ["RE", 3, [0, 5, 10, 15, 1, 6, 11, 16, 2, 7, 12, 17, 20, 23, 26, 21, 24, 27, 3, 8, 13, 18, 22, 25, 28, 4, 9, 14, 19]], ["FSP", 5, 0, 0, 3], ["FSP", 5, 4, 1, 3], ["FSP", 5, 8, 2, 3], ["FSP", 5, 12, 3, 3], ["RE", 5, [0, 4, 8, 12, 1, 5, 9, 13, 2, 6, 10, 14, 3, 7, 11, 15]], ["CA", 3, 5, 11], ["CHR", 2, "shared", [3]], ["CA", 3, 4, 14], ["CHR", 1, "shared", [4]], ["CA", 2, 5, 14], ["CI", 1], ["FU", 7, [0, 1, 2, 3]], ["AN", 7, 0, 5], ["FU", 7, [1, 2, 3, 4]], ["AN", 7, 1, 4], ["FU", 7, [2, 3, 4, 5]], ["AN", 7, 2, 6], ["FU", 4, [0, 1, 2, 3]], ["SP", 4, 0, 128, [4], 1], ["AN", 4, 1, 2], ["FFSP", 4, 0, [3, 2, 1, 0], 1, 1], ["AN", 4, 1, 6], ["FU", 2, [0, 1, 2, 3]], ["SP", 2, 0, 8, [1], 1], ["AN", 2, 1, 2], ["FFSP", 2, 0, [3, 2, 1, 0], 1, 1], ["AN", 2, 1, 6], ["PR", 5, 0, "auto_unroll_max_step$16"]]]], "r": [[0.0178529], 0, 1.72188, 1680127134], "v": "v0.6"}
{"i": [["[\"4b23b0dc1d1164f464c7f5544479ae4d\", [1, 28, 28, 512], [1, 1, 512, 1024], [1, 1, 1, 1024], [1, 14, 14, 1024]]", "cuda -keys=cuda,gpu -arch=sm_75 -max_num_threads=1024 -model=2080ti -thread_warp_size=32", [-1, 16, 64, 49152, 2147483647, 1024, 8, 32], "", 0, []], [[], [["SP", 3, 0, 1, [1, 1, 1, 1], 1], ["SP", 3, 5, 14, [7, 1, 1, 2], 1], ["SP", 3, 10, 14, [1, 2, 7, 1], 1], ["SP", 3, 15, 1024, [2, 16, 8, 2], 1], ["SP", 3, 20, 1, [1, 1], 1], ["SP", 3, 23, 1, [1, 1], 1], ["SP", 3, 26, 512, [2, 2], 1], ["RE", 3, [0, 5, 10, 15, 1, 6, 11, 16, 2, 7, 12, 17, 20, 23, 26, 21, 24, 27, 3, 8, 13, 18, 22, 25, 28, 4, 9, 14, 19]], ["FSP", 5, 0, 0, 3], ["FSP", 5, 4, 1, 3], ["FSP", 5, 8, 2, 3], ["FSP", 5, 12, 3, 3], ["RE", 5, [0, 4, 8, 12, 1, 5, 9, 13, 2, 6, 10, 14, 3, 7, 11, 15]], ["CA", 3, 5, 11], ["CHR", 2, "shared", [3]], ["CA", 3, 4, 14], ["CHR", 1, "shared", [4]], ["CA", 2, 5, 14], ["CI", 1], ["FU", 7, [0, 1, 2, 3]], ["AN", 7, 0, 5], ["FU", 7, [1, 2, 3, 4]], ["AN", 7, 1, 4], ["FU", 7, [2, 3, 4, 5]], ["AN", 7, 2, 6], ["FU", 4, [0, 1, 2, 3]], ["SP", 4, 0, 64, [1], 1], ["AN", 4, 1, 2], ["FFSP", 4, 0, [3, 2, 1, 0], 1, 1], ["AN", 4, 1, 6], ["FU", 2, [0, 1, 2, 3]], ["SP", 2, 0, 156, [1], 1], ["AN", 2, 1, 2], ["FFSP", 2, 0, [3, 2, 1, 0], 1, 1], ["AN", 2, 1, 6], ["PR", 5, 0, "auto_unroll_max_step$512"]]]], "r": [[0.00900855], 0, 6.43715, 1680127134], "v": "v0.6"}
{"i": [["[\"4b23b0dc1d1164f464c7f5544479ae4d\", [1, 28, 28, 512], [1, 1, 512, 1024], [1, 1, 1, 1024], [1, 14, 14, 1024]]", "cuda -keys=cuda,gpu -arch=sm_75 -max_num_threads=1024 -model=2080ti -thread_warp_size=32", [-1, 16, 64, 49152, 2147483647, 1024, 8, 32], "", 0, []], [[], [["SP", 3, 0, 1, [1, 1, 1, 1], 1], ["SP", 3, 5, 14, [1, 1, 1, 14], 1], ["SP", 3, 10, 14, [1, 7, 2, 1], 1], ["SP", 3, 15, 1024, [4, 8, 8, 4], 1], ["SP", 3, 20, 1, [1, 1], 1], ["SP", 3, 23, 1, [1, 1], 1], ["SP", 3, 26, 512, [2, 1], 1], ["RE", 3, [0, 5, 10, 15, 1, 6, 11, 16, 2, 7, 12, 17, 20, 23, 26, 21, 24, 27, 3, 8, 13, 18, 22, 25, 28, 4, 9, 14, 19]], ["FSP", 5, 0, 0, 3], ["FSP", 5, 4, 1, 3], ["FSP", 5, 8, 2, 3], ["FSP", 5, 12, 3, 3], ["RE", 5, [0, 4, 8, 12, 1, 5, 9, 13, 2, 6, 10, 14, 3, 7, 11, 15]], ["CA", 3, 5, 11], ["CHR", 2, "shared", [3]], ["CA", 3, 4, 14], ["CHR", 1, "shared", [4]], ["CA", 2, 5, 14], ["CI", 1], ["FU", 7, [0, 1, 2, 3]], ["AN", 7, 0, 5], ["FU", 7, [1, 2, 3, 4]], ["AN", 7, 1, 4], ["FU", 7, [2, 3, 4, 5]], ["AN", 7, 2, 6], ["FU", 4, [0, 1, 2, 3]], ["SP", 4, 0, 64, [8], 1], ["AN", 4, 1, 2], ["FFSP", 4, 0, [3, 2, 1, 0], 1, 1], ["AN", 4, 1, 6], ["FU", 2, [0, 1, 2, 3]], ["SP", 2, 0, 54, [1], 1], ["AN", 2, 1, 2], ["FFSP", 2, 0, [3, 2, 1, 0], 1, 1], ["AN", 2, 1, 6], ["PR", 5, 0, "auto_unroll_max_step$0"]]]], "r": [[0.0180824], 0, 2.8003, 1680127135], "v": "v0.6"}
{"i": [["[\"4b23b0dc1d1164f464c7f5544479ae4d\", [1, 28, 28, 512], [1, 1, 512, 1024], [1, 1, 1, 1024], [1, 14, 14, 1024]]", "cuda -keys=cuda,gpu -arch=sm_75 -max_num_threads=1024 -model=2080ti -thread_warp_size=32", [-1, 16, 64, 49152, 2147483647, 1024, 8, 32], "", 0, []], [[], [["SP", 3, 0, 1, [1, 1, 1, 1], 1], ["SP", 3, 5, 14, [1, 7, 1, 1], 1], ["SP", 3, 10, 14, [1, 2, 1, 1], 1], ["SP", 3, 15, 1024, [2, 16, 2, 2], 1], ["SP", 3, 20, 1, [1, 1], 1], ["SP", 3, 23, 1, [1, 1], 1], ["SP", 3, 26, 512, [1, 32], 1], ["RE", 3, [0, 5, 10, 15, 1, 6, 11, 16, 2, 7, 12, 17, 20, 23, 26, 21, 24, 27, 3, 8, 13, 18, 22, 25, 28, 4, 9, 14, 19]], ["FSP", 5, 0, 0, 3], ["FSP", 5, 4, 1, 3], ["FSP", 5, 8, 2, 3], ["FSP", 5, 12, 3, 3], ["RE", 5, [0, 4, 8, 12, 1, 5, 9, 13, 2, 6, 10, 14, 3, 7, 11, 15]], ["CA", 3, 5, 11], ["CHR", 2, "shared", [3]], ["CA", 3, 4, 14], ["CHR", 1, "shared", [4]], ["CA", 2, 5, 14], ["CI", 1], ["FU", 7, [0, 1, 2, 3]], ["AN", 7, 0, 5], ["FU", 7, [1, 2, 3, 4]], ["AN", 7, 1, 4], ["FU", 7, [2, 3, 4, 5]], ["AN", 7, 2, 6], ["FU", 4, [0, 1, 2, 3]], ["SP", 4, 0, 128, [1], 1], ["AN", 4, 1, 2], ["FFSP", 4, 0, [3, 2, 1, 0], 1, 1], ["AN", 4, 1, 6], ["FU", 2, [0, 1, 2, 3]], ["SP", 2, 0, 32, [1], 1], ["AN", 2, 1, 2], ["FFSP", 2, 0, [3, 2, 1, 0], 1, 1], ["AN", 2, 1, 6], ["PR", 5, 0, "auto_unroll_max_step$512"]]]], "r": [[0.000116564], 0, 3.46427, 1680127136], "v": "v0.6"}
{"i": [["[\"4b23b0dc1d1164f464c7f5544479ae4d\", [1, 28, 28, 512], [1, 1, 512, 1024], [1, 1, 1, 1024], [1, 14, 14, 1024]]", "cuda -keys=cuda,gpu -arch=sm_75 -max_num_threads=1024 -model=2080ti -thread_warp_size=32", [-1, 16, 64, 49152, 2147483647, 1024, 8, 32], "", 0, []], [[], [["SP", 3, 0, 1, [1, 1, 1, 1], 1], ["SP", 3, 5, 14, [1, 7, 1, 1], 1], ["SP", 3, 10, 14, [1, 2, 1, 1], 1], ["SP", 3, 15, 1024, [2, 16, 2, 2], 1], ["SP", 3, 20, 1, [1, 1], 1], ["SP", 3, 23, 1, [1, 1], 1], ["SP", 3, 26, 512, [1, 32], 1], ["RE", 3, [0, 5, 10, 15, 1, 6, 11, 16, 2, 7, 12, 17, 20, 23, 26, 21, 24, 27, 3, 8, 13, 18, 22, 25, 28, 4, 9, 14, 19]], ["FSP", 5, 0, 0, 3], ["FSP", 5, 4, 1, 3], ["FSP", 5, 8, 2, 3], ["FSP", 5, 12, 3, 3], ["RE", 5, [0, 4, 8, 12, 1, 5, 9, 13, 2, 6, 10, 14, 3, 7, 11, 15]], ["CA", 3, 5, 11], ["CHR", 2, "shared", [3]], ["CA", 3, 4, 14], ["CHR", 1, "shared", [4]], ["CA", 2, 5, 14], ["CI", 1], ["FU", 7, [0, 1, 2, 3]], ["AN", 7, 0, 5], ["FU", 7, [1, 2, 3, 4]], ["AN", 7, 1, 4], ["FU", 7, [2, 3, 4, 5]], ["AN", 7, 2, 6], ["FU", 4, [0, 1, 2, 3]], ["SP", 4, 0, 128, [1], 1], ["AN", 4, 1, 2], ["FFSP", 4, 0, [3, 2, 1, 0], 1, 1], ["AN", 4, 1, 6], ["FU", 2, [0, 1, 2, 3]], ["SP", 2, 0, 32, [1], 1], ["AN", 2, 1, 2], ["FFSP", 2, 0, [3, 2, 1, 0], 1, 1], ["AN", 2, 1, 6], ["PR", 5, 0, "auto_unroll_max_step$1024"]]]], "r": [[0.00011655], 0, 3.47504, 1680127137], "v": "v0.6"}
{"i": [["[\"4b23b0dc1d1164f464c7f5544479ae4d\", [1, 28, 28, 512], [1, 1, 512, 1024], [1, 1, 1, 1024], [1, 14, 14, 1024]]", "cuda -keys=cuda,gpu -arch=sm_75 -max_num_threads=1024 -model=2080ti -thread_warp_size=32", [-1, 16, 64, 49152, 2147483647, 1024, 8, 32], "", 0, []], [[], [["SP", 3, 0, 1, [1, 1, 1, 1], 1], ["SP", 3, 5, 14, [1, 1, 1, 14], 1], ["SP", 3, 10, 14, [1, 7, 1, 1], 1], ["SP", 3, 15, 1024, [8, 4, 8, 4], 1], ["SP", 3, 20, 1, [1, 1], 1], ["SP", 3, 23, 1, [1, 1], 1], ["SP", 3, 26, 512, [2, 1], 1], ["RE", 3, [0, 5, 10, 15, 1, 6, 11, 16, 2, 7, 12, 17, 20, 23, 26, 21, 24, 27, 3, 8, 13, 18, 22, 25, 28, 4, 9, 14, 19]], ["FSP", 5, 0, 0, 3], ["FSP", 5, 4, 1, 3], ["FSP", 5, 8, 2, 3], ["FSP", 5, 12, 3, 3], ["RE", 5, [0, 4, 8, 12, 1, 5, 9, 13, 2, 6, 10, 14, 3, 7, 11, 15]], ["CA", 3, 5, 11], ["CHR", 2, "shared", [3]], ["CA", 3, 4, 14], ["CHR", 1, "shared", [4]], ["CA", 2, 5, 14], ["CI", 1], ["FU", 7, [0, 1, 2, 3]], ["AN", 7, 0, 5], ["FU", 7, [1, 2, 3, 4]], ["AN", 7, 1, 4], ["FU", 7, [2, 3, 4, 5]], ["AN", 7, 2, 6], ["FU", 4, [0, 1, 2, 3]], ["SP", 4, 0, 64, [2], 1], ["AN", 4, 1, 2], ["FFSP", 4, 0, [3, 2, 1, 0], 1, 1], ["AN", 4, 1, 6], ["FU", 2, [0, 1, 2, 3]], ["SP", 2, 0, 54, [1], 1], ["AN", 2, 1, 2], ["FFSP", 2, 0, [3, 2, 1, 0], 1, 1], ["AN", 2, 1, 6], ["PR", 5, 0, "auto_unroll_max_step$16"]]]], "r": [[0.0231607], 0, 2.50727, 1680127138], "v": "v0.6"}
{"i": [["[\"4b23b0dc1d1164f464c7f5544479ae4d\", [1, 28, 28, 512], [1, 1, 512, 1024], [1, 1, 1, 1024], [1, 14, 14, 1024]]", "cuda -keys=cuda,gpu -arch=sm_75 -max_num_threads=1024 -model=2080ti -thread_warp_size=32", [-1, 16, 64, 49152, 2147483647, 1024, 8, 32], "", 0, []], [[], [["SP", 3, 0, 1, [1, 1, 1, 1], 1], ["SP", 3, 5, 14, [1, 2, 1, 7], 1], ["SP", 3, 10, 14, [1, 1, 1, 1], 1], ["SP", 3, 15, 1024, [8, 16, 4, 2], 1], ["SP", 3, 20, 1, [1, 1], 1], ["SP", 3, 23, 1, [1, 1], 1], ["SP", 3, 26, 512, [8, 1], 1], ["RE", 3, [0, 5, 10, 15, 1, 6, 11, 16, 2, 7, 12, 17, 20, 23, 26, 21, 24, 27, 3, 8, 13, 18, 22, 25, 28, 4, 9, 14, 19]], ["FSP", 5, 0, 0, 3], ["FSP", 5, 4, 1, 3], ["FSP", 5, 8, 2, 3], ["FSP", 5, 12, 3, 3], ["RE", 5, [0, 4, 8, 12, 1, 5, 9, 13, 2, 6, 10, 14, 3, 7, 11, 15]], ["CA", 3, 5, 11], ["CHR", 2, "shared", [3]], ["CA", 3, 4, 14], ["CHR", 1, "shared", [4]], ["CA", 2, 5, 14], ["CI", 1], ["FU", 7, [0, 1, 2, 3]], ["AN", 7, 0, 5], ["FU", 7, [1, 2, 3, 4]], ["AN", 7, 1, 4], ["FU", 7, [2, 3, 4, 5]], ["AN", 7, 2, 6], ["FU", 4, [0, 1, 2, 3]], ["SP", 4, 0, 64, [1], 1], ["AN", 4, 1, 2], ["FFSP", 4, 0, [3, 2, 1, 0], 1, 1], ["AN", 4, 1, 6], ["FU", 2, [0, 1, 2, 3]], ["SP", 2, 0, 104, [2], 1], ["AN", 2, 1, 2], ["FFSP", 2, 0, [3, 2, 1, 0], 1, 1], ["AN", 2, 1, 6], ["PR", 5, 0, "auto_unroll_max_step$16"]]]], "r": [[0.00242247], 0, 2.69573, 1680127139], "v": "v0.6"}
{"i": [["[\"4b23b0dc1d1164f464c7f5544479ae4d\", [1, 28, 28, 512], [1, 1, 512, 1024], [1, 1, 1, 1024], [1, 14, 14, 1024]]", "cuda -keys=cuda,gpu -arch=sm_75 -max_num_threads=1024 -model=2080ti -thread_warp_size=32", [-1, 16, 64, 49152, 2147483647, 1024, 8, 32], "", 0, []], [[], [["SP", 3, 0, 1, [1, 1, 1, 1], 1], ["SP", 3, 5, 14, [2, 1, 1, 1], 1], ["SP", 3, 10, 14, [1, 1, 1, 2], 1], ["SP", 3, 15, 1024, [1, 16, 32, 2], 1], ["SP", 3, 20, 1, [1, 1], 1], ["SP", 3, 23, 1, [1, 1], 1], ["SP", 3, 26, 512, [1, 4], 1], ["RE", 3, [0, 5, 10, 15, 1, 6, 11, 16, 2, 7, 12, 17, 20, 23, 26, 21, 24, 27, 3, 8, 13, 18, 22, 25, 28, 4, 9, 14, 19]], ["FSP", 5, 0, 0, 3], ["FSP", 5, 4, 1, 3], ["FSP", 5, 8, 2, 3], ["FSP", 5, 12, 3, 3], ["RE", 5, [0, 4, 8, 12, 1, 5, 9, 13, 2, 6, 10, 14, 3, 7, 11, 15]], ["CA", 3, 5, 11], ["CHR", 2, "shared", [3]], ["CA", 3, 4, 14], ["CHR", 1, "shared", [4]], ["CA", 2, 5, 14], ["CI", 1], ["FU", 7, [0, 1, 2, 3]], ["AN", 7, 0, 5], ["FU", 7, [1, 2, 3, 4]], ["AN", 7, 1, 4], ["FU", 7, [2, 3, 4, 5]], ["AN", 7, 2, 6], ["FU", 4, [0, 1, 2, 3]], ["SP", 4, 0, 256, [1], 1], ["AN", 4, 1, 2], ["FFSP", 4, 0, [3, 2, 1, 0], 1, 1], ["AN", 4, 1, 6], ["FU", 2, [0, 1, 2, 3]], ["SP", 2, 0, 12, [1], 1], ["AN", 2, 1, 2], ["FFSP", 2, 0, [3, 2, 1, 0], 1, 1], ["AN", 2, 1, 6], ["PR", 5, 0, "auto_unroll_max_step$16"]]]], "r": [[0.00140668], 0, 1.95594, 1680127140], "v": "v0.6"}
{"i": [["[\"4b23b0dc1d1164f464c7f5544479ae4d\", [1, 28, 28, 512], [1, 1, 512, 1024], [1, 1, 1, 1024], [1, 14, 14, 1024]]", "cuda -keys=cuda,gpu -arch=sm_75 -max_num_threads=1024 -model=2080ti -thread_warp_size=32", [-1, 16, 64, 49152, 2147483647, 1024, 8, 32], "", 0, []], [[], [["SP", 3, 0, 1, [1, 1, 1, 1], 1], ["SP", 3, 5, 14, [1, 2, 7, 1], 1], ["SP", 3, 10, 14, [1, 7, 1, 1], 1], ["SP", 3, 15, 1024, [1, 4, 8, 4], 1], ["SP", 3, 20, 1, [1, 1], 1], ["SP", 3, 23, 1, [1, 1], 1], ["SP", 3, 26, 512, [4, 1], 1], ["RE", 3, [0, 5, 10, 15, 1, 6, 11, 16, 2, 7, 12, 17, 20, 23, 26, 21, 24, 27, 3, 8, 13, 18, 22, 25, 28, 4, 9, 14, 19]], ["FSP", 5, 0, 0, 3], ["FSP", 5, 4, 1, 3], ["FSP", 5, 8, 2, 3], ["FSP", 5, 12, 3, 3], ["RE", 5, [0, 4, 8, 12, 1, 5, 9, 13, 2, 6, 10, 14, 3, 7, 11, 15]], ["CA", 3, 5, 11], ["CHR", 2, "shared", [3]], ["CA", 3, 4, 14], ["CHR", 1, "shared", [4]], ["CA", 2, 5, 14], ["CI", 1], ["FU", 7, [0, 1, 2, 3]], ["AN", 7, 0, 5], ["FU", 7, [1, 2, 3, 4]], ["AN", 7, 1, 4], ["FU", 7, [2, 3, 4, 5]], ["AN", 7, 2, 6], ["FU", 4, [0, 1, 2, 3]], ["SP", 4, 0, 128, [1], 1], ["AN", 4, 1, 2], ["FFSP", 4, 0, [3, 2, 1, 0], 1, 1], ["AN", 4, 1, 6], ["FU", 2, [0, 1, 2, 3]], ["SP", 2, 0, 52, [26], 1], ["AN", 2, 1, 2], ["FFSP", 2, 0, [3, 2, 1, 0], 1, 1], ["AN", 2, 1, 6], ["PR", 5, 0, "auto_unroll_max_step$1024"]]]], "r": [[0.000856328], 0, 6.06788, 1680127141], "v": "v0.6"}
{"i": [["[\"4b23b0dc1d1164f464c7f5544479ae4d\", [1, 28, 28, 512], [1, 1, 512, 1024], [1, 1, 1, 1024], [1, 14, 14, 1024]]", "cuda -keys=cuda,gpu -arch=sm_75 -max_num_threads=1024 -model=2080ti -thread_warp_size=32", [-1, 16, 64, 49152, 2147483647, 1024, 8, 32], "", 0, []], [[], [["SP", 3, 0, 1, [1, 1, 1, 1], 1], ["SP", 3, 5, 14, [1, 7, 1, 2], 1], ["SP", 3, 10, 14, [1, 2, 1, 7], 1], ["SP", 3, 15, 1024, [1, 32, 1, 32], 1], ["SP", 3, 20, 1, [1, 1], 1], ["SP", 3, 23, 1, [1, 1], 1], ["SP", 3, 26, 512, [1, 2], 1], ["RE", 3, [0, 5, 10, 15, 1, 6, 11, 16, 2, 7, 12, 17, 20, 23, 26, 21, 24, 27, 3, 8, 13, 18, 22, 25, 28, 4, 9, 14, 19]], ["FSP", 5, 0, 0, 3], ["FSP", 5, 4, 1, 3], ["FSP", 5, 8, 2, 3], ["FSP", 5, 12, 3, 3], ["RE", 5, [0, 4, 8, 12, 1, 5, 9, 13, 2, 6, 10, 14, 3, 7, 11, 15]], ["CA", 3, 5, 11], ["CHR", 2, "shared", [3]], ["CA", 3, 4, 14], ["CHR", 1, "shared", [4]], ["CA", 2, 5, 14], ["CI", 1], ["FU", 7, [0, 1, 2, 3]], ["AN", 7, 0, 5], ["FU", 7, [1, 2, 3, 4]], ["AN", 7, 1, 4], ["FU", 7, [2, 3, 4, 5]], ["AN", 7, 2, 6], ["FU", 4, [0, 1, 2, 3]], ["SP", 4, 0, 64, [1], 1], ["AN", 4, 1, 2], ["FFSP", 4, 0, [3, 2, 1, 0], 1, 1], ["AN", 4, 1, 6], ["FU", 2, [0, 1, 2, 3]], ["SP", 2, 0, 162, [1], 1], ["AN", 2, 1, 2], ["FFSP", 2, 0, [3, 2, 1, 0], 1, 1], ["AN", 2, 1, 6], ["PR", 5, 0, "auto_unroll_max_step$512"]]]], "r": [[0.015107], 0, 4.59142, 1680127142], "v": "v0.6"}
{"i": [["[\"4b23b0dc1d1164f464c7f5544479ae4d\", [1, 28, 28, 512], [1, 1, 512, 1024], [1, 1, 1, 1024], [1, 14, 14, 1024]]", "cuda -keys=cuda,gpu -arch=sm_75 -max_num_threads=1024 -model=2080ti -thread_warp_size=32", [-1, 16, 64, 49152, 2147483647, 1024, 8, 32], "", 0, []], [[], [["SP", 3, 0, 1, [1, 1, 1, 1], 1], ["SP", 3, 5, 14, [1, 2, 1, 7], 1], ["SP", 3, 10, 14, [7, 1, 1, 1], 1], ["SP", 3, 15, 1024, [1, 32, 4, 4], 1], ["SP", 3, 20, 1, [1, 1], 1], ["SP", 3, 23, 1, [1, 1], 1], ["SP", 3, 26, 512, [1, 8], 1], ["RE", 3, [0, 5, 10, 15, 1, 6, 11, 16, 2, 7, 12, 17, 20, 23, 26, 21, 24, 27, 3, 8, 13, 18, 22, 25, 28, 4, 9, 14, 19]], ["FSP", 5, 0, 0, 3], ["FSP", 5, 4, 1, 3], ["FSP", 5, 8, 2, 3], ["FSP", 5, 12, 3, 3], ["RE", 5, [0, 4, 8, 12, 1, 5, 9, 13, 2, 6, 10, 14, 3, 7, 11, 15]], ["CA", 3, 5, 11], ["CHR", 2, "shared", [3]], ["CA", 3, 4, 14], ["CHR", 1, "shared", [4]], ["CA", 2, 5, 14], ["CI", 1], ["FU", 7, [0, 1, 2, 3]], ["AN", 7, 0, 5], ["FU", 7, [1, 2, 3, 4]], ["AN", 7, 1, 4], ["FU", 7, [2, 3, 4, 5]], ["AN", 7, 2, 6], ["FU", 4, [0, 1, 2, 3]], ["SP", 4, 0, 128, [4], 1], ["AN", 4, 1, 2], ["FFSP", 4, 0, [3, 2, 1, 0], 1, 1], ["AN", 4, 1, 6], ["FU", 2, [0, 1, 2, 3]], ["SP", 2, 0, 104, [1], 1], ["AN", 2, 1, 2], ["FFSP", 2, 0, [3, 2, 1, 0], 1, 1], ["AN", 2, 1, 6], ["PR", 5, 0, "auto_unroll_max_step$0"]]]], "r": [[0.00186206], 0, 2.84422, 1680127143], "v": "v0.6"}
{"i": [["[\"4b23b0dc1d1164f464c7f5544479ae4d\", [1, 28, 28, 512], [1, 1, 512, 1024], [1, 1, 1, 1024], [1, 14, 14, 1024]]", "cuda -keys=cuda,gpu -arch=sm_75 -max_num_threads=1024 -model=2080ti -thread_warp_size=32", [-1, 16, 64, 49152, 2147483647, 1024, 8, 32], "", 0, []], [[], [["SP", 3, 0, 1, [1, 1, 1, 1], 1], ["SP", 3, 5, 14, [1, 2, 1, 1], 1], ["SP", 3, 10, 14, [1, 1, 7, 2], 1], ["SP", 3, 15, 1024, [1, 64, 4, 2], 1], ["SP", 3, 20, 1, [1, 1], 1], ["SP", 3, 23, 1, [1, 1], 1], ["SP", 3, 26, 512, [8, 1], 1], ["RE", 3, [0, 5, 10, 15, 1, 6, 11, 16, 2, 7, 12, 17, 20, 23, 26, 21, 24, 27, 3, 8, 13, 18, 22, 25, 28, 4, 9, 14, 19]], ["FSP", 5, 0, 0, 3], ["FSP", 5, 4, 1, 3], ["FSP", 5, 8, 2, 3], ["FSP", 5, 12, 3, 3], ["RE", 5, [0, 4, 8, 12, 1, 5, 9, 13, 2, 6, 10, 14, 3, 7, 11, 15]], ["CA", 3, 5, 11], ["CHR", 2, "shared", [3]], ["CA", 3, 4, 14], ["CHR", 1, "shared", [4]], ["CA", 2, 5, 14], ["CI", 1], ["FU", 7, [0, 1, 2, 3]], ["AN", 7, 0, 5], ["FU", 7, [1, 2, 3, 4]], ["AN", 7, 1, 4], ["FU", 7, [2, 3, 4, 5]], ["AN", 7, 2, 6], ["FU", 4, [0, 1, 2, 3]], ["SP", 4, 0, 64, [2], 1], ["AN", 4, 1, 2], ["FFSP", 4, 0, [3, 2, 1, 0], 1, 1], ["AN", 4, 1, 6], ["FU", 2, [0, 1, 2, 3]], ["SP", 2, 0, 216, [1], 1], ["AN", 2, 1, 2], ["FFSP", 2, 0, [3, 2, 1, 0], 1, 1], ["AN", 2, 1, 6], ["PR", 5, 0, "auto_unroll_max_step$512"]]]], "r": [[0.000189837], 0, 2.65015, 1680127144], "v": "v0.6"}
{"i": [["[\"4b23b0dc1d1164f464c7f5544479ae4d\", [1, 28, 28, 512], [1, 1, 512, 1024], [1, 1, 1, 1024], [1, 14, 14, 1024]]", "cuda -keys=cuda,gpu -arch=sm_75 -max_num_threads=1024 -model=2080ti -thread_warp_size=32", [-1, 16, 64, 49152, 2147483647, 1024, 8, 32], "", 0, []], [[], [["SP", 3, 0, 1, [1, 1, 1, 1], 1], ["SP", 3, 5, 14, [1, 1, 1, 14], 1], ["SP", 3, 10, 14, [1, 1, 7, 1], 1], ["SP", 3, 15, 1024, [2, 64, 2, 4], 1], ["SP", 3, 20, 1, [1, 1], 1], ["SP", 3, 23, 1, [1, 1], 1], ["SP", 3, 26, 512, [8, 1], 1], ["RE", 3, [0, 5, 10, 15, 1, 6, 11, 16, 2, 7, 12, 17, 20, 23, 26, 21, 24, 27, 3, 8, 13, 18, 22, 25, 28, 4, 9, 14, 19]], ["FSP", 5, 0, 0, 3], ["FSP", 5, 4, 1, 3], ["FSP", 5, 8, 2, 3], ["FSP", 5, 12, 3, 3], ["RE", 5, [0, 4, 8, 12, 1, 5, 9, 13, 2, 6, 10, 14, 3, 7, 11, 15]], ["CA", 3, 5, 11], ["CHR", 2, "shared", [3]], ["CA", 3, 4, 14], ["CHR", 1, "shared", [4]], ["CA", 2, 5, 14], ["CI", 1], ["FU", 7, [0, 1, 2, 3]], ["AN", 7, 0, 5], ["FU", 7, [1, 2, 3, 4]], ["AN", 7, 1, 4], ["FU", 7, [2, 3, 4, 5]], ["AN", 7, 2, 6], ["FU", 4, [0, 1, 2, 3]], ["SP", 4, 0, 64, [1], 1], ["AN", 4, 1, 2], ["FFSP", 4, 0, [3, 2, 1, 0], 1, 1], ["AN", 4, 1, 6], ["FU", 2, [0, 1, 2, 3]], ["SP", 2, 0, 2808, [1], 1], ["AN", 2, 1, 2], ["FFSP", 2, 0, [3, 2, 1, 0], 1, 1], ["AN", 2, 1, 6], ["PR", 5, 0, "auto_unroll_max_step$64"]]]], "r": [[0.00848757], 0, 2.62809, 1680127145], "v": "v0.6"}
{"i": [["[\"4b23b0dc1d1164f464c7f5544479ae4d\", [1, 28, 28, 512], [1, 1, 512, 1024], [1, 1, 1, 1024], [1, 14, 14, 1024]]", "cuda -keys=cuda,gpu -arch=sm_75 -max_num_threads=1024 -model=2080ti -thread_warp_size=32", [-1, 16, 64, 49152, 2147483647, 1024, 8, 32], "", 0, []], [[], [["SP", 3, 0, 1, [1, 1, 1, 1], 1], ["SP", 3, 5, 14, [1, 7, 1, 2], 1], ["SP", 3, 10, 14, [1, 2, 1, 1], 1], ["SP", 3, 15, 1024, [4, 8, 4, 8], 1], ["SP", 3, 20, 1, [1, 1], 1], ["SP", 3, 23, 1, [1, 1], 1], ["SP", 3, 26, 512, [1, 8], 1], ["RE", 3, [0, 5, 10, 15, 1, 6, 11, 16, 2, 7, 12, 17, 20, 23, 26, 21, 24, 27, 3, 8, 13, 18, 22, 25, 28, 4, 9, 14, 19]], ["FSP", 5, 0, 0, 3], ["FSP", 5, 4, 1, 3], ["FSP", 5, 8, 2, 3], ["FSP", 5, 12, 3, 3], ["RE", 5, [0, 4, 8, 12, 1, 5, 9, 13, 2, 6, 10, 14, 3, 7, 11, 15]], ["CA", 3, 5, 11], ["CHR", 2, "shared", [3]], ["CA", 3, 4, 14], ["CHR", 1, "shared", [4]], ["CA", 2, 5, 14], ["CI", 1], ["FU", 7, [0, 1, 2, 3]], ["AN", 7, 0, 5], ["FU", 7, [1, 2, 3, 4]], ["AN", 7, 1, 4], ["FU", 7, [2, 3, 4, 5]], ["AN", 7, 2, 6], ["FU", 4, [0, 1, 2, 3]], ["SP", 4, 0, 128, [2], 1], ["AN", 4, 1, 2], ["FFSP", 4, 0, [3, 2, 1, 0], 1, 1], ["AN", 4, 1, 6], ["FU", 2, [0, 1, 2, 3]], ["SP", 2, 0, 24, [1], 1], ["AN", 2, 1, 2], ["FFSP", 2, 0, [3, 2, 1, 0], 1, 1], ["AN", 2, 1, 6], ["PR", 5, 0, "auto_unroll_max_step$1024"]]]], "r": [[0.00170142], 0, 13.1938, 1680127146], "v": "v0.6"}
{"i": [["[\"4b23b0dc1d1164f464c7f5544479ae4d\", [1, 28, 28, 512], [1, 1, 512, 1024], [1, 1, 1, 1024], [1, 14, 14, 1024]]", "cuda -keys=cuda,gpu -arch=sm_75 -max_num_threads=1024 -model=2080ti -thread_warp_size=32", [-1, 16, 64, 49152, 2147483647, 1024, 8, 32], "", 0, []], [[], [["SP", 3, 0, 1, [1, 1, 1, 1], 1], ["SP", 3, 5, 14, [1, 7, 1, 2], 1], ["SP", 3, 10, 14, [1, 1, 1, 14], 1], ["SP", 3, 15, 1024, [4, 8, 1, 32], 1], ["SP", 3, 20, 1, [1, 1], 1], ["SP", 3, 23, 1, [1, 1], 1], ["SP", 3, 26, 512, [2, 1], 1], ["RE", 3, [0, 5, 10, 15, 1, 6, 11, 16, 2, 7, 12, 17, 20, 23, 26, 21, 24, 27, 3, 8, 13, 18, 22, 25, 28, 4, 9, 14, 19]], ["FSP", 5, 0, 0, 3], ["FSP", 5, 4, 1, 3], ["FSP", 5, 8, 2, 3], ["FSP", 5, 12, 3, 3], ["RE", 5, [0, 4, 8, 12, 1, 5, 9, 13, 2, 6, 10, 14, 3, 7, 11, 15]], ["CA", 3, 5, 11], ["CHR", 2, "shared", [3]], ["CA", 3, 4, 14], ["CHR", 1, "shared", [4]], ["CA", 2, 5, 14], ["CI", 1], ["FU", 7, [0, 1, 2, 3]], ["AN", 7, 0, 5], ["FU", 7, [1, 2, 3, 4]], ["AN", 7, 1, 4], ["FU", 7, [2, 3, 4, 5]], ["AN", 7, 2, 6], ["FU", 4, [0, 1, 2, 3]], ["SP", 4, 0, 64, [8], 1], ["AN", 4, 1, 2], ["FFSP", 4, 0, [3, 2, 1, 0], 1, 1], ["AN", 4, 1, 6], ["FU", 2, [0, 1, 2, 3]], ["SP", 2, 0, 162, [1], 1], ["AN", 2, 1, 2], ["FFSP", 2, 0, [3, 2, 1, 0], 1, 1], ["AN", 2, 1, 6], ["PR", 5, 0, "auto_unroll_max_step$512"]]]], "r": [[0.0189472], 0, 10.2784, 1680127146], "v": "v0.6"}
{"i": [["[\"4b23b0dc1d1164f464c7f5544479ae4d\", [1, 28, 28, 512], [1, 1, 512, 1024], [1, 1, 1, 1024], [1, 14, 14, 1024]]", "cuda -keys=cuda,gpu -arch=sm_75 -max_num_threads=1024 -model=2080ti -thread_warp_size=32", [-1, 16, 64, 49152, 2147483647, 1024, 8, 32], "", 0, []], [[], [["SP", 3, 0, 1, [1, 1, 1, 1], 1], ["SP", 3, 5, 14, [1, 1, 1, 7], 1], ["SP", 3, 10, 14, [7, 1, 1, 1], 1], ["SP", 3, 15, 1024, [1, 512, 1, 2], 1], ["SP", 3, 20, 1, [1, 1], 1], ["SP", 3, 23, 1, [1, 1], 1], ["SP", 3, 26, 512, [4, 2], 1], ["RE", 3, [0, 5, 10, 15, 1, 6, 11, 16, 2, 7, 12, 17, 20, 23, 26, 21, 24, 27, 3, 8, 13, 18, 22, 25, 28, 4, 9, 14, 19]], ["FSP", 5, 0, 0, 3], ["FSP", 5, 4, 1, 3], ["FSP", 5, 8, 2, 3], ["FSP", 5, 12, 3, 3], ["RE", 5, [0, 4, 8, 12, 1, 5, 9, 13, 2, 6, 10, 14, 3, 7, 11, 15]], ["CA", 3, 5, 11], ["CHR", 2, "shared", [3]], ["CA", 3, 4, 14], ["CHR", 1, "shared", [4]], ["CA", 2, 5, 14], ["CI", 1], ["FU", 7, [0, 1, 2, 3]], ["AN", 7, 0, 5], ["FU", 7, [1, 2, 3, 4]], ["AN", 7, 1, 4], ["FU", 7, [2, 3, 4, 5]], ["AN", 7, 2, 6], ["FU", 4, [0, 1, 2, 3]], ["SP", 4, 0, 16, [1], 1], ["AN", 4, 1, 2], ["FFSP", 4, 0, [3, 2, 1, 0], 1, 1], ["AN", 4, 1, 6], ["FU", 2, [0, 1, 2, 3]], ["SP", 2, 0, 104, [1], 1], ["AN", 2, 1, 2], ["FFSP", 2, 0, [3, 2, 1, 0], 1, 1], ["AN", 2, 1, 6], ["PR", 5, 0, "auto_unroll_max_step$64"]]]], "r": [[0.00120674], 0, 2.3226, 1680127147], "v": "v0.6"}
{"i": [["[\"4b23b0dc1d1164f464c7f5544479ae4d\", [1, 28, 28, 512], [1, 1, 512, 1024], [1, 1, 1, 1024], [1, 14, 14, 1024]]", "cuda -keys=cuda,gpu -arch=sm_75 -max_num_threads=1024 -model=2080ti -thread_warp_size=32", [-1, 16, 64, 49152, 2147483647, 1024, 8, 32], "", 0, []], [[], [["SP", 3, 0, 1, [1, 1, 1, 1], 1], ["SP", 3, 5, 14, [1, 7, 1, 2], 1], ["SP", 3, 10, 14, [2, 1, 1, 1], 1], ["SP", 3, 15, 1024, [1, 1, 4, 64], 1], ["SP", 3, 20, 1, [1, 1], 1], ["SP", 3, 23, 1, [1, 1], 1], ["SP", 3, 26, 512, [1, 4], 1], ["RE", 3, [0, 5, 10, 15, 1, 6, 11, 16, 2, 7, 12, 17, 20, 23, 26, 21, 24, 27, 3, 8, 13, 18, 22, 25, 28, 4, 9, 14, 19]], ["FSP", 5, 0, 0, 3], ["FSP", 5, 4, 1, 3], ["FSP", 5, 8, 2, 3], ["FSP", 5, 12, 3, 3], ["RE", 5, [0, 4, 8, 12, 1, 5, 9, 13, 2, 6, 10, 14, 3, 7, 11, 15]], ["CA", 3, 5, 11], ["CHR", 2, "shared", [3]], ["CA", 3, 4, 14], ["CHR", 1, "shared", [4]], ["CA", 2, 5, 14], ["CI", 1], ["FU", 7, [0, 1, 2, 3]], ["AN", 7, 0, 5], ["FU", 7, [1, 2, 3, 4]], ["AN", 7, 1, 4], ["FU", 7, [2, 3, 4, 5]], ["AN", 7, 2, 6], ["FU", 4, [0, 1, 2, 3]], ["SP", 4, 0, 16, [1], 1], ["AN", 4, 1, 2], ["FFSP", 4, 0, [3, 2, 1, 0], 1, 1], ["AN", 4, 1, 6], ["FU", 2, [0, 1, 2, 3]], ["SP", 2, 0, 12, [1], 1], ["AN", 2, 1, 2], ["FFSP", 2, 0, [3, 2, 1, 0], 1, 1], ["AN", 2, 1, 6], ["PR", 5, 0, "auto_unroll_max_step$0"]]]], "r": [[0.00549017], 0, 2.19072, 1680127148], "v": "v0.6"}
{"i": [["[\"4b23b0dc1d1164f464c7f5544479ae4d\", [1, 28, 28, 512], [1, 1, 512, 1024], [1, 1, 1, 1024], [1, 14, 14, 1024]]", "cuda -keys=cuda,gpu -arch=sm_75 -max_num_threads=1024 -model=2080ti -thread_warp_size=32", [-1, 16, 64, 49152, 2147483647, 1024, 8, 32], "", 0, []], [[], [["SP", 3, 0, 1, [1, 1, 1, 1], 1], ["SP", 3, 5, 14, [1, 1, 1, 14], 1], ["SP", 3, 10, 14, [1, 2, 1, 1], 1], ["SP", 3, 15, 1024, [1, 16, 1, 8], 1], ["SP", 3, 20, 1, [1, 1], 1], ["SP", 3, 23, 1, [1, 1], 1], ["SP", 3, 26, 512, [2, 16], 1], ["RE", 3, [0, 5, 10, 15, 1, 6, 11, 16, 2, 7, 12, 17, 20, 23, 26, 21, 24, 27, 3, 8, 13, 18, 22, 25, 28, 4, 9, 14, 19]], ["FSP", 5, 0, 0, 3], ["FSP", 5, 4, 1, 3], ["FSP", 5, 8, 2, 3], ["FSP", 5, 12, 3, 3], ["RE", 5, [0, 4, 8, 12, 1, 5, 9, 13, 2, 6, 10, 14, 3, 7, 11, 15]], ["CA", 3, 5, 11], ["CHR", 2, "shared", [3]], ["CA", 3, 4, 14], ["CHR", 1, "shared", [4]], ["CA", 2, 5, 14], ["CI", 1], ["FU", 7, [0, 1, 2, 3]], ["AN", 7, 0, 5], ["FU", 7, [1, 2, 3, 4]], ["AN", 7, 1, 4], ["FU", 7, [2, 3, 4, 5]], ["AN", 7, 2, 6], ["FU", 4, [0, 1, 2, 3]], ["SP", 4, 0, 128, [1], 1], ["AN", 4, 1, 2], ["FFSP", 4, 0, [3, 2, 1, 0], 1, 1], ["AN", 4, 1, 6], ["FU", 2, [0, 1, 2, 3]], ["SP", 2, 0, 208, [1], 1], ["AN", 2, 1, 2], ["FFSP", 2, 0, [3, 2, 1, 0], 1, 1], ["AN", 2, 1, 6], ["PR", 5, 0, "auto_unroll_max_step$1024"]]]], "r": [[0.000216879], 0, 3.47579, 1680127149], "v": "v0.6"}
{"i": [["[\"4b23b0dc1d1164f464c7f5544479ae4d\", [1, 28, 28, 512], [1, 1, 512, 1024], [1, 1, 1, 1024], [1, 14, 14, 1024]]", "cuda -keys=cuda,gpu -arch=sm_75 -max_num_threads=1024 -model=2080ti -thread_warp_size=32", [-1, 16, 64, 49152, 2147483647, 1024, 8, 32], "", 0, []], [[], [["SP", 3, 0, 1, [1, 1, 1, 1], 1], ["SP", 3, 5, 14, [1, 1, 1, 2], 1], ["SP", 3, 10, 14, [1, 1, 1, 7], 1], ["SP", 3, 15, 1024, [4, 128, 1, 1], 1], ["SP", 3, 20, 1, [1, 1], 1], ["SP", 3, 23, 1, [1, 1], 1], ["SP", 3, 26, 512, [4, 4], 1], ["RE", 3, [0, 5, 10, 15, 1, 6, 11, 16, 2, 7, 12, 17, 20, 23, 26, 21, 24, 27, 3, 8, 13, 18, 22, 25, 28, 4, 9, 14, 19]], ["FSP", 5, 0, 0, 3], ["FSP", 5, 4, 1, 3], ["FSP", 5, 8, 2, 3], ["FSP", 5, 12, 3, 3], ["RE", 5, [0, 4, 8, 12, 1, 5, 9, 13, 2, 6, 10, 14, 3, 7, 11, 15]], ["CA", 3, 5, 11], ["CHR", 2, "shared", [3]], ["CA", 3, 4, 14], ["CHR", 1, "shared", [4]], ["CA", 2, 5, 14], ["CI", 1], ["FU", 7, [0, 1, 2, 3]], ["AN", 7, 0, 5], ["FU", 7, [1, 2, 3, 4]], ["AN", 7, 1, 4], ["FU", 7, [2, 3, 4, 5]], ["AN", 7, 2, 6], ["FU", 4, [0, 1, 2, 3]], ["SP", 4, 0, 16, [1], 1], ["AN", 4, 1, 2], ["FFSP", 4, 0, [3, 2, 1, 0], 1, 1], ["AN", 4, 1, 6], ["FU", 2, [0, 1, 2, 3]], ["SP", 2, 0, 624, [48], 1], ["AN", 2, 1, 2], ["FFSP", 2, 0, [3, 2, 1, 0], 1, 1], ["AN", 2, 1, 6], ["PR", 5, 0, "auto_unroll_max_step$0"]]]], "r": [[0.000178833], 0, 1.99713, 1680127150], "v": "v0.6"}
{"i": [["[\"4b23b0dc1d1164f464c7f5544479ae4d\", [1, 28, 28, 512], [1, 1, 512, 1024], [1, 1, 1, 1024], [1, 14, 14, 1024]]", "cuda -keys=cuda,gpu -arch=sm_75 -max_num_threads=1024 -model=2080ti -thread_warp_size=32", [-1, 16, 64, 49152, 2147483647, 1024, 8, 32], "", 0, []], [[], [["SP", 3, 0, 1, [1, 1, 1, 1], 1], ["SP", 3, 5, 14, [1, 1, 7, 2], 1], ["SP", 3, 10, 14, [1, 7, 1, 1], 1], ["SP", 3, 15, 1024, [1, 16, 1, 16], 1], ["SP", 3, 20, 1, [1, 1], 1], ["SP", 3, 23, 1, [1, 1], 1], ["SP", 3, 26, 512, [4, 1], 1], ["RE", 3, [0, 5, 10, 15, 1, 6, 11, 16, 2, 7, 12, 17, 20, 23, 26, 21, 24, 27, 3, 8, 13, 18, 22, 25, 28, 4, 9, 14, 19]], ["FSP", 5, 0, 0, 3], ["FSP", 5, 4, 1, 3], ["FSP", 5, 8, 2, 3], ["FSP", 5, 12, 3, 3], ["RE", 5, [0, 4, 8, 12, 1, 5, 9, 13, 2, 6, 10, 14, 3, 7, 11, 15]], ["CA", 3, 5, 11], ["CHR", 2, "shared", [3]], ["CA", 3, 4, 14], ["CHR", 1, "shared", [4]], ["CA", 2, 5, 14], ["CI", 1], ["FU", 7, [0, 1, 2, 3]], ["AN", 7, 0, 5], ["FU", 7, [1, 2, 3, 4]], ["AN", 7, 1, 4], ["FU", 7, [2, 3, 4, 5]], ["AN", 7, 2, 6], ["FU", 4, [0, 1, 2, 3]], ["SP", 4, 0, 64, [1], 1], ["AN", 4, 1, 2], ["FFSP", 4, 0, [3, 2, 1, 0], 1, 1], ["AN", 4, 1, 6], ["FU", 2, [0, 1, 2, 3]], ["SP", 2, 0, 108, [9], 1], ["AN", 2, 1, 2], ["FFSP", 2, 0, [3, 2, 1, 0], 1, 1], ["AN", 2, 1, 6], ["PR", 5, 0, "auto_unroll_max_step$16"]]]], "r": [[0.000619738], 0, 2.67612, 1680127151], "v": "v0.6"}
{"i": [["[\"4b23b0dc1d1164f464c7f5544479ae4d\", [1, 28, 28, 512], [1, 1, 512, 1024], [1, 1, 1, 1024], [1, 14, 14, 1024]]", "cuda -keys=cuda,gpu -arch=sm_75 -max_num_threads=1024 -model=2080ti -thread_warp_size=32", [-1, 16, 64, 49152, 2147483647, 1024, 8, 32], "", 0, []], [[], [["SP", 3, 0, 1, [1, 1, 1, 1], 1], ["SP", 3, 5, 14, [1, 7, 2, 1], 1], ["SP", 3, 10, 14, [2, 1, 1, 1], 1], ["SP", 3, 15, 1024, [2, 64, 1, 1], 1], ["SP", 3, 20, 1, [1, 1], 1], ["SP", 3, 23, 1, [1, 1], 1], ["SP", 3, 26, 512, [1, 16], 1], ["RE", 3, [0, 5, 10, 15, 1, 6, 11, 16, 2, 7, 12, 17, 20, 23, 26, 21, 24, 27, 3, 8, 13, 18, 22, 25, 28, 4, 9, 14, 19]], ["FSP", 5, 0, 0, 3], ["FSP", 5, 4, 1, 3], ["FSP", 5, 8, 2, 3], ["FSP", 5, 12, 3, 3], ["RE", 5, [0, 4, 8, 12, 1, 5, 9, 13, 2, 6, 10, 14, 3, 7, 11, 15]], ["CA", 3, 5, 11], ["CHR", 2, "shared", [3]], ["CA", 3, 4, 14], ["CHR", 1, "shared", [4]], ["CA", 2, 5, 14], ["CI", 1], ["FU", 7, [0, 1, 2, 3]], ["AN", 7, 0, 5], ["FU", 7, [1, 2, 3, 4]], ["AN", 7, 1, 4], ["FU", 7, [2, 3, 4, 5]], ["AN", 7, 2, 6], ["FU", 4, [0, 1, 2, 3]], ["SP", 4, 0, 16, [1], 1], ["AN", 4, 1, 2], ["FFSP", 4, 0, [3, 2, 1, 0], 1, 1], ["AN", 4, 1, 6], ["FU", 2, [0, 1, 2, 3]], ["SP", 2, 0, 432, [1], 1], ["AN", 2, 1, 2], ["FFSP", 2, 0, [3, 2, 1, 0], 1, 1], ["AN", 2, 1, 6], ["PR", 5, 0, "auto_unroll_max_step$16"]]]], "r": [[7.32022e-05], 0, 2.00013, 1680127152], "v": "v0.6"}
{"i": [["[\"4b23b0dc1d1164f464c7f5544479ae4d\", [1, 28, 28, 512], [1, 1, 512, 1024], [1, 1, 1, 1024], [1, 14, 14, 1024]]", "cuda -keys=cuda,gpu -arch=sm_75 -max_num_threads=1024 -model=2080ti -thread_warp_size=32", [-1, 16, 64, 49152, 2147483647, 1024, 8, 32], "", 0, []], [[], [["SP", 3, 0, 1, [1, 1, 1, 1], 1], ["SP", 3, 5, 14, [1, 1, 7, 2], 1], ["SP", 3, 10, 14, [2, 7, 1, 1], 1], ["SP", 3, 15, 1024, [1, 1, 1, 4], 1], ["SP", 3, 20, 1, [1, 1], 1], ["SP", 3, 23, 1, [1, 1], 1], ["SP", 3, 26, 512, [2, 4], 1], ["RE", 3, [0, 5, 10, 15, 1, 6, 11, 16, 2, 7, 12, 17, 20, 23, 26, 21, 24, 27, 3, 8, 13, 18, 22, 25, 28, 4, 9, 14, 19]], ["FSP", 5, 0, 0, 3], ["FSP", 5, 4, 1, 3], ["FSP", 5, 8, 2, 3], ["FSP", 5, 12, 3, 3], ["RE", 5, [0, 4, 8, 12, 1, 5, 9, 13, 2, 6, 10, 14, 3, 7, 11, 15]], ["CA", 3, 5, 11], ["CHR", 2, "shared", [3]], ["CA", 3, 4, 14], ["CHR", 1, "shared", [4]], ["CA", 2, 5, 14], ["CI", 1], ["FU", 7, [0, 1, 2, 3]], ["AN", 7, 0, 5], ["FU", 7, [1, 2, 3, 4]], ["AN", 7, 1, 4], ["FU", 7, [2, 3, 4, 5]], ["AN", 7, 2, 6], ["FU", 4, [0, 1, 2, 3]], ["SP", 4, 0, 32, [1], 1], ["AN", 4, 1, 2], ["FFSP", 4, 0, [3, 2, 1, 0], 1, 1], ["AN", 4, 1, 6], ["FU", 2, [0, 1, 2, 3]], ["SP", 2, 0, 24, [1], 1], ["AN", 2, 1, 2], ["FFSP", 2, 0, [3, 2, 1, 0], 1, 1], ["AN", 2, 1, 6], ["PR", 5, 0, "auto_unroll_max_step$16"]]]], "r": [[0.00577401], 0, 1.8361, 1680127153], "v": "v0.6"}
{"i": [["[\"4b23b0dc1d1164f464c7f5544479ae4d\", [1, 28, 28, 512], [1, 1, 512, 1024], [1, 1, 1, 1024], [1, 14, 14, 1024]]", "cuda -keys=cuda,gpu -arch=sm_75 -max_num_threads=1024 -model=2080ti -thread_warp_size=32", [-1, 16, 64, 49152, 2147483647, 1024, 8, 32], "", 0, []], [[], [["SP", 3, 0, 1, [1, 1, 1, 1], 1], ["SP", 3, 5, 14, [1, 1, 1, 14], 1], ["SP", 3, 10, 14, [1, 7, 2, 1], 1], ["SP", 3, 15, 1024, [1, 8, 4, 8], 1], ["SP", 3, 20, 1, [1, 1], 1], ["SP", 3, 23, 1, [1, 1], 1], ["SP", 3, 26, 512, [2, 4], 1], ["RE", 3, [0, 5, 10, 15, 1, 6, 11, 16, 2, 7, 12, 17, 20, 23, 26, 21, 24, 27, 3, 8, 13, 18, 22, 25, 28, 4, 9, 14, 19]], ["FSP", 5, 0, 0, 3], ["FSP", 5, 4, 1, 3], ["FSP", 5, 8, 2, 3], ["FSP", 5, 12, 3, 3], ["RE", 5, [0, 4, 8, 12, 1, 5, 9, 13, 2, 6, 10, 14, 3, 7, 11, 15]], ["CA", 3, 5, 11], ["CHR", 2, "shared", [3]], ["CA", 3, 4, 14], ["CHR", 1, "shared", [4]], ["CA", 2, 5, 14], ["CI", 1], ["FU", 7, [0, 1, 2, 3]], ["AN", 7, 0, 5], ["FU", 7, [1, 2, 3, 4]], ["AN", 7, 1, 4], ["FU", 7, [2, 3, 4, 5]], ["AN", 7, 2, 6], ["FU", 4, [0, 1, 2, 3]], ["SP", 4, 0, 256, [1], 1], ["AN", 4, 1, 2], ["FFSP", 4, 0, [3, 2, 1, 0], 1, 1], ["AN", 4, 1, 6], ["FU", 2, [0, 1, 2, 3]], ["SP", 2, 0, 648, [1], 1], ["AN", 2, 1, 2], ["FFSP", 2, 0, [3, 2, 1, 0], 1, 1], ["AN", 2, 1, 6], ["PR", 5, 0, "auto_unroll_max_step$0"]]]], "r": [[0.00387018], 0, 2.59377, 1680127154], "v": "v0.6"}
{"i": [["[\"4b23b0dc1d1164f464c7f5544479ae4d\", [1, 28, 28, 512], [1, 1, 512, 1024], [1, 1, 1, 1024], [1, 14, 14, 1024]]", "cuda -keys=cuda,gpu -arch=sm_75 -max_num_threads=1024 -model=2080ti -thread_warp_size=32", [-1, 16, 64, 49152, 2147483647, 1024, 8, 32], "", 0, []], [[], [["SP", 3, 0, 1, [1, 1, 1, 1], 1], ["SP", 3, 5, 14, [1, 2, 1, 1], 1], ["SP", 3, 10, 14, [1, 1, 14, 1], 1], ["SP", 3, 15, 1024, [2, 32, 8, 1], 1], ["SP", 3, 20, 1, [1, 1], 1], ["SP", 3, 23, 1, [1, 1], 1], ["SP", 3, 26, 512, [2, 4], 1], ["RE", 3, [0, 5, 10, 15, 1, 6, 11, 16, 2, 7, 12, 17, 20, 23, 26, 21, 24, 27, 3, 8, 13, 18, 22, 25, 28, 4, 9, 14, 19]], ["FSP", 5, 0, 0, 3], ["FSP", 5, 4, 1, 3], ["FSP", 5, 8, 2, 3], ["FSP", 5, 12, 3, 3], ["RE", 5, [0, 4, 8, 12, 1, 5, 9, 13, 2, 6, 10, 14, 3, 7, 11, 15]], ["CA", 3, 5, 11], ["CHR", 2, "shared", [3]], ["CA", 3, 4, 14], ["CHR", 1, "shared", [4]], ["CA", 2, 5, 14], ["CI", 1], ["FU", 7, [0, 1, 2, 3]], ["AN", 7, 0, 5], ["FU", 7, [1, 2, 3, 4]], ["AN", 7, 1, 4], ["FU", 7, [2, 3, 4, 5]], ["AN", 7, 2, 6], ["FU", 4, [0, 1, 2, 3]], ["SP", 4, 0, 64, [1], 1], ["AN", 4, 1, 2], ["FFSP", 4, 0, [3, 2, 1, 0], 1, 1], ["AN", 4, 1, 6], ["FU", 2, [0, 1, 2, 3]], ["SP", 2, 0, 216, [6], 1], ["AN", 2, 1, 2], ["FFSP", 2, 0, [3, 2, 1, 0], 1, 1], ["AN", 2, 1, 6], ["PR", 5, 0, "auto_unroll_max_step$64"]]]], "r": [[0.000751442], 0, 3.10846, 1680127155], "v": "v0.6"}
{"i": [["[\"4b23b0dc1d1164f464c7f5544479ae4d\", [1, 28, 28, 512], [1, 1, 512, 1024], [1, 1, 1, 1024], [1, 14, 14, 1024]]", "cuda -keys=cuda,gpu -arch=sm_75 -max_num_threads=1024 -model=2080ti -thread_warp_size=32", [-1, 16, 64, 49152, 2147483647, 1024, 8, 32], "", 0, []], [[], [["SP", 3, 0, 1, [1, 1, 1, 1], 1], ["SP", 3, 5, 14, [2, 1, 1, 7], 1], ["SP", 3, 10, 14, [1, 1, 1, 1], 1], ["SP", 3, 15, 1024, [1, 64, 8, 2], 1], ["SP", 3, 20, 1, [1, 1], 1], ["SP", 3, 23, 1, [1, 1], 1], ["SP", 3, 26, 512, [8, 1], 1], ["RE", 3, [0, 5, 10, 15, 1, 6, 11, 16, 2, 7, 12, 17, 20, 23, 26, 21, 24, 27, 3, 8, 13, 18, 22, 25, 28, 4, 9, 14, 19]], ["FSP", 5, 0, 0, 3], ["FSP", 5, 4, 1, 3], ["FSP", 5, 8, 2, 3], ["FSP", 5, 12, 3, 3], ["RE", 5, [0, 4, 8, 12, 1, 5, 9, 13, 2, 6, 10, 14, 3, 7, 11, 15]], ["CA", 3, 5, 11], ["CHR", 2, "shared", [3]], ["CA", 3, 4, 14], ["CHR", 1, "shared", [4]], ["CA", 2, 5, 14], ["CI", 1], ["FU", 7, [0, 1, 2, 3]], ["AN", 7, 0, 5], ["FU", 7, [1, 2, 3, 4]], ["AN", 7, 1, 4], ["FU", 7, [2, 3, 4, 5]], ["AN", 7, 2, 6], ["FU", 4, [0, 1, 2, 3]], ["SP", 4, 0, 128, [1], 1], ["AN", 4, 1, 2], ["FFSP", 4, 0, [3, 2, 1, 0], 1, 1], ["AN", 4, 1, 6], ["FU", 2, [0, 1, 2, 3]], ["SP", 2, 0, 312, [52], 1], ["AN", 2, 1, 2], ["FFSP", 2, 0, [3, 2, 1, 0], 1, 1], ["AN", 2, 1, 6], ["PR", 5, 0, "auto_unroll_max_step$16"]]]], "r": [[0.000802935], 0, 2.17441, 1680127156], "v": "v0.6"}
{"i": [["[\"4b23b0dc1d1164f464c7f5544479ae4d\", [1, 28, 28, 512], [1, 1, 512, 1024], [1, 1, 1, 1024], [1, 14, 14, 1024]]", "cuda -keys=cuda,gpu -arch=sm_75 -max_num_threads=1024 -model=2080ti -thread_warp_size=32", [-1, 16, 64, 49152, 2147483647, 1024, 8, 32], "", 0, []], [[], [["SP", 3, 0, 1, [1, 1, 1, 1], 1], ["SP", 3, 5, 14, [2, 7, 1, 1], 1], ["SP", 3, 10, 14, [1, 7, 1, 1], 1], ["SP", 3, 15, 1024, [1, 2, 32, 4], 1], ["SP", 3, 20, 1, [1, 1], 1], ["SP", 3, 23, 1, [1, 1], 1], ["SP", 3, 26, 512, [4, 4], 1], ["RE", 3, [0, 5, 10, 15, 1, 6, 11, 16, 2, 7, 12, 17, 20, 23, 26, 21, 24, 27, 3, 8, 13, 18, 22, 25, 28, 4, 9, 14, 19]], ["FSP", 5, 0, 0, 3], ["FSP", 5, 4, 1, 3], ["FSP", 5, 8, 2, 3], ["FSP", 5, 12, 3, 3], ["RE", 5, [0, 4, 8, 12, 1, 5, 9, 13, 2, 6, 10, 14, 3, 7, 11, 15]], ["CA", 3, 5, 11], ["CHR", 2, "shared", [3]], ["CA", 3, 4, 14], ["CHR", 1, "shared", [4]], ["CA", 2, 5, 14], ["CI", 1], ["FU", 7, [0, 1, 2, 3]], ["AN", 7, 0, 5], ["FU", 7, [1, 2, 3, 4]], ["AN", 7, 1, 4], ["FU", 7, [2, 3, 4, 5]], ["AN", 7, 2, 6], ["FU", 4, [0, 1, 2, 3]], ["SP", 4, 0, 2048, [2], 1], ["AN", 4, 1, 2], ["FFSP", 4, 0, [3, 2, 1, 0], 1, 1], ["AN", 4, 1, 6], ["FU", 2, [0, 1, 2, 3]], ["SP", 2, 0, 16, [1], 1], ["AN", 2, 1, 2], ["FFSP", 2, 0, [3, 2, 1, 0], 1, 1], ["AN", 2, 1, 6], ["PR", 5, 0, "auto_unroll_max_step$0"]]]], "r": [[0.00170959], 0, 1.90491, 1680127157], "v": "v0.6"}
{"i": [["[\"4b23b0dc1d1164f464c7f5544479ae4d\", [1, 28, 28, 512], [1, 1, 512, 1024], [1, 1, 1, 1024], [1, 14, 14, 1024]]", "cuda -keys=cuda,gpu -arch=sm_75 -max_num_threads=1024 -model=2080ti -thread_warp_size=32", [-1, 16, 64, 49152, 2147483647, 1024, 8, 32], "", 0, []], [[], [["SP", 3, 0, 1, [1, 1, 1, 1], 1], ["SP", 3, 5, 14, [7, 1, 1, 2], 1], ["SP", 3, 10, 14, [1, 7, 2, 1], 1], ["SP", 3, 15, 1024, [1, 1, 4, 64], 1], ["SP", 3, 20, 1, [1, 1], 1], ["SP", 3, 23, 1, [1, 1], 1], ["SP", 3, 26, 512, [2, 4], 1], ["RE", 3, [0, 5, 10, 15, 1, 6, 11, 16, 2, 7, 12, 17, 20, 23, 26, 21, 24, 27, 3, 8, 13, 18, 22, 25, 28, 4, 9, 14, 19]], ["FSP", 5, 0, 0, 3], ["FSP", 5, 4, 1, 3], ["FSP", 5, 8, 2, 3], ["FSP", 5, 12, 3, 3], ["RE", 5, [0, 4, 8, 12, 1, 5, 9, 13, 2, 6, 10, 14, 3, 7, 11, 15]], ["CA", 3, 5, 11], ["CHR", 2, "shared", [3]], ["CA", 3, 4, 14], ["CHR", 1, "shared", [4]], ["CA", 2, 5, 14], ["CI", 1], ["FU", 7, [0, 1, 2, 3]], ["AN", 7, 0, 5], ["FU", 7, [1, 2, 3, 4]], ["AN", 7, 1, 4], ["FU", 7, [2, 3, 4, 5]], ["AN", 7, 2, 6], ["FU", 4, [0, 1, 2, 3]], ["SP", 4, 0, 256, [16], 1], ["AN", 4, 1, 2], ["FFSP", 4, 0, [3, 2, 1, 0], 1, 1], ["AN", 4, 1, 6], ["FU", 2, [0, 1, 2, 3]], ["SP", 2, 0, 648, [1], 1], ["AN", 2, 1, 2], ["FFSP", 2, 0, [3, 2, 1, 0], 1, 1], ["AN", 2, 1, 6], ["PR", 5, 0, "auto_unroll_max_step$0"]]]], "r": [[0.0721582], 0, 2.77788, 1680127158], "v": "v0.6"}
{"i": [["[\"4b23b0dc1d1164f464c7f5544479ae4d\", [1, 28, 28, 512], [1, 1, 512, 1024], [1, 1, 1, 1024], [1, 14, 14, 1024]]", "cuda -keys=cuda,gpu -arch=sm_75 -max_num_threads=1024 -model=2080ti -thread_warp_size=32", [-1, 16, 64, 49152, 2147483647, 1024, 8, 32], "", 0, []], [[], [["SP", 3, 0, 1, [1, 1, 1, 1], 1], ["SP", 3, 5, 14, [1, 1, 7, 2], 1], ["SP", 3, 10, 14, [1, 1, 1, 1], 1], ["SP", 3, 15, 1024, [8, 16, 2, 4], 1], ["SP", 3, 20, 1, [1, 1], 1], ["SP", 3, 23, 1, [1, 1], 1], ["SP", 3, 26, 512, [2, 1], 1], ["RE", 3, [0, 5, 10, 15, 1, 6, 11, 16, 2, 7, 12, 17, 20, 23, 26, 21, 24, 27, 3, 8, 13, 18, 22, 25, 28, 4, 9, 14, 19]], ["FSP", 5, 0, 0, 3], ["FSP", 5, 4, 1, 3], ["FSP", 5, 8, 2, 3], ["FSP", 5, 12, 3, 3], ["RE", 5, [0, 4, 8, 12, 1, 5, 9, 13, 2, 6, 10, 14, 3, 7, 11, 15]], ["CA", 3, 5, 11], ["CHR", 2, "shared", [3]], ["CA", 3, 4, 14], ["CHR", 1, "shared", [4]], ["CA", 2, 5, 14], ["CI", 1], ["FU", 7, [0, 1, 2, 3]], ["AN", 7, 0, 5], ["FU", 7, [1, 2, 3, 4]], ["AN", 7, 1, 4], ["FU", 7, [2, 3, 4, 5]], ["AN", 7, 2, 6], ["FU", 4, [0, 1, 2, 3]], ["SP", 4, 0, 16, [1], 1], ["AN", 4, 1, 2], ["FFSP", 4, 0, [3, 2, 1, 0], 1, 1], ["AN", 4, 1, 6], ["FU", 2, [0, 1, 2, 3]], ["SP", 2, 0, 162, [1], 1], ["AN", 2, 1, 2], ["FFSP", 2, 0, [3, 2, 1, 0], 1, 1], ["AN", 2, 1, 6], ["PR", 5, 0, "auto_unroll_max_step$512"]]]], "r": [[0.00269489], 0, 6.09263, 1680127159], "v": "v0.6"}
{"i": [["[\"4b23b0dc1d1164f464c7f5544479ae4d\", [1, 28, 28, 512], [1, 1, 512, 1024], [1, 1, 1, 1024], [1, 14, 14, 1024]]", "cuda -keys=cuda,gpu -arch=sm_75 -max_num_threads=1024 -model=2080ti -thread_warp_size=32", [-1, 16, 64, 49152, 2147483647, 1024, 8, 32], "", 0, []], [[], [["SP", 3, 0, 1, [1, 1, 1, 1], 1], ["SP", 3, 5, 14, [1, 7, 1, 1], 1], ["SP", 3, 10, 14, [1, 2, 1, 1], 1], ["SP", 3, 15, 1024, [1, 1, 256, 2], 1], ["SP", 3, 20, 1, [1, 1], 1], ["SP", 3, 23, 1, [1, 1], 1], ["SP", 3, 26, 512, [1, 8], 1], ["RE", 3, [0, 5, 10, 15, 1, 6, 11, 16, 2, 7, 12, 17, 20, 23, 26, 21, 24, 27, 3, 8, 13, 18, 22, 25, 28, 4, 9, 14, 19]], ["FSP", 5, 0, 0, 3], ["FSP", 5, 4, 1, 3], ["FSP", 5, 8, 2, 3], ["FSP", 5, 12, 3, 3], ["RE", 5, [0, 4, 8, 12, 1, 5, 9, 13, 2, 6, 10, 14, 3, 7, 11, 15]], ["CA", 3, 5, 11], ["CHR", 2, "shared", [3]], ["CA", 3, 4, 14], ["CHR", 1, "shared", [4]], ["CA", 2, 5, 14], ["CI", 1], ["FU", 7, [0, 1, 2, 3]], ["AN", 7, 0, 5], ["FU", 7, [1, 2, 3, 4]], ["AN", 7, 1, 4], ["FU", 7, [2, 3, 4, 5]], ["AN", 7, 2, 6], ["FU", 4, [0, 1, 2, 3]], ["SP", 4, 0, 128, [1], 1], ["AN", 4, 1, 2], ["FFSP", 4, 0, [3, 2, 1, 0], 1, 1], ["AN", 4, 1, 6], ["FU", 2, [0, 1, 2, 3]], ["SP", 2, 0, 8, [8], 1], ["AN", 2, 1, 2], ["FFSP", 2, 0, [3, 2, 1, 0], 1, 1], ["AN", 2, 1, 6], ["PR", 5, 0, "auto_unroll_max_step$1024"]]]], "r": [[0.00372319], 0, 6.98902, 1680127161], "v": "v0.6"}
{"i": [["[\"4b23b0dc1d1164f464c7f5544479ae4d\", [1, 28, 28, 512], [1, 1, 512, 1024], [1, 1, 1, 1024], [1, 14, 14, 1024]]", "cuda -keys=cuda,gpu -arch=sm_75 -max_num_threads=1024 -model=2080ti -thread_warp_size=32", [-1, 16, 64, 49152, 2147483647, 1024, 8, 32], "", 0, []], [[], [["SP", 3, 0, 1, [1, 1, 1, 1], 1], ["SP", 3, 5, 14, [1, 1, 1, 14], 1], ["SP", 3, 10, 14, [1, 1, 7, 1], 1], ["SP", 3, 15, 1024, [4, 8, 8, 4], 1], ["SP", 3, 20, 1, [1, 1], 1], ["SP", 3, 23, 1, [1, 1], 1], ["SP", 3, 26, 512, [2, 1], 1], ["RE", 3, [0, 5, 10, 15, 1, 6, 11, 16, 2, 7, 12, 17, 20, 23, 26, 21, 24, 27, 3, 8, 13, 18, 22, 25, 28, 4, 9, 14, 19]], ["FSP", 5, 0, 0, 3], ["FSP", 5, 4, 1, 3], ["FSP", 5, 8, 2, 3], ["FSP", 5, 12, 3, 3], ["RE", 5, [0, 4, 8, 12, 1, 5, 9, 13, 2, 6, 10, 14, 3, 7, 11, 15]], ["CA", 3, 5, 11], ["CHR", 2, "shared", [3]], ["CA", 3, 4, 14], ["CHR", 1, "shared", [4]], ["CA", 2, 5, 14], ["CI", 1], ["FU", 7, [0, 1, 2, 3]], ["AN", 7, 0, 5], ["FU", 7, [1, 2, 3, 4]], ["AN", 7, 1, 4], ["FU", 7, [2, 3, 4, 5]], ["AN", 7, 2, 6], ["FU", 4, [0, 1, 2, 3]], ["SP", 4, 0, 64, [1], 1], ["AN", 4, 1, 2], ["FFSP", 4, 0, [3, 2, 1, 0], 1, 1], ["AN", 4, 1, 6], ["FU", 2, [0, 1, 2, 3]], ["SP", 2, 0, 54, [54], 1], ["AN", 2, 1, 2], ["FFSP", 2, 0, [3, 2, 1, 0], 1, 1], ["AN", 2, 1, 6], ["PR", 5, 0, "auto_unroll_max_step$16"]]]], "r": [[0.0402924], 0, 2.36469, 1680127161], "v": "v0.6"}
{"i": [["[\"4b23b0dc1d1164f464c7f5544479ae4d\", [1, 28, 28, 512], [1, 1, 512, 1024], [1, 1, 1, 1024], [1, 14, 14, 1024]]", "cuda -keys=cuda,gpu -arch=sm_75 -max_num_threads=1024 -model=2080ti -thread_warp_size=32", [-1, 16, 64, 49152, 2147483647, 1024, 8, 32], "", 0, []], [[], [["SP", 3, 0, 1, [1, 1, 1, 1], 1], ["SP", 3, 5, 14, [2, 1, 1, 1], 1], ["SP", 3, 10, 14, [1, 7, 1, 2], 1], ["SP", 3, 15, 1024, [1, 16, 32, 2], 1], ["SP", 3, 20, 1, [1, 1], 1], ["SP", 3, 23, 1, [1, 1], 1], ["SP", 3, 26, 512, [1, 2], 1], ["RE", 3, [0, 5, 10, 15, 1, 6, 11, 16, 2, 7, 12, 17, 20, 23, 26, 21, 24, 27, 3, 8, 13, 18, 22, 25, 28, 4, 9, 14, 19]], ["FSP", 5, 0, 0, 3], ["FSP", 5, 4, 1, 3], ["FSP", 5, 8, 2, 3], ["FSP", 5, 12, 3, 3], ["RE", 5, [0, 4, 8, 12, 1, 5, 9, 13, 2, 6, 10, 14, 3, 7, 11, 15]], ["CA", 3, 5, 11], ["CHR", 2, "shared", [3]], ["CA", 3, 4, 14], ["CHR", 1, "shared", [4]], ["CA", 2, 5, 14], ["CI", 1], ["FU", 7, [0, 1, 2, 3]], ["AN", 7, 0, 5], ["FU", 7, [1, 2, 3, 4]], ["AN", 7, 1, 4], ["FU", 7, [2, 3, 4, 5]], ["AN", 7, 2, 6], ["FU", 4, [0, 1, 2, 3]], ["SP", 4, 0, 256, [1], 1], ["AN", 4, 1, 2], ["FFSP", 4, 0, [3, 2, 1, 0], 1, 1], ["AN", 4, 1, 6], ["FU", 2, [0, 1, 2, 3]], ["SP", 2, 0, 12, [1], 1], ["AN", 2, 1, 2], ["FFSP", 2, 0, [3, 2, 1, 0], 1, 1], ["AN", 2, 1, 6], ["PR", 5, 0, "auto_unroll_max_step$16"]]]], "r": [[0.00287621], 0, 1.97629, 1680127162], "v": "v0.6"}
{"i": [["[\"4b23b0dc1d1164f464c7f5544479ae4d\", [1, 28, 28, 512], [1, 1, 512, 1024], [1, 1, 1, 1024], [1, 14, 14, 1024]]", "cuda -keys=cuda,gpu -arch=sm_75 -max_num_threads=1024 -model=2080ti -thread_warp_size=32", [-1, 16, 64, 49152, 2147483647, 1024, 8, 32], "", 0, []], [[], [["SP", 3, 0, 1, [1, 1, 1, 1], 1], ["SP", 3, 5, 14, [1, 2, 1, 1], 1], ["SP", 3, 10, 14, [1, 1, 2, 7], 1], ["SP", 3, 15, 1024, [2, 32, 8, 1], 1], ["SP", 3, 20, 1, [1, 1], 1], ["SP", 3, 23, 1, [1, 1], 1], ["SP", 3, 26, 512, [2, 4], 1], ["RE", 3, [0, 5, 10, 15, 1, 6, 11, 16, 2, 7, 12, 17, 20, 23, 26, 21, 24, 27, 3, 8, 13, 18, 22, 25, 28, 4, 9, 14, 19]], ["FSP", 5, 0, 0, 3], ["FSP", 5, 4, 1, 3], ["FSP", 5, 8, 2, 3], ["FSP", 5, 12, 3, 3], ["RE", 5, [0, 4, 8, 12, 1, 5, 9, 13, 2, 6, 10, 14, 3, 7, 11, 15]], ["CA", 3, 5, 11], ["CHR", 2, "shared", [3]], ["CA", 3, 4, 14], ["CHR", 1, "shared", [4]], ["CA", 2, 5, 14], ["CI", 1], ["FU", 7, [0, 1, 2, 3]], ["AN", 7, 0, 5], ["FU", 7, [1, 2, 3, 4]], ["AN", 7, 1, 4], ["FU", 7, [2, 3, 4, 5]], ["AN", 7, 2, 6], ["FU", 4, [0, 1, 2, 3]], ["SP", 4, 0, 64, [1], 1], ["AN", 4, 1, 2], ["FFSP", 4, 0, [3, 2, 1, 0], 1, 1], ["AN", 4, 1, 6], ["FU", 2, [0, 1, 2, 3]], ["SP", 2, 0, 216, [1], 1], ["AN", 2, 1, 2], ["FFSP", 2, 0, [3, 2, 1, 0], 1, 1], ["AN", 2, 1, 6], ["PR", 5, 0, "auto_unroll_max_step$64"]]]], "r": [[0.000877675], 0, 2.92502, 1680127164], "v": "v0.6"}
{"i": [["[\"4b23b0dc1d1164f464c7f5544479ae4d\", [1, 28, 28, 512], [1, 1, 512, 1024], [1, 1, 1, 1024], [1, 14, 14, 1024]]", "cuda -keys=cuda,gpu -arch=sm_75 -max_num_threads=1024 -model=2080ti -thread_warp_size=32", [-1, 16, 64, 49152, 2147483647, 1024, 8, 32], "", 0, []], [[], [["SP", 3, 0, 1, [1, 1, 1, 1], 1], ["SP", 3, 5, 14, [1, 1, 1, 14], 1], ["SP", 3, 10, 14, [1, 1, 7, 1], 1], ["SP", 3, 15, 1024, [4, 8, 8, 4], 1], ["SP", 3, 20, 1, [1, 1], 1], ["SP", 3, 23, 1, [1, 1], 1], ["SP", 3, 26, 512, [2, 1], 1], ["RE", 3, [0, 5, 10, 15, 1, 6, 11, 16, 2, 7, 12, 17, 20, 23, 26, 21, 24, 27, 3, 8, 13, 18, 22, 25, 28, 4, 9, 14, 19]], ["FSP", 5, 0, 0, 3], ["FSP", 5, 4, 1, 3], ["FSP", 5, 8, 2, 3], ["FSP", 5, 12, 3, 3], ["RE", 5, [0, 4, 8, 12, 1, 5, 9, 13, 2, 6, 10, 14, 3, 7, 11, 15]], ["CA", 3, 5, 11], ["CHR", 2, "shared", [3]], ["CA", 3, 4, 14], ["CHR", 1, "shared", [4]], ["CA", 2, 5, 14], ["CI", 1], ["FU", 7, [0, 1, 2, 3]], ["AN", 7, 0, 5], ["FU", 7, [1, 2, 3, 4]], ["AN", 7, 1, 4], ["FU", 7, [2, 3, 4, 5]], ["AN", 7, 2, 6], ["FU", 4, [0, 1, 2, 3]], ["SP", 4, 0, 64, [1], 1], ["AN", 4, 1, 2], ["FFSP", 4, 0, [3, 2, 1, 0], 1, 1], ["AN", 4, 1, 6], ["FU", 2, [0, 1, 2, 3]], ["SP", 2, 0, 54, [3], 1], ["AN", 2, 1, 2], ["FFSP", 2, 0, [3, 2, 1, 0], 1, 1], ["AN", 2, 1, 6], ["PR", 5, 0, "auto_unroll_max_step$16"]]]], "r": [[0.0407298], 0, 2.24182, 1680127164], "v": "v0.6"}
{"i": [["[\"4b23b0dc1d1164f464c7f5544479ae4d\", [1, 28, 28, 512], [1, 1, 512, 1024], [1, 1, 1, 1024], [1, 14, 14, 1024]]", "cuda -keys=cuda,gpu -arch=sm_75 -max_num_threads=1024 -model=2080ti -thread_warp_size=32", [-1, 16, 64, 49152, 2147483647, 1024, 8, 32], "", 0, []], [[], [["SP", 3, 0, 1, [1, 1, 1, 1], 1], ["SP", 3, 5, 14, [1, 14, 1, 1], 1], ["SP", 3, 10, 14, [1, 7, 2, 1], 1], ["SP", 3, 15, 1024, [4, 4, 1, 4], 1], ["SP", 3, 20, 1, [1, 1], 1], ["SP", 3, 23, 1, [1, 1], 1], ["SP", 3, 26, 512, [2, 4], 1], ["RE", 3, [0, 5, 10, 15, 1, 6, 11, 16, 2, 7, 12, 17, 20, 23, 26, 21, 24, 27, 3, 8, 13, 18, 22, 25, 28, 4, 9, 14, 19]], ["FSP", 5, 0, 0, 3], ["FSP", 5, 4, 1, 3], ["FSP", 5, 8, 2, 3], ["FSP", 5, 12, 3, 3], ["RE", 5, [0, 4, 8, 12, 1, 5, 9, 13, 2, 6, 10, 14, 3, 7, 11, 15]], ["CA", 3, 5, 11], ["CHR", 2, "shared", [3]], ["CA", 3, 4, 14], ["CHR", 1, "shared", [4]], ["CA", 2, 5, 14], ["CI", 1], ["FU", 7, [0, 1, 2, 3]], ["AN", 7, 0, 5], ["FU", 7, [1, 2, 3, 4]], ["AN", 7, 1, 4], ["FU", 7, [2, 3, 4, 5]], ["AN", 7, 2, 6], ["FU", 4, [0, 1, 2, 3]], ["SP", 4, 0, 32, [1], 1], ["AN", 4, 1, 2], ["FFSP", 4, 0, [3, 2, 1, 0], 1, 1], ["AN", 4, 1, 6], ["FU", 2, [0, 1, 2, 3]], ["SP", 2, 0, 312, [1], 1], ["AN", 2, 1, 2], ["FFSP", 2, 0, [3, 2, 1, 0], 1, 1], ["AN", 2, 1, 6], ["PR", 5, 0, "auto_unroll_max_step$1024"]]]], "r": [[0.000233629], 0, 2.7604, 1680127165], "v": "v0.6"}
{"i": [["[\"4b23b0dc1d1164f464c7f5544479ae4d\", [1, 28, 28, 512], [1, 1, 512, 1024], [1, 1, 1, 1024], [1, 14, 14, 1024]]", "cuda -keys=cuda,gpu -arch=sm_75 -max_num_threads=1024 -model=2080ti -thread_warp_size=32", [-1, 16, 64, 49152, 2147483647, 1024, 8, 32], "", 0, []], [[], [["SP", 3, 0, 1, [1, 1, 1, 1], 1], ["SP", 3, 5, 14, [7, 1, 2, 1], 1], ["SP", 3, 10, 14, [1, 14, 1, 1], 1], ["SP", 3, 15, 1024, [2, 4, 1, 1], 1], ["SP", 3, 20, 1, [1, 1], 1], ["SP", 3, 23, 1, [1, 1], 1], ["SP", 3, 26, 512, [4, 4], 1], ["RE", 3, [0, 5, 10, 15, 1, 6, 11, 16, 2, 7, 12, 17, 20, 23, 26, 21, 24, 27, 3, 8, 13, 18, 22, 25, 28, 4, 9, 14, 19]], ["FSP", 5, 0, 0, 3], ["FSP", 5, 4, 1, 3], ["FSP", 5, 8, 2, 3], ["FSP", 5, 12, 3, 3], ["RE", 5, [0, 4, 8, 12, 1, 5, 9, 13, 2, 6, 10, 14, 3, 7, 11, 15]], ["CA", 3, 5, 11], ["CHR", 2, "shared", [3]], ["CA", 3, 4, 14], ["CHR", 1, "shared", [4]], ["CA", 2, 5, 14], ["CI", 1], ["FU", 7, [0, 1, 2, 3]], ["AN", 7, 0, 5], ["FU", 7, [1, 2, 3, 4]], ["AN", 7, 1, 4], ["FU", 7, [2, 3, 4, 5]], ["AN", 7, 2, 6], ["FU", 4, [0, 1, 2, 3]], ["SP", 4, 0, 16, [1], 1], ["AN", 4, 1, 2], ["FFSP", 4, 0, [3, 2, 1, 0], 1, 1], ["AN", 4, 1, 6], ["FU", 2, [0, 1, 2, 3]], ["SP", 2, 0, 432, [1], 1], ["AN", 2, 1, 2], ["FFSP", 2, 0, [3, 2, 1, 0], 1, 1], ["AN", 2, 1, 6], ["PR", 5, 0, "auto_unroll_max_step$64"]]]], "r": [[0.00322776], 0, 2.29842, 1680127167], "v": "v0.6"}
{"i": [["[\"4b23b0dc1d1164f464c7f5544479ae4d\", [1, 28, 28, 512], [1, 1, 512, 1024], [1, 1, 1, 1024], [1, 14, 14, 1024]]", "cuda -keys=cuda,gpu -arch=sm_75 -max_num_threads=1024 -model=2080ti -thread_warp_size=32", [-1, 16, 64, 49152, 2147483647, 1024, 8, 32], "", 0, []], [[], [["SP", 3, 0, 1, [1, 1, 1, 1], 1], ["SP", 3, 5, 14, [1, 1, 14, 1], 1], ["SP", 3, 10, 14, [1, 14, 1, 1], 1], ["SP", 3, 15, 1024, [4, 32, 2, 2], 1], ["SP", 3, 20, 1, [1, 1], 1], ["SP", 3, 23, 1, [1, 1], 1], ["SP", 3, 26, 512, [1, 4], 1], ["RE", 3, [0, 5, 10, 15, 1, 6, 11, 16, 2, 7, 12, 17, 20, 23, 26, 21, 24, 27, 3, 8, 13, 18, 22, 25, 28, 4, 9, 14, 19]], ["FSP", 5, 0, 0, 3], ["FSP", 5, 4, 1, 3], ["FSP", 5, 8, 2, 3], ["FSP", 5, 12, 3, 3], ["RE", 5, [0, 4, 8, 12, 1, 5, 9, 13, 2, 6, 10, 14, 3, 7, 11, 15]], ["CA", 3, 5, 11], ["CHR", 2, "shared", [3]], ["CA", 3, 4, 14], ["CHR", 1, "shared", [4]], ["CA", 2, 5, 14], ["CI", 1], ["FU", 7, [0, 1, 2, 3]], ["AN", 7, 0, 5], ["FU", 7, [1, 2, 3, 4]], ["AN", 7, 1, 4], ["FU", 7, [2, 3, 4, 5]], ["AN", 7, 2, 6], ["FU", 4, [0, 1, 2, 3]], ["SP", 4, 0, 16, [1], 1], ["AN", 4, 1, 2], ["FFSP", 4, 0, [3, 2, 1, 0], 1, 1], ["AN", 4, 1, 6], ["FU", 2, [0, 1, 2, 3]], ["SP", 2, 0, 1404, [1], 1], ["AN", 2, 1, 2], ["FFSP", 2, 0, [3, 2, 1, 0], 1, 1], ["AN", 2, 1, 6], ["PR", 5, 0, "auto_unroll_max_step$64"]]]], "r": [[0.00214152], 0, 2.30878, 1680127168], "v": "v0.6"}
{"i": [["[\"4b23b0dc1d1164f464c7f5544479ae4d\", [1, 28, 28, 512], [1, 1, 512, 1024], [1, 1, 1, 1024], [1, 14, 14, 1024]]", "cuda -keys=cuda,gpu -arch=sm_75 -max_num_threads=1024 -model=2080ti -thread_warp_size=32", [-1, 16, 64, 49152, 2147483647, 1024, 8, 32], "", 0, []], [[], [["SP", 3, 0, 1, [1, 1, 1, 1], 1], ["SP", 3, 5, 14, [1, 2, 1, 1], 1], ["SP", 3, 10, 14, [1, 2, 7, 1], 1], ["SP", 3, 15, 1024, [1, 16, 2, 8], 1], ["SP", 3, 20, 1, [1, 1], 1], ["SP", 3, 23, 1, [1, 1], 1], ["SP", 3, 26, 512, [2, 2], 1], ["RE", 3, [0, 5, 10, 15, 1, 6, 11, 16, 2, 7, 12, 17, 20, 23, 26, 21, 24, 27, 3, 8, 13, 18, 22, 25, 28, 4, 9, 14, 19]], ["FSP", 5, 0, 0, 3], ["FSP", 5, 4, 1, 3], ["FSP", 5, 8, 2, 3], ["FSP", 5, 12, 3, 3], ["RE", 5, [0, 4, 8, 12, 1, 5, 9, 13, 2, 6, 10, 14, 3, 7, 11, 15]], ["CA", 3, 5, 11], ["CHR", 2, "shared", [3]], ["CA", 3, 4, 14], ["CHR", 1, "shared", [4]], ["CA", 2, 5, 14], ["CI", 1], ["FU", 7, [0, 1, 2, 3]], ["AN", 7, 0, 5], ["FU", 7, [1, 2, 3, 4]], ["AN", 7, 1, 4], ["FU", 7, [2, 3, 4, 5]], ["AN", 7, 2, 6], ["FU", 4, [0, 1, 2, 3]], ["SP", 4, 0, 128, [1], 1], ["AN", 4, 1, 2], ["FFSP", 4, 0, [3, 2, 1, 0], 1, 1], ["AN", 4, 1, 6], ["FU", 2, [0, 1, 2, 3]], ["SP", 2, 0, 52, [2], 1], ["AN", 2, 1, 2], ["FFSP", 2, 0, [3, 2, 1, 0], 1, 1], ["AN", 2, 1, 6], ["PR", 5, 0, "auto_unroll_max_step$1024"]]]], "r": [[0.000172262], 0, 3.46977, 1680127169], "v": "v0.6"}
{"i": [["[\"4b23b0dc1d1164f464c7f5544479ae4d\", [1, 28, 28, 512], [1, 1, 512, 1024], [1, 1, 1, 1024], [1, 14, 14, 1024]]", "cuda -keys=cuda,gpu -arch=sm_75 -max_num_threads=1024 -model=2080ti -thread_warp_size=32", [-1, 16, 64, 49152, 2147483647, 1024, 8, 32], "", 0, []], [[], [["SP", 3, 0, 1, [1, 1, 1, 1], 1], ["SP", 3, 5, 14, [1, 2, 1, 1], 1], ["SP", 3, 10, 14, [1, 1, 1, 1], 1], ["SP", 3, 15, 1024, [2, 32, 8, 1], 1], ["SP", 3, 20, 1, [1, 1], 1], ["SP", 3, 23, 1, [1, 1], 1], ["SP", 3, 26, 512, [1, 8], 1], ["RE", 3, [0, 5, 10, 15, 1, 6, 11, 16, 2, 7, 12, 17, 20, 23, 26, 21, 24, 27, 3, 8, 13, 18, 22, 25, 28, 4, 9, 14, 19]], ["FSP", 5, 0, 0, 3], ["FSP", 5, 4, 1, 3], ["FSP", 5, 8, 2, 3], ["FSP", 5, 12, 3, 3], ["RE", 5, [0, 4, 8, 12, 1, 5, 9, 13, 2, 6, 10, 14, 3, 7, 11, 15]], ["CA", 3, 5, 11], ["CHR", 2, "shared", [3]], ["CA", 3, 4, 14], ["CHR", 1, "shared", [4]], ["CA", 2, 5, 14], ["CI", 1], ["FU", 7, [0, 1, 2, 3]], ["AN", 7, 0, 5], ["FU", 7, [1, 2, 3, 4]], ["AN", 7, 1, 4], ["FU", 7, [2, 3, 4, 5]], ["AN", 7, 2, 6], ["FU", 4, [0, 1, 2, 3]], ["SP", 4, 0, 64, [4], 1], ["AN", 4, 1, 2], ["FFSP", 4, 0, [3, 2, 1, 0], 1, 1], ["AN", 4, 1, 6], ["FU", 2, [0, 1, 2, 3]], ["SP", 2, 0, 8, [4], 1], ["AN", 2, 1, 2], ["FFSP", 2, 0, [3, 2, 1, 0], 1, 1], ["AN", 2, 1, 6], ["PR", 5, 0, "auto_unroll_max_step$512"]]]], "r": [[0.000246684], 0, 2.09911, 1680127170], "v": "v0.6"}
{"i": [["[\"4b23b0dc1d1164f464c7f5544479ae4d\", [1, 28, 28, 512], [1, 1, 512, 1024], [1, 1, 1, 1024], [1, 14, 14, 1024]]", "cuda -keys=cuda,gpu -arch=sm_75 -max_num_threads=1024 -model=2080ti -thread_warp_size=32", [-1, 16, 64, 49152, 2147483647, 1024, 8, 32], "", 0, []], [[], [["SP", 3, 0, 1, [1, 1, 1, 1], 1], ["SP", 3, 5, 14, [1, 2, 7, 1], 1], ["SP", 3, 10, 14, [1, 2, 7, 1], 1], ["SP", 3, 15, 1024, [1, 8, 1, 64], 1], ["SP", 3, 20, 1, [1, 1], 1], ["SP", 3, 23, 1, [1, 1], 1], ["SP", 3, 26, 512, [1, 1], 1], ["RE", 3, [0, 5, 10, 15, 1, 6, 11, 16, 2, 7, 12, 17, 20, 23, 26, 21, 24, 27, 3, 8, 13, 18, 22, 25, 28, 4, 9, 14, 19]], ["FSP", 5, 0, 0, 3], ["FSP", 5, 4, 1, 3], ["FSP", 5, 8, 2, 3], ["FSP", 5, 12, 3, 3], ["RE", 5, [0, 4, 8, 12, 1, 5, 9, 13, 2, 6, 10, 14, 3, 7, 11, 15]], ["CA", 3, 5, 11], ["CHR", 2, "shared", [3]], ["CA", 3, 4, 14], ["CHR", 1, "shared", [4]], ["CA", 2, 5, 14], ["CI", 1], ["FU", 7, [0, 1, 2, 3]], ["AN", 7, 0, 5], ["FU", 7, [1, 2, 3, 4]], ["AN", 7, 1, 4], ["FU", 7, [2, 3, 4, 5]], ["AN", 7, 2, 6], ["FU", 4, [0, 1, 2, 3]], ["SP", 4, 0, 64, [1], 1], ["AN", 4, 1, 2], ["FFSP", 4, 0, [3, 2, 1, 0], 1, 1], ["AN", 4, 1, 6], ["FU", 2, [0, 1, 2, 3]], ["SP", 2, 0, 169, [13], 1], ["AN", 2, 1, 2], ["FFSP", 2, 0, [3, 2, 1, 0], 1, 1], ["AN", 2, 1, 6], ["PR", 5, 0, "auto_unroll_max_step$0"]]]], "r": [[0.025924], 0, 1.88669, 1680127170], "v": "v0.6"}
{"i": [["[\"4b23b0dc1d1164f464c7f5544479ae4d\", [1, 28, 28, 512], [1, 1, 512, 1024], [1, 1, 1, 1024], [1, 14, 14, 1024]]", "cuda -keys=cuda,gpu -arch=sm_75 -max_num_threads=1024 -model=2080ti -thread_warp_size=32", [-1, 16, 64, 49152, 2147483647, 1024, 8, 32], "", 0, []], [[], [["SP", 3, 0, 1, [1, 1, 1, 1], 1], ["SP", 3, 5, 14, [1, 1, 2, 7], 1], ["SP", 3, 10, 14, [1, 1, 7, 1], 1], ["SP", 3, 15, 1024, [1, 8, 4, 8], 1], ["SP", 3, 20, 1, [1, 1], 1], ["SP", 3, 23, 1, [1, 1], 1], ["SP", 3, 26, 512, [2, 4], 1], ["RE", 3, [0, 5, 10, 15, 1, 6, 11, 16, 2, 7, 12, 17, 20, 23, 26, 21, 24, 27, 3, 8, 13, 18, 22, 25, 28, 4, 9, 14, 19]], ["FSP", 5, 0, 0, 3], ["FSP", 5, 4, 1, 3], ["FSP", 5, 8, 2, 3], ["FSP", 5, 12, 3, 3], ["RE", 5, [0, 4, 8, 12, 1, 5, 9, 13, 2, 6, 10, 14, 3, 7, 11, 15]], ["CA", 3, 5, 11], ["CHR", 2, "shared", [3]], ["CA", 3, 4, 14], ["CHR", 1, "shared", [4]], ["CA", 2, 5, 14], ["CI", 1], ["FU", 7, [0, 1, 2, 3]], ["AN", 7, 0, 5], ["FU", 7, [1, 2, 3, 4]], ["AN", 7, 1, 4], ["FU", 7, [2, 3, 4, 5]], ["AN", 7, 2, 6], ["FU", 4, [0, 1, 2, 3]], ["SP", 4, 0, 256, [1], 1], ["AN", 4, 1, 2], ["FFSP", 4, 0, [3, 2, 1, 0], 1, 1], ["AN", 4, 1, 6], ["FU", 2, [0, 1, 2, 3]], ["SP", 2, 0, 648, [1], 1], ["AN", 2, 1, 2], ["FFSP", 2, 0, [3, 2, 1, 0], 1, 1], ["AN", 2, 1, 6], ["PR", 5, 0, "auto_unroll_max_step$0"]]]], "r": [[0.00684002], 0, 1.9294, 1680127171], "v": "v0.6"}
{"i": [["[\"4b23b0dc1d1164f464c7f5544479ae4d\", [1, 28, 28, 512], [1, 1, 512, 1024], [1, 1, 1, 1024], [1, 14, 14, 1024]]", "cuda -keys=cuda,gpu -arch=sm_75 -max_num_threads=1024 -model=2080ti -thread_warp_size=32", [-1, 16, 64, 49152, 2147483647, 1024, 8, 32], "", 0, []], [[], [["SP", 3, 0, 1, [1, 1, 1, 1], 1], ["SP", 3, 5, 14, [2, 1, 7, 1], 1], ["SP", 3, 10, 14, [1, 1, 7, 2], 1], ["SP", 3, 15, 1024, [2, 4, 32, 1], 1], ["SP", 3, 20, 1, [1, 1], 1], ["SP", 3, 23, 1, [1, 1], 1], ["SP", 3, 26, 512, [1, 4], 1], ["RE", 3, [0, 5, 10, 15, 1, 6, 11, 16, 2, 7, 12, 17, 20, 23, 26, 21, 24, 27, 3, 8, 13, 18, 22, 25, 28, 4, 9, 14, 19]], ["FSP", 5, 0, 0, 3], ["FSP", 5, 4, 1, 3], ["FSP", 5, 8, 2, 3], ["FSP", 5, 12, 3, 3], ["RE", 5, [0, 4, 8, 12, 1, 5, 9, 13, 2, 6, 10, 14, 3, 7, 11, 15]], ["CA", 3, 5, 11], ["CHR", 2, "shared", [3]], ["CA", 3, 4, 14], ["CHR", 1, "shared", [4]], ["CA", 2, 5, 14], ["CI", 1], ["FU", 7, [0, 1, 2, 3]], ["AN", 7, 0, 5], ["FU", 7, [1, 2, 3, 4]], ["AN", 7, 1, 4], ["FU", 7, [2, 3, 4, 5]], ["AN", 7, 2, 6], ["FU", 4, [0, 1, 2, 3]], ["SP", 4, 0, 32, [1], 1], ["AN", 4, 1, 2], ["FFSP", 4, 0, [3, 2, 1, 0], 1, 1], ["AN", 4, 1, 6], ["FU", 2, [0, 1, 2, 3]], ["SP", 2, 0, 108, [1], 1], ["AN", 2, 1, 2], ["FFSP", 2, 0, [3, 2, 1, 0], 1, 1], ["AN", 2, 1, 6], ["PR", 5, 0, "auto_unroll_max_step$0"]]]], "r": [[0.0879094], 0, 2.06891, 1680127172], "v": "v0.6"}
{"i": [["[\"4b23b0dc1d1164f464c7f5544479ae4d\", [1, 28, 28, 512], [1, 1, 512, 1024], [1, 1, 1, 1024], [1, 14, 14, 1024]]", "cuda -keys=cuda,gpu -arch=sm_75 -max_num_threads=1024 -model=2080ti -thread_warp_size=32", [-1, 16, 64, 49152, 2147483647, 1024, 8, 32], "", 0, []], [[], [["SP", 3, 0, 1, [1, 1, 1, 1], 1], ["SP", 3, 5, 14, [1, 2, 7, 1], 1], ["SP", 3, 10, 14, [1, 1, 1, 7], 1], ["SP", 3, 15, 1024, [2, 32, 8, 1], 1], ["SP", 3, 20, 1, [1, 1], 1], ["SP", 3, 23, 1, [1, 1], 1], ["SP", 3, 26, 512, [2, 1], 1], ["RE", 3, [0, 5, 10, 15, 1, 6, 11, 16, 2, 7, 12, 17, 20, 23, 26, 21, 24, 27, 3, 8, 13, 18, 22, 25, 28, 4, 9, 14, 19]], ["FSP", 5, 0, 0, 3], ["FSP", 5, 4, 1, 3], ["FSP", 5, 8, 2, 3], ["FSP", 5, 12, 3, 3], ["RE", 5, [0, 4, 8, 12, 1, 5, 9, 13, 2, 6, 10, 14, 3, 7, 11, 15]], ["CA", 3, 5, 11], ["CHR", 2, "shared", [3]], ["CA", 3, 4, 14], ["CHR", 1, "shared", [4]], ["CA", 2, 5, 14], ["CI", 1], ["FU", 7, [0, 1, 2, 3]], ["AN", 7, 0, 5], ["FU", 7, [1, 2, 3, 4]], ["AN", 7, 1, 4], ["FU", 7, [2, 3, 4, 5]], ["AN", 7, 2, 6], ["FU", 4, [0, 1, 2, 3]], ["SP", 4, 0, 64, [1], 1], ["AN", 4, 1, 2], ["FFSP", 4, 0, [3, 2, 1, 0], 1, 1], ["AN", 4, 1, 6], ["FU", 2, [0, 1, 2, 3]], ["SP", 2, 0, 216, [1], 1], ["AN", 2, 1, 2], ["FFSP", 2, 0, [3, 2, 1, 0], 1, 1], ["AN", 2, 1, 6], ["PR", 5, 0, "auto_unroll_max_step$64"]]]], "r": [[0.00577949], 0, 1.80119, 1680127173], "v": "v0.6"}
{"i": [["[\"4b23b0dc1d1164f464c7f5544479ae4d\", [1, 28, 28, 512], [1, 1, 512, 1024], [1, 1, 1, 1024], [1, 14, 14, 1024]]", "cuda -keys=cuda,gpu -arch=sm_75 -max_num_threads=1024 -model=2080ti -thread_warp_size=32", [-1, 16, 64, 49152, 2147483647, 1024, 8, 32], "", 0, []], [[], [["SP", 3, 0, 1, [1, 1, 1, 1], 1], ["SP", 3, 5, 14, [1, 1, 7, 1], 1], ["SP", 3, 10, 14, [1, 7, 1, 1], 1], ["SP", 3, 15, 1024, [1, 1, 4, 2], 1], ["SP", 3, 20, 1, [1, 1], 1], ["SP", 3, 23, 1, [1, 1], 1], ["SP", 3, 26, 512, [1, 4], 1], ["RE", 3, [0, 5, 10, 15, 1, 6, 11, 16, 2, 7, 12, 17, 20, 23, 26, 21, 24, 27, 3, 8, 13, 18, 22, 25, 28, 4, 9, 14, 19]], ["FSP", 5, 0, 0, 3], ["FSP", 5, 4, 1, 3], ["FSP", 5, 8, 2, 3], ["FSP", 5, 12, 3, 3], ["RE", 5, [0, 4, 8, 12, 1, 5, 9, 13, 2, 6, 10, 14, 3, 7, 11, 15]], ["CA", 3, 5, 11], ["CHR", 2, "shared", [3]], ["CA", 3, 4, 14], ["CHR", 1, "shared", [4]], ["CA", 2, 5, 14], ["CI", 1], ["FU", 7, [0, 1, 2, 3]], ["AN", 7, 0, 5], ["FU", 7, [1, 2, 3, 4]], ["AN", 7, 1, 4], ["FU", 7, [2, 3, 4, 5]], ["AN", 7, 2, 6], ["FU", 4, [0, 1, 2, 3]], ["SP", 4, 0, 32, [1], 1], ["AN", 4, 1, 2], ["FFSP", 4, 0, [3, 2, 1, 0], 1, 1], ["AN", 4, 1, 6], ["FU", 2, [0, 1, 2, 3]], ["SP", 2, 0, 4, [1], 1], ["AN", 2, 1, 2], ["FFSP", 2, 0, [3, 2, 1, 0], 1, 1], ["AN", 2, 1, 6], ["PR", 5, 0, "auto_unroll_max_step$0"]]]], "r": [[0.00306363], 0, 1.63431, 1680127174], "v": "v0.6"}
