saved_logs/1000trials/0.4local-pop-2023-03-28/autoscheduler/2080ti/bert-B1-float32.json
{"i": [["[\"4b5e216f8244b4e8f7b6543c4a9087e5\", [1536, 128], [1536, 128]]", "cuda -keys=cuda,gpu -arch=sm_75 -max_num_threads=1024 -model=2080ti -thread_warp_size=32", [-1, 16, 64, 49152, 2147483647, 1024, 8, 32], "", 0, []], [[], [["SP", 5, 1, 128, [32], 1], ["AN", 5, 2, 6], ["FSP", 4, 1, 0, 1], ["AN", 4, 2, 6], ["CA", 4, 5, 0], ["CI", 3], ["CI", 2], ["AN", 5, 0, 5], ["SP", 1, 0, 1536, [4], 1], ["AN", 1, 0, 5], ["AN", 1, 1, 6], ["PR", 1, 0, "auto_unroll_max_step$16"], ["PR", 4, 0, "auto_unroll_max_step$16"]]]], "r": [[1.23764e-05], 0, 1.86518, 1680117447], "v": "v0.6"}
{"i": [["[\"4b5e216f8244b4e8f7b6543c4a9087e5\", [1536, 128], [1536, 128]]", "cuda -keys=cuda,gpu -arch=sm_75 -max_num_threads=1024 -model=2080ti -thread_warp_size=32", [-1, 16, 64, 49152, 2147483647, 1024, 8, 32], "", 0, []], [[], [["CI", 3], ["CI", 2], ["SP", 1, 1, 128, [32], 1], ["AN", 1, 2, 6], ["FU", 5, [0, 1]], ["SP", 5, 0, 196608, [32], 1], ["AN", 5, 0, 5], ["AN", 5, 1, 6], ["SP", 4, 0, 1536, [32], 1], ["AN", 4, 0, 5], ["AN", 4, 1, 6], ["AN", 1, 0, 5], ["PR", 1, 0, "auto_unroll_max_step$512"], ["PR", 4, 0, "auto_unroll_max_step$64"]]]], "r": [[2.36672e-05], 0, 1.863, 1680117448], "v": "v0.6"}
{"i": [["[\"4b5e216f8244b4e8f7b6543c4a9087e5\", [1536, 128], [1536, 128]]", "cuda -keys=cuda,gpu -arch=sm_75 -max_num_threads=1024 -model=2080ti -thread_warp_size=32", [-1, 16, 64, 49152, 2147483647, 1024, 8, 32], "", 0, []], [[], [["CI", 3], ["CI", 2], ["FU", 5, [0, 1]], ["SP", 5, 0, 196608, [64], 1], ["AN", 5, 0, 5], ["AN", 5, 1, 6], ["SP", 4, 0, 1536, [32], 1], ["AN", 4, 0, 5], ["AN", 4, 1, 6], ["SP", 1, 0, 1536, [8], 1], ["AN", 1, 0, 5], ["AN", 1, 1, 6], ["PR", 1, 0, "auto_unroll_max_step$64"], ["PR", 4, 0, "auto_unroll_max_step$512"]]]], "r": [[2.425e-05], 0, 1.92563, 1680117449], "v": "v0.6"}
{"i": [["[\"4b5e216f8244b4e8f7b6543c4a9087e5\", [1536, 128], [1536, 128]]", "cuda -keys=cuda,gpu -arch=sm_75 -max_num_threads=1024 -model=2080ti -thread_warp_size=32", [-1, 16, 64, 49152, 2147483647, 1024, 8, 32], "", 0, []], [[], [["SP", 5, 1, 128, [32], 1], ["AN", 5, 2, 6], ["FSP", 4, 1, 0, 1], ["AN", 4, 2, 6], ["CA", 4, 5, 0], ["CI", 3], ["CI", 2], ["AN", 5, 0, 5], ["SP", 1, 0, 1536, [64], 1], ["AN", 1, 0, 5], ["AN", 1, 1, 6], ["PR", 1, 0, "auto_unroll_max_step$1024"], ["PR", 4, 0, "auto_unroll_max_step$16"]]]], "r": [[1.42339e-05], 0, 2.00453, 1680117451], "v": "v0.6"}
{"i": [["[\"4b5e216f8244b4e8f7b6543c4a9087e5\", [1536, 128], [1536, 128]]", "cuda -keys=cuda,gpu -arch=sm_75 -max_num_threads=1024 -model=2080ti -thread_warp_size=32", [-1, 16, 64, 49152, 2147483647, 1024, 8, 32], "", 0, []], [[], [["SP", 5, 1, 128, [1], 1], ["AN", 5, 2, 6], ["FSP", 4, 1, 0, 1], ["AN", 4, 2, 6], ["CA", 4, 5, 0], ["CI", 3], ["CI", 2], ["AN", 5, 0, 5], ["SP", 1, 0, 1536, [16], 1], ["AN", 1, 0, 5], ["AN", 1, 1, 6], ["PR", 1, 0, "auto_unroll_max_step$64"], ["PR", 4, 0, "auto_unroll_max_step$1024"]]]], "r": [[8.15882e-05], 0, 5.49079, 1680117452], "v": "v0.6"}
{"i": [["[\"4b5e216f8244b4e8f7b6543c4a9087e5\", [1536, 128], [1536, 128]]", "cuda -keys=cuda,gpu -arch=sm_75 -max_num_threads=1024 -model=2080ti -thread_warp_size=32", [-1, 16, 64, 49152, 2147483647, 1024, 8, 32], "", 0, []], [[], [["CI", 3], ["CI", 2], ["SP", 1, 1, 128, [32], 1], ["AN", 1, 2, 6], ["FU", 5, [0, 1]], ["SP", 5, 0, 196608, [4], 1], ["AN", 5, 0, 5], ["AN", 5, 1, 6], ["SP", 4, 0, 1536, [32], 1], ["AN", 4, 0, 5], ["AN", 4, 1, 6], ["AN", 1, 0, 5], ["PR", 1, 0, "auto_unroll_max_step$1024"], ["PR", 4, 0, "auto_unroll_max_step$0"]]]], "r": [[6.01909e-05], 0, 1.90338, 1680117453], "v": "v0.6"}
{"i": [["[\"4b5e216f8244b4e8f7b6543c4a9087e5\", [1536, 128], [1536, 128]]", "cuda -keys=cuda,gpu -arch=sm_75 -max_num_threads=1024 -model=2080ti -thread_warp_size=32", [-1, 16, 64, 49152, 2147483647, 1024, 8, 32], "", 0, []], [[], [["SP", 5, 1, 128, [1], 1], ["AN", 5, 2, 6], ["FSP", 4, 1, 0, 1], ["AN", 4, 2, 6], ["CA", 4, 5, 0], ["CI", 3], ["CI", 2], ["AN", 5, 0, 5], ["SP", 1, 0, 1536, [32], 1], ["AN", 1, 0, 5], ["AN", 1, 1, 6], ["PR", 1, 0, "auto_unroll_max_step$512"], ["PR", 4, 0, "auto_unroll_max_step$512"]]]], "r": [[8.31019e-05], 0, 5.13451, 1680117455], "v": "v0.6"}
{"i": [["[\"4b5e216f8244b4e8f7b6543c4a9087e5\", [1536, 128], [1536, 128]]", "cuda -keys=cuda,gpu -arch=sm_75 -max_num_threads=1024 -model=2080ti -thread_warp_size=32", [-1, 16, 64, 49152, 2147483647, 1024, 8, 32], "", 0, []], [[], [["CI", 3], ["CI", 2], ["SP", 1, 1, 128, [4], 1], ["AN", 1, 2, 6], ["FU", 5, [0, 1]], ["SP", 5, 0, 196608, [32], 1], ["AN", 5, 0, 5], ["AN", 5, 1, 6], ["SP", 4, 0, 1536, [64], 1], ["AN", 4, 0, 5], ["AN", 4, 1, 6], ["AN", 1, 0, 5], ["PR", 1, 0, "auto_unroll_max_step$16"], ["PR", 4, 0, "auto_unroll_max_step$512"]]]], "r": [[2.22203e-05], 0, 2.03923, 1680117456], "v": "v0.6"}
{"i": [["[\"4b5e216f8244b4e8f7b6543c4a9087e5\", [1536, 128], [1536, 128]]", "cuda -keys=cuda,gpu -arch=sm_75 -max_num_threads=1024 -model=2080ti -thread_warp_size=32", [-1, 16, 64, 49152, 2147483647, 1024, 8, 32], "", 0, []], [[], [["CI", 3], ["CI", 2], ["SP", 1, 1, 128, [64], 1], ["AN", 1, 2, 6], ["FU", 5, [0, 1]], ["SP", 5, 0, 196608, [64], 1], ["AN", 5, 0, 5], ["AN", 5, 1, 6], ["SP", 4, 0, 1536, [64], 1], ["AN", 4, 0, 5], ["AN", 4, 1, 6], ["AN", 1, 0, 5], ["PR", 1, 0, "auto_unroll_max_step$0"], ["PR", 4, 0, "auto_unroll_max_step$512"]]]], "r": [[1.95638e-05], 0, 1.84723, 1680117458], "v": "v0.6"}
{"i": [["[\"4b5e216f8244b4e8f7b6543c4a9087e5\", [1536, 128], [1536, 128]]", "cuda -keys=cuda,gpu -arch=sm_75 -max_num_threads=1024 -model=2080ti -thread_warp_size=32", [-1, 16, 64, 49152, 2147483647, 1024, 8, 32], "", 0, []], [[], [["CI", 3], ["CI", 2], ["SP", 1, 1, 128, [32], 1], ["AN", 1, 2, 6], ["FU", 5, [0, 1]], ["SP", 5, 0, 196608, [3], 1], ["AN", 5, 0, 5], ["AN", 5, 1, 6], ["SP", 4, 0, 1536, [32], 1], ["AN", 4, 0, 5], ["AN", 4, 1, 6], ["AN", 1, 0, 5], ["PR", 1, 0, "auto_unroll_max_step$16"], ["PR", 4, 0, "auto_unroll_max_step$1024"]]]], "r": [[7.42219e-05], 0, 2.01309, 1680117459], "v": "v0.6"}
{"i": [["[\"4b5e216f8244b4e8f7b6543c4a9087e5\", [1536, 128], [1536, 128]]", "cuda -keys=cuda,gpu -arch=sm_75 -max_num_threads=1024 -model=2080ti -thread_warp_size=32", [-1, 16, 64, 49152, 2147483647, 1024, 8, 32], "", 0, []], [[], [["CI", 3], ["CI", 2], ["FU", 5, [0, 1]], ["SP", 5, 0, 196608, [2], 1], ["AN", 5, 0, 5], ["AN", 5, 1, 6], ["SP", 4, 0, 1536, [32], 1], ["AN", 4, 0, 5], ["AN", 4, 1, 6], ["SP", 1, 0, 1536, [1], 1], ["AN", 1, 0, 5], ["AN", 1, 1, 6], ["PR", 1, 0, "auto_unroll_max_step$512"], ["PR", 4, 0, "auto_unroll_max_step$16"]]]], "r": [[0.00010575], 0, 2.04981, 1680117460], "v": "v0.6"}
{"i": [["[\"4b5e216f8244b4e8f7b6543c4a9087e5\", [1536, 128], [1536, 128]]", "cuda -keys=cuda,gpu -arch=sm_75 -max_num_threads=1024 -model=2080ti -thread_warp_size=32", [-1, 16, 64, 49152, 2147483647, 1024, 8, 32], "", 0, []], [[], [["CI", 3], ["CI", 2], ["SP", 1, 1, 128, [64], 1], ["AN", 1, 2, 6], ["FU", 5, [0, 1]], ["SP", 5, 0, 196608, [32], 1], ["AN", 5, 0, 5], ["AN", 5, 1, 6], ["SP", 4, 0, 1536, [16], 1], ["AN", 4, 0, 5], ["AN", 4, 1, 6], ["AN", 1, 0, 5], ["PR", 1, 0, "auto_unroll_max_step$1024"], ["PR", 4, 0, "auto_unroll_max_step$0"]]]], "r": [[2.10514e-05], 0, 1.8769, 1680117462], "v": "v0.6"}
{"i": [["[\"4b5e216f8244b4e8f7b6543c4a9087e5\", [1536, 128], [1536, 128]]", "cuda -keys=cuda,gpu -arch=sm_75 -max_num_threads=1024 -model=2080ti -thread_warp_size=32", [-1, 16, 64, 49152, 2147483647, 1024, 8, 32], "", 0, []], [[], [["SP", 5, 1, 128, [64], 1], ["AN", 5, 2, 6], ["FSP", 4, 1, 0, 1], ["AN", 4, 2, 6], ["CA", 4, 5, 0], ["CI", 3], ["CI", 2], ["AN", 5, 0, 5], ["SP", 1, 0, 1536, [64], 1], ["AN", 1, 0, 5], ["AN", 1, 1, 6], ["PR", 1, 0, "auto_unroll_max_step$16"], ["PR", 4, 0, "auto_unroll_max_step$512"]]]], "r": [[1.33053e-05], 0, 1.85711, 1680117463], "v": "v0.6"}
{"i": [["[\"4b5e216f8244b4e8f7b6543c4a9087e5\", [1536, 128], [1536, 128]]", "cuda -keys=cuda,gpu -arch=sm_75 -max_num_threads=1024 -model=2080ti -thread_warp_size=32", [-1, 16, 64, 49152, 2147483647, 1024, 8, 32], "", 0, []], [[], [["CI", 3], ["CI", 2], ["SP", 1, 1, 128, [64], 1], ["AN", 1, 2, 6], ["FU", 5, [0, 1]], ["SP", 5, 0, 196608, [4], 1], ["AN", 5, 0, 5], ["AN", 5, 1, 6], ["SP", 4, 0, 1536, [64], 1], ["AN", 4, 0, 5], ["AN", 4, 1, 6], ["AN", 1, 0, 5], ["PR", 1, 0, "auto_unroll_max_step$1024"], ["PR", 4, 0, "auto_unroll_max_step$16"]]]], "r": [[5.87775e-05], 0, 1.98609, 1680117464], "v": "v0.6"}
{"i": [["[\"4b5e216f8244b4e8f7b6543c4a9087e5\", [1536, 128], [1536, 128]]", "cuda -keys=cuda,gpu -arch=sm_75 -max_num_threads=1024 -model=2080ti -thread_warp_size=32", [-1, 16, 64, 49152, 2147483647, 1024, 8, 32], "", 0, []], [[], [["CI", 3], ["CI", 2], ["SP", 1, 1, 128, [32], 1], ["AN", 1, 2, 6], ["FU", 5, [0, 1]], ["SP", 5, 0, 196608, [32], 1], ["AN", 5, 0, 5], ["AN", 5, 1, 6], ["SP", 4, 0, 1536, [4], 1], ["AN", 4, 0, 5], ["AN", 4, 1, 6], ["AN", 1, 0, 5], ["PR", 1, 0, "auto_unroll_max_step$0"], ["PR", 4, 0, "auto_unroll_max_step$512"]]]], "r": [[2.03366e-05], 0, 1.95901, 1680117466], "v": "v0.6"}
{"i": [["[\"4b5e216f8244b4e8f7b6543c4a9087e5\", [1536, 128], [1536, 128]]", "cuda -keys=cuda,gpu -arch=sm_75 -max_num_threads=1024 -model=2080ti -thread_warp_size=32", [-1, 16, 64, 49152, 2147483647, 1024, 8, 32], "", 0, []], [[], [["CI", 3], ["CI", 2], ["FU", 5, [0, 1]], ["SP", 5, 0, 196608, [32], 1], ["AN", 5, 0, 5], ["AN", 5, 1, 6], ["SP", 4, 0, 1536, [1], 1], ["AN", 4, 0, 5], ["AN", 4, 1, 6], ["SP", 1, 0, 1536, [8], 1], ["AN", 1, 0, 5], ["AN", 1, 1, 6], ["PR", 1, 0, "auto_unroll_max_step$64"], ["PR", 4, 0, "auto_unroll_max_step$16"]]]], "r": [[3.47527e-05], 0, 2.04895, 1680117467], "v": "v0.6"}
{"i": [["[\"4b5e216f8244b4e8f7b6543c4a9087e5\", [1536, 128], [1536, 128]]", "cuda -keys=cuda,gpu -arch=sm_75 -max_num_threads=1024 -model=2080ti -thread_warp_size=32", [-1, 16, 64, 49152, 2147483647, 1024, 8, 32], "", 0, []], [[], [["CI", 3], ["CI", 2], ["FU", 5, [0, 1]], ["SP", 5, 0, 196608, [32], 1], ["AN", 5, 0, 5], ["AN", 5, 1, 6], ["SP", 4, 0, 1536, [2], 1], ["AN", 4, 0, 5], ["AN", 4, 1, 6], ["SP", 1, 0, 1536, [64], 1], ["AN", 1, 0, 5], ["AN", 1, 1, 6], ["PR", 1, 0, "auto_unroll_max_step$512"], ["PR", 4, 0, "auto_unroll_max_step$512"]]]], "r": [[2.84894e-05], 0, 1.98044, 1680117468], "v": "v0.6"}
{"i": [["[\"4b5e216f8244b4e8f7b6543c4a9087e5\", [1536, 128], [1536, 128]]", "cuda -keys=cuda,gpu -arch=sm_75 -max_num_threads=1024 -model=2080ti -thread_warp_size=32", [-1, 16, 64, 49152, 2147483647, 1024, 8, 32], "", 0, []], [[], [["CI", 3], ["CI", 2], ["FU", 5, [0, 1]], ["SP", 5, 0, 196608, [32], 1], ["AN", 5, 0, 5], ["AN", 5, 1, 6], ["SP", 4, 0, 1536, [32], 1], ["AN", 4, 0, 5], ["AN", 4, 1, 6], ["SP", 1, 0, 1536, [32], 1], ["AN", 1, 0, 5], ["AN", 1, 1, 6], ["PR", 1, 0, "auto_unroll_max_step$64"], ["PR", 4, 0, "auto_unroll_max_step$16"]]]], "r": [[2.84326e-05], 0, 2.03339, 1680117470], "v": "v0.6"}
{"i": [["[\"4b5e216f8244b4e8f7b6543c4a9087e5\", [1536, 128], [1536, 128]]", "cuda -keys=cuda,gpu -arch=sm_75 -max_num_threads=1024 -model=2080ti -thread_warp_size=32", [-1, 16, 64, 49152, 2147483647, 1024, 8, 32], "", 0, []], [[], [["CI", 3], ["CI", 2], ["SP", 1, 1, 128, [64], 1], ["AN", 1, 2, 6], ["FU", 5, [0, 1]], ["SP", 5, 0, 196608, [32], 1], ["AN", 5, 0, 5], ["AN", 5, 1, 6], ["SP", 4, 0, 1536, [32], 1], ["AN", 4, 0, 5], ["AN", 4, 1, 6], ["AN", 1, 0, 5], ["PR", 1, 0, "auto_unroll_max_step$1024"], ["PR", 4, 0, "auto_unroll_max_step$512"]]]], "r": [[2.41741e-05], 0, 1.95818, 1680117471], "v": "v0.6"}
{"i": [["[\"4b5e216f8244b4e8f7b6543c4a9087e5\", [1536, 128], [1536, 128]]", "cuda -keys=cuda,gpu -arch=sm_75 -max_num_threads=1024 -model=2080ti -thread_warp_size=32", [-1, 16, 64, 49152, 2147483647, 1024, 8, 32], "", 0, []], [[], [["CI", 3], ["CI", 2], ["FU", 5, [0, 1]], ["SP", 5, 0, 196608, [64], 1], ["AN", 5, 0, 5], ["AN", 5, 1, 6], ["SP", 4, 0, 1536, [32], 1], ["AN", 4, 0, 5], ["AN", 4, 1, 6], ["SP", 1, 0, 1536, [4], 1], ["AN", 1, 0, 5], ["AN", 1, 1, 6], ["PR", 1, 0, "auto_unroll_max_step$512"], ["PR", 4, 0, "auto_unroll_max_step$64"]]]], "r": [[2.42156e-05], 0, 1.8911, 1680117472], "v": "v0.6"}
{"i": [["[\"4b5e216f8244b4e8f7b6543c4a9087e5\", [1536, 128], [1536, 128]]", "cuda -keys=cuda,gpu -arch=sm_75 -max_num_threads=1024 -model=2080ti -thread_warp_size=32", [-1, 16, 64, 49152, 2147483647, 1024, 8, 32], "", 0, []], [[], [["SP", 5, 1, 128, [1], 1], ["AN", 5, 2, 6], ["FSP", 4, 1, 0, 1], ["AN", 4, 2, 6], ["CA", 4, 5, 0], ["CI", 3], ["CI", 2], ["AN", 5, 0, 5], ["SP", 1, 0, 1536, [64], 1], ["AN", 1, 0, 5], ["AN", 1, 1, 6], ["PR", 1, 0, "auto_unroll_max_step$1024"], ["PR", 4, 0, "auto_unroll_max_step$512"]]]], "r": [[8.34037e-05], 0, 4.87525, 1680117474], "v": "v0.6"}
{"i": [["[\"4b5e216f8244b4e8f7b6543c4a9087e5\", [1536, 128], [1536, 128]]", "cuda -keys=cuda,gpu -arch=sm_75 -max_num_threads=1024 -model=2080ti -thread_warp_size=32", [-1, 16, 64, 49152, 2147483647, 1024, 8, 32], "", 0, []], [[], [["CI", 3], ["CI", 2], ["FU", 5, [0, 1]], ["SP", 5, 0, 196608, [64], 1], ["AN", 5, 0, 5], ["AN", 5, 1, 6], ["SP", 4, 0, 1536, [2], 1], ["AN", 4, 0, 5], ["AN", 4, 1, 6], ["SP", 1, 0, 1536, [64], 1], ["AN", 1, 0, 5], ["AN", 1, 1, 6], ["PR", 1, 0, "auto_unroll_max_step$16"], ["PR", 4, 0, "auto_unroll_max_step$512"]]]], "r": [[2.58006e-05], 0, 2.0231, 1680117475], "v": "v0.6"}
{"i": [["[\"4b5e216f8244b4e8f7b6543c4a9087e5\", [1536, 128], [1536, 128]]", "cuda -keys=cuda,gpu -arch=sm_75 -max_num_threads=1024 -model=2080ti -thread_warp_size=32", [-1, 16, 64, 49152, 2147483647, 1024, 8, 32], "", 0, []], [[], [["CI", 3], ["CI", 2], ["FU", 5, [0, 1]], ["SP", 5, 0, 196608, [32], 1], ["AN", 5, 0, 5], ["AN", 5, 1, 6], ["SP", 4, 0, 1536, [64], 1], ["AN", 4, 0, 5], ["AN", 4, 1, 6], ["SP", 1, 0, 1536, [1], 1], ["AN", 1, 0, 5], ["AN", 1, 1, 6], ["PR", 1, 0, "auto_unroll_max_step$512"], ["PR", 4, 0, "auto_unroll_max_step$64"]]]], "r": [[2.57764e-05], 0, 1.86668, 1680117476], "v": "v0.6"}
{"i": [["[\"4b5e216f8244b4e8f7b6543c4a9087e5\", [1536, 128], [1536, 128]]", "cuda -keys=cuda,gpu -arch=sm_75 -max_num_threads=1024 -model=2080ti -thread_warp_size=32", [-1, 16, 64, 49152, 2147483647, 1024, 8, 32], "", 0, []], [[], [["CI", 3], ["CI", 2], ["SP", 1, 1, 128, [32], 1], ["AN", 1, 2, 6], ["FU", 5, [0, 1]], ["SP", 5, 0, 196608, [64], 1], ["AN", 5, 0, 5], ["AN", 5, 1, 6], ["SP", 4, 0, 1536, [32], 1], ["AN", 4, 0, 5], ["AN", 4, 1, 6], ["AN", 1, 0, 5], ["PR", 1, 0, "auto_unroll_max_step$512"], ["PR", 4, 0, "auto_unroll_max_step$0"]]]], "r": [[2.09709e-05], 0, 1.97068, 1680117478], "v": "v0.6"}
{"i": [["[\"4b5e216f8244b4e8f7b6543c4a9087e5\", [1536, 128], [1536, 128]]", "cuda -keys=cuda,gpu -arch=sm_75 -max_num_threads=1024 -model=2080ti -thread_warp_size=32", [-1, 16, 64, 49152, 2147483647, 1024, 8, 32], "", 0, []], [[], [["CI", 3], ["CI", 2], ["SP", 1, 1, 128, [64], 1], ["AN", 1, 2, 6], ["FU", 5, [0, 1]], ["SP", 5, 0, 196608, [32], 1], ["AN", 5, 0, 5], ["AN", 5, 1, 6], ["SP", 4, 0, 1536, [32], 1], ["AN", 4, 0, 5], ["AN", 4, 1, 6], ["AN", 1, 0, 5], ["PR", 1, 0, "auto_unroll_max_step$16"], ["PR", 4, 0, "auto_unroll_max_step$1024"]]]], "r": [[2.41811e-05], 0, 1.92048, 1680117479], "v": "v0.6"}
{"i": [["[\"4b5e216f8244b4e8f7b6543c4a9087e5\", [1536, 128], [1536, 128]]", "cuda -keys=cuda,gpu -arch=sm_75 -max_num_threads=1024 -model=2080ti -thread_warp_size=32", [-1, 16, 64, 49152, 2147483647, 1024, 8, 32], "", 0, []], [[], [["CI", 3], ["CI", 2], ["FU", 5, [0, 1]], ["SP", 5, 0, 196608, [32], 1], ["AN", 5, 0, 5], ["AN", 5, 1, 6], ["SP", 4, 0, 1536, [32], 1], ["AN", 4, 0, 5], ["AN", 4, 1, 6], ["SP", 1, 0, 1536, [64], 1], ["AN", 1, 0, 5], ["AN", 1, 1, 6], ["PR", 1, 0, "auto_unroll_max_step$1024"], ["PR", 4, 0, "auto_unroll_max_step$16"]]]], "r": [[2.87725e-05], 0, 1.89528, 1680117480], "v": "v0.6"}
{"i": [["[\"4b5e216f8244b4e8f7b6543c4a9087e5\", [1536, 128], [1536, 128]]", "cuda -keys=cuda,gpu -arch=sm_75 -max_num_threads=1024 -model=2080ti -thread_warp_size=32", [-1, 16, 64, 49152, 2147483647, 1024, 8, 32], "", 0, []], [[], [["CI", 3], ["CI", 2], ["FU", 5, [0, 1]], ["SP", 5, 0, 196608, [2], 1], ["AN", 5, 0, 5], ["AN", 5, 1, 6], ["SP", 4, 0, 1536, [64], 1], ["AN", 4, 0, 5], ["AN", 4, 1, 6], ["SP", 1, 0, 1536, [32], 1], ["AN", 1, 0, 5], ["AN", 1, 1, 6], ["PR", 1, 0, "auto_unroll_max_step$16"], ["PR", 4, 0, "auto_unroll_max_step$512"]]]], "r": [[0.000104621], 0, 2.03904, 1680117482], "v": "v0.6"}
{"i": [["[\"4b5e216f8244b4e8f7b6543c4a9087e5\", [1536, 128], [1536, 128]]", "cuda -keys=cuda,gpu -arch=sm_75 -max_num_threads=1024 -model=2080ti -thread_warp_size=32", [-1, 16, 64, 49152, 2147483647, 1024, 8, 32], "", 0, []], [[], [["SP", 5, 1, 128, [2], 1], ["AN", 5, 2, 6], ["FSP", 4, 1, 0, 1], ["AN", 4, 2, 6], ["CA", 4, 5, 0], ["CI", 3], ["CI", 2], ["AN", 5, 0, 5], ["SP", 1, 0, 1536, [1], 1], ["AN", 1, 0, 5], ["AN", 1, 1, 6], ["PR", 1, 0, "auto_unroll_max_step$0"], ["PR", 4, 0, "auto_unroll_max_step$0"]]]], "r": [[5.04405e-05], 0, 2.04496, 1680117483], "v": "v0.6"}
{"i": [["[\"4b5e216f8244b4e8f7b6543c4a9087e5\", [1536, 128], [1536, 128]]", "cuda -keys=cuda,gpu -arch=sm_75 -max_num_threads=1024 -model=2080ti -thread_warp_size=32", [-1, 16, 64, 49152, 2147483647, 1024, 8, 32], "", 0, []], [[], [["CI", 3], ["CI", 2], ["FU", 5, [0, 1]], ["SP", 5, 0, 196608, [4], 1], ["AN", 5, 0, 5], ["AN", 5, 1, 6], ["SP", 4, 0, 1536, [32], 1], ["AN", 4, 0, 5], ["AN", 4, 1, 6], ["SP", 1, 0, 1536, [32], 1], ["AN", 1, 0, 5], ["AN", 1, 1, 6], ["PR", 1, 0, "auto_unroll_max_step$64"], ["PR", 4, 0, "auto_unroll_max_step$0"]]]], "r": [[6.49206e-05], 0, 1.89549, 1680117484], "v": "v0.6"}
{"i": [["[\"4b5e216f8244b4e8f7b6543c4a9087e5\", [1536, 128], [1536, 128]]", "cuda -keys=cuda,gpu -arch=sm_75 -max_num_threads=1024 -model=2080ti -thread_warp_size=32", [-1, 16, 64, 49152, 2147483647, 1024, 8, 32], "", 0, []], [[], [["CI", 3], ["CI", 2], ["SP", 1, 1, 128, [16], 1], ["AN", 1, 2, 6], ["FU", 5, [0, 1]], ["SP", 5, 0, 196608, [1], 1], ["AN", 5, 0, 5], ["AN", 5, 1, 6], ["SP", 4, 0, 1536, [4], 1], ["AN", 4, 0, 5], ["AN", 4, 1, 6], ["AN", 1, 0, 5], ["PR", 1, 0, "auto_unroll_max_step$1024"], ["PR", 4, 0, "auto_unroll_max_step$0"]]]], "r": [[0.000178846], 0, 1.98454, 1680117486], "v": "v0.6"}
{"i": [["[\"4b5e216f8244b4e8f7b6543c4a9087e5\", [1536, 128], [1536, 128]]", "cuda -keys=cuda,gpu -arch=sm_75 -max_num_threads=1024 -model=2080ti -thread_warp_size=32", [-1, 16, 64, 49152, 2147483647, 1024, 8, 32], "", 0, []], [[], [["CI", 3], ["CI", 2], ["SP", 1, 1, 128, [32], 1], ["AN", 1, 2, 6], ["FU", 5, [0, 1]], ["SP", 5, 0, 196608, [32], 1], ["AN", 5, 0, 5], ["AN", 5, 1, 6], ["SP", 4, 0, 1536, [8], 1], ["AN", 4, 0, 5], ["AN", 4, 1, 6], ["AN", 1, 0, 5], ["PR", 1, 0, "auto_unroll_max_step$1024"], ["PR", 4, 0, "auto_unroll_max_step$512"]]]], "r": [[1.95946e-05], 0, 1.88811, 1680117487], "v": "v0.6"}
{"i": [["[\"4b5e216f8244b4e8f7b6543c4a9087e5\", [1536, 128], [1536, 128]]", "cuda -keys=cuda,gpu -arch=sm_75 -max_num_threads=1024 -model=2080ti -thread_warp_size=32", [-1, 16, 64, 49152, 2147483647, 1024, 8, 32], "", 0, []], [[], [["CI", 3], ["CI", 2], ["SP", 1, 1, 128, [2], 1], ["AN", 1, 2, 6], ["FU", 5, [0, 1]], ["SP", 5, 0, 196608, [32], 1], ["AN", 5, 0, 5], ["AN", 5, 1, 6], ["SP", 4, 0, 1536, [32], 1], ["AN", 4, 0, 5], ["AN", 4, 1, 6], ["AN", 1, 0, 5], ["PR", 1, 0, "auto_unroll_max_step$1024"], ["PR", 4, 0, "auto_unroll_max_step$512"]]]], "r": [[2.51096e-05], 0, 1.99281, 1680117488], "v": "v0.6"}
{"i": [["[\"4b5e216f8244b4e8f7b6543c4a9087e5\", [1536, 128], [1536, 128]]", "cuda -keys=cuda,gpu -arch=sm_75 -max_num_threads=1024 -model=2080ti -thread_warp_size=32", [-1, 16, 64, 49152, 2147483647, 1024, 8, 32], "", 0, []], [[], [["CI", 3], ["CI", 2], ["SP", 1, 1, 128, [32], 1], ["AN", 1, 2, 6], ["FU", 5, [0, 1]], ["SP", 5, 0, 196608, [32], 1], ["AN", 5, 0, 5], ["AN", 5, 1, 6], ["SP", 4, 0, 1536, [64], 1], ["AN", 4, 0, 5], ["AN", 4, 1, 6], ["AN", 1, 0, 5], ["PR", 1, 0, "auto_unroll_max_step$16"], ["PR", 4, 0, "auto_unroll_max_step$64"]]]], "r": [[2.17519e-05], 0, 1.97383, 1680117490], "v": "v0.6"}
{"i": [["[\"4b5e216f8244b4e8f7b6543c4a9087e5\", [1536, 128], [1536, 128]]", "cuda -keys=cuda,gpu -arch=sm_75 -max_num_threads=1024 -model=2080ti -thread_warp_size=32", [-1, 16, 64, 49152, 2147483647, 1024, 8, 32], "", 0, []], [[], [["CI", 3], ["CI", 2], ["FU", 5, [0, 1]], ["SP", 5, 0, 196608, [2], 1], ["AN", 5, 0, 5], ["AN", 5, 1, 6], ["SP", 4, 0, 1536, [32], 1], ["AN", 4, 0, 5], ["AN", 4, 1, 6], ["SP", 1, 0, 1536, [32], 1], ["AN", 1, 0, 5], ["AN", 1, 1, 6], ["PR", 1, 0, "auto_unroll_max_step$1024"], ["PR", 4, 0, "auto_unroll_max_step$0"]]]], "r": [[0.000106464], 0, 1.95511, 1680117491], "v": "v0.6"}
{"i": [["[\"4b5e216f8244b4e8f7b6543c4a9087e5\", [1536, 128], [1536, 128]]", "cuda -keys=cuda,gpu -arch=sm_75 -max_num_threads=1024 -model=2080ti -thread_warp_size=32", [-1, 16, 64, 49152, 2147483647, 1024, 8, 32], "", 0, []], [[], [["SP", 5, 1, 128, [1], 1], ["AN", 5, 2, 6], ["FSP", 4, 1, 0, 1], ["AN", 4, 2, 6], ["CA", 4, 5, 0], ["CI", 3], ["CI", 2], ["FSP", 1, 1, 0, 1], ["AN", 1, 2, 6], ["CA", 1, 5, 0], ["AN", 5, 0, 5], ["PR", 1, 0, "auto_unroll_max_step$0"], ["PR", 4, 0, "auto_unroll_max_step$0"]]]], "r": [[7.91885e-05], 0, 1.99841, 1680117492], "v": "v0.6"}
{"i": [["[\"4b5e216f8244b4e8f7b6543c4a9087e5\", [1536, 128], [1536, 128]]", "cuda -keys=cuda,gpu -arch=sm_75 -max_num_threads=1024 -model=2080ti -thread_warp_size=32", [-1, 16, 64, 49152, 2147483647, 1024, 8, 32], "", 0, []], [[], [["SP", 5, 1, 128, [1], 1], ["AN", 5, 2, 6], ["FSP", 4, 1, 0, 1], ["AN", 4, 2, 6], ["CA", 4, 5, 0], ["CI", 3], ["CI", 2], ["AN", 5, 0, 5], ["SP", 1, 0, 1536, [64], 1], ["AN", 1, 0, 5], ["AN", 1, 1, 6], ["PR", 1, 0, "auto_unroll_max_step$1024"], ["PR", 4, 0, "auto_unroll_max_step$16"]]]], "r": [[8.56574e-05], 0, 1.93286, 1680117494], "v": "v0.6"}
{"i": [["[\"4b5e216f8244b4e8f7b6543c4a9087e5\", [1536, 128], [1536, 128]]", "cuda -keys=cuda,gpu -arch=sm_75 -max_num_threads=1024 -model=2080ti -thread_warp_size=32", [-1, 16, 64, 49152, 2147483647, 1024, 8, 32], "", 0, []], [[], [["CI", 3], ["CI", 2], ["SP", 1, 1, 128, [32], 1], ["AN", 1, 2, 6], ["FU", 5, [0, 1]], ["SP", 5, 0, 196608, [64], 1], ["AN", 5, 0, 5], ["AN", 5, 1, 6], ["SP", 4, 0, 1536, [1], 1], ["AN", 4, 0, 5], ["AN", 4, 1, 6], ["AN", 1, 0, 5], ["PR", 1, 0, "auto_unroll_max_step$0"], ["PR", 4, 0, "auto_unroll_max_step$512"]]]], "r": [[2.87834e-05], 0, 1.96112, 1680117495], "v": "v0.6"}
{"i": [["[\"4b5e216f8244b4e8f7b6543c4a9087e5\", [1536, 128], [1536, 128]]", "cuda -keys=cuda,gpu -arch=sm_75 -max_num_threads=1024 -model=2080ti -thread_warp_size=32", [-1, 16, 64, 49152, 2147483647, 1024, 8, 32], "", 0, []], [[], [["SP", 5, 1, 128, [64], 1], ["AN", 5, 2, 6], ["FSP", 4, 1, 0, 1], ["AN", 4, 2, 6], ["CA", 4, 5, 0], ["CI", 3], ["CI", 2], ["AN", 5, 0, 5], ["SP", 1, 0, 1536, [32], 1], ["AN", 1, 0, 5], ["AN", 1, 1, 6], ["PR", 1, 0, "auto_unroll_max_step$64"], ["PR", 4, 0, "auto_unroll_max_step$512"]]]], "r": [[1.30606e-05], 0, 1.75151, 1680117496], "v": "v0.6"}
{"i": [["[\"4b5e216f8244b4e8f7b6543c4a9087e5\", [1536, 128], [1536, 128]]", "cuda -keys=cuda,gpu -arch=sm_75 -max_num_threads=1024 -model=2080ti -thread_warp_size=32", [-1, 16, 64, 49152, 2147483647, 1024, 8, 32], "", 0, []], [[], [["CI", 3], ["CI", 2], ["SP", 1, 1, 128, [32], 1], ["AN", 1, 2, 6], ["FU", 5, [0, 1]], ["SP", 5, 0, 196608, [32], 1], ["AN", 5, 0, 5], ["AN", 5, 1, 6], ["SP", 4, 0, 1536, [32], 1], ["AN", 4, 0, 5], ["AN", 4, 1, 6], ["AN", 1, 0, 5], ["PR", 1, 0, "auto_unroll_max_step$1024"], ["PR", 4, 0, "auto_unroll_max_step$16"]]]], "r": [[2.36763e-05], 0, 1.82326, 1680117498], "v": "v0.6"}
{"i": [["[\"4b5e216f8244b4e8f7b6543c4a9087e5\", [1536, 128], [1536, 128]]", "cuda -keys=cuda,gpu -arch=sm_75 -max_num_threads=1024 -model=2080ti -thread_warp_size=32", [-1, 16, 64, 49152, 2147483647, 1024, 8, 32], "", 0, []], [[], [["CI", 3], ["CI", 2], ["SP", 1, 1, 128, [1], 1], ["AN", 1, 2, 6], ["FU", 5, [0, 1]], ["SP", 5, 0, 196608, [32], 1], ["AN", 5, 0, 5], ["AN", 5, 1, 6], ["SP", 4, 0, 1536, [32], 1], ["AN", 4, 0, 5], ["AN", 4, 1, 6], ["AN", 1, 0, 5], ["PR", 1, 0, "auto_unroll_max_step$1024"], ["PR", 4, 0, "auto_unroll_max_step$64"]]]], "r": [[2.75849e-05], 0, 1.87936, 1680117499], "v": "v0.6"}
{"i": [["[\"4b5e216f8244b4e8f7b6543c4a9087e5\", [1536, 128], [1536, 128]]", "cuda -keys=cuda,gpu -arch=sm_75 -max_num_threads=1024 -model=2080ti -thread_warp_size=32", [-1, 16, 64, 49152, 2147483647, 1024, 8, 32], "", 0, []], [[], [["CI", 3], ["CI", 2], ["FU", 5, [0, 1]], ["SP", 5, 0, 196608, [32], 1], ["AN", 5, 0, 5], ["AN", 5, 1, 6], ["SP", 4, 0, 1536, [1], 1], ["AN", 4, 0, 5], ["AN", 4, 1, 6], ["SP", 1, 0, 1536, [64], 1], ["AN", 1, 0, 5], ["AN", 1, 1, 6], ["PR", 1, 0, "auto_unroll_max_step$1024"], ["PR", 4, 0, "auto_unroll_max_step$1024"]]]], "r": [[3.65883e-05], 0, 1.82198, 1680117500], "v": "v0.6"}
{"i": [["[\"4b5e216f8244b4e8f7b6543c4a9087e5\", [1536, 128], [1536, 128]]", "cuda -keys=cuda,gpu -arch=sm_75 -max_num_threads=1024 -model=2080ti -thread_warp_size=32", [-1, 16, 64, 49152, 2147483647, 1024, 8, 32], "", 0, []], [[], [["CI", 3], ["CI", 2], ["SP", 1, 1, 128, [32], 1], ["AN", 1, 2, 6], ["FU", 5, [0, 1]], ["SP", 5, 0, 196608, [1], 1], ["AN", 5, 0, 5], ["AN", 5, 1, 6], ["SP", 4, 0, 1536, [32], 1], ["AN", 4, 0, 5], ["AN", 4, 1, 6], ["AN", 1, 0, 5], ["PR", 1, 0, "auto_unroll_max_step$1024"], ["PR", 4, 0, "auto_unroll_max_step$512"]]]], "r": [[0.00018219], 0, 1.98959, 1680117502], "v": "v0.6"}
{"i": [["[\"4b5e216f8244b4e8f7b6543c4a9087e5\", [1536, 128], [1536, 128]]", "cuda -keys=cuda,gpu -arch=sm_75 -max_num_threads=1024 -model=2080ti -thread_warp_size=32", [-1, 16, 64, 49152, 2147483647, 1024, 8, 32], "", 0, []], [[], [["CI", 3], ["CI", 2], ["SP", 1, 1, 128, [32], 1], ["AN", 1, 2, 6], ["FU", 5, [0, 1]], ["SP", 5, 0, 196608, [16], 1], ["AN", 5, 0, 5], ["AN", 5, 1, 6], ["SP", 4, 0, 1536, [32], 1], ["AN", 4, 0, 5], ["AN", 4, 1, 6], ["AN", 1, 0, 5], ["PR", 1, 0, "auto_unroll_max_step$1024"], ["PR", 4, 0, "auto_unroll_max_step$1024"]]]], "r": [[2.89966e-05], 0, 1.84645, 1680117503], "v": "v0.6"}
{"i": [["[\"4b5e216f8244b4e8f7b6543c4a9087e5\", [1536, 128], [1536, 128]]", "cuda -keys=cuda,gpu -arch=sm_75 -max_num_threads=1024 -model=2080ti -thread_warp_size=32", [-1, 16, 64, 49152, 2147483647, 1024, 8, 32], "", 0, []], [[], [["CI", 3], ["CI", 2], ["SP", 1, 1, 128, [64], 1], ["AN", 1, 2, 6], ["FU", 5, [0, 1]], ["SP", 5, 0, 196608, [64], 1], ["AN", 5, 0, 5], ["AN", 5, 1, 6], ["SP", 4, 0, 1536, [32], 1], ["AN", 4, 0, 5], ["AN", 4, 1, 6], ["AN", 1, 0, 5], ["PR", 1, 0, "auto_unroll_max_step$0"], ["PR", 4, 0, "auto_unroll_max_step$512"]]]], "r": [[2.14835e-05], 0, 1.8686, 1680117505], "v": "v0.6"}
{"i": [["[\"4b5e216f8244b4e8f7b6543c4a9087e5\", [1536, 128], [1536, 128]]", "cuda -keys=cuda,gpu -arch=sm_75 -max_num_threads=1024 -model=2080ti -thread_warp_size=32", [-1, 16, 64, 49152, 2147483647, 1024, 8, 32], "", 0, []], [[], [["SP", 5, 1, 128, [4], 1], ["AN", 5, 2, 6], ["FSP", 4, 1, 0, 1], ["AN", 4, 2, 6], ["CA", 4, 5, 0], ["CI", 3], ["CI", 2], ["AN", 5, 0, 5], ["SP", 1, 0, 1536, [64], 1], ["AN", 1, 0, 5], ["AN", 1, 1, 6], ["PR", 1, 0, "auto_unroll_max_step$16"], ["PR", 4, 0, "auto_unroll_max_step$16"]]]], "r": [[3.14846e-05], 0, 1.9141, 1680117506], "v": "v0.6"}
{"i": [["[\"4b5e216f8244b4e8f7b6543c4a9087e5\", [1536, 128], [1536, 128]]", "cuda -keys=cuda,gpu -arch=sm_75 -max_num_threads=1024 -model=2080ti -thread_warp_size=32", [-1, 16, 64, 49152, 2147483647, 1024, 8, 32], "", 0, []], [[], [["CI", 3], ["CI", 2], ["SP", 1, 1, 128, [32], 1], ["AN", 1, 2, 6], ["FU", 5, [0, 1]], ["SP", 5, 0, 196608, [64], 1], ["AN", 5, 0, 5], ["AN", 5, 1, 6], ["SP", 4, 0, 1536, [64], 1], ["AN", 4, 0, 5], ["AN", 4, 1, 6], ["AN", 1, 0, 5], ["PR", 1, 0, "auto_unroll_max_step$0"], ["PR", 4, 0, "auto_unroll_max_step$0"]]]], "r": [[1.90571e-05], 0, 1.77989, 1680117507], "v": "v0.6"}
{"i": [["[\"4b5e216f8244b4e8f7b6543c4a9087e5\", [1536, 128], [1536, 128]]", "cuda -keys=cuda,gpu -arch=sm_75 -max_num_threads=1024 -model=2080ti -thread_warp_size=32", [-1, 16, 64, 49152, 2147483647, 1024, 8, 32], "", 0, []], [[], [["CI", 3], ["CI", 2], ["SP", 1, 1, 128, [32], 1], ["AN", 1, 2, 6], ["FU", 5, [0, 1]], ["SP", 5, 0, 196608, [4], 1], ["AN", 5, 0, 5], ["AN", 5, 1, 6], ["SP", 4, 0, 1536, [64], 1], ["AN", 4, 0, 5], ["AN", 4, 1, 6], ["AN", 1, 0, 5], ["PR", 1, 0, "auto_unroll_max_step$16"], ["PR", 4, 0, "auto_unroll_max_step$512"]]]], "r": [[5.82749e-05], 0, 1.76959, 1680117509], "v": "v0.6"}
{"i": [["[\"4b5e216f8244b4e8f7b6543c4a9087e5\", [1536, 128], [1536, 128]]", "cuda -keys=cuda,gpu -arch=sm_75 -max_num_threads=1024 -model=2080ti -thread_warp_size=32", [-1, 16, 64, 49152, 2147483647, 1024, 8, 32], "", 0, []], [[], [["CI", 3], ["CI", 2], ["SP", 1, 1, 128, [32], 1], ["AN", 1, 2, 6], ["FU", 5, [0, 1]], ["SP", 5, 0, 196608, [64], 1], ["AN", 5, 0, 5], ["AN", 5, 1, 6], ["SP", 4, 0, 1536, [2], 1], ["AN", 4, 0, 5], ["AN", 4, 1, 6], ["AN", 1, 0, 5], ["PR", 1, 0, "auto_unroll_max_step$64"], ["PR", 4, 0, "auto_unroll_max_step$0"]]]], "r": [[2.06677e-05], 0, 1.91886, 1680117510], "v": "v0.6"}
{"i": [["[\"4b5e216f8244b4e8f7b6543c4a9087e5\", [1536, 128], [1536, 128]]", "cuda -keys=cuda,gpu -arch=sm_75 -max_num_threads=1024 -model=2080ti -thread_warp_size=32", [-1, 16, 64, 49152, 2147483647, 1024, 8, 32], "", 0, []], [[], [["SP", 5, 1, 128, [8], 1], ["AN", 5, 2, 6], ["FSP", 4, 1, 0, 1], ["AN", 4, 2, 6], ["CA", 4, 5, 0], ["CI", 3], ["CI", 2], ["AN", 5, 0, 5], ["SP", 1, 0, 1536, [64], 1], ["AN", 1, 0, 5], ["AN", 1, 1, 6], ["PR", 1, 0, "auto_unroll_max_step$512"], ["PR", 4, 0, "auto_unroll_max_step$512"]]]], "r": [[2.1146e-05], 0, 2.22778, 1680117511], "v": "v0.6"}
{"i": [["[\"4b5e216f8244b4e8f7b6543c4a9087e5\", [1536, 128], [1536, 128]]", "cuda -keys=cuda,gpu -arch=sm_75 -max_num_threads=1024 -model=2080ti -thread_warp_size=32", [-1, 16, 64, 49152, 2147483647, 1024, 8, 32], "", 0, []], [[], [["CI", 3], ["CI", 2], ["FU", 5, [0, 1]], ["SP", 5, 0, 196608, [64], 1], ["AN", 5, 0, 5], ["AN", 5, 1, 6], ["SP", 4, 0, 1536, [64], 1], ["AN", 4, 0, 5], ["AN", 4, 1, 6], ["SP", 1, 0, 1536, [32], 1], ["AN", 1, 0, 5], ["AN", 1, 1, 6], ["PR", 1, 0, "auto_unroll_max_step$0"], ["PR", 4, 0, "auto_unroll_max_step$0"]]]], "r": [[2.38798e-05], 0, 1.71204, 1680117512], "v": "v0.6"}
{"i": [["[\"4b5e216f8244b4e8f7b6543c4a9087e5\", [1536, 128], [1536, 128]]", "cuda -keys=cuda,gpu -arch=sm_75 -max_num_threads=1024 -model=2080ti -thread_warp_size=32", [-1, 16, 64, 49152, 2147483647, 1024, 8, 32], "", 0, []], [[], [["CI", 3], ["CI", 2], ["FU", 5, [0, 1]], ["SP", 5, 0, 196608, [32], 1], ["AN", 5, 0, 5], ["AN", 5, 1, 6], ["SP", 4, 0, 1536, [1], 1], ["AN", 4, 0, 5], ["AN", 4, 1, 6], ["SP", 1, 0, 1536, [64], 1], ["AN", 1, 0, 5], ["AN", 1, 1, 6], ["PR", 1, 0, "auto_unroll_max_step$512"], ["PR", 4, 0, "auto_unroll_max_step$512"]]]], "r": [[3.65801e-05], 0, 1.79542, 1680117514], "v": "v0.6"}
{"i": [["[\"4b5e216f8244b4e8f7b6543c4a9087e5\", [1536, 128], [1536, 128]]", "cuda -keys=cuda,gpu -arch=sm_75 -max_num_threads=1024 -model=2080ti -thread_warp_size=32", [-1, 16, 64, 49152, 2147483647, 1024, 8, 32], "", 0, []], [[], [["CI", 3], ["CI", 2], ["SP", 1, 1, 128, [32], 1], ["AN", 1, 2, 6], ["FU", 5, [0, 1]], ["SP", 5, 0, 196608, [32], 1], ["AN", 5, 0, 5], ["AN", 5, 1, 6], ["SP", 4, 0, 1536, [2], 1], ["AN", 4, 0, 5], ["AN", 4, 1, 6], ["AN", 1, 0, 5], ["PR", 1, 0, "auto_unroll_max_step$1024"], ["PR", 4, 0, "auto_unroll_max_step$0"]]]], "r": [[2.33761e-05], 0, 1.83185, 1680117515], "v": "v0.6"}
{"i": [["[\"4b5e216f8244b4e8f7b6543c4a9087e5\", [1536, 128], [1536, 128]]", "cuda -keys=cuda,gpu -arch=sm_75 -max_num_threads=1024 -model=2080ti -thread_warp_size=32", [-1, 16, 64, 49152, 2147483647, 1024, 8, 32], "", 0, []], [[], [["CI", 3], ["CI", 2], ["FU", 5, [0, 1]], ["SP", 5, 0, 196608, [1], 1], ["AN", 5, 0, 5], ["AN", 5, 1, 6], ["SP", 4, 0, 1536, [2], 1], ["AN", 4, 0, 5], ["AN", 4, 1, 6], ["SP", 1, 0, 1536, [64], 1], ["AN", 1, 0, 5], ["AN", 1, 1, 6], ["PR", 1, 0, "auto_unroll_max_step$64"], ["PR", 4, 0, "auto_unroll_max_step$0"]]]], "r": [[0.000186968], 0, 1.79939, 1680117517], "v": "v0.6"}
{"i": [["[\"4b5e216f8244b4e8f7b6543c4a9087e5\", [1536, 128], [1536, 128]]", "cuda -keys=cuda,gpu -arch=sm_75 -max_num_threads=1024 -model=2080ti -thread_warp_size=32", [-1, 16, 64, 49152, 2147483647, 1024, 8, 32], "", 0, []], [[], [["CI", 3], ["CI", 2], ["FU", 5, [0, 1]], ["SP", 5, 0, 196608, [32], 1], ["AN", 5, 0, 5], ["AN", 5, 1, 6], ["SP", 4, 0, 1536, [8], 1], ["AN", 4, 0, 5], ["AN", 4, 1, 6], ["SP", 1, 0, 1536, [32], 1], ["AN", 1, 0, 5], ["AN", 1, 1, 6], ["PR", 1, 0, "auto_unroll_max_step$512"], ["PR", 4, 0, "auto_unroll_max_step$512"]]]], "r": [[2.44251e-05], 0, 1.81092, 1680117518], "v": "v0.6"}
{"i": [["[\"4b5e216f8244b4e8f7b6543c4a9087e5\", [1536, 128], [1536, 128]]", "cuda -keys=cuda,gpu -arch=sm_75 -max_num_threads=1024 -model=2080ti -thread_warp_size=32", [-1, 16, 64, 49152, 2147483647, 1024, 8, 32], "", 0, []], [[], [["CI", 3], ["CI", 2], ["FU", 5, [0, 1]], ["SP", 5, 0, 196608, [4], 1], ["AN", 5, 0, 5], ["AN", 5, 1, 6], ["SP", 4, 0, 1536, [2], 1], ["AN", 4, 0, 5], ["AN", 4, 1, 6], ["SP", 1, 0, 1536, [4], 1], ["AN", 1, 0, 5], ["AN", 1, 1, 6], ["PR", 1, 0, "auto_unroll_max_step$64"], ["PR", 4, 0, "auto_unroll_max_step$16"]]]], "r": [[6.31406e-05], 0, 1.87576, 1680117519], "v": "v0.6"}
{"i": [["[\"4b5e216f8244b4e8f7b6543c4a9087e5\", [1536, 128], [1536, 128]]", "cuda -keys=cuda,gpu -arch=sm_75 -max_num_threads=1024 -model=2080ti -thread_warp_size=32", [-1, 16, 64, 49152, 2147483647, 1024, 8, 32], "", 0, []], [[], [["SP", 5, 1, 128, [32], 1], ["AN", 5, 2, 6], ["FSP", 4, 1, 0, 1], ["AN", 4, 2, 6], ["CA", 4, 5, 0], ["CI", 3], ["CI", 2], ["AN", 5, 0, 5], ["SP", 1, 0, 1536, [48], 1], ["AN", 1, 0, 5], ["AN", 1, 1, 6], ["PR", 1, 0, "auto_unroll_max_step$1024"], ["PR", 4, 0, "auto_unroll_max_step$16"]]]], "r": [[1.2499e-05], 0, 1.7452, 1680117521], "v": "v0.6"}
{"i": [["[\"4b5e216f8244b4e8f7b6543c4a9087e5\", [1536, 128], [1536, 128]]", "cuda -keys=cuda,gpu -arch=sm_75 -max_num_threads=1024 -model=2080ti -thread_warp_size=32", [-1, 16, 64, 49152, 2147483647, 1024, 8, 32], "", 0, []], [[], [["CI", 3], ["CI", 2], ["FU", 5, [0, 1]], ["SP", 5, 0, 196608, [32], 1], ["AN", 5, 0, 5], ["AN", 5, 1, 6], ["SP", 4, 0, 1536, [2], 1], ["AN", 4, 0, 5], ["AN", 4, 1, 6], ["SP", 1, 0, 1536, [4], 1], ["AN", 1, 0, 5], ["AN", 1, 1, 6], ["PR", 1, 0, "auto_unroll_max_step$16"], ["PR", 4, 0, "auto_unroll_max_step$0"]]]], "r": [[2.66307e-05], 0, 1.81735, 1680117522], "v": "v0.6"}
{"i": [["[\"4b5e216f8244b4e8f7b6543c4a9087e5\", [1536, 128], [1536, 128]]", "cuda -keys=cuda,gpu -arch=sm_75 -max_num_threads=1024 -model=2080ti -thread_warp_size=32", [-1, 16, 64, 49152, 2147483647, 1024, 8, 32], "", 0, []], [[], [["SP", 5, 1, 128, [8], 1], ["AN", 5, 2, 6], ["FSP", 4, 1, 0, 1], ["AN", 4, 2, 6], ["CA", 4, 5, 0], ["CI", 3], ["CI", 2], ["FSP", 1, 1, 0, 1], ["AN", 1, 2, 6], ["CA", 1, 5, 0], ["AN", 5, 0, 5], ["PR", 1, 0, "auto_unroll_max_step$512"], ["PR", 4, 0, "auto_unroll_max_step$0"]]]], "r": [[1.32522e-05], 0, 1.79291, 1680117523], "v": "v0.6"}
{"i": [["[\"4b5e216f8244b4e8f7b6543c4a9087e5\", [1536, 128], [1536, 128]]", "cuda -keys=cuda,gpu -arch=sm_75 -max_num_threads=1024 -model=2080ti -thread_warp_size=32", [-1, 16, 64, 49152, 2147483647, 1024, 8, 32], "", 0, []], [[], [["CI", 3], ["CI", 2], ["FU", 5, [0, 1]], ["SP", 5, 0, 196608, [1], 1], ["AN", 5, 0, 5], ["AN", 5, 1, 6], ["SP", 4, 0, 1536, [2], 1], ["AN", 4, 0, 5], ["AN", 4, 1, 6], ["SP", 1, 0, 1536, [4], 1], ["AN", 1, 0, 5], ["AN", 1, 1, 6], ["PR", 1, 0, "auto_unroll_max_step$64"], ["PR", 4, 0, "auto_unroll_max_step$16"]]]], "r": [[0.000185139], 0, 1.88126, 1680117524], "v": "v0.6"}
{"i": [["[\"4b5e216f8244b4e8f7b6543c4a9087e5\", [1536, 128], [1536, 128]]", "cuda -keys=cuda,gpu -arch=sm_75 -max_num_threads=1024 -model=2080ti -thread_warp_size=32", [-1, 16, 64, 49152, 2147483647, 1024, 8, 32], "", 0, []], [[], [["CI", 3], ["CI", 2], ["SP", 1, 1, 128, [32], 1], ["AN", 1, 2, 6], ["FU", 5, [0, 1]], ["SP", 5, 0, 196608, [32], 1], ["AN", 5, 0, 5], ["AN", 5, 1, 6], ["SP", 4, 0, 1536, [8], 1], ["AN", 4, 0, 5], ["AN", 4, 1, 6], ["AN", 1, 0, 5], ["PR", 1, 0, "auto_unroll_max_step$16"], ["PR", 4, 0, "auto_unroll_max_step$512"]]]], "r": [[1.95916e-05], 0, 1.77081, 1680117526], "v": "v0.6"}
{"i": [["[\"4b5e216f8244b4e8f7b6543c4a9087e5\", [1536, 128], [1536, 128]]", "cuda -keys=cuda,gpu -arch=sm_75 -max_num_threads=1024 -model=2080ti -thread_warp_size=32", [-1, 16, 64, 49152, 2147483647, 1024, 8, 32], "", 0, []], [[], [["SP", 5, 1, 128, [4], 1], ["AN", 5, 2, 6], ["FSP", 4, 1, 0, 1], ["AN", 4, 2, 6], ["CA", 4, 5, 0], ["CI", 3], ["CI", 2], ["FSP", 1, 1, 0, 1], ["AN", 1, 2, 6], ["CA", 1, 5, 0], ["AN", 5, 0, 5], ["PR", 1, 0, "auto_unroll_max_step$1024"], ["PR", 4, 0, "auto_unroll_max_step$64"]]]], "r": [[2.26883e-05], 0, 2.69991, 1680117527], "v": "v0.6"}
{"i": [["[\"4b5e216f8244b4e8f7b6543c4a9087e5\", [1536, 128], [1536, 128]]", "cuda -keys=cuda,gpu -arch=sm_75 -max_num_threads=1024 -model=2080ti -thread_warp_size=32", [-1, 16, 64, 49152, 2147483647, 1024, 8, 32], "", 0, []], [[], [["CI", 3], ["CI", 2], ["FU", 5, [0, 1]], ["SP", 5, 0, 196608, [32], 1], ["AN", 5, 0, 5], ["AN", 5, 1, 6], ["SP", 4, 0, 1536, [32], 1], ["AN", 4, 0, 5], ["AN", 4, 1, 6], ["SP", 1, 0, 1536, [32], 1], ["AN", 1, 0, 5], ["AN", 1, 1, 6], ["PR", 1, 0, "auto_unroll_max_step$512"], ["PR", 4, 0, "auto_unroll_max_step$0"]]]], "r": [[2.84318e-05], 0, 1.81443, 1680117528], "v": "v0.6"}
{"i": [["[\"4b5e216f8244b4e8f7b6543c4a9087e5\", [1536, 128], [1536, 128]]", "cuda -keys=cuda,gpu -arch=sm_75 -max_num_threads=1024 -model=2080ti -thread_warp_size=32", [-1, 16, 64, 49152, 2147483647, 1024, 8, 32], "", 0, []], [[], [["CI", 3], ["CI", 2], ["FU", 5, [0, 1]], ["SP", 5, 0, 196608, [32], 1], ["AN", 5, 0, 5], ["AN", 5, 1, 6], ["SP", 4, 0, 1536, [32], 1], ["AN", 4, 0, 5], ["AN", 4, 1, 6], ["SP", 1, 0, 1536, [32], 1], ["AN", 1, 0, 5], ["AN", 1, 1, 6], ["PR", 1, 0, "auto_unroll_max_step$512"], ["PR", 4, 0, "auto_unroll_max_step$512"]]]], "r": [[2.84227e-05], 0, 1.79935, 1680117530], "v": "v0.6"}
{"i": [["[\"4b5e216f8244b4e8f7b6543c4a9087e5\", [1536, 128], [1536, 128]]", "cuda -keys=cuda,gpu -arch=sm_75 -max_num_threads=1024 -model=2080ti -thread_warp_size=32", [-1, 16, 64, 49152, 2147483647, 1024, 8, 32], "", 0, []], [[], [["CI", 3], ["CI", 2], ["FU", 5, [0, 1]], ["SP", 5, 0, 196608, [32], 1], ["AN", 5, 0, 5], ["AN", 5, 1, 6], ["SP", 4, 0, 1536, [32], 1], ["AN", 4, 0, 5], ["AN", 4, 1, 6], ["SP", 1, 0, 1536, [32], 1], ["AN", 1, 0, 5], ["AN", 1, 1, 6], ["PR", 1, 0, "auto_unroll_max_step$512"], ["PR", 4, 0, "auto_unroll_max_step$16"]]]], "r": [[2.84302e-05], 0, 1.84102, 1680117531], "v": "v0.6"}
{"i": [["[\"5b1e704ad5950c6ef36e46f1856366cd\", [1, 768], [768, 768], [1, 768], [1, 768]]", "cuda -keys=cuda,gpu -arch=sm_75 -max_num_threads=1024 -model=2080ti -thread_warp_size=32", [-1, 16, 64, 49152, 2147483647, 1024, 8, 32], "", 0, []], [[], [["CI", 6], ["CI", 5], ["CI", 4], ["SP", 2, 0, 1, [1, 1, 1, 1], 1], ["SP", 2, 5, 768, [3, 64, 2, 1], 1], ["SP", 2, 10, 768, [8, 2], 1], ["RE", 2, [0, 5, 1, 6, 2, 7, 10, 11, 3, 8, 12, 4, 9]], ["FSP", 7, 0, 3, 3], ["FSP", 7, 4, 4, 3], ["RE", 7, [0, 4, 1, 5, 2, 6, 3, 7]], ["CA", 2, 7, 5], ["CHR", 1, "shared", [2]], ["CA", 2, 3, 6], ["CHR", 0, "shared", [3]], ["CA", 1, 4, 6], ["FU", 9, [0, 1]], ["AN", 9, 0, 5], ["FU", 9, [1, 2]], ["AN", 9, 1, 4], ["FU", 9, [2, 3]], ["AN", 9, 2, 6], ["FU", 3, [0, 1]], ["SP", 3, 0, 32, [1], 1], ["AN", 3, 1, 2], ["FFSP", 3, 0, [4, 3], 1, 1], ["AN", 3, 1, 6], ["FU", 1, [0, 1]], ["SP", 1, 0, 16, [4], 1], ["AN", 1, 1, 2], ["FFSP", 1, 0, [4, 3], 1, 1], ["AN", 1, 1, 6], ["PR", 4, 0, "auto_unroll_max_step$0"]]]], "r": [[0.00012059], 0, 2.4913, 1680117571], "v": "v0.6"}
{"i": [["[\"5b1e704ad5950c6ef36e46f1856366cd\", [1, 768], [768, 768], [1, 768], [1, 768]]", "cuda -keys=cuda,gpu -arch=sm_75 -max_num_threads=1024 -model=2080ti -thread_warp_size=32", [-1, 16, 64, 49152, 2147483647, 1024, 8, 32], "", 0, []], [[], [["CI", 6], ["CI", 5], ["CI", 4], ["SP", 2, 0, 1, [1, 1, 1, 1], 1], ["SP", 2, 5, 768, [1, 96, 4, 2], 1], ["SP", 2, 10, 768, [2, 4], 1], ["RE", 2, [0, 5, 1, 6, 2, 7, 10, 11, 3, 8, 12, 4, 9]], ["FSP", 7, 0, 3, 3], ["FSP", 7, 4, 4, 3], ["RE", 7, [0, 4, 1, 5, 2, 6, 3, 7]], ["CA", 2, 7, 5], ["CHR", 1, "shared", [2]], ["CA", 2, 3, 6], ["CHR", 0, "shared", [3]], ["CA", 1, 4, 6], ["FU", 9, [0, 1]], ["AN", 9, 0, 5], ["FU", 9, [1, 2]], ["AN", 9, 1, 4], ["FU", 9, [2, 3]], ["AN", 9, 2, 6], ["FU", 3, [0, 1]], ["SP", 3, 0, 64, [1], 1], ["AN", 3, 1, 2], ["FFSP", 3, 0, [4, 3], 1, 1], ["AN", 3, 1, 6], ["FU", 1, [0, 1]], ["SP", 1, 0, 8, [2], 1], ["AN", 1, 1, 2], ["FFSP", 1, 0, [4, 3], 1, 1], ["AN", 1, 1, 6], ["PR", 4, 0, "auto_unroll_max_step$64"]]]], "r": [[0.000250586], 0, 2.48156, 1680117572], "v": "v0.6"}
{"i": [["[\"5b1e704ad5950c6ef36e46f1856366cd\", [1, 768], [768, 768], [1, 768], [1, 768]]", "cuda -keys=cuda,gpu -arch=sm_75 -max_num_threads=1024 -model=2080ti -thread_warp_size=32", [-1, 16, 64, 49152, 2147483647, 1024, 8, 32], "", 0, []], [[], [["CI", 6], ["CI", 5], ["CI", 4], ["SP", 2, 0, 1, [1, 1, 1, 1], 1], ["SP", 2, 5, 768, [2, 32, 1, 1], 1], ["SP", 2, 10, 768, [3, 2], 1], ["RE", 2, [0, 5, 1, 6, 2, 7, 10, 11, 3, 8, 12, 4, 9]], ["FSP", 7, 0, 3, 3], ["FSP", 7, 4, 4, 3], ["RE", 7, [0, 4, 1, 5, 2, 6, 3, 7]], ["CA", 2, 7, 5], ["CHR", 1, "shared", [2]], ["CA", 2, 3, 6], ["CHR", 0, "shared", [3]], ["CA", 1, 4, 6], ["FU", 9, [0, 1]], ["AN", 9, 0, 5], ["FU", 9, [1, 2]], ["AN", 9, 1, 4], ["FU", 9, [2, 3]], ["AN", 9, 2, 6], ["FU", 3, [0, 1]], ["SP", 3, 0, 18, [3], 1], ["AN", 3, 1, 2], ["FFSP", 3, 0, [4, 3], 1, 1], ["AN", 3, 1, 6], ["FU", 1, [0, 1]], ["SP", 1, 0, 6, [2], 1], ["AN", 1, 1, 2], ["FFSP", 1, 0, [4, 3], 1, 1], ["AN", 1, 1, 6], ["PR", 4, 0, "auto_unroll_max_step$0"]]]], "r": [[5.52125e-05], 0, 2.15523, 1680117574], "v": "v0.6"}
{"i": [["[\"5b1e704ad5950c6ef36e46f1856366cd\", [1, 768], [768, 768], [1, 768], [1, 768]]", "cuda -keys=cuda,gpu -arch=sm_75 -max_num_threads=1024 -model=2080ti -thread_warp_size=32", [-1, 16, 64, 49152, 2147483647, 1024, 8, 32], "", 0, []], [[], [["CI", 6], ["CI", 5], ["CI", 4], ["SP", 2, 0, 1, [1, 1, 1, 1], 1], ["SP", 2, 5, 768, [2, 32, 2, 6], 1], ["SP", 2, 10, 768, [2, 2], 1], ["RE", 2, [0, 5, 1, 6, 2, 7, 10, 11, 3, 8, 12, 4, 9]], ["FSP", 7, 0, 3, 3], ["FSP", 7, 4, 4, 3], ["RE", 7, [0, 4, 1, 5, 2, 6, 3, 7]], ["CA", 2, 7, 5], ["CHR", 1, "shared", [2]], ["CA", 2, 3, 6], ["CHR", 0, "shared", [3]], ["CA", 1, 4, 6], ["FU", 9, [0, 1]], ["AN", 9, 0, 5], ["FU", 9, [1, 2]], ["AN", 9, 1, 4], ["FU", 9, [2, 3]], ["AN", 9, 2, 6], ["FU", 3, [0, 1]], ["SP", 3, 0, 48, [1], 1], ["AN", 3, 1, 2], ["FFSP", 3, 0, [4, 3], 1, 1], ["AN", 3, 1, 6], ["FU", 1, [0, 1]], ["SP", 1, 0, 4, [1], 1], ["AN", 1, 1, 2], ["FFSP", 1, 0, [4, 3], 1, 1], ["AN", 1, 1, 6], ["PR", 4, 0, "auto_unroll_max_step$64"]]]], "r": [[0.000444608], 0, 2.35345, 1680117575], "v": "v0.6"}
{"i": [["[\"5b1e704ad5950c6ef36e46f1856366cd\", [1, 768], [768, 768], [1, 768], [1, 768]]", "cuda -keys=cuda,gpu -arch=sm_75 -max_num_threads=1024 -model=2080ti -thread_warp_size=32", [-1, 16, 64, 49152, 2147483647, 1024, 8, 32], "", 0, []], [[], [["CI", 6], ["CI", 5], ["CI", 4], ["SP", 2, 0, 1, [1, 1, 1, 1], 1], ["SP", 2, 5, 768, [1, 48, 4, 4], 1], ["SP", 2, 10, 768, [1, 2], 1], ["RE", 2, [0, 5, 1, 6, 2, 7, 10, 11, 3, 8, 12, 4, 9]], ["FSP", 7, 0, 3, 3], ["FSP", 7, 4, 4, 3], ["RE", 7, [0, 4, 1, 5, 2, 6, 3, 7]], ["CA", 2, 7, 5], ["CHR", 1, "shared", [2]], ["CA", 2, 3, 6], ["CHR", 0, "shared", [3]], ["CA", 1, 4, 6], ["FU", 9, [0, 1]], ["AN", 9, 0, 5], ["FU", 9, [1, 2]], ["AN", 9, 1, 4], ["FU", 9, [2, 3]], ["AN", 9, 2, 6], ["FU", 3, [0, 1]], ["SP", 3, 0, 16, [1], 1], ["AN", 3, 1, 2], ["FFSP", 3, 0, [4, 3], 1, 1], ["AN", 3, 1, 6], ["FU", 1, [0, 1]], ["SP", 1, 0, 2, [2], 1], ["AN", 1, 1, 2], ["FFSP", 1, 0, [4, 3], 1, 1], ["AN", 1, 1, 6], ["PR", 4, 0, "auto_unroll_max_step$0"]]]], "r": [[0.000744362], 0, 2.24806, 1680117577], "v": "v0.6"}
{"i": [["[\"5b1e704ad5950c6ef36e46f1856366cd\", [1, 768], [768, 768], [1, 768], [1, 768]]", "cuda -keys=cuda,gpu -arch=sm_75 -max_num_threads=1024 -model=2080ti -thread_warp_size=32", [-1, 16, 64, 49152, 2147483647, 1024, 8, 32], "", 0, []], [[], [["CI", 6], ["CI", 5], ["CI", 4], ["SP", 2, 0, 1, [1, 1, 1, 1], 1], ["SP", 2, 5, 768, [4, 16, 1, 1], 1], ["SP", 2, 10, 768, [2, 3], 1], ["RE", 2, [0, 5, 1, 6, 2, 7, 10, 11, 3, 8, 12, 4, 9]], ["FSP", 7, 0, 3, 3], ["FSP", 7, 4, 4, 3], ["RE", 7, [0, 4, 1, 5, 2, 6, 3, 7]], ["CA", 2, 7, 5], ["CHR", 1, "shared", [2]], ["CA", 2, 3, 6], ["CHR", 0, "shared", [3]], ["CA", 1, 4, 6], ["FU", 9, [0, 1]], ["AN", 9, 0, 5], ["FU", 9, [1, 2]], ["AN", 9, 1, 4], ["FU", 9, [2, 3]], ["AN", 9, 2, 6], ["FU", 3, [0, 1]], ["SP", 3, 0, 6, [3], 1], ["AN", 3, 1, 2], ["FFSP", 3, 0, [4, 3], 1, 1], ["AN", 3, 1, 6], ["FU", 1, [0, 1]], ["SP", 1, 0, 6, [1], 1], ["AN", 1, 1, 2], ["FFSP", 1, 0, [4, 3], 1, 1], ["AN", 1, 1, 6], ["PR", 4, 0, "auto_unroll_max_step$64"]]]], "r": [[6.56192e-05], 0, 2.32234, 1680117578], "v": "v0.6"}
{"i": [["[\"5b1e704ad5950c6ef36e46f1856366cd\", [1, 768], [768, 768], [1, 768], [1, 768]]", "cuda -keys=cuda,gpu -arch=sm_75 -max_num_threads=1024 -model=2080ti -thread_warp_size=32", [-1, 16, 64, 49152, 2147483647, 1024, 8, 32], "", 0, []], [[], [["CI", 6], ["CI", 5], ["CI", 4], ["SP", 2, 0, 1, [1, 1, 1, 1], 1], ["SP", 2, 5, 768, [2, 4, 6, 1], 1], ["SP", 2, 10, 768, [1, 2], 1], ["RE", 2, [0, 5, 1, 6, 2, 7, 10, 11, 3, 8, 12, 4, 9]], ["FSP", 7, 0, 3, 3], ["FSP", 7, 4, 4, 3], ["RE", 7, [0, 4, 1, 5, 2, 6, 3, 7]], ["CA", 2, 7, 5], ["CHR", 1, "shared", [2]], ["CA", 2, 3, 6], ["CHR", 0, "shared", [3]], ["CA", 1, 4, 6], ["FU", 9, [0, 1]], ["AN", 9, 0, 5], ["FU", 9, [1, 2]], ["AN", 9, 1, 4], ["FU", 9, [2, 3]], ["AN", 9, 2, 6], ["FU", 3, [0, 1]], ["SP", 3, 0, 12, [1], 1], ["AN", 3, 1, 2], ["FFSP", 3, 0, [4, 3], 1, 1], ["AN", 3, 1, 6], ["FU", 1, [0, 1]], ["SP", 1, 0, 2, [2], 1], ["AN", 1, 1, 2], ["FFSP", 1, 0, [4, 3], 1, 1], ["AN", 1, 1, 6], ["PR", 4, 0, "auto_unroll_max_step$16"]]]], "r": [[0.000132079], 0, 2.41287, 1680117580], "v": "v0.6"}
{"i": [["[\"5b1e704ad5950c6ef36e46f1856366cd\", [1, 768], [768, 768], [1, 768], [1, 768]]", "cuda -keys=cuda,gpu -arch=sm_75 -max_num_threads=1024 -model=2080ti -thread_warp_size=32", [-1, 16, 64, 49152, 2147483647, 1024, 8, 32], "", 0, []], [[], [["CI", 6], ["CI", 5], ["CI", 4], ["SP", 2, 0, 1, [1, 1, 1, 1], 1], ["SP", 2, 5, 768, [4, 4, 1, 48], 1], ["SP", 2, 10, 768, [8, 1], 1], ["RE", 2, [0, 5, 1, 6, 2, 7, 10, 11, 3, 8, 12, 4, 9]], ["FSP", 7, 0, 3, 3], ["FSP", 7, 4, 4, 3], ["RE", 7, [0, 4, 1, 5, 2, 6, 3, 7]], ["CA", 2, 7, 5], ["CHR", 1, "shared", [2]], ["CA", 2, 3, 6], ["CHR", 0, "shared", [3]], ["CA", 1, 4, 6], ["FU", 9, [0, 1]], ["AN", 9, 0, 5], ["FU", 9, [1, 2]], ["AN", 9, 1, 4], ["FU", 9, [2, 3]], ["AN", 9, 2, 6], ["FU", 3, [0, 1]], ["SP", 3, 0, 16, [1], 1], ["AN", 3, 1, 2], ["FFSP", 3, 0, [4, 3], 1, 1], ["AN", 3, 1, 6], ["FU", 1, [0, 1]], ["SP", 1, 0, 8, [1], 1], ["AN", 1, 1, 2], ["FFSP", 1, 0, [4, 3], 1, 1], ["AN", 1, 1, 6], ["PR", 4, 0, "auto_unroll_max_step$64"]]]], "r": [[0.00458796], 0, 2.63846, 1680117581], "v": "v0.6"}
{"i": [["[\"5b1e704ad5950c6ef36e46f1856366cd\", [1, 768], [768, 768], [1, 768], [1, 768]]", "cuda -keys=cuda,gpu -arch=sm_75 -max_num_threads=1024 -model=2080ti -thread_warp_size=32", [-1, 16, 64, 49152, 2147483647, 1024, 8, 32], "", 0, []], [[], [["CI", 6], ["CI", 5], ["CI", 4], ["SP", 2, 0, 1, [1, 1, 1, 1], 1], ["SP", 2, 5, 768, [2, 32, 2, 6], 1], ["SP", 2, 10, 768, [2, 2], 1], ["RE", 2, [0, 5, 1, 6, 2, 7, 10, 11, 3, 8, 12, 4, 9]], ["FSP", 7, 0, 3, 3], ["FSP", 7, 4, 4, 3], ["RE", 7, [0, 4, 1, 5, 2, 6, 3, 7]], ["CA", 2, 7, 5], ["CHR", 1, "shared", [2]], ["CA", 2, 3, 6], ["CHR", 0, "shared", [3]], ["CA", 1, 4, 6], ["FU", 9, [0, 1]], ["AN", 9, 0, 5], ["FU", 9, [1, 2]], ["AN", 9, 1, 4], ["FU", 9, [2, 3]], ["AN", 9, 2, 6], ["FU", 3, [0, 1]], ["SP", 3, 0, 48, [1], 1], ["AN", 3, 1, 2], ["FFSP", 3, 0, [4, 3], 1, 1], ["AN", 3, 1, 6], ["FU", 1, [0, 1]], ["SP", 1, 0, 4, [4], 1], ["AN", 1, 1, 2], ["FFSP", 1, 0, [4, 3], 1, 1], ["AN", 1, 1, 6], ["PR", 4, 0, "auto_unroll_max_step$64"]]]], "r": [[0.000446575], 0, 2.25376, 1680117582], "v": "v0.6"}
{"i": [["[\"5b1e704ad5950c6ef36e46f1856366cd\", [1, 768], [768, 768], [1, 768], [1, 768]]", "cuda -keys=cuda,gpu -arch=sm_75 -max_num_threads=1024 -model=2080ti -thread_warp_size=32", [-1, 16, 64, 49152, 2147483647, 1024, 8, 32], "", 0, []], [[], [["CI", 6], ["CI", 5], ["CI", 4], ["SP", 2, 0, 1, [1, 1, 1, 1], 1], ["SP", 2, 5, 768, [1, 128, 1, 1], 1], ["SP", 2, 10, 768, [32, 1], 1], ["RE", 2, [0, 5, 1, 6, 2, 7, 10, 11, 3, 8, 12, 4, 9]], ["FSP", 7, 0, 3, 3], ["FSP", 7, 4, 4, 3], ["RE", 7, [0, 4, 1, 5, 2, 6, 3, 7]], ["CA", 2, 7, 5], ["CHR", 1, "shared", [2]], ["CA", 2, 3, 6], ["CHR", 0, "shared", [3]], ["CA", 1, 4, 6], ["FU", 9, [0, 1]], ["AN", 9, 0, 5], ["FU", 9, [1, 2]], ["AN", 9, 1, 4], ["FU", 9, [2, 3]], ["AN", 9, 2, 6], ["FU", 3, [0, 1]], ["SP", 3, 0, 32, [4], 1], ["AN", 3, 1, 2], ["FFSP", 3, 0, [4, 3], 1, 1], ["AN", 3, 1, 6], ["FU", 1, [0, 1]], ["SP", 1, 0, 32, [1], 1], ["AN", 1, 1, 2], ["FFSP", 1, 0, [4, 3], 1, 1], ["AN", 1, 1, 6], ["PR", 4, 0, "auto_unroll_max_step$64"]]]], "r": [[3.88358e-05], 0, 2.25905, 1680117584], "v": "v0.6"}
{"i": [["[\"5b1e704ad5950c6ef36e46f1856366cd\", [1, 768], [768, 768], [1, 768], [1, 768]]", "cuda -keys=cuda,gpu -arch=sm_75 -max_num_threads=1024 -model=2080ti -thread_warp_size=32", [-1, 16, 64, 49152, 2147483647, 1024, 8, 32], "", 0, []], [[], [["CI", 6], ["CI", 5], ["CI", 4], ["SP", 2, 0, 1, [1, 1, 1, 1], 1], ["SP", 2, 5, 768, [2, 32, 1, 1], 1], ["SP", 2, 10, 768, [8, 12], 1], ["RE", 2, [0, 5, 1, 6, 2, 7, 10, 11, 3, 8, 12, 4, 9]], ["FSP", 7, 0, 3, 3], ["FSP", 7, 4, 4, 3], ["RE", 7, [0, 4, 1, 5, 2, 6, 3, 7]], ["CA", 2, 7, 5], ["CHR", 1, "shared", [2]], ["CA", 2, 3, 6], ["CHR", 0, "shared", [3]], ["CA", 1, 4, 6], ["FU", 9, [0, 1]], ["AN", 9, 0, 5], ["FU", 9, [1, 2]], ["AN", 9, 1, 4], ["FU", 9, [2, 3]], ["AN", 9, 2, 6], ["FU", 3, [0, 1]], ["SP", 3, 0, 96, [4], 1], ["AN", 3, 1, 2], ["FFSP", 3, 0, [4, 3], 1, 1], ["AN", 3, 1, 6], ["FU", 1, [0, 1]], ["SP", 1, 0, 96, [1], 1], ["AN", 1, 1, 2], ["FFSP", 1, 0, [4, 3], 1, 1], ["AN", 1, 1, 6], ["PR", 4, 0, "auto_unroll_max_step$0"]]]], "r": [[4.41964e-05], 0, 2.18985, 1680117585], "v": "v0.6"}
{"i": [["[\"5b1e704ad5950c6ef36e46f1856366cd\", [1, 768], [768, 768], [1, 768], [1, 768]]", "cuda -keys=cuda,gpu -arch=sm_75 -max_num_threads=1024 -model=2080ti -thread_warp_size=32", [-1, 16, 64, 49152, 2147483647, 1024, 8, 32], "", 0, []], [[], [["CI", 6], ["CI", 5], ["CI", 4], ["SP", 2, 0, 1, [1, 1, 1, 1], 1], ["SP", 2, 5, 768, [1, 32, 1, 1], 1], ["SP", 2, 10, 768, [2, 12], 1], ["RE", 2, [0, 5, 1, 6, 2, 7, 10, 11, 3, 8, 12, 4, 9]], ["FSP", 7, 0, 3, 3], ["FSP", 7, 4, 4, 3], ["RE", 7, [0, 4, 1, 5, 2, 6, 3, 7]], ["CA", 2, 7, 5], ["CHR", 1, "shared", [2]], ["CA", 2, 3, 6], ["CHR", 0, "shared", [3]], ["CA", 1, 4, 6], ["FU", 9, [0, 1]], ["AN", 9, 0, 5], ["FU", 9, [1, 2]], ["AN", 9, 1, 4], ["FU", 9, [2, 3]], ["AN", 9, 2, 6], ["FU", 3, [0, 1]], ["SP", 3, 0, 96, [1], 1], ["AN", 3, 1, 2], ["FFSP", 3, 0, [4, 3], 1, 1], ["AN", 3, 1, 6], ["FU", 1, [0, 1]], ["SP", 1, 0, 24, [1], 1], ["AN", 1, 1, 2], ["FFSP", 1, 0, [4, 3], 1, 1], ["AN", 1, 1, 6], ["PR", 4, 0, "auto_unroll_max_step$1024"]]]], "r": [[1.85331e-05], 0, 2.31196, 1680117587], "v": "v0.6"}
{"i": [["[\"5b1e704ad5950c6ef36e46f1856366cd\", [1, 768], [768, 768], [1, 768], [1, 768]]", "cuda -keys=cuda,gpu -arch=sm_75 -max_num_threads=1024 -model=2080ti -thread_warp_size=32", [-1, 16, 64, 49152, 2147483647, 1024, 8, 32], "", 0, []], [[], [["CI", 6], ["CI", 5], ["CI", 4], ["SP", 2, 0, 1, [1, 1, 1, 1], 1], ["SP", 2, 5, 768, [1, 384, 1, 1], 1], ["SP", 2, 10, 768, [1, 16], 1], ["RE", 2, [0, 5, 1, 6, 2, 7, 10, 11, 3, 8, 12, 4, 9]], ["FSP", 7, 0, 3, 3], ["FSP", 7, 4, 4, 3], ["RE", 7, [0, 4, 1, 5, 2, 6, 3, 7]], ["CA", 2, 7, 5], ["CHR", 1, "shared", [2]], ["CA", 2, 3, 6], ["CHR", 0, "shared", [3]], ["CA", 1, 4, 6], ["FU", 9, [0, 1]], ["AN", 9, 0, 5], ["FU", 9, [1, 2]], ["AN", 9, 1, 4], ["FU", 9, [2, 3]], ["AN", 9, 2, 6], ["FU", 3, [0, 1]], ["SP", 3, 0, 48, [6], 1], ["AN", 3, 1, 2], ["FFSP", 3, 0, [4, 3], 1, 1], ["AN", 3, 1, 6], ["FU", 1, [0, 1]], ["SP", 1, 0, 16, [1], 1], ["AN", 1, 1, 2], ["FFSP", 1, 0, [4, 3], 1, 1], ["AN", 1, 1, 6], ["PR", 4, 0, "auto_unroll_max_step$64"]]]], "r": [[0.000189898], 0, 2.2839, 1680117588], "v": "v0.6"}
{"i": [["[\"5b1e704ad5950c6ef36e46f1856366cd\", [1, 768], [768, 768], [1, 768], [1, 768]]", "cuda -keys=cuda,gpu -arch=sm_75 -max_num_threads=1024 -model=2080ti -thread_warp_size=32", [-1, 16, 64, 49152, 2147483647, 1024, 8, 32], "", 0, []], [[], [["CI", 6], ["CI", 5], ["CI", 4], ["SP", 2, 0, 1, [1, 1, 1, 1], 1], ["SP", 2, 5, 768, [2, 16, 1, 12], 1], ["SP", 2, 10, 768, [2, 12], 1], ["RE", 2, [0, 5, 1, 6, 2, 7, 10, 11, 3, 8, 12, 4, 9]], ["FSP", 7, 0, 3, 3], ["FSP", 7, 4, 4, 3], ["RE", 7, [0, 4, 1, 5, 2, 6, 3, 7]], ["CA", 2, 7, 5], ["CHR", 1, "shared", [2]], ["CA", 2, 3, 6], ["CHR", 0, "shared", [3]], ["CA", 1, 4, 6], ["FU", 9, [0, 1]], ["AN", 9, 0, 5], ["FU", 9, [1, 2]], ["AN", 9, 1, 4], ["FU", 9, [2, 3]], ["AN", 9, 2, 6], ["FU", 3, [0, 1]], ["SP", 3, 0, 144, [1], 1], ["AN", 3, 1, 2], ["FFSP", 3, 0, [4, 3], 1, 1], ["AN", 3, 1, 6], ["FU", 1, [0, 1]], ["SP", 1, 0, 24, [1], 1], ["AN", 1, 1, 2], ["FFSP", 1, 0, [4, 3], 1, 1], ["AN", 1, 1, 6], ["PR", 4, 0, "auto_unroll_max_step$512"]]]], "r": [[0.000853217], 0, 4.02287, 1680117589], "v": "v0.6"}
{"i": [["[\"5b1e704ad5950c6ef36e46f1856366cd\", [1, 768], [768, 768], [1, 768], [1, 768]]", "cuda -keys=cuda,gpu -arch=sm_75 -max_num_threads=1024 -model=2080ti -thread_warp_size=32", [-1, 16, 64, 49152, 2147483647, 1024, 8, 32], "", 0, []], [[], [["CI", 6], ["CI", 5], ["CI", 4], ["SP", 2, 0, 1, [1, 1, 1, 1], 1], ["SP", 2, 5, 768, [2, 32, 1, 1], 1], ["SP", 2, 10, 768, [1, 24], 1], ["RE", 2, [0, 5, 1, 6, 2, 7, 10, 11, 3, 8, 12, 4, 9]], ["FSP", 7, 0, 3, 3], ["FSP", 7, 4, 4, 3], ["RE", 7, [0, 4, 1, 5, 2, 6, 3, 7]], ["CA", 2, 7, 5], ["CHR", 1, "shared", [2]], ["CA", 2, 3, 6], ["CHR", 0, "shared", [3]], ["CA", 1, 4, 6], ["FU", 9, [0, 1]], ["AN", 9, 0, 5], ["FU", 9, [1, 2]], ["AN", 9, 1, 4], ["FU", 9, [2, 3]], ["AN", 9, 2, 6], ["FU", 3, [0, 1]], ["SP", 3, 0, 24, [1], 1], ["AN", 3, 1, 2], ["FFSP", 3, 0, [4, 3], 1, 1], ["AN", 3, 1, 6], ["FU", 1, [0, 1]], ["SP", 1, 0, 24, [1], 1], ["AN", 1, 1, 2], ["FFSP", 1, 0, [4, 3], 1, 1], ["AN", 1, 1, 6], ["PR", 4, 0, "auto_unroll_max_step$0"]]]], "r": [[8.14223e-05], 0, 2.27467, 1680117591], "v": "v0.6"}
{"i": [["[\"5b1e704ad5950c6ef36e46f1856366cd\", [1, 768], [768, 768], [1, 768], [1, 768]]", "cuda -keys=cuda,gpu -arch=sm_75 -max_num_threads=1024 -model=2080ti -thread_warp_size=32", [-1, 16, 64, 49152, 2147483647, 1024, 8, 32], "", 0, []], [[], [["CI", 6], ["CI", 5], ["CI", 4], ["SP", 2, 0, 1, [1, 1, 1, 1], 1], ["SP", 2, 5, 768, [1, 128, 2, 3], 1], ["SP", 2, 10, 768, [6, 2], 1], ["RE", 2, [0, 5, 1, 6, 2, 7, 10, 11, 3, 8, 12, 4, 9]], ["FSP", 7, 0, 3, 3], ["FSP", 7, 4, 4, 3], ["RE", 7, [0, 4, 1, 5, 2, 6, 3, 7]], ["CA", 2, 7, 5], ["CHR", 1, "shared", [2]], ["CA", 2, 3, 6], ["CHR", 0, "shared", [3]], ["CA", 1, 4, 6], ["FU", 9, [0, 1]], ["AN", 9, 0, 5], ["FU", 9, [1, 2]], ["AN", 9, 1, 4], ["FU", 9, [2, 3]], ["AN", 9, 2, 6], ["FU", 3, [0, 1]], ["SP", 3, 0, 72, [1], 1], ["AN", 3, 1, 2], ["FFSP", 3, 0, [4, 3], 1, 1], ["AN", 3, 1, 6], ["FU", 1, [0, 1]], ["SP", 1, 0, 12, [3], 1], ["AN", 1, 1, 2], ["FFSP", 1, 0, [4, 3], 1, 1], ["AN", 1, 1, 6], ["PR", 4, 0, "auto_unroll_max_step$0"]]]], "r": [[0.000255969], 0, 2.04988, 1680117592], "v": "v0.6"}
{"i": [["[\"5b1e704ad5950c6ef36e46f1856366cd\", [1, 768], [768, 768], [1, 768], [1, 768]]", "cuda -keys=cuda,gpu -arch=sm_75 -max_num_threads=1024 -model=2080ti -thread_warp_size=32", [-1, 16, 64, 49152, 2147483647, 1024, 8, 32], "", 0, []], [[], [["CI", 6], ["CI", 5], ["CI", 4], ["SP", 2, 0, 1, [1, 1, 1, 1], 1], ["SP", 2, 5, 768, [6, 32, 2, 1], 1], ["SP", 2, 10, 768, [1, 12], 1], ["RE", 2, [0, 5, 1, 6, 2, 7, 10, 11, 3, 8, 12, 4, 9]], ["FSP", 7, 0, 3, 3], ["FSP", 7, 4, 4, 3], ["RE", 7, [0, 4, 1, 5, 2, 6, 3, 7]], ["CA", 2, 7, 5], ["CHR", 1, "shared", [2]], ["CA", 2, 3, 6], ["CHR", 0, "shared", [3]], ["CA", 1, 4, 6], ["FU", 9, [0, 1]], ["AN", 9, 0, 5], ["FU", 9, [1, 2]], ["AN", 9, 1, 4], ["FU", 9, [2, 3]], ["AN", 9, 2, 6], ["FU", 3, [0, 1]], ["SP", 3, 0, 2, [1], 1], ["AN", 3, 1, 2], ["FFSP", 3, 0, [4, 3], 1, 1], ["AN", 3, 1, 6], ["FU", 1, [0, 1]], ["SP", 1, 0, 1, [1], 1], ["AN", 1, 1, 2], ["FFSP", 1, 0, [4, 3], 1, 1], ["AN", 1, 1, 6], ["PR", 4, 0, "auto_unroll_max_step$64"]]]], "r": [[0.000420999], 0, 2.79156, 1680117594], "v": "v0.6"}
{"i": [["[\"5b1e704ad5950c6ef36e46f1856366cd\", [1, 768], [768, 768], [1, 768], [1, 768]]", "cuda -keys=cuda,gpu -arch=sm_75 -max_num_threads=1024 -model=2080ti -thread_warp_size=32", [-1, 16, 64, 49152, 2147483647, 1024, 8, 32], "", 0, []], [[], [["CI", 6], ["CI", 5], ["CI", 4], ["SP", 2, 0, 1, [1, 1, 1, 1], 1], ["SP", 2, 5, 768, [1, 384, 1, 1], 1], ["SP", 2, 10, 768, [1, 1], 1], ["RE", 2, [0, 5, 1, 6, 2, 7, 10, 11, 3, 8, 12, 4, 9]], ["FSP", 7, 0, 3, 3], ["FSP", 7, 4, 4, 3], ["RE", 7, [0, 4, 1, 5, 2, 6, 3, 7]], ["CA", 2, 7, 5], ["CHR", 1, "shared", [2]], ["CA", 2, 3, 6], ["CHR", 0, "shared", [3]], ["CA", 1, 4, 6], ["FU", 9, [0, 1]], ["AN", 9, 0, 5], ["FU", 9, [1, 2]], ["AN", 9, 1, 4], ["FU", 9, [2, 3]], ["AN", 9, 2, 6], ["FU", 3, [0, 1]], ["SP", 3, 0, 9, [1], 1], ["AN", 3, 1, 2], ["FFSP", 3, 0, [4, 3], 1, 1], ["AN", 3, 1, 6], ["FU", 1, [0, 1]], ["SP", 1, 0, 3, [3], 1], ["AN", 1, 1, 2], ["FFSP", 1, 0, [4, 3], 1, 1], ["AN", 1, 1, 6], ["PR", 4, 0, "auto_unroll_max_step$16"]]]], "r": [[0.000344971], 0, 2.09451, 1680117595], "v": "v0.6"}
{"i": [["[\"5b1e704ad5950c6ef36e46f1856366cd\", [1, 768], [768, 768], [1, 768], [1, 768]]", "cuda -keys=cuda,gpu -arch=sm_75 -max_num_threads=1024 -model=2080ti -thread_warp_size=32", [-1, 16, 64, 49152, 2147483647, 1024, 8, 32], "", 0, []], [[], [["CI", 6], ["CI", 5], ["CI", 4], ["SP", 2, 0, 1, [1, 1, 1, 1], 1], ["SP", 2, 5, 768, [6, 1, 1, 4], 1], ["SP", 2, 10, 768, [1, 8], 1], ["RE", 2, [0, 5, 1, 6, 2, 7, 10, 11, 3, 8, 12, 4, 9]], ["FSP", 7, 0, 3, 3], ["FSP", 7, 4, 4, 3], ["RE", 7, [0, 4, 1, 5, 2, 6, 3, 7]], ["CA", 2, 7, 5], ["CHR", 1, "shared", [2]], ["CA", 2, 3, 6], ["CHR", 0, "shared", [3]], ["CA", 1, 4, 6], ["FU", 9, [0, 1]], ["AN", 9, 0, 5], ["FU", 9, [1, 2]], ["AN", 9, 1, 4], ["FU", 9, [2, 3]], ["AN", 9, 2, 6], ["FU", 3, [0, 1]], ["SP", 3, 0, 32, [1], 1], ["AN", 3, 1, 2], ["FFSP", 3, 0, [4, 3], 1, 1], ["AN", 3, 1, 6], ["FU", 1, [0, 1]], ["SP", 1, 0, 32, [1], 1], ["AN", 1, 1, 2], ["FFSP", 1, 0, [4, 3], 1, 1], ["AN", 1, 1, 6], ["PR", 4, 0, "auto_unroll_max_step$0"]]]], "r": [[0.000305651], 0, 2.70924, 1680117600], "v": "v0.6"}
{"i": [["[\"5b1e704ad5950c6ef36e46f1856366cd\", [1, 768], [768, 768], [1, 768], [1, 768]]", "cuda -keys=cuda,gpu -arch=sm_75 -max_num_threads=1024 -model=2080ti -thread_warp_size=32", [-1, 16, 64, 49152, 2147483647, 1024, 8, 32], "", 0, []], [[], [["CI", 6], ["CI", 5], ["CI", 4], ["SP", 2, 0, 1, [1, 1, 1, 1], 1], ["SP", 2, 5, 768, [3, 32, 1, 1], 1], ["SP", 2, 10, 768, [32, 1], 1], ["RE", 2, [0, 5, 1, 6, 2, 7, 10, 11, 3, 8, 12, 4, 9]], ["FSP", 7, 0, 3, 3], ["FSP", 7, 4, 4, 3], ["RE", 7, [0, 4, 1, 5, 2, 6, 3, 7]], ["CA", 2, 7, 5], ["CHR", 1, "shared", [2]], ["CA", 2, 3, 6], ["CHR", 0, "shared", [3]], ["CA", 1, 4, 6], ["FU", 9, [0, 1]], ["AN", 9, 0, 5], ["FU", 9, [1, 2]], ["AN", 9, 1, 4], ["FU", 9, [2, 3]], ["AN", 9, 2, 6], ["FU", 3, [0, 1]], ["SP", 3, 0, 64, [1], 1], ["AN", 3, 1, 2], ["FFSP", 3, 0, [4, 3], 1, 1], ["AN", 3, 1, 6], ["FU", 1, [0, 1]], ["SP", 1, 0, 64, [1], 1], ["AN", 1, 1, 2], ["FFSP", 1, 0, [4, 3], 1, 1], ["AN", 1, 1, 6], ["PR", 4, 0, "auto_unroll_max_step$64"]]]], "r": [[5.07753e-05], 0, 2.15204, 1680117602], "v": "v0.6"}
{"i": [["[\"5b1e704ad5950c6ef36e46f1856366cd\", [1, 768], [768, 768], [1, 768], [1, 768]]", "cuda -keys=cuda,gpu -arch=sm_75 -max_num_threads=1024 -model=2080ti -thread_warp_size=32", [-1, 16, 64, 49152, 2147483647, 1024, 8, 32], "", 0, []], [[], [["CI", 6], ["CI", 5], ["CI", 4], ["SP", 2, 0, 1, [1, 1, 1, 1], 1], ["SP", 2, 5, 768, [1, 1, 3, 4], 1], ["SP", 2, 10, 768, [3, 2], 1], ["RE", 2, [0, 5, 1, 6, 2, 7, 10, 11, 3, 8, 12, 4, 9]], ["FSP", 7, 0, 3, 3], ["FSP", 7, 4, 4, 3], ["RE", 7, [0, 4, 1, 5, 2, 6, 3, 7]], ["CA", 2, 7, 5], ["CHR", 1, "shared", [2]], ["CA", 2, 3, 6], ["CHR", 0, "shared", [3]], ["CA", 1, 4, 6], ["FU", 9, [0, 1]], ["AN", 9, 0, 5], ["FU", 9, [1, 2]], ["AN", 9, 1, 4], ["FU", 9, [2, 3]], ["AN", 9, 2, 6], ["FU", 3, [0, 1]], ["SP", 3, 0, 72, [3], 1], ["AN", 3, 1, 2], ["FFSP", 3, 0, [4, 3], 1, 1], ["AN", 3, 1, 6], ["FU", 1, [0, 1]], ["SP", 1, 0, 6, [1], 1], ["AN", 1, 1, 2], ["FFSP", 1, 0, [4, 3], 1, 1], ["AN", 1, 1, 6], ["PR", 4, 0, "auto_unroll_max_step$512"]]]], "r": [[9.53223e-05], 0, 2.30532, 1680117603], "v": "v0.6"}
{"i": [["[\"5b1e704ad5950c6ef36e46f1856366cd\", [1, 768], [768, 768], [1, 768], [1, 768]]", "cuda -keys=cuda,gpu -arch=sm_75 -max_num_threads=1024 -model=2080ti -thread_warp_size=32", [-1, 16, 64, 49152, 2147483647, 1024, 8, 32], "", 0, []], [[], [["CI", 6], ["CI", 5], ["CI", 4], ["SP", 2, 0, 1, [1, 1, 1, 1], 1], ["SP", 2, 5, 768, [1, 48, 1, 4], 1], ["SP", 2, 10, 768, [8, 6], 1], ["RE", 2, [0, 5, 1, 6, 2, 7, 10, 11, 3, 8, 12, 4, 9]], ["FSP", 7, 0, 3, 3], ["FSP", 7, 4, 4, 3], ["RE", 7, [0, 4, 1, 5, 2, 6, 3, 7]], ["CA", 2, 7, 5], ["CHR", 1, "shared", [2]], ["CA", 2, 3, 6], ["CHR", 0, "shared", [3]], ["CA", 1, 4, 6], ["FU", 9, [0, 1]], ["AN", 9, 0, 5], ["FU", 9, [1, 2]], ["AN", 9, 1, 4], ["FU", 9, [2, 3]], ["AN", 9, 2, 6], ["FU", 3, [0, 1]], ["SP", 3, 0, 96, [1], 1], ["AN", 3, 1, 2], ["FFSP", 3, 0, [4, 3], 1, 1], ["AN", 3, 1, 6], ["FU", 1, [0, 1]], ["SP", 1, 0, 24, [2], 1], ["AN", 1, 1, 2], ["FFSP", 1, 0, [4, 3], 1, 1], ["AN", 1, 1, 6], ["PR", 4, 0, "auto_unroll_max_step$1024"]]]], "r": [[6.65699e-05], 0, 2.97689, 1680117604], "v": "v0.6"}
{"i": [["[\"5b1e704ad5950c6ef36e46f1856366cd\", [1, 768], [768, 768], [1, 768], [1, 768]]", "cuda -keys=cuda,gpu -arch=sm_75 -max_num_threads=1024 -model=2080ti -thread_warp_size=32", [-1, 16, 64, 49152, 2147483647, 1024, 8, 32], "", 0, []], [[], [["CI", 6], ["CI", 5], ["CI", 4], ["SP", 2, 0, 1, [1, 1, 1, 1], 1], ["SP", 2, 5, 768, [8, 12, 1, 8], 1], ["SP", 2, 10, 768, [1, 4], 1], ["RE", 2, [0, 5, 1, 6, 2, 7, 10, 11, 3, 8, 12, 4, 9]], ["FSP", 7, 0, 3, 3], ["FSP", 7, 4, 4, 3], ["RE", 7, [0, 4, 1, 5, 2, 6, 3, 7]], ["CA", 2, 7, 5], ["CHR", 1, "shared", [2]], ["CA", 2, 3, 6], ["CHR", 0, "shared", [3]], ["CA", 1, 4, 6], ["FU", 9, [0, 1]], ["AN", 9, 0, 5], ["FU", 9, [1, 2]], ["AN", 9, 1, 4], ["FU", 9, [2, 3]], ["AN", 9, 2, 6], ["FU", 3, [0, 1]], ["SP", 3, 0, 8, [1], 1], ["AN", 3, 1, 2], ["FFSP", 3, 0, [4, 3], 1, 1], ["AN", 3, 1, 6], ["FU", 1, [0, 1]], ["SP", 1, 0, 4, [1], 1], ["AN", 1, 1, 2], ["FFSP", 1, 0, [4, 3], 1, 1], ["AN", 1, 1, 6], ["PR", 4, 0, "auto_unroll_max_step$0"]]]], "r": [[0.00140957], 0, 2.52627, 1680117606], "v": "v0.6"}
{"i": [["[\"5b1e704ad5950c6ef36e46f1856366cd\", [1, 768], [768, 768], [1, 768], [1, 768]]", "cuda -keys=cuda,gpu -arch=sm_75 -max_num_threads=1024 -model=2080ti -thread_warp_size=32", [-1, 16, 64, 49152, 2147483647, 1024, 8, 32], "", 0, []], [[], [["CI", 6], ["CI", 5], ["CI", 4], ["SP", 2, 0, 1, [1, 1, 1, 1], 1], ["SP", 2, 5, 768, [1, 96, 1, 1], 1], ["SP", 2, 10, 768, [3, 8], 1], ["RE", 2, [0, 5, 1, 6, 2, 7, 10, 11, 3, 8, 12, 4, 9]], ["FSP", 7, 0, 3, 3], ["FSP", 7, 4, 4, 3], ["RE", 7, [0, 4, 1, 5, 2, 6, 3, 7]], ["CA", 2, 7, 5], ["CHR", 1, "shared", [2]], ["CA", 2, 3, 6], ["CHR", 0, "shared", [3]], ["CA", 1, 4, 6], ["FU", 9, [0, 1]], ["AN", 9, 0, 5], ["FU", 9, [1, 2]], ["AN", 9, 1, 4], ["FU", 9, [2, 3]], ["AN", 9, 2, 6], ["FU", 3, [0, 1]], ["SP", 3, 0, 24, [1], 1], ["AN", 3, 1, 2], ["FFSP", 3, 0, [4, 3], 1, 1], ["AN", 3, 1, 6], ["FU", 1, [0, 1]], ["SP", 1, 0, 24, [1], 1], ["AN", 1, 1, 2], ["FFSP", 1, 0, [4, 3], 1, 1], ["AN", 1, 1, 6], ["PR", 4, 0, "auto_unroll_max_step$16"]]]], "r": [[2.5164e-05], 0, 1.98483, 1680117607], "v": "v0.6"}
