saved_logs/1000trials/default-Ansor/3/autoscheduler/2080ti/bert-B1-float32.json
{"i": [["[\"4b5e216f8244b4e8f7b6543c4a9087e5\", [1536, 128], [1536, 128]]", "cuda -keys=cuda,gpu -arch=sm_75 -max_num_threads=1024 -model=2080ti -thread_warp_size=32", [-1, 16, 64, 49152, 2147483647, 1024, 8, 32], "", 0, []], [[], [["CI", 3], ["CI", 2], ["FU", 5, [0, 1]], ["SP", 5, 0, 196608, [64], 1], ["AN", 5, 0, 5], ["AN", 5, 1, 6], ["SP", 4, 0, 1536, [32], 1], ["AN", 4, 0, 5], ["AN", 4, 1, 6], ["SP", 1, 0, 1536, [32], 1], ["AN", 1, 0, 5], ["AN", 1, 1, 6], ["PR", 1, 0, "auto_unroll_max_step$0"], ["PR", 4, 0, "auto_unroll_max_step$16"]]]], "r": [[2.57188e-05], 0, 1.93834, 1680246259], "v": "v0.6"}
{"i": [["[\"4b5e216f8244b4e8f7b6543c4a9087e5\", [1536, 128], [1536, 128]]", "cuda -keys=cuda,gpu -arch=sm_75 -max_num_threads=1024 -model=2080ti -thread_warp_size=32", [-1, 16, 64, 49152, 2147483647, 1024, 8, 32], "", 0, []], [[], [["SP", 5, 1, 128, [16], 1], ["AN", 5, 2, 6], ["FSP", 4, 1, 0, 1], ["AN", 4, 2, 6], ["CA", 4, 5, 0], ["CI", 3], ["CI", 2], ["AN", 5, 0, 5], ["SP", 1, 0, 1536, [32], 1], ["AN", 1, 0, 5], ["AN", 1, 1, 6], ["PR", 1, 0, "auto_unroll_max_step$64"], ["PR", 4, 0, "auto_unroll_max_step$64"]]]], "r": [[1.61125e-05], 0, 2.20794, 1680246260], "v": "v0.6"}
{"i": [["[\"4b5e216f8244b4e8f7b6543c4a9087e5\", [1536, 128], [1536, 128]]", "cuda -keys=cuda,gpu -arch=sm_75 -max_num_threads=1024 -model=2080ti -thread_warp_size=32", [-1, 16, 64, 49152, 2147483647, 1024, 8, 32], "", 0, []], [[], [["CI", 3], ["CI", 2], ["FU", 5, [0, 1]], ["SP", 5, 0, 196608, [32], 1], ["AN", 5, 0, 5], ["AN", 5, 1, 6], ["SP", 4, 0, 1536, [16], 1], ["AN", 4, 0, 5], ["AN", 4, 1, 6], ["SP", 1, 0, 1536, [32], 1], ["AN", 1, 0, 5], ["AN", 1, 1, 6], ["PR", 1, 0, "auto_unroll_max_step$1024"], ["PR", 4, 0, "auto_unroll_max_step$0"]]]], "r": [[2.5385e-05], 0, 1.96574, 1680246262], "v": "v0.6"}
{"i": [["[\"4b5e216f8244b4e8f7b6543c4a9087e5\", [1536, 128], [1536, 128]]", "cuda -keys=cuda,gpu -arch=sm_75 -max_num_threads=1024 -model=2080ti -thread_warp_size=32", [-1, 16, 64, 49152, 2147483647, 1024, 8, 32], "", 0, []], [[], [["SP", 5, 1, 128, [1], 1], ["AN", 5, 2, 6], ["FSP", 4, 1, 0, 1], ["AN", 4, 2, 6], ["CA", 4, 5, 0], ["CI", 3], ["CI", 2], ["FSP", 1, 1, 0, 1], ["AN", 1, 2, 6], ["CA", 1, 5, 0], ["AN", 5, 0, 5], ["PR", 1, 0, "auto_unroll_max_step$64"], ["PR", 4, 0, "auto_unroll_max_step$16"]]]], "r": [[7.91946e-05], 0, 1.93938, 1680246263], "v": "v0.6"}
{"i": [["[\"4b5e216f8244b4e8f7b6543c4a9087e5\", [1536, 128], [1536, 128]]", "cuda -keys=cuda,gpu -arch=sm_75 -max_num_threads=1024 -model=2080ti -thread_warp_size=32", [-1, 16, 64, 49152, 2147483647, 1024, 8, 32], "", 0, []], [[], [["SP", 5, 1, 128, [16], 1], ["AN", 5, 2, 6], ["FSP", 4, 1, 0, 1], ["AN", 4, 2, 6], ["CA", 4, 5, 0], ["CI", 3], ["CI", 2], ["AN", 5, 0, 5], ["SP", 1, 0, 1536, [32], 1], ["AN", 1, 0, 5], ["AN", 1, 1, 6], ["PR", 1, 0, "auto_unroll_max_step$0"], ["PR", 4, 0, "auto_unroll_max_step$512"]]]], "r": [[1.61213e-05], 0, 2.18713, 1680246264], "v": "v0.6"}
{"i": [["[\"4b5e216f8244b4e8f7b6543c4a9087e5\", [1536, 128], [1536, 128]]", "cuda -keys=cuda,gpu -arch=sm_75 -max_num_threads=1024 -model=2080ti -thread_warp_size=32", [-1, 16, 64, 49152, 2147483647, 1024, 8, 32], "", 0, []], [[], [["CI", 3], ["CI", 2], ["SP", 1, 1, 128, [64], 1], ["AN", 1, 2, 6], ["FU", 5, [0, 1]], ["SP", 5, 0, 196608, [1], 1], ["AN", 5, 0, 5], ["AN", 5, 1, 6], ["SP", 4, 0, 1536, [32], 1], ["AN", 4, 0, 5], ["AN", 4, 1, 6], ["AN", 1, 0, 5], ["PR", 1, 0, "auto_unroll_max_step$1024"], ["PR", 4, 0, "auto_unroll_max_step$512"]]]], "r": [[0.000182662], 0, 1.97094, 1680246266], "v": "v0.6"}
{"i": [["[\"4b5e216f8244b4e8f7b6543c4a9087e5\", [1536, 128], [1536, 128]]", "cuda -keys=cuda,gpu -arch=sm_75 -max_num_threads=1024 -model=2080ti -thread_warp_size=32", [-1, 16, 64, 49152, 2147483647, 1024, 8, 32], "", 0, []], [[], [["SP", 5, 1, 128, [1], 1], ["AN", 5, 2, 6], ["FSP", 4, 1, 0, 1], ["AN", 4, 2, 6], ["CA", 4, 5, 0], ["CI", 3], ["CI", 2], ["AN", 5, 0, 5], ["SP", 1, 0, 1536, [32], 1], ["AN", 1, 0, 5], ["AN", 1, 1, 6], ["PR", 1, 0, "auto_unroll_max_step$64"], ["PR", 4, 0, "auto_unroll_max_step$16"]]]], "r": [[8.53949e-05], 0, 1.98397, 1680246267], "v": "v0.6"}
{"i": [["[\"4b5e216f8244b4e8f7b6543c4a9087e5\", [1536, 128], [1536, 128]]", "cuda -keys=cuda,gpu -arch=sm_75 -max_num_threads=1024 -model=2080ti -thread_warp_size=32", [-1, 16, 64, 49152, 2147483647, 1024, 8, 32], "", 0, []], [[], [["CI", 3], ["CI", 2], ["FU", 5, [0, 1]], ["SP", 5, 0, 196608, [32], 1], ["AN", 5, 0, 5], ["AN", 5, 1, 6], ["SP", 4, 0, 1536, [48], 1], ["AN", 4, 0, 5], ["AN", 4, 1, 6], ["SP", 1, 0, 1536, [4], 1], ["AN", 1, 0, 5], ["AN", 1, 1, 6], ["PR", 1, 0, "auto_unroll_max_step$64"], ["PR", 4, 0, "auto_unroll_max_step$16"]]]], "r": [[2.45026e-05], 0, 2.03166, 1680246269], "v": "v0.6"}
{"i": [["[\"4b5e216f8244b4e8f7b6543c4a9087e5\", [1536, 128], [1536, 128]]", "cuda -keys=cuda,gpu -arch=sm_75 -max_num_threads=1024 -model=2080ti -thread_warp_size=32", [-1, 16, 64, 49152, 2147483647, 1024, 8, 32], "", 0, []], [[], [["SP", 5, 1, 128, [64], 1], ["AN", 5, 2, 6], ["FSP", 4, 1, 0, 1], ["AN", 4, 2, 6], ["CA", 4, 5, 0], ["CI", 3], ["CI", 2], ["FSP", 1, 1, 0, 1], ["AN", 1, 2, 6], ["CA", 1, 5, 0], ["AN", 5, 0, 5], ["PR", 1, 0, "auto_unroll_max_step$1024"], ["PR", 4, 0, "auto_unroll_max_step$64"]]]], "r": [[6.11862e-06], 0, 1.76312, 1680246270], "v": "v0.6"}
{"i": [["[\"4b5e216f8244b4e8f7b6543c4a9087e5\", [1536, 128], [1536, 128]]", "cuda -keys=cuda,gpu -arch=sm_75 -max_num_threads=1024 -model=2080ti -thread_warp_size=32", [-1, 16, 64, 49152, 2147483647, 1024, 8, 32], "", 0, []], [[], [["SP", 5, 1, 128, [4], 1], ["AN", 5, 2, 6], ["FSP", 4, 1, 0, 1], ["AN", 4, 2, 6], ["CA", 4, 5, 0], ["CI", 3], ["CI", 2], ["FSP", 1, 1, 0, 1], ["AN", 1, 2, 6], ["CA", 1, 5, 0], ["AN", 5, 0, 5], ["PR", 1, 0, "auto_unroll_max_step$1024"], ["PR", 4, 0, "auto_unroll_max_step$512"]]]], "r": [[2.26904e-05], 0, 3.17781, 1680246271], "v": "v0.6"}
{"i": [["[\"4b5e216f8244b4e8f7b6543c4a9087e5\", [1536, 128], [1536, 128]]", "cuda -keys=cuda,gpu -arch=sm_75 -max_num_threads=1024 -model=2080ti -thread_warp_size=32", [-1, 16, 64, 49152, 2147483647, 1024, 8, 32], "", 0, []], [[], [["CI", 3], ["CI", 2], ["SP", 1, 1, 128, [4], 1], ["AN", 1, 2, 6], ["FU", 5, [0, 1]], ["SP", 5, 0, 196608, [32], 1], ["AN", 5, 0, 5], ["AN", 5, 1, 6], ["SP", 4, 0, 1536, [64], 1], ["AN", 4, 0, 5], ["AN", 4, 1, 6], ["AN", 1, 0, 5], ["PR", 1, 0, "auto_unroll_max_step$64"], ["PR", 4, 0, "auto_unroll_max_step$16"]]]], "r": [[2.22117e-05], 0, 1.97183, 1680246272], "v": "v0.6"}
{"i": [["[\"4b5e216f8244b4e8f7b6543c4a9087e5\", [1536, 128], [1536, 128]]", "cuda -keys=cuda,gpu -arch=sm_75 -max_num_threads=1024 -model=2080ti -thread_warp_size=32", [-1, 16, 64, 49152, 2147483647, 1024, 8, 32], "", 0, []], [[], [["SP", 5, 1, 128, [32], 1], ["AN", 5, 2, 6], ["FSP", 4, 1, 0, 1], ["AN", 4, 2, 6], ["CA", 4, 5, 0], ["CI", 3], ["CI", 2], ["FSP", 1, 1, 0, 1], ["AN", 1, 2, 6], ["CA", 1, 5, 0], ["AN", 5, 0, 5], ["PR", 1, 0, "auto_unroll_max_step$1024"], ["PR", 4, 0, "auto_unroll_max_step$512"]]]], "r": [[5.97461e-06], 0, 1.92261, 1680246273], "v": "v0.6"}
{"i": [["[\"4b5e216f8244b4e8f7b6543c4a9087e5\", [1536, 128], [1536, 128]]", "cuda -keys=cuda,gpu -arch=sm_75 -max_num_threads=1024 -model=2080ti -thread_warp_size=32", [-1, 16, 64, 49152, 2147483647, 1024, 8, 32], "", 0, []], [[], [["CI", 3], ["CI", 2], ["SP", 1, 1, 128, [1], 1], ["AN", 1, 2, 6], ["FU", 5, [0, 1]], ["SP", 5, 0, 196608, [32], 1], ["AN", 5, 0, 5], ["AN", 5, 1, 6], ["SP", 4, 0, 1536, [32], 1], ["AN", 4, 0, 5], ["AN", 4, 1, 6], ["AN", 1, 0, 5], ["PR", 1, 0, "auto_unroll_max_step$64"], ["PR", 4, 0, "auto_unroll_max_step$16"]]]], "r": [[2.75856e-05], 0, 2.13157, 1680246275], "v": "v0.6"}
{"i": [["[\"4b5e216f8244b4e8f7b6543c4a9087e5\", [1536, 128], [1536, 128]]", "cuda -keys=cuda,gpu -arch=sm_75 -max_num_threads=1024 -model=2080ti -thread_warp_size=32", [-1, 16, 64, 49152, 2147483647, 1024, 8, 32], "", 0, []], [[], [["CI", 3], ["CI", 2], ["FU", 5, [0, 1]], ["SP", 5, 0, 196608, [32], 1], ["AN", 5, 0, 5], ["AN", 5, 1, 6], ["SP", 4, 0, 1536, [2], 1], ["AN", 4, 0, 5], ["AN", 4, 1, 6], ["SP", 1, 0, 1536, [32], 1], ["AN", 1, 0, 5], ["AN", 1, 1, 6], ["PR", 1, 0, "auto_unroll_max_step$0"], ["PR", 4, 0, "auto_unroll_max_step$64"]]]], "r": [[2.81988e-05], 0, 2.01966, 1680246276], "v": "v0.6"}
{"i": [["[\"4b5e216f8244b4e8f7b6543c4a9087e5\", [1536, 128], [1536, 128]]", "cuda -keys=cuda,gpu -arch=sm_75 -max_num_threads=1024 -model=2080ti -thread_warp_size=32", [-1, 16, 64, 49152, 2147483647, 1024, 8, 32], "", 0, []], [[], [["SP", 5, 1, 128, [2], 1], ["AN", 5, 2, 6], ["FSP", 4, 1, 0, 1], ["AN", 4, 2, 6], ["CA", 4, 5, 0], ["CI", 3], ["CI", 2], ["AN", 5, 0, 5], ["SP", 1, 0, 1536, [64], 1], ["AN", 1, 0, 5], ["AN", 1, 1, 6], ["PR", 1, 0, "auto_unroll_max_step$64"], ["PR", 4, 0, "auto_unroll_max_step$512"]]]], "r": [[4.95771e-05], 0, 4.02902, 1680246278], "v": "v0.6"}
{"i": [["[\"4b5e216f8244b4e8f7b6543c4a9087e5\", [1536, 128], [1536, 128]]", "cuda -keys=cuda,gpu -arch=sm_75 -max_num_threads=1024 -model=2080ti -thread_warp_size=32", [-1, 16, 64, 49152, 2147483647, 1024, 8, 32], "", 0, []], [[], [["SP", 5, 1, 128, [64], 1], ["AN", 5, 2, 6], ["FSP", 4, 1, 0, 1], ["AN", 4, 2, 6], ["CA", 4, 5, 0], ["CI", 3], ["CI", 2], ["AN", 5, 0, 5], ["SP", 1, 0, 1536, [8], 1], ["AN", 1, 0, 5], ["AN", 1, 1, 6], ["PR", 1, 0, "auto_unroll_max_step$1024"], ["PR", 4, 0, "auto_unroll_max_step$16"]]]], "r": [[1.14798e-05], 0, 1.98905, 1680246279], "v": "v0.6"}
{"i": [["[\"4b5e216f8244b4e8f7b6543c4a9087e5\", [1536, 128], [1536, 128]]", "cuda -keys=cuda,gpu -arch=sm_75 -max_num_threads=1024 -model=2080ti -thread_warp_size=32", [-1, 16, 64, 49152, 2147483647, 1024, 8, 32], "", 0, []], [[], [["SP", 5, 1, 128, [64], 1], ["AN", 5, 2, 6], ["FSP", 4, 1, 0, 1], ["AN", 4, 2, 6], ["CA", 4, 5, 0], ["CI", 3], ["CI", 2], ["AN", 5, 0, 5], ["SP", 1, 0, 1536, [64], 1], ["AN", 1, 0, 5], ["AN", 1, 1, 6], ["PR", 1, 0, "auto_unroll_max_step$512"], ["PR", 4, 0, "auto_unroll_max_step$0"]]]], "r": [[1.3291e-05], 0, 1.89427, 1680246280], "v": "v0.6"}
{"i": [["[\"4b5e216f8244b4e8f7b6543c4a9087e5\", [1536, 128], [1536, 128]]", "cuda -keys=cuda,gpu -arch=sm_75 -max_num_threads=1024 -model=2080ti -thread_warp_size=32", [-1, 16, 64, 49152, 2147483647, 1024, 8, 32], "", 0, []], [[], [["CI", 3], ["CI", 2], ["FU", 5, [0, 1]], ["SP", 5, 0, 196608, [32], 1], ["AN", 5, 0, 5], ["AN", 5, 1, 6], ["SP", 4, 0, 1536, [32], 1], ["AN", 4, 0, 5], ["AN", 4, 1, 6], ["SP", 1, 0, 1536, [64], 1], ["AN", 1, 0, 5], ["AN", 1, 1, 6], ["PR", 1, 0, "auto_unroll_max_step$0"], ["PR", 4, 0, "auto_unroll_max_step$16"]]]], "r": [[2.87722e-05], 0, 1.9652, 1680246281], "v": "v0.6"}
{"i": [["[\"4b5e216f8244b4e8f7b6543c4a9087e5\", [1536, 128], [1536, 128]]", "cuda -keys=cuda,gpu -arch=sm_75 -max_num_threads=1024 -model=2080ti -thread_warp_size=32", [-1, 16, 64, 49152, 2147483647, 1024, 8, 32], "", 0, []], [[], [["CI", 3], ["CI", 2], ["FU", 5, [0, 1]], ["SP", 5, 0, 196608, [2], 1], ["AN", 5, 0, 5], ["AN", 5, 1, 6], ["SP", 4, 0, 1536, [16], 1], ["AN", 4, 0, 5], ["AN", 4, 1, 6], ["SP", 1, 0, 1536, [64], 1], ["AN", 1, 0, 5], ["AN", 1, 1, 6], ["PR", 1, 0, "auto_unroll_max_step$512"], ["PR", 4, 0, "auto_unroll_max_step$64"]]]], "r": [[0.000103686], 0, 2.01859, 1680246283], "v": "v0.6"}
{"i": [["[\"4b5e216f8244b4e8f7b6543c4a9087e5\", [1536, 128], [1536, 128]]", "cuda -keys=cuda,gpu -arch=sm_75 -max_num_threads=1024 -model=2080ti -thread_warp_size=32", [-1, 16, 64, 49152, 2147483647, 1024, 8, 32], "", 0, []], [[], [["CI", 3], ["CI", 2], ["FU", 5, [0, 1]], ["SP", 5, 0, 196608, [64], 1], ["AN", 5, 0, 5], ["AN", 5, 1, 6], ["SP", 4, 0, 1536, [8], 1], ["AN", 4, 0, 5], ["AN", 4, 1, 6], ["SP", 1, 0, 1536, [8], 1], ["AN", 1, 0, 5], ["AN", 1, 1, 6], ["PR", 1, 0, "auto_unroll_max_step$1024"], ["PR", 4, 0, "auto_unroll_max_step$1024"]]]], "r": [[2.01487e-05], 0, 1.91793, 1680246284], "v": "v0.6"}
{"i": [["[\"4b5e216f8244b4e8f7b6543c4a9087e5\", [1536, 128], [1536, 128]]", "cuda -keys=cuda,gpu -arch=sm_75 -max_num_threads=1024 -model=2080ti -thread_warp_size=32", [-1, 16, 64, 49152, 2147483647, 1024, 8, 32], "", 0, []], [[], [["SP", 5, 1, 128, [64], 1], ["AN", 5, 2, 6], ["FSP", 4, 1, 0, 1], ["AN", 4, 2, 6], ["CA", 4, 5, 0], ["CI", 3], ["CI", 2], ["AN", 5, 0, 5], ["SP", 1, 0, 1536, [32], 1], ["AN", 1, 0, 5], ["AN", 1, 1, 6], ["PR", 1, 0, "auto_unroll_max_step$0"], ["PR", 4, 0, "auto_unroll_max_step$1024"]]]], "r": [[1.30553e-05], 0, 1.85814, 1680246285], "v": "v0.6"}
{"i": [["[\"4b5e216f8244b4e8f7b6543c4a9087e5\", [1536, 128], [1536, 128]]", "cuda -keys=cuda,gpu -arch=sm_75 -max_num_threads=1024 -model=2080ti -thread_warp_size=32", [-1, 16, 64, 49152, 2147483647, 1024, 8, 32], "", 0, []], [[], [["SP", 5, 1, 128, [64], 1], ["AN", 5, 2, 6], ["FSP", 4, 1, 0, 1], ["AN", 4, 2, 6], ["CA", 4, 5, 0], ["CI", 3], ["CI", 2], ["FSP", 1, 1, 0, 1], ["AN", 1, 2, 6], ["CA", 1, 5, 0], ["AN", 5, 0, 5], ["PR", 1, 0, "auto_unroll_max_step$1024"], ["PR", 4, 0, "auto_unroll_max_step$0"]]]], "r": [[6.11697e-06], 0, 1.93281, 1680246286], "v": "v0.6"}
{"i": [["[\"4b5e216f8244b4e8f7b6543c4a9087e5\", [1536, 128], [1536, 128]]", "cuda -keys=cuda,gpu -arch=sm_75 -max_num_threads=1024 -model=2080ti -thread_warp_size=32", [-1, 16, 64, 49152, 2147483647, 1024, 8, 32], "", 0, []], [[], [["CI", 3], ["CI", 2], ["SP", 1, 1, 128, [64], 1], ["AN", 1, 2, 6], ["FU", 5, [0, 1]], ["SP", 5, 0, 196608, [32], 1], ["AN", 5, 0, 5], ["AN", 5, 1, 6], ["SP", 4, 0, 1536, [32], 1], ["AN", 4, 0, 5], ["AN", 4, 1, 6], ["AN", 1, 0, 5], ["PR", 1, 0, "auto_unroll_max_step$1024"], ["PR", 4, 0, "auto_unroll_max_step$0"]]]], "r": [[2.41857e-05], 0, 1.91933, 1680246288], "v": "v0.6"}
{"i": [["[\"4b5e216f8244b4e8f7b6543c4a9087e5\", [1536, 128], [1536, 128]]", "cuda -keys=cuda,gpu -arch=sm_75 -max_num_threads=1024 -model=2080ti -thread_warp_size=32", [-1, 16, 64, 49152, 2147483647, 1024, 8, 32], "", 0, []], [[], [["CI", 3], ["CI", 2], ["FU", 5, [0, 1]], ["SP", 5, 0, 196608, [32], 1], ["AN", 5, 0, 5], ["AN", 5, 1, 6], ["SP", 4, 0, 1536, [32], 1], ["AN", 4, 0, 5], ["AN", 4, 1, 6], ["SP", 1, 0, 1536, [64], 1], ["AN", 1, 0, 5], ["AN", 1, 1, 6], ["PR", 1, 0, "auto_unroll_max_step$1024"], ["PR", 4, 0, "auto_unroll_max_step$0"]]]], "r": [[2.87653e-05], 0, 2.01999, 1680246289], "v": "v0.6"}
{"i": [["[\"4b5e216f8244b4e8f7b6543c4a9087e5\", [1536, 128], [1536, 128]]", "cuda -keys=cuda,gpu -arch=sm_75 -max_num_threads=1024 -model=2080ti -thread_warp_size=32", [-1, 16, 64, 49152, 2147483647, 1024, 8, 32], "", 0, []], [[], [["SP", 5, 1, 128, [4], 1], ["AN", 5, 2, 6], ["FSP", 4, 1, 0, 1], ["AN", 4, 2, 6], ["CA", 4, 5, 0], ["CI", 3], ["CI", 2], ["FSP", 1, 1, 0, 1], ["AN", 1, 2, 6], ["CA", 1, 5, 0], ["AN", 5, 0, 5], ["PR", 1, 0, "auto_unroll_max_step$64"], ["PR", 4, 0, "auto_unroll_max_step$16"]]]], "r": [[2.35602e-05], 0, 2.12501, 1680246290], "v": "v0.6"}
{"i": [["[\"4b5e216f8244b4e8f7b6543c4a9087e5\", [1536, 128], [1536, 128]]", "cuda -keys=cuda,gpu -arch=sm_75 -max_num_threads=1024 -model=2080ti -thread_warp_size=32", [-1, 16, 64, 49152, 2147483647, 1024, 8, 32], "", 0, []], [[], [["CI", 3], ["CI", 2], ["SP", 1, 1, 128, [32], 1], ["AN", 1, 2, 6], ["FU", 5, [0, 1]], ["SP", 5, 0, 196608, [32], 1], ["AN", 5, 0, 5], ["AN", 5, 1, 6], ["SP", 4, 0, 1536, [64], 1], ["AN", 4, 0, 5], ["AN", 4, 1, 6], ["AN", 1, 0, 5], ["PR", 1, 0, "auto_unroll_max_step$16"], ["PR", 4, 0, "auto_unroll_max_step$1024"]]]], "r": [[2.17698e-05], 0, 1.96523, 1680246292], "v": "v0.6"}
{"i": [["[\"4b5e216f8244b4e8f7b6543c4a9087e5\", [1536, 128], [1536, 128]]", "cuda -keys=cuda,gpu -arch=sm_75 -max_num_threads=1024 -model=2080ti -thread_warp_size=32", [-1, 16, 64, 49152, 2147483647, 1024, 8, 32], "", 0, []], [[], [["CI", 3], ["CI", 2], ["FU", 5, [0, 1]], ["SP", 5, 0, 196608, [32], 1], ["AN", 5, 0, 5], ["AN", 5, 1, 6], ["SP", 4, 0, 1536, [1], 1], ["AN", 4, 0, 5], ["AN", 4, 1, 6], ["SP", 1, 0, 1536, [32], 1], ["AN", 1, 0, 5], ["AN", 1, 1, 6], ["PR", 1, 0, "auto_unroll_max_step$512"], ["PR", 4, 0, "auto_unroll_max_step$1024"]]]], "r": [[3.63033e-05], 0, 1.93401, 1680246293], "v": "v0.6"}
{"i": [["[\"4b5e216f8244b4e8f7b6543c4a9087e5\", [1536, 128], [1536, 128]]", "cuda -keys=cuda,gpu -arch=sm_75 -max_num_threads=1024 -model=2080ti -thread_warp_size=32", [-1, 16, 64, 49152, 2147483647, 1024, 8, 32], "", 0, []], [[], [["SP", 5, 1, 128, [32], 1], ["AN", 5, 2, 6], ["FSP", 4, 1, 0, 1], ["AN", 4, 2, 6], ["CA", 4, 5, 0], ["CI", 3], ["CI", 2], ["AN", 5, 0, 5], ["SP", 1, 0, 1536, [4], 1], ["AN", 1, 0, 5], ["AN", 1, 1, 6], ["PR", 1, 0, "auto_unroll_max_step$512"], ["PR", 4, 0, "auto_unroll_max_step$0"]]]], "r": [[1.23793e-05], 0, 1.87793, 1680246294], "v": "v0.6"}
{"i": [["[\"4b5e216f8244b4e8f7b6543c4a9087e5\", [1536, 128], [1536, 128]]", "cuda -keys=cuda,gpu -arch=sm_75 -max_num_threads=1024 -model=2080ti -thread_warp_size=32", [-1, 16, 64, 49152, 2147483647, 1024, 8, 32], "", 0, []], [[], [["SP", 5, 1, 128, [1], 1], ["AN", 5, 2, 6], ["FSP", 4, 1, 0, 1], ["AN", 4, 2, 6], ["CA", 4, 5, 0], ["CI", 3], ["CI", 2], ["FSP", 1, 1, 0, 1], ["AN", 1, 2, 6], ["CA", 1, 5, 0], ["AN", 5, 0, 5], ["PR", 1, 0, "auto_unroll_max_step$16"], ["PR", 4, 0, "auto_unroll_max_step$512"]]]], "r": [[8.35159e-05], 0, 4.84425, 1680246296], "v": "v0.6"}
{"i": [["[\"4b5e216f8244b4e8f7b6543c4a9087e5\", [1536, 128], [1536, 128]]", "cuda -keys=cuda,gpu -arch=sm_75 -max_num_threads=1024 -model=2080ti -thread_warp_size=32", [-1, 16, 64, 49152, 2147483647, 1024, 8, 32], "", 0, []], [[], [["CI", 3], ["CI", 2], ["FU", 5, [0, 1]], ["SP", 5, 0, 196608, [64], 1], ["AN", 5, 0, 5], ["AN", 5, 1, 6], ["SP", 4, 0, 1536, [32], 1], ["AN", 4, 0, 5], ["AN", 4, 1, 6], ["SP", 1, 0, 1536, [64], 1], ["AN", 1, 0, 5], ["AN", 1, 1, 6], ["PR", 1, 0, "auto_unroll_max_step$512"], ["PR", 4, 0, "auto_unroll_max_step$1024"]]]], "r": [[2.60598e-05], 0, 1.952, 1680246297], "v": "v0.6"}
{"i": [["[\"4b5e216f8244b4e8f7b6543c4a9087e5\", [1536, 128], [1536, 128]]", "cuda -keys=cuda,gpu -arch=sm_75 -max_num_threads=1024 -model=2080ti -thread_warp_size=32", [-1, 16, 64, 49152, 2147483647, 1024, 8, 32], "", 0, []], [[], [["CI", 3], ["CI", 2], ["SP", 1, 1, 128, [32], 1], ["AN", 1, 2, 6], ["FU", 5, [0, 1]], ["SP", 5, 0, 196608, [16], 1], ["AN", 5, 0, 5], ["AN", 5, 1, 6], ["SP", 4, 0, 1536, [64], 1], ["AN", 4, 0, 5], ["AN", 4, 1, 6], ["AN", 1, 0, 5], ["PR", 1, 0, "auto_unroll_max_step$16"], ["PR", 4, 0, "auto_unroll_max_step$16"]]]], "r": [[2.70795e-05], 0, 2.03014, 1680246298], "v": "v0.6"}
{"i": [["[\"4b5e216f8244b4e8f7b6543c4a9087e5\", [1536, 128], [1536, 128]]", "cuda -keys=cuda,gpu -arch=sm_75 -max_num_threads=1024 -model=2080ti -thread_warp_size=32", [-1, 16, 64, 49152, 2147483647, 1024, 8, 32], "", 0, []], [[], [["CI", 3], ["CI", 2], ["FU", 5, [0, 1]], ["SP", 5, 0, 196608, [64], 1], ["AN", 5, 0, 5], ["AN", 5, 1, 6], ["SP", 4, 0, 1536, [2], 1], ["AN", 4, 0, 5], ["AN", 4, 1, 6], ["SP", 1, 0, 1536, [2], 1], ["AN", 1, 0, 5], ["AN", 1, 1, 6], ["PR", 1, 0, "auto_unroll_max_step$1024"], ["PR", 4, 0, "auto_unroll_max_step$1024"]]]], "r": [[2.38655e-05], 0, 1.98892, 1680246300], "v": "v0.6"}
{"i": [["[\"4b5e216f8244b4e8f7b6543c4a9087e5\", [1536, 128], [1536, 128]]", "cuda -keys=cuda,gpu -arch=sm_75 -max_num_threads=1024 -model=2080ti -thread_warp_size=32", [-1, 16, 64, 49152, 2147483647, 1024, 8, 32], "", 0, []], [[], [["CI", 3], ["CI", 2], ["FU", 5, [0, 1]], ["SP", 5, 0, 196608, [3], 1], ["AN", 5, 0, 5], ["AN", 5, 1, 6], ["SP", 4, 0, 1536, [32], 1], ["AN", 4, 0, 5], ["AN", 4, 1, 6], ["SP", 1, 0, 1536, [32], 1], ["AN", 1, 0, 5], ["AN", 1, 1, 6], ["PR", 1, 0, "auto_unroll_max_step$0"], ["PR", 4, 0, "auto_unroll_max_step$0"]]]], "r": [[7.89606e-05], 0, 2.17047, 1680246301], "v": "v0.6"}
{"i": [["[\"4b5e216f8244b4e8f7b6543c4a9087e5\", [1536, 128], [1536, 128]]", "cuda -keys=cuda,gpu -arch=sm_75 -max_num_threads=1024 -model=2080ti -thread_warp_size=32", [-1, 16, 64, 49152, 2147483647, 1024, 8, 32], "", 0, []], [[], [["SP", 5, 1, 128, [2], 1], ["AN", 5, 2, 6], ["FSP", 4, 1, 0, 1], ["AN", 4, 2, 6], ["CA", 4, 5, 0], ["CI", 3], ["CI", 2], ["FSP", 1, 1, 0, 1], ["AN", 1, 2, 6], ["CA", 1, 5, 0], ["AN", 5, 0, 5], ["PR", 1, 0, "auto_unroll_max_step$1024"], ["PR", 4, 0, "auto_unroll_max_step$64"]]]], "r": [[4.39215e-05], 0, 3.99733, 1680246303], "v": "v0.6"}
{"i": [["[\"4b5e216f8244b4e8f7b6543c4a9087e5\", [1536, 128], [1536, 128]]", "cuda -keys=cuda,gpu -arch=sm_75 -max_num_threads=1024 -model=2080ti -thread_warp_size=32", [-1, 16, 64, 49152, 2147483647, 1024, 8, 32], "", 0, []], [[], [["CI", 3], ["CI", 2], ["FU", 5, [0, 1]], ["SP", 5, 0, 196608, [4], 1], ["AN", 5, 0, 5], ["AN", 5, 1, 6], ["SP", 4, 0, 1536, [32], 1], ["AN", 4, 0, 5], ["AN", 4, 1, 6], ["SP", 1, 0, 1536, [64], 1], ["AN", 1, 0, 5], ["AN", 1, 1, 6], ["PR", 1, 0, "auto_unroll_max_step$64"], ["PR", 4, 0, "auto_unroll_max_step$1024"]]]], "r": [[6.52368e-05], 0, 2.02229, 1680246304], "v": "v0.6"}
{"i": [["[\"4b5e216f8244b4e8f7b6543c4a9087e5\", [1536, 128], [1536, 128]]", "cuda -keys=cuda,gpu -arch=sm_75 -max_num_threads=1024 -model=2080ti -thread_warp_size=32", [-1, 16, 64, 49152, 2147483647, 1024, 8, 32], "", 0, []], [[], [["SP", 5, 1, 128, [8], 1], ["AN", 5, 2, 6], ["FSP", 4, 1, 0, 1], ["AN", 4, 2, 6], ["CA", 4, 5, 0], ["CI", 3], ["CI", 2], ["FSP", 1, 1, 0, 1], ["AN", 1, 2, 6], ["CA", 1, 5, 0], ["AN", 5, 0, 5], ["PR", 1, 0, "auto_unroll_max_step$512"], ["PR", 4, 0, "auto_unroll_max_step$512"]]]], "r": [[1.27781e-05], 0, 2.37543, 1680246305], "v": "v0.6"}
{"i": [["[\"4b5e216f8244b4e8f7b6543c4a9087e5\", [1536, 128], [1536, 128]]", "cuda -keys=cuda,gpu -arch=sm_75 -max_num_threads=1024 -model=2080ti -thread_warp_size=32", [-1, 16, 64, 49152, 2147483647, 1024, 8, 32], "", 0, []], [[], [["SP", 5, 1, 128, [8], 1], ["AN", 5, 2, 6], ["FSP", 4, 1, 0, 1], ["AN", 4, 2, 6], ["CA", 4, 5, 0], ["CI", 3], ["CI", 2], ["FSP", 1, 1, 0, 1], ["AN", 1, 2, 6], ["CA", 1, 5, 0], ["AN", 5, 0, 5], ["PR", 1, 0, "auto_unroll_max_step$1024"], ["PR", 4, 0, "auto_unroll_max_step$64"]]]], "r": [[1.27808e-05], 0, 2.39563, 1680246306], "v": "v0.6"}
{"i": [["[\"4b5e216f8244b4e8f7b6543c4a9087e5\", [1536, 128], [1536, 128]]", "cuda -keys=cuda,gpu -arch=sm_75 -max_num_threads=1024 -model=2080ti -thread_warp_size=32", [-1, 16, 64, 49152, 2147483647, 1024, 8, 32], "", 0, []], [[], [["SP", 5, 1, 128, [32], 1], ["AN", 5, 2, 6], ["FSP", 4, 1, 0, 1], ["AN", 4, 2, 6], ["CA", 4, 5, 0], ["CI", 3], ["CI", 2], ["AN", 5, 0, 5], ["SP", 1, 0, 1536, [16], 1], ["AN", 1, 0, 5], ["AN", 1, 1, 6], ["PR", 1, 0, "auto_unroll_max_step$64"], ["PR", 4, 0, "auto_unroll_max_step$1024"]]]], "r": [[1.24351e-05], 0, 1.952, 1680246308], "v": "v0.6"}
{"i": [["[\"4b5e216f8244b4e8f7b6543c4a9087e5\", [1536, 128], [1536, 128]]", "cuda -keys=cuda,gpu -arch=sm_75 -max_num_threads=1024 -model=2080ti -thread_warp_size=32", [-1, 16, 64, 49152, 2147483647, 1024, 8, 32], "", 0, []], [[], [["SP", 5, 1, 128, [64], 1], ["AN", 5, 2, 6], ["FSP", 4, 1, 0, 1], ["AN", 4, 2, 6], ["CA", 4, 5, 0], ["CI", 3], ["CI", 2], ["FSP", 1, 1, 0, 1], ["AN", 1, 2, 6], ["CA", 1, 5, 0], ["AN", 5, 0, 5], ["PR", 1, 0, "auto_unroll_max_step$0"], ["PR", 4, 0, "auto_unroll_max_step$16"]]]], "r": [[6.12028e-06], 0, 1.78028, 1680246309], "v": "v0.6"}
{"i": [["[\"4b5e216f8244b4e8f7b6543c4a9087e5\", [1536, 128], [1536, 128]]", "cuda -keys=cuda,gpu -arch=sm_75 -max_num_threads=1024 -model=2080ti -thread_warp_size=32", [-1, 16, 64, 49152, 2147483647, 1024, 8, 32], "", 0, []], [[], [["CI", 3], ["CI", 2], ["FU", 5, [0, 1]], ["SP", 5, 0, 196608, [48], 1], ["AN", 5, 0, 5], ["AN", 5, 1, 6], ["SP", 4, 0, 1536, [32], 1], ["AN", 4, 0, 5], ["AN", 4, 1, 6], ["SP", 1, 0, 1536, [2], 1], ["AN", 1, 0, 5], ["AN", 1, 1, 6], ["PR", 1, 0, "auto_unroll_max_step$16"], ["PR", 4, 0, "auto_unroll_max_step$64"]]]], "r": [[2.49416e-05], 0, 2.07525, 1680246310], "v": "v0.6"}
{"i": [["[\"4b5e216f8244b4e8f7b6543c4a9087e5\", [1536, 128], [1536, 128]]", "cuda -keys=cuda,gpu -arch=sm_75 -max_num_threads=1024 -model=2080ti -thread_warp_size=32", [-1, 16, 64, 49152, 2147483647, 1024, 8, 32], "", 0, []], [[], [["SP", 5, 1, 128, [16], 1], ["AN", 5, 2, 6], ["FSP", 4, 1, 0, 1], ["AN", 4, 2, 6], ["CA", 4, 5, 0], ["CI", 3], ["CI", 2], ["FSP", 1, 1, 0, 1], ["AN", 1, 2, 6], ["CA", 1, 5, 0], ["AN", 5, 0, 5], ["PR", 1, 0, "auto_unroll_max_step$16"], ["PR", 4, 0, "auto_unroll_max_step$0"]]]], "r": [[8.32226e-06], 0, 1.89963, 1680246311], "v": "v0.6"}
{"i": [["[\"4b5e216f8244b4e8f7b6543c4a9087e5\", [1536, 128], [1536, 128]]", "cuda -keys=cuda,gpu -arch=sm_75 -max_num_threads=1024 -model=2080ti -thread_warp_size=32", [-1, 16, 64, 49152, 2147483647, 1024, 8, 32], "", 0, []], [[], [["SP", 5, 1, 128, [1], 1], ["AN", 5, 2, 6], ["FSP", 4, 1, 0, 1], ["AN", 4, 2, 6], ["CA", 4, 5, 0], ["CI", 3], ["CI", 2], ["FSP", 1, 1, 0, 1], ["AN", 1, 2, 6], ["CA", 1, 5, 0], ["AN", 5, 0, 5], ["PR", 1, 0, "auto_unroll_max_step$512"], ["PR", 4, 0, "auto_unroll_max_step$512"]]]], "r": [[8.35178e-05], 0, 5.05522, 1680246313], "v": "v0.6"}
{"i": [["[\"4b5e216f8244b4e8f7b6543c4a9087e5\", [1536, 128], [1536, 128]]", "cuda -keys=cuda,gpu -arch=sm_75 -max_num_threads=1024 -model=2080ti -thread_warp_size=32", [-1, 16, 64, 49152, 2147483647, 1024, 8, 32], "", 0, []], [[], [["CI", 3], ["CI", 2], ["FU", 5, [0, 1]], ["SP", 5, 0, 196608, [32], 1], ["AN", 5, 0, 5], ["AN", 5, 1, 6], ["SP", 4, 0, 1536, [32], 1], ["AN", 4, 0, 5], ["AN", 4, 1, 6], ["SP", 1, 0, 1536, [8], 1], ["AN", 1, 0, 5], ["AN", 1, 1, 6], ["PR", 1, 0, "auto_unroll_max_step$512"], ["PR", 4, 0, "auto_unroll_max_step$0"]]]], "r": [[2.69266e-05], 0, 1.81549, 1680246314], "v": "v0.6"}
{"i": [["[\"4b5e216f8244b4e8f7b6543c4a9087e5\", [1536, 128], [1536, 128]]", "cuda -keys=cuda,gpu -arch=sm_75 -max_num_threads=1024 -model=2080ti -thread_warp_size=32", [-1, 16, 64, 49152, 2147483647, 1024, 8, 32], "", 0, []], [[], [["CI", 3], ["CI", 2], ["SP", 1, 1, 128, [32], 1], ["AN", 1, 2, 6], ["FU", 5, [0, 1]], ["SP", 5, 0, 196608, [32], 1], ["AN", 5, 0, 5], ["AN", 5, 1, 6], ["SP", 4, 0, 1536, [32], 1], ["AN", 4, 0, 5], ["AN", 4, 1, 6], ["AN", 1, 0, 5], ["PR", 1, 0, "auto_unroll_max_step$0"], ["PR", 4, 0, "auto_unroll_max_step$16"]]]], "r": [[2.36943e-05], 0, 1.83384, 1680246315], "v": "v0.6"}
{"i": [["[\"4b5e216f8244b4e8f7b6543c4a9087e5\", [1536, 128], [1536, 128]]", "cuda -keys=cuda,gpu -arch=sm_75 -max_num_threads=1024 -model=2080ti -thread_warp_size=32", [-1, 16, 64, 49152, 2147483647, 1024, 8, 32], "", 0, []], [[], [["SP", 5, 1, 128, [1], 1], ["AN", 5, 2, 6], ["FSP", 4, 1, 0, 1], ["AN", 4, 2, 6], ["CA", 4, 5, 0], ["CI", 3], ["CI", 2], ["FSP", 1, 1, 0, 1], ["AN", 1, 2, 6], ["CA", 1, 5, 0], ["AN", 5, 0, 5], ["PR", 1, 0, "auto_unroll_max_step$0"], ["PR", 4, 0, "auto_unroll_max_step$512"]]]], "r": [[8.35176e-05], 0, 5.01505, 1680246317], "v": "v0.6"}
{"i": [["[\"4b5e216f8244b4e8f7b6543c4a9087e5\", [1536, 128], [1536, 128]]", "cuda -keys=cuda,gpu -arch=sm_75 -max_num_threads=1024 -model=2080ti -thread_warp_size=32", [-1, 16, 64, 49152, 2147483647, 1024, 8, 32], "", 0, []], [[], [["CI", 3], ["CI", 2], ["FU", 5, [0, 1]], ["SP", 5, 0, 196608, [64], 1], ["AN", 5, 0, 5], ["AN", 5, 1, 6], ["SP", 4, 0, 1536, [32], 1], ["AN", 4, 0, 5], ["AN", 4, 1, 6], ["SP", 1, 0, 1536, [32], 1], ["AN", 1, 0, 5], ["AN", 1, 1, 6], ["PR", 1, 0, "auto_unroll_max_step$512"], ["PR", 4, 0, "auto_unroll_max_step$512"]]]], "r": [[2.57121e-05], 0, 1.9793, 1680246318], "v": "v0.6"}
{"i": [["[\"4b5e216f8244b4e8f7b6543c4a9087e5\", [1536, 128], [1536, 128]]", "cuda -keys=cuda,gpu -arch=sm_75 -max_num_threads=1024 -model=2080ti -thread_warp_size=32", [-1, 16, 64, 49152, 2147483647, 1024, 8, 32], "", 0, []], [[], [["CI", 3], ["CI", 2], ["SP", 1, 1, 128, [32], 1], ["AN", 1, 2, 6], ["FU", 5, [0, 1]], ["SP", 5, 0, 196608, [2], 1], ["AN", 5, 0, 5], ["AN", 5, 1, 6], ["SP", 4, 0, 1536, [32], 1], ["AN", 4, 0, 5], ["AN", 4, 1, 6], ["AN", 1, 0, 5], ["PR", 1, 0, "auto_unroll_max_step$16"], ["PR", 4, 0, "auto_unroll_max_step$16"]]]], "r": [[0.000101729], 0, 1.90867, 1680246320], "v": "v0.6"}
{"i": [["[\"4b5e216f8244b4e8f7b6543c4a9087e5\", [1536, 128], [1536, 128]]", "cuda -keys=cuda,gpu -arch=sm_75 -max_num_threads=1024 -model=2080ti -thread_warp_size=32", [-1, 16, 64, 49152, 2147483647, 1024, 8, 32], "", 0, []], [[], [["CI", 3], ["CI", 2], ["FU", 5, [0, 1]], ["SP", 5, 0, 196608, [32], 1], ["AN", 5, 0, 5], ["AN", 5, 1, 6], ["SP", 4, 0, 1536, [32], 1], ["AN", 4, 0, 5], ["AN", 4, 1, 6], ["SP", 1, 0, 1536, [4], 1], ["AN", 1, 0, 5], ["AN", 1, 1, 6], ["PR", 1, 0, "auto_unroll_max_step$512"], ["PR", 4, 0, "auto_unroll_max_step$1024"]]]], "r": [[2.6917e-05], 0, 1.99717, 1680246321], "v": "v0.6"}
{"i": [["[\"4b5e216f8244b4e8f7b6543c4a9087e5\", [1536, 128], [1536, 128]]", "cuda -keys=cuda,gpu -arch=sm_75 -max_num_threads=1024 -model=2080ti -thread_warp_size=32", [-1, 16, 64, 49152, 2147483647, 1024, 8, 32], "", 0, []], [[], [["CI", 3], ["CI", 2], ["SP", 1, 1, 128, [32], 1], ["AN", 1, 2, 6], ["FU", 5, [0, 1]], ["SP", 5, 0, 196608, [32], 1], ["AN", 5, 0, 5], ["AN", 5, 1, 6], ["SP", 4, 0, 1536, [16], 1], ["AN", 4, 0, 5], ["AN", 4, 1, 6], ["AN", 1, 0, 5], ["PR", 1, 0, "auto_unroll_max_step$16"], ["PR", 4, 0, "auto_unroll_max_step$0"]]]], "r": [[2.05571e-05], 0, 1.76643, 1680246322], "v": "v0.6"}
{"i": [["[\"4b5e216f8244b4e8f7b6543c4a9087e5\", [1536, 128], [1536, 128]]", "cuda -keys=cuda,gpu -arch=sm_75 -max_num_threads=1024 -model=2080ti -thread_warp_size=32", [-1, 16, 64, 49152, 2147483647, 1024, 8, 32], "", 0, []], [[], [["CI", 3], ["CI", 2], ["SP", 1, 1, 128, [4], 1], ["AN", 1, 2, 6], ["FU", 5, [0, 1]], ["SP", 5, 0, 196608, [8], 1], ["AN", 5, 0, 5], ["AN", 5, 1, 6], ["SP", 4, 0, 1536, [32], 1], ["AN", 4, 0, 5], ["AN", 4, 1, 6], ["AN", 1, 0, 5], ["PR", 1, 0, "auto_unroll_max_step$0"], ["PR", 4, 0, "auto_unroll_max_step$64"]]]], "r": [[3.97526e-05], 0, 1.92251, 1680246324], "v": "v0.6"}
{"i": [["[\"4b5e216f8244b4e8f7b6543c4a9087e5\", [1536, 128], [1536, 128]]", "cuda -keys=cuda,gpu -arch=sm_75 -max_num_threads=1024 -model=2080ti -thread_warp_size=32", [-1, 16, 64, 49152, 2147483647, 1024, 8, 32], "", 0, []], [[], [["CI", 3], ["CI", 2], ["SP", 1, 1, 128, [64], 1], ["AN", 1, 2, 6], ["FU", 5, [0, 1]], ["SP", 5, 0, 196608, [32], 1], ["AN", 5, 0, 5], ["AN", 5, 1, 6], ["SP", 4, 0, 1536, [64], 1], ["AN", 4, 0, 5], ["AN", 4, 1, 6], ["AN", 1, 0, 5], ["PR", 1, 0, "auto_unroll_max_step$16"], ["PR", 4, 0, "auto_unroll_max_step$0"]]]], "r": [[2.22641e-05], 0, 1.78544, 1680246325], "v": "v0.6"}
{"i": [["[\"4b5e216f8244b4e8f7b6543c4a9087e5\", [1536, 128], [1536, 128]]", "cuda -keys=cuda,gpu -arch=sm_75 -max_num_threads=1024 -model=2080ti -thread_warp_size=32", [-1, 16, 64, 49152, 2147483647, 1024, 8, 32], "", 0, []], [[], [["CI", 3], ["CI", 2], ["SP", 1, 1, 128, [32], 1], ["AN", 1, 2, 6], ["FU", 5, [0, 1]], ["SP", 5, 0, 196608, [32], 1], ["AN", 5, 0, 5], ["AN", 5, 1, 6], ["SP", 4, 0, 1536, [64], 1], ["AN", 4, 0, 5], ["AN", 4, 1, 6], ["AN", 1, 0, 5], ["PR", 1, 0, "auto_unroll_max_step$512"], ["PR", 4, 0, "auto_unroll_max_step$64"]]]], "r": [[2.1778e-05], 0, 1.99244, 1680246326], "v": "v0.6"}
{"i": [["[\"4b5e216f8244b4e8f7b6543c4a9087e5\", [1536, 128], [1536, 128]]", "cuda -keys=cuda,gpu -arch=sm_75 -max_num_threads=1024 -model=2080ti -thread_warp_size=32", [-1, 16, 64, 49152, 2147483647, 1024, 8, 32], "", 0, []], [[], [["SP", 5, 1, 128, [1], 1], ["AN", 5, 2, 6], ["FSP", 4, 1, 0, 1], ["AN", 4, 2, 6], ["CA", 4, 5, 0], ["CI", 3], ["CI", 2], ["FSP", 1, 1, 0, 1], ["AN", 1, 2, 6], ["CA", 1, 5, 0], ["AN", 5, 0, 5], ["PR", 1, 0, "auto_unroll_max_step$512"], ["PR", 4, 0, "auto_unroll_max_step$16"]]]], "r": [[7.85314e-05], 0, 2.17767, 1680246328], "v": "v0.6"}
{"i": [["[\"4b5e216f8244b4e8f7b6543c4a9087e5\", [1536, 128], [1536, 128]]", "cuda -keys=cuda,gpu -arch=sm_75 -max_num_threads=1024 -model=2080ti -thread_warp_size=32", [-1, 16, 64, 49152, 2147483647, 1024, 8, 32], "", 0, []], [[], [["SP", 5, 1, 128, [64], 1], ["AN", 5, 2, 6], ["FSP", 4, 1, 0, 1], ["AN", 4, 2, 6], ["CA", 4, 5, 0], ["CI", 3], ["CI", 2], ["AN", 5, 0, 5], ["SP", 1, 0, 1536, [32], 1], ["AN", 1, 0, 5], ["AN", 1, 1, 6], ["PR", 1, 0, "auto_unroll_max_step$16"], ["PR", 4, 0, "auto_unroll_max_step$64"]]]], "r": [[1.30633e-05], 0, 1.65656, 1680246329], "v": "v0.6"}
{"i": [["[\"4b5e216f8244b4e8f7b6543c4a9087e5\", [1536, 128], [1536, 128]]", "cuda -keys=cuda,gpu -arch=sm_75 -max_num_threads=1024 -model=2080ti -thread_warp_size=32", [-1, 16, 64, 49152, 2147483647, 1024, 8, 32], "", 0, []], [[], [["CI", 3], ["CI", 2], ["SP", 1, 1, 128, [64], 1], ["AN", 1, 2, 6], ["FU", 5, [0, 1]], ["SP", 5, 0, 196608, [2], 1], ["AN", 5, 0, 5], ["AN", 5, 1, 6], ["SP", 4, 0, 1536, [32], 1], ["AN", 4, 0, 5], ["AN", 4, 1, 6], ["AN", 1, 0, 5], ["PR", 1, 0, "auto_unroll_max_step$1024"], ["PR", 4, 0, "auto_unroll_max_step$16"]]]], "r": [[0.000102207], 0, 1.86826, 1680246330], "v": "v0.6"}
{"i": [["[\"4b5e216f8244b4e8f7b6543c4a9087e5\", [1536, 128], [1536, 128]]", "cuda -keys=cuda,gpu -arch=sm_75 -max_num_threads=1024 -model=2080ti -thread_warp_size=32", [-1, 16, 64, 49152, 2147483647, 1024, 8, 32], "", 0, []], [[], [["CI", 3], ["CI", 2], ["SP", 1, 1, 128, [1], 1], ["AN", 1, 2, 6], ["FU", 5, [0, 1]], ["SP", 5, 0, 196608, [64], 1], ["AN", 5, 0, 5], ["AN", 5, 1, 6], ["SP", 4, 0, 1536, [32], 1], ["AN", 4, 0, 5], ["AN", 4, 1, 6], ["AN", 1, 0, 5], ["PR", 1, 0, "auto_unroll_max_step$64"], ["PR", 4, 0, "auto_unroll_max_step$16"]]]], "r": [[2.48845e-05], 0, 1.96874, 1680246332], "v": "v0.6"}
{"i": [["[\"4b5e216f8244b4e8f7b6543c4a9087e5\", [1536, 128], [1536, 128]]", "cuda -keys=cuda,gpu -arch=sm_75 -max_num_threads=1024 -model=2080ti -thread_warp_size=32", [-1, 16, 64, 49152, 2147483647, 1024, 8, 32], "", 0, []], [[], [["CI", 3], ["CI", 2], ["SP", 1, 1, 128, [32], 1], ["AN", 1, 2, 6], ["FU", 5, [0, 1]], ["SP", 5, 0, 196608, [4], 1], ["AN", 5, 0, 5], ["AN", 5, 1, 6], ["SP", 4, 0, 1536, [32], 1], ["AN", 4, 0, 5], ["AN", 4, 1, 6], ["AN", 1, 0, 5], ["PR", 1, 0, "auto_unroll_max_step$512"], ["PR", 4, 0, "auto_unroll_max_step$64"]]]], "r": [[6.01893e-05], 0, 1.77253, 1680246333], "v": "v0.6"}
{"i": [["[\"4b5e216f8244b4e8f7b6543c4a9087e5\", [1536, 128], [1536, 128]]", "cuda -keys=cuda,gpu -arch=sm_75 -max_num_threads=1024 -model=2080ti -thread_warp_size=32", [-1, 16, 64, 49152, 2147483647, 1024, 8, 32], "", 0, []], [[], [["SP", 5, 1, 128, [32], 1], ["AN", 5, 2, 6], ["FSP", 4, 1, 0, 1], ["AN", 4, 2, 6], ["CA", 4, 5, 0], ["CI", 3], ["CI", 2], ["FSP", 1, 1, 0, 1], ["AN", 1, 2, 6], ["CA", 1, 5, 0], ["AN", 5, 0, 5], ["PR", 1, 0, "auto_unroll_max_step$1024"], ["PR", 4, 0, "auto_unroll_max_step$1024"]]]], "r": [[5.9567e-06], 0, 1.8235, 1680246334], "v": "v0.6"}
{"i": [["[\"4b5e216f8244b4e8f7b6543c4a9087e5\", [1536, 128], [1536, 128]]", "cuda -keys=cuda,gpu -arch=sm_75 -max_num_threads=1024 -model=2080ti -thread_warp_size=32", [-1, 16, 64, 49152, 2147483647, 1024, 8, 32], "", 0, []], [[], [["CI", 3], ["CI", 2], ["FU", 5, [0, 1]], ["SP", 5, 0, 196608, [64], 1], ["AN", 5, 0, 5], ["AN", 5, 1, 6], ["SP", 4, 0, 1536, [16], 1], ["AN", 4, 0, 5], ["AN", 4, 1, 6], ["SP", 1, 0, 1536, [12], 1], ["AN", 1, 0, 5], ["AN", 1, 1, 6], ["PR", 1, 0, "auto_unroll_max_step$0"], ["PR", 4, 0, "auto_unroll_max_step$16"]]]], "r": [[2.10925e-05], 0, 1.88226, 1680246335], "v": "v0.6"}
{"i": [["[\"4b5e216f8244b4e8f7b6543c4a9087e5\", [1536, 128], [1536, 128]]", "cuda -keys=cuda,gpu -arch=sm_75 -max_num_threads=1024 -model=2080ti -thread_warp_size=32", [-1, 16, 64, 49152, 2147483647, 1024, 8, 32], "", 0, []], [[], [["CI", 3], ["CI", 2], ["FU", 5, [0, 1]], ["SP", 5, 0, 196608, [4], 1], ["AN", 5, 0, 5], ["AN", 5, 1, 6], ["SP", 4, 0, 1536, [64], 1], ["AN", 4, 0, 5], ["AN", 4, 1, 6], ["SP", 1, 0, 1536, [32], 1], ["AN", 1, 0, 5], ["AN", 1, 1, 6], ["PR", 1, 0, "auto_unroll_max_step$16"], ["PR", 4, 0, "auto_unroll_max_step$64"]]]], "r": [[6.30859e-05], 0, 1.76404, 1680246337], "v": "v0.6"}
{"i": [["[\"4b5e216f8244b4e8f7b6543c4a9087e5\", [1536, 128], [1536, 128]]", "cuda -keys=cuda,gpu -arch=sm_75 -max_num_threads=1024 -model=2080ti -thread_warp_size=32", [-1, 16, 64, 49152, 2147483647, 1024, 8, 32], "", 0, []], [[], [["SP", 5, 1, 128, [32], 1], ["AN", 5, 2, 6], ["FSP", 4, 1, 0, 1], ["AN", 4, 2, 6], ["CA", 4, 5, 0], ["CI", 3], ["CI", 2], ["AN", 5, 0, 5], ["SP", 1, 0, 1536, [8], 1], ["AN", 1, 0, 5], ["AN", 1, 1, 6], ["PR", 1, 0, "auto_unroll_max_step$16"], ["PR", 4, 0, "auto_unroll_max_step$64"]]]], "r": [[1.23929e-05], 0, 1.86903, 1680246338], "v": "v0.6"}
{"i": [["[\"4b5e216f8244b4e8f7b6543c4a9087e5\", [1536, 128], [1536, 128]]", "cuda -keys=cuda,gpu -arch=sm_75 -max_num_threads=1024 -model=2080ti -thread_warp_size=32", [-1, 16, 64, 49152, 2147483647, 1024, 8, 32], "", 0, []], [[], [["SP", 5, 1, 128, [32], 1], ["AN", 5, 2, 6], ["FSP", 4, 1, 0, 1], ["AN", 4, 2, 6], ["CA", 4, 5, 0], ["CI", 3], ["CI", 2], ["AN", 5, 0, 5], ["SP", 1, 0, 1536, [32], 1], ["AN", 1, 0, 5], ["AN", 1, 1, 6], ["PR", 1, 0, "auto_unroll_max_step$16"], ["PR", 4, 0, "auto_unroll_max_step$512"]]]], "r": [[1.39744e-05], 0, 1.83944, 1680246339], "v": "v0.6"}
{"i": [["[\"4b5e216f8244b4e8f7b6543c4a9087e5\", [1536, 128], [1536, 128]]", "cuda -keys=cuda,gpu -arch=sm_75 -max_num_threads=1024 -model=2080ti -thread_warp_size=32", [-1, 16, 64, 49152, 2147483647, 1024, 8, 32], "", 0, []], [[], [["CI", 3], ["CI", 2], ["SP", 1, 1, 128, [32], 1], ["AN", 1, 2, 6], ["FU", 5, [0, 1]], ["SP", 5, 0, 196608, [32], 1], ["AN", 5, 0, 5], ["AN", 5, 1, 6], ["SP", 4, 0, 1536, [32], 1], ["AN", 4, 0, 5], ["AN", 4, 1, 6], ["AN", 1, 0, 5], ["PR", 1, 0, "auto_unroll_max_step$1024"], ["PR", 4, 0, "auto_unroll_max_step$0"]]]], "r": [[2.36839e-05], 0, 1.7174, 1680246341], "v": "v0.6"}
{"i": [["[\"4b5e216f8244b4e8f7b6543c4a9087e5\", [1536, 128], [1536, 128]]", "cuda -keys=cuda,gpu -arch=sm_75 -max_num_threads=1024 -model=2080ti -thread_warp_size=32", [-1, 16, 64, 49152, 2147483647, 1024, 8, 32], "", 0, []], [[], [["CI", 3], ["CI", 2], ["FU", 5, [0, 1]], ["SP", 5, 0, 196608, [32], 1], ["AN", 5, 0, 5], ["AN", 5, 1, 6], ["SP", 4, 0, 1536, [32], 1], ["AN", 4, 0, 5], ["AN", 4, 1, 6], ["SP", 1, 0, 1536, [32], 1], ["AN", 1, 0, 5], ["AN", 1, 1, 6], ["PR", 1, 0, "auto_unroll_max_step$16"], ["PR", 4, 0, "auto_unroll_max_step$1024"]]]], "r": [[2.84138e-05], 0, 1.77596, 1680246342], "v": "v0.6"}
{"i": [["[\"5b1e704ad5950c6ef36e46f1856366cd\", [1, 768], [768, 768], [1, 768], [1, 768]]", "cuda -keys=cuda,gpu -arch=sm_75 -max_num_threads=1024 -model=2080ti -thread_warp_size=32", [-1, 16, 64, 49152, 2147483647, 1024, 8, 32], "", 0, []], [[], [["CI", 6], ["CI", 5], ["CI", 4], ["SP", 2, 0, 1, [1, 1, 1, 1], 1], ["SP", 2, 5, 768, [4, 96, 1, 2], 1], ["SP", 2, 10, 768, [1, 4], 1], ["RE", 2, [0, 5, 1, 6, 2, 7, 10, 11, 3, 8, 12, 4, 9]], ["FSP", 7, 0, 3, 3], ["FSP", 7, 4, 4, 3], ["RE", 7, [0, 4, 1, 5, 2, 6, 3, 7]], ["CA", 2, 7, 5], ["CHR", 1, "shared", [2]], ["CA", 2, 3, 6], ["CHR", 0, "shared", [3]], ["CA", 1, 4, 6], ["FU", 9, [0, 1]], ["AN", 9, 0, 5], ["FU", 9, [1, 2]], ["AN", 9, 1, 4], ["FU", 9, [2, 3]], ["AN", 9, 2, 6], ["FU", 3, [0, 1]], ["SP", 3, 0, 24, [1], 1], ["AN", 3, 1, 2], ["FFSP", 3, 0, [4, 3], 1, 1], ["AN", 3, 1, 6], ["FU", 1, [0, 1]], ["SP", 1, 0, 12, [1], 1], ["AN", 1, 1, 2], ["FFSP", 1, 0, [4, 3], 1, 1], ["AN", 1, 1, 6], ["PR", 4, 0, "auto_unroll_max_step$512"]]]], "r": [[0.000263218], 0, 2.36518, 1680246379], "v": "v0.6"}
{"i": [["[\"5b1e704ad5950c6ef36e46f1856366cd\", [1, 768], [768, 768], [1, 768], [1, 768]]", "cuda -keys=cuda,gpu -arch=sm_75 -max_num_threads=1024 -model=2080ti -thread_warp_size=32", [-1, 16, 64, 49152, 2147483647, 1024, 8, 32], "", 0, []], [[], [["CI", 6], ["CI", 5], ["CI", 4], ["SP", 2, 0, 1, [1, 1, 1, 1], 1], ["SP", 2, 5, 768, [1, 64, 3, 2], 1], ["SP", 2, 10, 768, [1, 1], 1], ["RE", 2, [0, 5, 1, 6, 2, 7, 10, 11, 3, 8, 12, 4, 9]], ["FSP", 7, 0, 3, 3], ["FSP", 7, 4, 4, 3], ["RE", 7, [0, 4, 1, 5, 2, 6, 3, 7]], ["CA", 2, 7, 5], ["CHR", 1, "shared", [2]], ["CA", 2, 3, 6], ["CHR", 0, "shared", [3]], ["CA", 1, 4, 6], ["FU", 9, [0, 1]], ["AN", 9, 0, 5], ["FU", 9, [1, 2]], ["AN", 9, 1, 4], ["FU", 9, [2, 3]], ["AN", 9, 2, 6], ["FU", 3, [0, 1]], ["SP", 3, 0, 18, [3], 1], ["AN", 3, 1, 2], ["FFSP", 3, 0, [4, 3], 1, 1], ["AN", 3, 1, 6], ["FU", 1, [0, 1]], ["SP", 1, 0, 3, [1], 1], ["AN", 1, 1, 2], ["FFSP", 1, 0, [4, 3], 1, 1], ["AN", 1, 1, 6], ["PR", 4, 0, "auto_unroll_max_step$0"]]]], "r": [[0.000374025], 0, 2.11626, 1680246381], "v": "v0.6"}
{"i": [["[\"5b1e704ad5950c6ef36e46f1856366cd\", [1, 768], [768, 768], [1, 768], [1, 768]]", "cuda -keys=cuda,gpu -arch=sm_75 -max_num_threads=1024 -model=2080ti -thread_warp_size=32", [-1, 16, 64, 49152, 2147483647, 1024, 8, 32], "", 0, []], [[], [["CI", 6], ["CI", 5], ["CI", 4], ["SP", 2, 0, 1, [1, 1, 1, 1], 1], ["SP", 2, 5, 768, [1, 1, 192, 4], 1], ["SP", 2, 10, 768, [4, 1], 1], ["RE", 2, [0, 5, 1, 6, 2, 7, 10, 11, 3, 8, 12, 4, 9]], ["FSP", 7, 0, 3, 3], ["FSP", 7, 4, 4, 3], ["RE", 7, [0, 4, 1, 5, 2, 6, 3, 7]], ["CA", 2, 7, 5], ["CHR", 1, "shared", [2]], ["CA", 2, 3, 6], ["CHR", 0, "shared", [3]], ["CA", 1, 4, 6], ["FU", 9, [0, 1]], ["AN", 9, 0, 5], ["FU", 9, [1, 2]], ["AN", 9, 1, 4], ["FU", 9, [2, 3]], ["AN", 9, 2, 6], ["FU", 3, [0, 1]], ["SP", 3, 0, 64, [4], 1], ["AN", 3, 1, 2], ["FFSP", 3, 0, [4, 3], 1, 1], ["AN", 3, 1, 6], ["FU", 1, [0, 1]], ["SP", 1, 0, 4, [1], 1], ["AN", 1, 1, 2], ["FFSP", 1, 0, [4, 3], 1, 1], ["AN", 1, 1, 6], ["PR", 4, 0, "auto_unroll_max_step$16"]]]], "r": [[0.016365], 0, 1.87364, 1680246381], "v": "v0.6"}
{"i": [["[\"5b1e704ad5950c6ef36e46f1856366cd\", [1, 768], [768, 768], [1, 768], [1, 768]]", "cuda -keys=cuda,gpu -arch=sm_75 -max_num_threads=1024 -model=2080ti -thread_warp_size=32", [-1, 16, 64, 49152, 2147483647, 1024, 8, 32], "", 0, []], [[], [["CI", 6], ["CI", 5], ["CI", 4], ["SP", 2, 0, 1, [1, 1, 1, 1], 1], ["SP", 2, 5, 768, [4, 1, 1, 3], 1], ["SP", 2, 10, 768, [2, 1], 1], ["RE", 2, [0, 5, 1, 6, 2, 7, 10, 11, 3, 8, 12, 4, 9]], ["FSP", 7, 0, 3, 3], ["FSP", 7, 4, 4, 3], ["RE", 7, [0, 4, 1, 5, 2, 6, 3, 7]], ["CA", 2, 7, 5], ["CHR", 1, "shared", [2]], ["CA", 2, 3, 6], ["CHR", 0, "shared", [3]], ["CA", 1, 4, 6], ["FU", 9, [0, 1]], ["AN", 9, 0, 5], ["FU", 9, [1, 2]], ["AN", 9, 1, 4], ["FU", 9, [2, 3]], ["AN", 9, 2, 6], ["FU", 3, [0, 1]], ["SP", 3, 0, 2, [1], 1], ["AN", 3, 1, 2], ["FFSP", 3, 0, [4, 3], 1, 1], ["AN", 3, 1, 6], ["FU", 1, [0, 1]], ["SP", 1, 0, 2, [1], 1], ["AN", 1, 1, 2], ["FFSP", 1, 0, [4, 3], 1, 1], ["AN", 1, 1, 6], ["PR", 4, 0, "auto_unroll_max_step$16"]]]], "r": [[0.000105619], 0, 2.09371, 1680246387], "v": "v0.6"}
{"i": [["[\"5b1e704ad5950c6ef36e46f1856366cd\", [1, 768], [768, 768], [1, 768], [1, 768]]", "cuda -keys=cuda,gpu -arch=sm_75 -max_num_threads=1024 -model=2080ti -thread_warp_size=32", [-1, 16, 64, 49152, 2147483647, 1024, 8, 32], "", 0, []], [[], [["CI", 6], ["CI", 5], ["CI", 4], ["SP", 2, 0, 1, [1, 1, 1, 1], 1], ["SP", 2, 5, 768, [3, 64, 1, 2], 1], ["SP", 2, 10, 768, [4, 3], 1], ["RE", 2, [0, 5, 1, 6, 2, 7, 10, 11, 3, 8, 12, 4, 9]], ["FSP", 7, 0, 3, 3], ["FSP", 7, 4, 4, 3], ["RE", 7, [0, 4, 1, 5, 2, 6, 3, 7]], ["CA", 2, 7, 5], ["CHR", 1, "shared", [2]], ["CA", 2, 3, 6], ["CHR", 0, "shared", [3]], ["CA", 1, 4, 6], ["FU", 9, [0, 1]], ["AN", 9, 0, 5], ["FU", 9, [1, 2]], ["AN", 9, 1, 4], ["FU", 9, [2, 3]], ["AN", 9, 2, 6], ["FU", 3, [0, 1]], ["SP", 3, 0, 24, [1], 1], ["AN", 3, 1, 2], ["FFSP", 3, 0, [4, 3], 1, 1], ["AN", 3, 1, 6], ["FU", 1, [0, 1]], ["SP", 1, 0, 12, [1], 1], ["AN", 1, 1, 2], ["FFSP", 1, 0, [4, 3], 1, 1], ["AN", 1, 1, 6], ["PR", 4, 0, "auto_unroll_max_step$1024"]]]], "r": [[9.18867e-05], 0, 2.99294, 1680246391], "v": "v0.6"}
{"i": [["[\"5b1e704ad5950c6ef36e46f1856366cd\", [1, 768], [768, 768], [1, 768], [1, 768]]", "cuda -keys=cuda,gpu -arch=sm_75 -max_num_threads=1024 -model=2080ti -thread_warp_size=32", [-1, 16, 64, 49152, 2147483647, 1024, 8, 32], "", 0, []], [[], [["CI", 6], ["CI", 5], ["CI", 4], ["SP", 2, 0, 1, [1, 1, 1, 1], 1], ["SP", 2, 5, 768, [2, 4, 32, 3], 1], ["SP", 2, 10, 768, [2, 1], 1], ["RE", 2, [0, 5, 1, 6, 2, 7, 10, 11, 3, 8, 12, 4, 9]], ["FSP", 7, 0, 3, 3], ["FSP", 7, 4, 4, 3], ["RE", 7, [0, 4, 1, 5, 2, 6, 3, 7]], ["CA", 2, 7, 5], ["CHR", 1, "shared", [2]], ["CA", 2, 3, 6], ["CHR", 0, "shared", [3]], ["CA", 1, 4, 6], ["FU", 9, [0, 1]], ["AN", 9, 0, 5], ["FU", 9, [1, 2]], ["AN", 9, 1, 4], ["FU", 9, [2, 3]], ["AN", 9, 2, 6], ["FU", 3, [0, 1]], ["SP", 3, 0, 6, [1], 1], ["AN", 3, 1, 2], ["FFSP", 3, 0, [4, 3], 1, 1], ["AN", 3, 1, 6], ["FU", 1, [0, 1]], ["SP", 1, 0, 2, [2], 1], ["AN", 1, 1, 2], ["FFSP", 1, 0, [4, 3], 1, 1], ["AN", 1, 1, 6], ["PR", 4, 0, "auto_unroll_max_step$16"]]]], "r": [[0.0024545], 0, 2.3888, 1680246392], "v": "v0.6"}
{"i": [["[\"5b1e704ad5950c6ef36e46f1856366cd\", [1, 768], [768, 768], [1, 768], [1, 768]]", "cuda -keys=cuda,gpu -arch=sm_75 -max_num_threads=1024 -model=2080ti -thread_warp_size=32", [-1, 16, 64, 49152, 2147483647, 1024, 8, 32], "", 0, []], [[], [["CI", 6], ["CI", 5], ["CI", 4], ["SP", 2, 0, 1, [1, 1, 1, 1], 1], ["SP", 2, 5, 768, [1, 32, 6, 1], 1], ["SP", 2, 10, 768, [1, 1], 1], ["RE", 2, [0, 5, 1, 6, 2, 7, 10, 11, 3, 8, 12, 4, 9]], ["FSP", 7, 0, 3, 3], ["FSP", 7, 4, 4, 3], ["RE", 7, [0, 4, 1, 5, 2, 6, 3, 7]], ["CA", 2, 7, 5], ["CHR", 1, "shared", [2]], ["CA", 2, 3, 6], ["CHR", 0, "shared", [3]], ["CA", 1, 4, 6], ["FU", 9, [0, 1]], ["AN", 9, 0, 5], ["FU", 9, [1, 2]], ["AN", 9, 1, 4], ["FU", 9, [2, 3]], ["AN", 9, 2, 6], ["FU", 3, [0, 1]], ["SP", 3, 0, 36, [1], 1], ["AN", 3, 1, 2], ["FFSP", 3, 0, [4, 3], 1, 1], ["AN", 3, 1, 6], ["FU", 1, [0, 1]], ["SP", 1, 0, 6, [1], 1], ["AN", 1, 1, 2], ["FFSP", 1, 0, [4, 3], 1, 1], ["AN", 1, 1, 6], ["PR", 4, 0, "auto_unroll_max_step$0"]]]], "r": [[0.00030712], 0, 1.99929, 1680246394], "v": "v0.6"}
{"i": [["[\"5b1e704ad5950c6ef36e46f1856366cd\", [1, 768], [768, 768], [1, 768], [1, 768]]", "cuda -keys=cuda,gpu -arch=sm_75 -max_num_threads=1024 -model=2080ti -thread_warp_size=32", [-1, 16, 64, 49152, 2147483647, 1024, 8, 32], "", 0, []], [[], [["CI", 6], ["CI", 5], ["CI", 4], ["SP", 2, 0, 1, [1, 1, 1, 1], 1], ["SP", 2, 5, 768, [1, 384, 1, 1], 1], ["SP", 2, 10, 768, [1, 1], 1], ["RE", 2, [0, 5, 1, 6, 2, 7, 10, 11, 3, 8, 12, 4, 9]], ["FSP", 7, 0, 3, 3], ["FSP", 7, 4, 4, 3], ["RE", 7, [0, 4, 1, 5, 2, 6, 3, 7]], ["CA", 2, 7, 5], ["CHR", 1, "shared", [2]], ["CA", 2, 3, 6], ["CHR", 0, "shared", [3]], ["CA", 1, 4, 6], ["FU", 9, [0, 1]], ["AN", 9, 0, 5], ["FU", 9, [1, 2]], ["AN", 9, 1, 4], ["FU", 9, [2, 3]], ["AN", 9, 2, 6], ["FU", 3, [0, 1]], ["SP", 3, 0, 18, [1], 1], ["AN", 3, 1, 2], ["FFSP", 3, 0, [4, 3], 1, 1], ["AN", 3, 1, 6], ["FU", 1, [0, 1]], ["SP", 1, 0, 3, [1], 1], ["AN", 1, 1, 2], ["FFSP", 1, 0, [4, 3], 1, 1], ["AN", 1, 1, 6], ["PR", 4, 0, "auto_unroll_max_step$0"]]]], "r": [[0.000344989], 0, 2.0757, 1680246395], "v": "v0.6"}
{"i": [["[\"5b1e704ad5950c6ef36e46f1856366cd\", [1, 768], [768, 768], [1, 768], [1, 768]]", "cuda -keys=cuda,gpu -arch=sm_75 -max_num_threads=1024 -model=2080ti -thread_warp_size=32", [-1, 16, 64, 49152, 2147483647, 1024, 8, 32], "", 0, []], [[], [["CI", 6], ["CI", 5], ["CI", 4], ["SP", 2, 0, 1, [1, 1, 1, 1], 1], ["SP", 2, 5, 768, [6, 32, 1, 1], 1], ["SP", 2, 10, 768, [2, 24], 1], ["RE", 2, [0, 5, 1, 6, 2, 7, 10, 11, 3, 8, 12, 4, 9]], ["FSP", 7, 0, 3, 3], ["FSP", 7, 4, 4, 3], ["RE", 7, [0, 4, 1, 5, 2, 6, 3, 7]], ["CA", 2, 7, 5], ["CHR", 1, "shared", [2]], ["CA", 2, 3, 6], ["CHR", 0, "shared", [3]], ["CA", 1, 4, 6], ["FU", 9, [0, 1]], ["AN", 9, 0, 5], ["FU", 9, [1, 2]], ["AN", 9, 1, 4], ["FU", 9, [2, 3]], ["AN", 9, 2, 6], ["FU", 3, [0, 1]], ["SP", 3, 0, 24, [1], 1], ["AN", 3, 1, 2], ["FFSP", 3, 0, [4, 3], 1, 1], ["AN", 3, 1, 6], ["FU", 1, [0, 1]], ["SP", 1, 0, 24, [1], 1], ["AN", 1, 1, 2], ["FFSP", 1, 0, [4, 3], 1, 1], ["AN", 1, 1, 6], ["PR", 4, 0, "auto_unroll_max_step$16"]]]], "r": [[0.00021944], 0, 2.43924, 1680246396], "v": "v0.6"}
{"i": [["[\"5b1e704ad5950c6ef36e46f1856366cd\", [1, 768], [768, 768], [1, 768], [1, 768]]", "cuda -keys=cuda,gpu -arch=sm_75 -max_num_threads=1024 -model=2080ti -thread_warp_size=32", [-1, 16, 64, 49152, 2147483647, 1024, 8, 32], "", 0, []], [[], [["CI", 6], ["CI", 5], ["CI", 4], ["SP", 2, 0, 1, [1, 1, 1, 1], 1], ["SP", 2, 5, 768, [4, 32, 1, 3], 1], ["SP", 2, 10, 768, [1, 3], 1], ["RE", 2, [0, 5, 1, 6, 2, 7, 10, 11, 3, 8, 12, 4, 9]], ["FSP", 7, 0, 3, 3], ["FSP", 7, 4, 4, 3], ["RE", 7, [0, 4, 1, 5, 2, 6, 3, 7]], ["CA", 2, 7, 5], ["CHR", 1, "shared", [2]], ["CA", 2, 3, 6], ["CHR", 0, "shared", [3]], ["CA", 1, 4, 6], ["FU", 9, [0, 1]], ["AN", 9, 0, 5], ["FU", 9, [1, 2]], ["AN", 9, 1, 4], ["FU", 9, [2, 3]], ["AN", 9, 2, 6], ["FU", 3, [0, 1]], ["SP", 3, 0, 18, [1], 1], ["AN", 3, 1, 2], ["FFSP", 3, 0, [4, 3], 1, 1], ["AN", 3, 1, 6], ["FU", 1, [0, 1]], ["SP", 1, 0, 6, [1], 1], ["AN", 1, 1, 2], ["FFSP", 1, 0, [4, 3], 1, 1], ["AN", 1, 1, 6], ["PR", 4, 0, "auto_unroll_max_step$1024"]]]], "r": [[0.000263269], 0, 2.56456, 1680246398], "v": "v0.6"}
{"i": [["[\"5b1e704ad5950c6ef36e46f1856366cd\", [1, 768], [768, 768], [1, 768], [1, 768]]", "cuda -keys=cuda,gpu -arch=sm_75 -max_num_threads=1024 -model=2080ti -thread_warp_size=32", [-1, 16, 64, 49152, 2147483647, 1024, 8, 32], "", 0, []], [[], [["CI", 6], ["CI", 5], ["CI", 4], ["SP", 2, 0, 1, [1, 1, 1, 1], 1], ["SP", 2, 5, 768, [1, 1, 128, 6], 1], ["SP", 2, 10, 768, [2, 1], 1], ["RE", 2, [0, 5, 1, 6, 2, 7, 10, 11, 3, 8, 12, 4, 9]], ["FSP", 7, 0, 3, 3], ["FSP", 7, 4, 4, 3], ["RE", 7, [0, 4, 1, 5, 2, 6, 3, 7]], ["CA", 2, 7, 5], ["CHR", 1, "shared", [2]], ["CA", 2, 3, 6], ["CHR", 0, "shared", [3]], ["CA", 1, 4, 6], ["FU", 9, [0, 1]], ["AN", 9, 0, 5], ["FU", 9, [1, 2]], ["AN", 9, 1, 4], ["FU", 9, [2, 3]], ["AN", 9, 2, 6], ["FU", 3, [0, 1]], ["SP", 3, 0, 6, [1], 1], ["AN", 3, 1, 2], ["FFSP", 3, 0, [4, 3], 1, 1], ["AN", 3, 1, 6], ["FU", 1, [0, 1]], ["SP", 1, 0, 2, [1], 1], ["AN", 1, 1, 2], ["FFSP", 1, 0, [4, 3], 1, 1], ["AN", 1, 1, 6], ["PR", 4, 0, "auto_unroll_max_step$512"]]]], "r": [[0.0242292], 0, 1.58774, 1680246399], "v": "v0.6"}
{"i": [["[\"5b1e704ad5950c6ef36e46f1856366cd\", [1, 768], [768, 768], [1, 768], [1, 768]]", "cuda -keys=cuda,gpu -arch=sm_75 -max_num_threads=1024 -model=2080ti -thread_warp_size=32", [-1, 16, 64, 49152, 2147483647, 1024, 8, 32], "", 0, []], [[], [["CI", 6], ["CI", 5], ["CI", 4], ["SP", 2, 0, 1, [1, 1, 1, 1], 1], ["SP", 2, 5, 768, [1, 128, 1, 1], 1], ["SP", 2, 10, 768, [8, 2], 1], ["RE", 2, [0, 5, 1, 6, 2, 7, 10, 11, 3, 8, 12, 4, 9]], ["FSP", 7, 0, 3, 3], ["FSP", 7, 4, 4, 3], ["RE", 7, [0, 4, 1, 5, 2, 6, 3, 7]], ["CA", 2, 7, 5], ["CHR", 1, "shared", [2]], ["CA", 2, 3, 6], ["CHR", 0, "shared", [3]], ["CA", 1, 4, 6], ["FU", 9, [0, 1]], ["AN", 9, 0, 5], ["FU", 9, [1, 2]], ["AN", 9, 1, 4], ["FU", 9, [2, 3]], ["AN", 9, 2, 6], ["FU", 3, [0, 1]], ["SP", 3, 0, 48, [1], 1], ["AN", 3, 1, 2], ["FFSP", 3, 0, [4, 3], 1, 1], ["AN", 3, 1, 6], ["FU", 1, [0, 1]], ["SP", 1, 0, 16, [1], 1], ["AN", 1, 1, 2], ["FFSP", 1, 0, [4, 3], 1, 1], ["AN", 1, 1, 6], ["PR", 4, 0, "auto_unroll_max_step$16"]]]], "r": [[3.86223e-05], 0, 2.06442, 1680246400], "v": "v0.6"}
{"i": [["[\"5b1e704ad5950c6ef36e46f1856366cd\", [1, 768], [768, 768], [1, 768], [1, 768]]", "cuda -keys=cuda,gpu -arch=sm_75 -max_num_threads=1024 -model=2080ti -thread_warp_size=32", [-1, 16, 64, 49152, 2147483647, 1024, 8, 32], "", 0, []], [[], [["CI", 6], ["CI", 5], ["CI", 4], ["SP", 2, 0, 1, [1, 1, 1, 1], 1], ["SP", 2, 5, 768, [2, 128, 3, 1], 1], ["SP", 2, 10, 768, [2, 6], 1], ["RE", 2, [0, 5, 1, 6, 2, 7, 10, 11, 3, 8, 12, 4, 9]], ["FSP", 7, 0, 3, 3], ["FSP", 7, 4, 4, 3], ["RE", 7, [0, 4, 1, 5, 2, 6, 3, 7]], ["CA", 2, 7, 5], ["CHR", 1, "shared", [2]], ["CA", 2, 3, 6], ["CHR", 0, "shared", [3]], ["CA", 1, 4, 6], ["FU", 9, [0, 1]], ["AN", 9, 0, 5], ["FU", 9, [1, 2]], ["AN", 9, 1, 4], ["FU", 9, [2, 3]], ["AN", 9, 2, 6], ["FU", 3, [0, 1]], ["SP", 3, 0, 36, [1], 1], ["AN", 3, 1, 2], ["FFSP", 3, 0, [4, 3], 1, 1], ["AN", 3, 1, 6], ["FU", 1, [0, 1]], ["SP", 1, 0, 12, [3], 1], ["AN", 1, 1, 2], ["FFSP", 1, 0, [4, 3], 1, 1], ["AN", 1, 1, 6], ["PR", 4, 0, "auto_unroll_max_step$64"]]]], "r": [[0.000247486], 0, 2.16639, 1680246401], "v": "v0.6"}
{"i": [["[\"5b1e704ad5950c6ef36e46f1856366cd\", [1, 768], [768, 768], [1, 768], [1, 768]]", "cuda -keys=cuda,gpu -arch=sm_75 -max_num_threads=1024 -model=2080ti -thread_warp_size=32", [-1, 16, 64, 49152, 2147483647, 1024, 8, 32], "", 0, []], [[], [["CI", 6], ["CI", 5], ["CI", 4], ["SP", 2, 0, 1, [1, 1, 1, 1], 1], ["SP", 2, 5, 768, [2, 48, 1, 1], 1], ["SP", 2, 10, 768, [3, 1], 1], ["RE", 2, [0, 5, 1, 6, 2, 7, 10, 11, 3, 8, 12, 4, 9]], ["FSP", 7, 0, 3, 3], ["FSP", 7, 4, 4, 3], ["RE", 7, [0, 4, 1, 5, 2, 6, 3, 7]], ["CA", 2, 7, 5], ["CHR", 1, "shared", [2]], ["CA", 2, 3, 6], ["CHR", 0, "shared", [3]], ["CA", 1, 4, 6], ["FU", 9, [0, 1]], ["AN", 9, 0, 5], ["FU", 9, [1, 2]], ["AN", 9, 1, 4], ["FU", 9, [2, 3]], ["AN", 9, 2, 6], ["FU", 3, [0, 1]], ["SP", 3, 0, 48, [3], 1], ["AN", 3, 1, 2], ["FFSP", 3, 0, [4, 3], 1, 1], ["AN", 3, 1, 6], ["FU", 1, [0, 1]], ["SP", 1, 0, 24, [3], 1], ["AN", 1, 1, 2], ["FFSP", 1, 0, [4, 3], 1, 1], ["AN", 1, 1, 6], ["PR", 4, 0, "auto_unroll_max_step$16"]]]], "r": [[9.41809e-05], 0, 2.27474, 1680246403], "v": "v0.6"}
{"i": [["[\"5b1e704ad5950c6ef36e46f1856366cd\", [1, 768], [768, 768], [1, 768], [1, 768]]", "cuda -keys=cuda,gpu -arch=sm_75 -max_num_threads=1024 -model=2080ti -thread_warp_size=32", [-1, 16, 64, 49152, 2147483647, 1024, 8, 32], "", 0, []], [[], [["CI", 6], ["CI", 5], ["CI", 4], ["SP", 2, 0, 1, [1, 1, 1, 1], 1], ["SP", 2, 5, 768, [2, 32, 1, 1], 1], ["SP", 2, 10, 768, [12, 8], 1], ["RE", 2, [0, 5, 1, 6, 2, 7, 10, 11, 3, 8, 12, 4, 9]], ["FSP", 7, 0, 3, 3], ["FSP", 7, 4, 4, 3], ["RE", 7, [0, 4, 1, 5, 2, 6, 3, 7]], ["CA", 2, 7, 5], ["CHR", 1, "shared", [2]], ["CA", 2, 3, 6], ["CHR", 0, "shared", [3]], ["CA", 1, 4, 6], ["FU", 9, [0, 1]], ["AN", 9, 0, 5], ["FU", 9, [1, 2]], ["AN", 9, 1, 4], ["FU", 9, [2, 3]], ["AN", 9, 2, 6], ["FU", 3, [0, 1]], ["SP", 3, 0, 96, [1], 1], ["AN", 3, 1, 2], ["FFSP", 3, 0, [4, 3], 1, 1], ["AN", 3, 1, 6], ["FU", 1, [0, 1]], ["SP", 1, 0, 96, [1], 1], ["AN", 1, 1, 2], ["FFSP", 1, 0, [4, 3], 1, 1], ["AN", 1, 1, 6], ["PR", 4, 0, "auto_unroll_max_step$0"]]]], "r": [[3.49892e-05], 0, 2.19608, 1680246404], "v": "v0.6"}
{"i": [["[\"5b1e704ad5950c6ef36e46f1856366cd\", [1, 768], [768, 768], [1, 768], [1, 768]]", "cuda -keys=cuda,gpu -arch=sm_75 -max_num_threads=1024 -model=2080ti -thread_warp_size=32", [-1, 16, 64, 49152, 2147483647, 1024, 8, 32], "", 0, []], [[], [["CI", 6], ["CI", 5], ["CI", 4], ["SP", 2, 0, 1, [1, 1, 1, 1], 1], ["SP", 2, 5, 768, [1, 48, 4, 2], 1], ["SP", 2, 10, 768, [24, 1], 1], ["RE", 2, [0, 5, 1, 6, 2, 7, 10, 11, 3, 8, 12, 4, 9]], ["FSP", 7, 0, 3, 3], ["FSP", 7, 4, 4, 3], ["RE", 7, [0, 4, 1, 5, 2, 6, 3, 7]], ["CA", 2, 7, 5], ["CHR", 1, "shared", [2]], ["CA", 2, 3, 6], ["CHR", 0, "shared", [3]], ["CA", 1, 4, 6], ["FU", 9, [0, 1]], ["AN", 9, 0, 5], ["FU", 9, [1, 2]], ["AN", 9, 1, 4], ["FU", 9, [2, 3]], ["AN", 9, 2, 6], ["FU", 3, [0, 1]], ["SP", 3, 0, 48, [4], 1], ["AN", 3, 1, 2], ["FFSP", 3, 0, [4, 3], 1, 1], ["AN", 3, 1, 6], ["FU", 1, [0, 1]], ["SP", 1, 0, 24, [1], 1], ["AN", 1, 1, 2], ["FFSP", 1, 0, [4, 3], 1, 1], ["AN", 1, 1, 6], ["PR", 4, 0, "auto_unroll_max_step$64"]]]], "r": [[0.00012425], 0, 2.38266, 1680246406], "v": "v0.6"}
{"i": [["[\"5b1e704ad5950c6ef36e46f1856366cd\", [1, 768], [768, 768], [1, 768], [1, 768]]", "cuda -keys=cuda,gpu -arch=sm_75 -max_num_threads=1024 -model=2080ti -thread_warp_size=32", [-1, 16, 64, 49152, 2147483647, 1024, 8, 32], "", 0, []], [[], [["CI", 6], ["CI", 5], ["CI", 4], ["SP", 2, 0, 1, [1, 1, 1, 1], 1], ["SP", 2, 5, 768, [4, 192, 1, 1], 1], ["SP", 2, 10, 768, [2, 1], 1], ["RE", 2, [0, 5, 1, 6, 2, 7, 10, 11, 3, 8, 12, 4, 9]], ["FSP", 7, 0, 3, 3], ["FSP", 7, 4, 4, 3], ["RE", 7, [0, 4, 1, 5, 2, 6, 3, 7]], ["CA", 2, 7, 5], ["CHR", 1, "shared", [2]], ["CA", 2, 3, 6], ["CHR", 0, "shared", [3]], ["CA", 1, 4, 6], ["FU", 9, [0, 1]], ["AN", 9, 0, 5], ["FU", 9, [1, 2]], ["AN", 9, 1, 4], ["FU", 9, [2, 3]], ["AN", 9, 2, 6], ["FU", 3, [0, 1]], ["SP", 3, 0, 8, [2], 1], ["AN", 3, 1, 2], ["FFSP", 3, 0, [4, 3], 1, 1], ["AN", 3, 1, 6], ["FU", 1, [0, 1]], ["SP", 1, 0, 2, [2], 1], ["AN", 1, 1, 2], ["FFSP", 1, 0, [4, 3], 1, 1], ["AN", 1, 1, 6], ["PR", 4, 0, "auto_unroll_max_step$64"]]]], "r": [[0.000335025], 0, 2.20548, 1680246410], "v": "v0.6"}
{"i": [["[\"5b1e704ad5950c6ef36e46f1856366cd\", [1, 768], [768, 768], [1, 768], [1, 768]]", "cuda -keys=cuda,gpu -arch=sm_75 -max_num_threads=1024 -model=2080ti -thread_warp_size=32", [-1, 16, 64, 49152, 2147483647, 1024, 8, 32], "", 0, []], [[], [["CI", 6], ["CI", 5], ["CI", 4], ["SP", 2, 0, 1, [1, 1, 1, 1], 1], ["SP", 2, 5, 768, [6, 32, 2, 1], 1], ["SP", 2, 10, 768, [1, 24], 1], ["RE", 2, [0, 5, 1, 6, 2, 7, 10, 11, 3, 8, 12, 4, 9]], ["FSP", 7, 0, 3, 3], ["FSP", 7, 4, 4, 3], ["RE", 7, [0, 4, 1, 5, 2, 6, 3, 7]], ["CA", 2, 7, 5], ["CHR", 1, "shared", [2]], ["CA", 2, 3, 6], ["CHR", 0, "shared", [3]], ["CA", 1, 4, 6], ["FU", 9, [0, 1]], ["AN", 9, 0, 5], ["FU", 9, [1, 2]], ["AN", 9, 1, 4], ["FU", 9, [2, 3]], ["AN", 9, 2, 6], ["FU", 3, [0, 1]], ["SP", 3, 0, 48, [1], 1], ["AN", 3, 1, 2], ["FFSP", 3, 0, [4, 3], 1, 1], ["AN", 3, 1, 6], ["FU", 1, [0, 1]], ["SP", 1, 0, 24, [3], 1], ["AN", 1, 1, 2], ["FFSP", 1, 0, [4, 3], 1, 1], ["AN", 1, 1, 6], ["PR", 4, 0, "auto_unroll_max_step$64"]]]], "r": [[0.000442369], 0, 2.62584, 1680246411], "v": "v0.6"}
{"i": [["[\"5b1e704ad5950c6ef36e46f1856366cd\", [1, 768], [768, 768], [1, 768], [1, 768]]", "cuda -keys=cuda,gpu -arch=sm_75 -max_num_threads=1024 -model=2080ti -thread_warp_size=32", [-1, 16, 64, 49152, 2147483647, 1024, 8, 32], "", 0, []], [[], [["CI", 6], ["CI", 5], ["CI", 4], ["SP", 2, 0, 1, [1, 1, 1, 1], 1], ["SP", 2, 5, 768, [1, 4, 1, 12], 1], ["SP", 2, 10, 768, [8, 1], 1], ["RE", 2, [0, 5, 1, 6, 2, 7, 10, 11, 3, 8, 12, 4, 9]], ["FSP", 7, 0, 3, 3], ["FSP", 7, 4, 4, 3], ["RE", 7, [0, 4, 1, 5, 2, 6, 3, 7]], ["CA", 2, 7, 5], ["CHR", 1, "shared", [2]], ["CA", 2, 3, 6], ["CHR", 0, "shared", [3]], ["CA", 1, 4, 6], ["FU", 9, [0, 1]], ["AN", 9, 0, 5], ["FU", 9, [1, 2]], ["AN", 9, 1, 4], ["FU", 9, [2, 3]], ["AN", 9, 2, 6], ["FU", 3, [0, 1]], ["SP", 3, 0, 96, [4], 1], ["AN", 3, 1, 2], ["FFSP", 3, 0, [4, 3], 1, 1], ["AN", 3, 1, 6], ["FU", 1, [0, 1]], ["SP", 1, 0, 8, [1], 1], ["AN", 1, 1, 2], ["FFSP", 1, 0, [4, 3], 1, 1], ["AN", 1, 1, 6], ["PR", 4, 0, "auto_unroll_max_step$512"]]]], "r": [[7.44169e-05], 0, 2.37298, 1680246413], "v": "v0.6"}
{"i": [["[\"5b1e704ad5950c6ef36e46f1856366cd\", [1, 768], [768, 768], [1, 768], [1, 768]]", "cuda -keys=cuda,gpu -arch=sm_75 -max_num_threads=1024 -model=2080ti -thread_warp_size=32", [-1, 16, 64, 49152, 2147483647, 1024, 8, 32], "", 0, []], [[], [["CI", 6], ["CI", 5], ["CI", 4], ["SP", 2, 0, 1, [1, 1, 1, 1], 1], ["SP", 2, 5, 768, [2, 1, 2, 64], 1], ["SP", 2, 10, 768, [4, 6], 1], ["RE", 2, [0, 5, 1, 6, 2, 7, 10, 11, 3, 8, 12, 4, 9]], ["FSP", 7, 0, 3, 3], ["FSP", 7, 4, 4, 3], ["RE", 7, [0, 4, 1, 5, 2, 6, 3, 7]], ["CA", 2, 7, 5], ["CHR", 1, "shared", [2]], ["CA", 2, 3, 6], ["CHR", 0, "shared", [3]], ["CA", 1, 4, 6], ["FU", 9, [0, 1]], ["AN", 9, 0, 5], ["FU", 9, [1, 2]], ["AN", 9, 1, 4], ["FU", 9, [2, 3]], ["AN", 9, 2, 6], ["FU", 3, [0, 1]], ["SP", 3, 0, 96, [1], 1], ["AN", 3, 1, 2], ["FFSP", 3, 0, [4, 3], 1, 1], ["AN", 3, 1, 6], ["FU", 1, [0, 1]], ["SP", 1, 0, 24, [1], 1], ["AN", 1, 1, 2], ["FFSP", 1, 0, [4, 3], 1, 1], ["AN", 1, 1, 6], ["PR", 4, 0, "auto_unroll_max_step$0"]]]], "r": [[0.00585238], 0, 2.80525, 1680246414], "v": "v0.6"}
{"i": [["[\"5b1e704ad5950c6ef36e46f1856366cd\", [1, 768], [768, 768], [1, 768], [1, 768]]", "cuda -keys=cuda,gpu -arch=sm_75 -max_num_threads=1024 -model=2080ti -thread_warp_size=32", [-1, 16, 64, 49152, 2147483647, 1024, 8, 32], "", 0, []], [[], [["CI", 6], ["CI", 5], ["CI", 4], ["SP", 2, 0, 1, [1, 1, 1, 1], 1], ["SP", 2, 5, 768, [1, 128, 1, 1], 1], ["SP", 2, 10, 768, [2, 2], 1], ["RE", 2, [0, 5, 1, 6, 2, 7, 10, 11, 3, 8, 12, 4, 9]], ["FSP", 7, 0, 3, 3], ["FSP", 7, 4, 4, 3], ["RE", 7, [0, 4, 1, 5, 2, 6, 3, 7]], ["CA", 2, 7, 5], ["CHR", 1, "shared", [2]], ["CA", 2, 3, 6], ["CHR", 0, "shared", [3]], ["CA", 1, 4, 6], ["FU", 9, [0, 1]], ["AN", 9, 0, 5], ["FU", 9, [1, 2]], ["AN", 9, 1, 4], ["FU", 9, [2, 3]], ["AN", 9, 2, 6], ["FU", 3, [0, 1]], ["SP", 3, 0, 16, [1], 1], ["AN", 3, 1, 2], ["FFSP", 3, 0, [4, 3], 1, 1], ["AN", 3, 1, 6], ["FU", 1, [0, 1]], ["SP", 1, 0, 16, [1], 1], ["AN", 1, 1, 2], ["FFSP", 1, 0, [4, 3], 1, 1], ["AN", 1, 1, 6], ["PR", 4, 0, "auto_unroll_max_step$1024"]]]], "r": [[5.01064e-05], 0, 1.987, 1680246415], "v": "v0.6"}
{"i": [["[\"5b1e704ad5950c6ef36e46f1856366cd\", [1, 768], [768, 768], [1, 768], [1, 768]]", "cuda -keys=cuda,gpu -arch=sm_75 -max_num_threads=1024 -model=2080ti -thread_warp_size=32", [-1, 16, 64, 49152, 2147483647, 1024, 8, 32], "", 0, []], [[], [["CI", 6], ["CI", 5], ["CI", 4], ["SP", 2, 0, 1, [1, 1, 1, 1], 1], ["SP", 2, 5, 768, [2, 32, 1, 6], 1], ["SP", 2, 10, 768, [1, 3], 1], ["RE", 2, [0, 5, 1, 6, 2, 7, 10, 11, 3, 8, 12, 4, 9]], ["FSP", 7, 0, 3, 3], ["FSP", 7, 4, 4, 3], ["RE", 7, [0, 4, 1, 5, 2, 6, 3, 7]], ["CA", 2, 7, 5], ["CHR", 1, "shared", [2]], ["CA", 2, 3, 6], ["CHR", 0, "shared", [3]], ["CA", 1, 4, 6], ["FU", 9, [0, 1]], ["AN", 9, 0, 5], ["FU", 9, [1, 2]], ["AN", 9, 1, 4], ["FU", 9, [2, 3]], ["AN", 9, 2, 6], ["FU", 3, [0, 1]], ["SP", 3, 0, 18, [3], 1], ["AN", 3, 1, 2], ["FFSP", 3, 0, [4, 3], 1, 1], ["AN", 3, 1, 6], ["FU", 1, [0, 1]], ["SP", 1, 0, 3, [1], 1], ["AN", 1, 1, 2], ["FFSP", 1, 0, [4, 3], 1, 1], ["AN", 1, 1, 6], ["PR", 4, 0, "auto_unroll_max_step$16"]]]], "r": [[0.000373407], 0, 2.30255, 1680246422], "v": "v0.6"}
{"i": [["[\"5b1e704ad5950c6ef36e46f1856366cd\", [1, 768], [768, 768], [1, 768], [1, 768]]", "cuda -keys=cuda,gpu -arch=sm_75 -max_num_threads=1024 -model=2080ti -thread_warp_size=32", [-1, 16, 64, 49152, 2147483647, 1024, 8, 32], "", 0, []], [[], [["CI", 6], ["CI", 5], ["CI", 4], ["SP", 2, 0, 1, [1, 1, 1, 1], 1], ["SP", 2, 5, 768, [1, 32, 1, 12], 1], ["SP", 2, 10, 768, [1, 4], 1], ["RE", 2, [0, 5, 1, 6, 2, 7, 10, 11, 3, 8, 12, 4, 9]], ["FSP", 7, 0, 3, 3], ["FSP", 7, 4, 4, 3], ["RE", 7, [0, 4, 1, 5, 2, 6, 3, 7]], ["CA", 2, 7, 5], ["CHR", 1, "shared", [2]], ["CA", 2, 3, 6], ["CHR", 0, "shared", [3]], ["CA", 1, 4, 6], ["FU", 9, [0, 1]], ["AN", 9, 0, 5], ["FU", 9, [1, 2]], ["AN", 9, 1, 4], ["FU", 9, [2, 3]], ["AN", 9, 2, 6], ["FU", 3, [0, 1]], ["SP", 3, 0, 48, [1], 1], ["AN", 3, 1, 2], ["FFSP", 3, 0, [4, 3], 1, 1], ["AN", 3, 1, 6], ["FU", 1, [0, 1]], ["SP", 1, 0, 4, [1], 1], ["AN", 1, 1, 2], ["FFSP", 1, 0, [4, 3], 1, 1], ["AN", 1, 1, 6], ["PR", 4, 0, "auto_unroll_max_step$1024"]]]], "r": [[0.00022459], 0, 2.43819, 1680246424], "v": "v0.6"}
{"i": [["[\"5b1e704ad5950c6ef36e46f1856366cd\", [1, 768], [768, 768], [1, 768], [1, 768]]", "cuda -keys=cuda,gpu -arch=sm_75 -max_num_threads=1024 -model=2080ti -thread_warp_size=32", [-1, 16, 64, 49152, 2147483647, 1024, 8, 32], "", 0, []], [[], [["CI", 6], ["CI", 5], ["CI", 4], ["SP", 2, 0, 1, [1, 1, 1, 1], 1], ["SP", 2, 5, 768, [2, 8, 24, 2], 1], ["SP", 2, 10, 768, [1, 8], 1], ["RE", 2, [0, 5, 1, 6, 2, 7, 10, 11, 3, 8, 12, 4, 9]], ["FSP", 7, 0, 3, 3], ["FSP", 7, 4, 4, 3], ["RE", 7, [0, 4, 1, 5, 2, 6, 3, 7]], ["CA", 2, 7, 5], ["CHR", 1, "shared", [2]], ["CA", 2, 3, 6], ["CHR", 0, "shared", [3]], ["CA", 1, 4, 6], ["FU", 9, [0, 1]], ["AN", 9, 0, 5], ["FU", 9, [1, 2]], ["AN", 9, 1, 4], ["FU", 9, [2, 3]], ["AN", 9, 2, 6], ["FU", 3, [0, 1]], ["SP", 3, 0, 96, [1], 1], ["AN", 3, 1, 2], ["FFSP", 3, 0, [4, 3], 1, 1], ["AN", 3, 1, 6], ["FU", 1, [0, 1]], ["SP", 1, 0, 8, [1], 1], ["AN", 1, 1, 2], ["FFSP", 1, 0, [4, 3], 1, 1], ["AN", 1, 1, 6], ["PR", 4, 0, "auto_unroll_max_step$64"]]]], "r": [[0.00120137], 0, 2.29942, 1680246425], "v": "v0.6"}
