saved_logs/0.6local-pop-2023-03-28/1/autoscheduler/2080ti/bert-B1-float32.json
{"i": [["[\"4b5e216f8244b4e8f7b6543c4a9087e5\", [1536, 128], [1536, 128]]", "cuda -keys=cuda,gpu -arch=sm_75 -max_num_threads=1024 -model=2080ti -thread_warp_size=32", [-1, 16, 64, 49152, 2147483647, 1024, 8, 32], "", 0, []], [[], [["SP", 5, 1, 128, [32], 1], ["AN", 5, 2, 6], ["FSP", 4, 1, 0, 1], ["AN", 4, 2, 6], ["CA", 4, 5, 0], ["CI", 3], ["CI", 2], ["AN", 5, 0, 5], ["SP", 1, 0, 1536, [64], 1], ["AN", 1, 0, 5], ["AN", 1, 1, 6], ["PR", 1, 0, "auto_unroll_max_step$0"], ["PR", 4, 0, "auto_unroll_max_step$512"]]]], "r": [[1.42268e-05], 0, 1.89085, 1680133917], "v": "v0.6"}
{"i": [["[\"4b5e216f8244b4e8f7b6543c4a9087e5\", [1536, 128], [1536, 128]]", "cuda -keys=cuda,gpu -arch=sm_75 -max_num_threads=1024 -model=2080ti -thread_warp_size=32", [-1, 16, 64, 49152, 2147483647, 1024, 8, 32], "", 0, []], [[], [["CI", 3], ["CI", 2], ["SP", 1, 1, 128, [32], 1], ["AN", 1, 2, 6], ["FU", 5, [0, 1]], ["SP", 5, 0, 196608, [64], 1], ["AN", 5, 0, 5], ["AN", 5, 1, 6], ["SP", 4, 0, 1536, [8], 1], ["AN", 4, 0, 5], ["AN", 4, 1, 6], ["AN", 1, 0, 5], ["PR", 1, 0, "auto_unroll_max_step$0"], ["PR", 4, 0, "auto_unroll_max_step$512"]]]], "r": [[1.68978e-05], 0, 1.87908, 1680133918], "v": "v0.6"}
{"i": [["[\"4b5e216f8244b4e8f7b6543c4a9087e5\", [1536, 128], [1536, 128]]", "cuda -keys=cuda,gpu -arch=sm_75 -max_num_threads=1024 -model=2080ti -thread_warp_size=32", [-1, 16, 64, 49152, 2147483647, 1024, 8, 32], "", 0, []], [[], [["SP", 5, 1, 128, [2], 1], ["AN", 5, 2, 6], ["FSP", 4, 1, 0, 1], ["AN", 4, 2, 6], ["CA", 4, 5, 0], ["CI", 3], ["CI", 2], ["FSP", 1, 1, 0, 1], ["AN", 1, 2, 6], ["CA", 1, 5, 0], ["AN", 5, 0, 5], ["PR", 1, 0, "auto_unroll_max_step$16"], ["PR", 4, 0, "auto_unroll_max_step$16"]]]], "r": [[4.45785e-05], 0, 1.94597, 1680133919], "v": "v0.6"}
{"i": [["[\"4b5e216f8244b4e8f7b6543c4a9087e5\", [1536, 128], [1536, 128]]", "cuda -keys=cuda,gpu -arch=sm_75 -max_num_threads=1024 -model=2080ti -thread_warp_size=32", [-1, 16, 64, 49152, 2147483647, 1024, 8, 32], "", 0, []], [[], [["SP", 5, 1, 128, [1], 1], ["AN", 5, 2, 6], ["FSP", 4, 1, 0, 1], ["AN", 4, 2, 6], ["CA", 4, 5, 0], ["CI", 3], ["CI", 2], ["FSP", 1, 1, 0, 1], ["AN", 1, 2, 6], ["CA", 1, 5, 0], ["AN", 5, 0, 5], ["PR", 1, 0, "auto_unroll_max_step$0"], ["PR", 4, 0, "auto_unroll_max_step$64"]]]], "r": [[7.91889e-05], 0, 2.06685, 1680133921], "v": "v0.6"}
{"i": [["[\"4b5e216f8244b4e8f7b6543c4a9087e5\", [1536, 128], [1536, 128]]", "cuda -keys=cuda,gpu -arch=sm_75 -max_num_threads=1024 -model=2080ti -thread_warp_size=32", [-1, 16, 64, 49152, 2147483647, 1024, 8, 32], "", 0, []], [[], [["CI", 3], ["CI", 2], ["FU", 5, [0, 1]], ["SP", 5, 0, 196608, [32], 1], ["AN", 5, 0, 5], ["AN", 5, 1, 6], ["SP", 4, 0, 1536, [1], 1], ["AN", 4, 0, 5], ["AN", 4, 1, 6], ["SP", 1, 0, 1536, [4], 1], ["AN", 1, 0, 5], ["AN", 1, 1, 6], ["PR", 1, 0, "auto_unroll_max_step$1024"], ["PR", 4, 0, "auto_unroll_max_step$0"]]]], "r": [[3.47257e-05], 0, 1.87883, 1680133922], "v": "v0.6"}
{"i": [["[\"4b5e216f8244b4e8f7b6543c4a9087e5\", [1536, 128], [1536, 128]]", "cuda -keys=cuda,gpu -arch=sm_75 -max_num_threads=1024 -model=2080ti -thread_warp_size=32", [-1, 16, 64, 49152, 2147483647, 1024, 8, 32], "", 0, []], [[], [["SP", 5, 1, 128, [1], 1], ["AN", 5, 2, 6], ["FSP", 4, 1, 0, 1], ["AN", 4, 2, 6], ["CA", 4, 5, 0], ["CI", 3], ["CI", 2], ["FSP", 1, 1, 0, 1], ["AN", 1, 2, 6], ["CA", 1, 5, 0], ["AN", 5, 0, 5], ["PR", 1, 0, "auto_unroll_max_step$16"], ["PR", 4, 0, "auto_unroll_max_step$1024"]]]], "r": [[8.3519e-05], 0, 5.51875, 1680133924], "v": "v0.6"}
{"i": [["[\"4b5e216f8244b4e8f7b6543c4a9087e5\", [1536, 128], [1536, 128]]", "cuda -keys=cuda,gpu -arch=sm_75 -max_num_threads=1024 -model=2080ti -thread_warp_size=32", [-1, 16, 64, 49152, 2147483647, 1024, 8, 32], "", 0, []], [[], [["CI", 3], ["CI", 2], ["SP", 1, 1, 128, [16], 1], ["AN", 1, 2, 6], ["FU", 5, [0, 1]], ["SP", 5, 0, 196608, [4], 1], ["AN", 5, 0, 5], ["AN", 5, 1, 6], ["SP", 4, 0, 1536, [64], 1], ["AN", 4, 0, 5], ["AN", 4, 1, 6], ["AN", 1, 0, 5], ["PR", 1, 0, "auto_unroll_max_step$64"], ["PR", 4, 0, "auto_unroll_max_step$0"]]]], "r": [[5.82848e-05], 0, 2.06292, 1680133925], "v": "v0.6"}
{"i": [["[\"4b5e216f8244b4e8f7b6543c4a9087e5\", [1536, 128], [1536, 128]]", "cuda -keys=cuda,gpu -arch=sm_75 -max_num_threads=1024 -model=2080ti -thread_warp_size=32", [-1, 16, 64, 49152, 2147483647, 1024, 8, 32], "", 0, []], [[], [["CI", 3], ["CI", 2], ["SP", 1, 1, 128, [64], 1], ["AN", 1, 2, 6], ["FU", 5, [0, 1]], ["SP", 5, 0, 196608, [16], 1], ["AN", 5, 0, 5], ["AN", 5, 1, 6], ["SP", 4, 0, 1536, [32], 1], ["AN", 4, 0, 5], ["AN", 4, 1, 6], ["AN", 1, 0, 5], ["PR", 1, 0, "auto_unroll_max_step$0"], ["PR", 4, 0, "auto_unroll_max_step$512"]]]], "r": [[2.94852e-05], 0, 1.95556, 1680133926], "v": "v0.6"}
{"i": [["[\"4b5e216f8244b4e8f7b6543c4a9087e5\", [1536, 128], [1536, 128]]", "cuda -keys=cuda,gpu -arch=sm_75 -max_num_threads=1024 -model=2080ti -thread_warp_size=32", [-1, 16, 64, 49152, 2147483647, 1024, 8, 32], "", 0, []], [[], [["SP", 5, 1, 128, [64], 1], ["AN", 5, 2, 6], ["FSP", 4, 1, 0, 1], ["AN", 4, 2, 6], ["CA", 4, 5, 0], ["CI", 3], ["CI", 2], ["AN", 5, 0, 5], ["SP", 1, 0, 1536, [32], 1], ["AN", 1, 0, 5], ["AN", 1, 1, 6], ["PR", 1, 0, "auto_unroll_max_step$0"], ["PR", 4, 0, "auto_unroll_max_step$512"]]]], "r": [[1.30579e-05], 0, 1.82389, 1680133928], "v": "v0.6"}
{"i": [["[\"4b5e216f8244b4e8f7b6543c4a9087e5\", [1536, 128], [1536, 128]]", "cuda -keys=cuda,gpu -arch=sm_75 -max_num_threads=1024 -model=2080ti -thread_warp_size=32", [-1, 16, 64, 49152, 2147483647, 1024, 8, 32], "", 0, []], [[], [["SP", 5, 1, 128, [64], 1], ["AN", 5, 2, 6], ["FSP", 4, 1, 0, 1], ["AN", 4, 2, 6], ["CA", 4, 5, 0], ["CI", 3], ["CI", 2], ["AN", 5, 0, 5], ["SP", 1, 0, 1536, [2], 1], ["AN", 1, 0, 5], ["AN", 1, 1, 6], ["PR", 1, 0, "auto_unroll_max_step$16"], ["PR", 4, 0, "auto_unroll_max_step$0"]]]], "r": [[1.14112e-05], 0, 1.78979, 1680133929], "v": "v0.6"}
{"i": [["[\"4b5e216f8244b4e8f7b6543c4a9087e5\", [1536, 128], [1536, 128]]", "cuda -keys=cuda,gpu -arch=sm_75 -max_num_threads=1024 -model=2080ti -thread_warp_size=32", [-1, 16, 64, 49152, 2147483647, 1024, 8, 32], "", 0, []], [[], [["CI", 3], ["CI", 2], ["SP", 1, 1, 128, [2], 1], ["AN", 1, 2, 6], ["FU", 5, [0, 1]], ["SP", 5, 0, 196608, [32], 1], ["AN", 5, 0, 5], ["AN", 5, 1, 6], ["SP", 4, 0, 1536, [32], 1], ["AN", 4, 0, 5], ["AN", 4, 1, 6], ["AN", 1, 0, 5], ["PR", 1, 0, "auto_unroll_max_step$1024"], ["PR", 4, 0, "auto_unroll_max_step$16"]]]], "r": [[2.5109e-05], 0, 1.86517, 1680133930], "v": "v0.6"}
{"i": [["[\"4b5e216f8244b4e8f7b6543c4a9087e5\", [1536, 128], [1536, 128]]", "cuda -keys=cuda,gpu -arch=sm_75 -max_num_threads=1024 -model=2080ti -thread_warp_size=32", [-1, 16, 64, 49152, 2147483647, 1024, 8, 32], "", 0, []], [[], [["SP", 5, 1, 128, [8], 1], ["AN", 5, 2, 6], ["FSP", 4, 1, 0, 1], ["AN", 4, 2, 6], ["CA", 4, 5, 0], ["CI", 3], ["CI", 2], ["AN", 5, 0, 5], ["SP", 1, 0, 1536, [64], 1], ["AN", 1, 0, 5], ["AN", 1, 1, 6], ["PR", 1, 0, "auto_unroll_max_step$1024"], ["PR", 4, 0, "auto_unroll_max_step$512"]]]], "r": [[2.11358e-05], 0, 2.7165, 1680133931], "v": "v0.6"}
{"i": [["[\"4b5e216f8244b4e8f7b6543c4a9087e5\", [1536, 128], [1536, 128]]", "cuda -keys=cuda,gpu -arch=sm_75 -max_num_threads=1024 -model=2080ti -thread_warp_size=32", [-1, 16, 64, 49152, 2147483647, 1024, 8, 32], "", 0, []], [[], [["CI", 3], ["CI", 2], ["SP", 1, 1, 128, [32], 1], ["AN", 1, 2, 6], ["FU", 5, [0, 1]], ["SP", 5, 0, 196608, [32], 1], ["AN", 5, 0, 5], ["AN", 5, 1, 6], ["SP", 4, 0, 1536, [32], 1], ["AN", 4, 0, 5], ["AN", 4, 1, 6], ["AN", 1, 0, 5], ["PR", 1, 0, "auto_unroll_max_step$512"], ["PR", 4, 0, "auto_unroll_max_step$64"]]]], "r": [[2.36828e-05], 0, 1.983, 1680133933], "v": "v0.6"}
{"i": [["[\"4b5e216f8244b4e8f7b6543c4a9087e5\", [1536, 128], [1536, 128]]", "cuda -keys=cuda,gpu -arch=sm_75 -max_num_threads=1024 -model=2080ti -thread_warp_size=32", [-1, 16, 64, 49152, 2147483647, 1024, 8, 32], "", 0, []], [[], [["CI", 3], ["CI", 2], ["SP", 1, 1, 128, [64], 1], ["AN", 1, 2, 6], ["FU", 5, [0, 1]], ["SP", 5, 0, 196608, [32], 1], ["AN", 5, 0, 5], ["AN", 5, 1, 6], ["SP", 4, 0, 1536, [32], 1], ["AN", 4, 0, 5], ["AN", 4, 1, 6], ["AN", 1, 0, 5], ["PR", 1, 0, "auto_unroll_max_step$64"], ["PR", 4, 0, "auto_unroll_max_step$512"]]]], "r": [[2.41855e-05], 0, 1.90486, 1680133934], "v": "v0.6"}
{"i": [["[\"4b5e216f8244b4e8f7b6543c4a9087e5\", [1536, 128], [1536, 128]]", "cuda -keys=cuda,gpu -arch=sm_75 -max_num_threads=1024 -model=2080ti -thread_warp_size=32", [-1, 16, 64, 49152, 2147483647, 1024, 8, 32], "", 0, []], [[], [["SP", 5, 1, 128, [16], 1], ["AN", 5, 2, 6], ["FSP", 4, 1, 0, 1], ["AN", 4, 2, 6], ["CA", 4, 5, 0], ["CI", 3], ["CI", 2], ["FSP", 1, 1, 0, 1], ["AN", 1, 2, 6], ["CA", 1, 5, 0], ["AN", 5, 0, 5], ["PR", 1, 0, "auto_unroll_max_step$0"], ["PR", 4, 0, "auto_unroll_max_step$16"]]]], "r": [[8.19055e-06], 0, 2.17957, 1680133935], "v": "v0.6"}
{"i": [["[\"4b5e216f8244b4e8f7b6543c4a9087e5\", [1536, 128], [1536, 128]]", "cuda -keys=cuda,gpu -arch=sm_75 -max_num_threads=1024 -model=2080ti -thread_warp_size=32", [-1, 16, 64, 49152, 2147483647, 1024, 8, 32], "", 0, []], [[], [["SP", 5, 1, 128, [64], 1], ["AN", 5, 2, 6], ["FSP", 4, 1, 0, 1], ["AN", 4, 2, 6], ["CA", 4, 5, 0], ["CI", 3], ["CI", 2], ["AN", 5, 0, 5], ["SP", 1, 0, 1536, [64], 1], ["AN", 1, 0, 5], ["AN", 1, 1, 6], ["PR", 1, 0, "auto_unroll_max_step$64"], ["PR", 4, 0, "auto_unroll_max_step$512"]]]], "r": [[1.33047e-05], 0, 1.88687, 1680133937], "v": "v0.6"}
{"i": [["[\"4b5e216f8244b4e8f7b6543c4a9087e5\", [1536, 128], [1536, 128]]", "cuda -keys=cuda,gpu -arch=sm_75 -max_num_threads=1024 -model=2080ti -thread_warp_size=32", [-1, 16, 64, 49152, 2147483647, 1024, 8, 32], "", 0, []], [[], [["SP", 5, 1, 128, [1], 1], ["AN", 5, 2, 6], ["FSP", 4, 1, 0, 1], ["AN", 4, 2, 6], ["CA", 4, 5, 0], ["CI", 3], ["CI", 2], ["FSP", 1, 1, 0, 1], ["AN", 1, 2, 6], ["CA", 1, 5, 0], ["AN", 5, 0, 5], ["PR", 1, 0, "auto_unroll_max_step$512"], ["PR", 4, 0, "auto_unroll_max_step$64"]]]], "r": [[7.85301e-05], 0, 2.24854, 1680133938], "v": "v0.6"}
{"i": [["[\"4b5e216f8244b4e8f7b6543c4a9087e5\", [1536, 128], [1536, 128]]", "cuda -keys=cuda,gpu -arch=sm_75 -max_num_threads=1024 -model=2080ti -thread_warp_size=32", [-1, 16, 64, 49152, 2147483647, 1024, 8, 32], "", 0, []], [[], [["CI", 3], ["CI", 2], ["FU", 5, [0, 1]], ["SP", 5, 0, 196608, [1], 1], ["AN", 5, 0, 5], ["AN", 5, 1, 6], ["SP", 4, 0, 1536, [32], 1], ["AN", 4, 0, 5], ["AN", 4, 1, 6], ["SP", 1, 0, 1536, [32], 1], ["AN", 1, 0, 5], ["AN", 1, 1, 6], ["PR", 1, 0, "auto_unroll_max_step$0"], ["PR", 4, 0, "auto_unroll_max_step$16"]]]], "r": [[0.000186908], 0, 2.03032, 1680133939], "v": "v0.6"}
{"i": [["[\"4b5e216f8244b4e8f7b6543c4a9087e5\", [1536, 128], [1536, 128]]", "cuda -keys=cuda,gpu -arch=sm_75 -max_num_threads=1024 -model=2080ti -thread_warp_size=32", [-1, 16, 64, 49152, 2147483647, 1024, 8, 32], "", 0, []], [[], [["CI", 3], ["CI", 2], ["SP", 1, 1, 128, [32], 1], ["AN", 1, 2, 6], ["FU", 5, [0, 1]], ["SP", 5, 0, 196608, [12], 1], ["AN", 5, 0, 5], ["AN", 5, 1, 6], ["SP", 4, 0, 1536, [8], 1], ["AN", 4, 0, 5], ["AN", 4, 1, 6], ["AN", 1, 0, 5], ["PR", 1, 0, "auto_unroll_max_step$64"], ["PR", 4, 0, "auto_unroll_max_step$16"]]]], "r": [[2.84033e-05], 0, 2.07786, 1680133941], "v": "v0.6"}
{"i": [["[\"4b5e216f8244b4e8f7b6543c4a9087e5\", [1536, 128], [1536, 128]]", "cuda -keys=cuda,gpu -arch=sm_75 -max_num_threads=1024 -model=2080ti -thread_warp_size=32", [-1, 16, 64, 49152, 2147483647, 1024, 8, 32], "", 0, []], [[], [["SP", 5, 1, 128, [64], 1], ["AN", 5, 2, 6], ["FSP", 4, 1, 0, 1], ["AN", 4, 2, 6], ["CA", 4, 5, 0], ["CI", 3], ["CI", 2], ["AN", 5, 0, 5], ["SP", 1, 0, 1536, [1], 1], ["AN", 1, 0, 5], ["AN", 1, 1, 6], ["PR", 1, 0, "auto_unroll_max_step$512"], ["PR", 4, 0, "auto_unroll_max_step$512"]]]], "r": [[1.2245e-05], 0, 1.94172, 1680133942], "v": "v0.6"}
{"i": [["[\"4b5e216f8244b4e8f7b6543c4a9087e5\", [1536, 128], [1536, 128]]", "cuda -keys=cuda,gpu -arch=sm_75 -max_num_threads=1024 -model=2080ti -thread_warp_size=32", [-1, 16, 64, 49152, 2147483647, 1024, 8, 32], "", 0, []], [[], [["CI", 3], ["CI", 2], ["SP", 1, 1, 128, [32], 1], ["AN", 1, 2, 6], ["FU", 5, [0, 1]], ["SP", 5, 0, 196608, [32], 1], ["AN", 5, 0, 5], ["AN", 5, 1, 6], ["SP", 4, 0, 1536, [24], 1], ["AN", 4, 0, 5], ["AN", 4, 1, 6], ["AN", 1, 0, 5], ["PR", 1, 0, "auto_unroll_max_step$64"], ["PR", 4, 0, "auto_unroll_max_step$1024"]]]], "r": [[2.22511e-05], 0, 1.92795, 1680133943], "v": "v0.6"}
{"i": [["[\"4b5e216f8244b4e8f7b6543c4a9087e5\", [1536, 128], [1536, 128]]", "cuda -keys=cuda,gpu -arch=sm_75 -max_num_threads=1024 -model=2080ti -thread_warp_size=32", [-1, 16, 64, 49152, 2147483647, 1024, 8, 32], "", 0, []], [[], [["CI", 3], ["CI", 2], ["FU", 5, [0, 1]], ["SP", 5, 0, 196608, [2], 1], ["AN", 5, 0, 5], ["AN", 5, 1, 6], ["SP", 4, 0, 1536, [32], 1], ["AN", 4, 0, 5], ["AN", 4, 1, 6], ["SP", 1, 0, 1536, [1], 1], ["AN", 1, 0, 5], ["AN", 1, 1, 6], ["PR", 1, 0, "auto_unroll_max_step$512"], ["PR", 4, 0, "auto_unroll_max_step$64"]]]], "r": [[0.000105754], 0, 2.07834, 1680133945], "v": "v0.6"}
{"i": [["[\"4b5e216f8244b4e8f7b6543c4a9087e5\", [1536, 128], [1536, 128]]", "cuda -keys=cuda,gpu -arch=sm_75 -max_num_threads=1024 -model=2080ti -thread_warp_size=32", [-1, 16, 64, 49152, 2147483647, 1024, 8, 32], "", 0, []], [[], [["CI", 3], ["CI", 2], ["FU", 5, [0, 1]], ["SP", 5, 0, 196608, [1], 1], ["AN", 5, 0, 5], ["AN", 5, 1, 6], ["SP", 4, 0, 1536, [32], 1], ["AN", 4, 0, 5], ["AN", 4, 1, 6], ["SP", 1, 0, 1536, [32], 1], ["AN", 1, 0, 5], ["AN", 1, 1, 6], ["PR", 1, 0, "auto_unroll_max_step$0"], ["PR", 4, 0, "auto_unroll_max_step$64"]]]], "r": [[0.00018691], 0, 2.08309, 1680133946], "v": "v0.6"}
{"i": [["[\"4b5e216f8244b4e8f7b6543c4a9087e5\", [1536, 128], [1536, 128]]", "cuda -keys=cuda,gpu -arch=sm_75 -max_num_threads=1024 -model=2080ti -thread_warp_size=32", [-1, 16, 64, 49152, 2147483647, 1024, 8, 32], "", 0, []], [[], [["SP", 5, 1, 128, [32], 1], ["AN", 5, 2, 6], ["FSP", 4, 1, 0, 1], ["AN", 4, 2, 6], ["CA", 4, 5, 0], ["CI", 3], ["CI", 2], ["FSP", 1, 1, 0, 1], ["AN", 1, 2, 6], ["CA", 1, 5, 0], ["AN", 5, 0, 5], ["PR", 1, 0, "auto_unroll_max_step$1024"], ["PR", 4, 0, "auto_unroll_max_step$16"]]]], "r": [[5.96312e-06], 0, 1.7996, 1680133947], "v": "v0.6"}
{"i": [["[\"4b5e216f8244b4e8f7b6543c4a9087e5\", [1536, 128], [1536, 128]]", "cuda -keys=cuda,gpu -arch=sm_75 -max_num_threads=1024 -model=2080ti -thread_warp_size=32", [-1, 16, 64, 49152, 2147483647, 1024, 8, 32], "", 0, []], [[], [["SP", 5, 1, 128, [32], 1], ["AN", 5, 2, 6], ["FSP", 4, 1, 0, 1], ["AN", 4, 2, 6], ["CA", 4, 5, 0], ["CI", 3], ["CI", 2], ["AN", 5, 0, 5], ["SP", 1, 0, 1536, [4], 1], ["AN", 1, 0, 5], ["AN", 1, 1, 6], ["PR", 1, 0, "auto_unroll_max_step$512"], ["PR", 4, 0, "auto_unroll_max_step$1024"]]]], "r": [[1.2392e-05], 0, 2.06001, 1680133948], "v": "v0.6"}
{"i": [["[\"4b5e216f8244b4e8f7b6543c4a9087e5\", [1536, 128], [1536, 128]]", "cuda -keys=cuda,gpu -arch=sm_75 -max_num_threads=1024 -model=2080ti -thread_warp_size=32", [-1, 16, 64, 49152, 2147483647, 1024, 8, 32], "", 0, []], [[], [["CI", 3], ["CI", 2], ["FU", 5, [0, 1]], ["SP", 5, 0, 196608, [32], 1], ["AN", 5, 0, 5], ["AN", 5, 1, 6], ["SP", 4, 0, 1536, [64], 1], ["AN", 4, 0, 5], ["AN", 4, 1, 6], ["SP", 1, 0, 1536, [64], 1], ["AN", 1, 0, 5], ["AN", 1, 1, 6], ["PR", 1, 0, "auto_unroll_max_step$0"], ["PR", 4, 0, "auto_unroll_max_step$64"]]]], "r": [[2.688e-05], 0, 2.03724, 1680133950], "v": "v0.6"}
{"i": [["[\"4b5e216f8244b4e8f7b6543c4a9087e5\", [1536, 128], [1536, 128]]", "cuda -keys=cuda,gpu -arch=sm_75 -max_num_threads=1024 -model=2080ti -thread_warp_size=32", [-1, 16, 64, 49152, 2147483647, 1024, 8, 32], "", 0, []], [[], [["CI", 3], ["CI", 2], ["SP", 1, 1, 128, [32], 1], ["AN", 1, 2, 6], ["FU", 5, [0, 1]], ["SP", 5, 0, 196608, [32], 1], ["AN", 5, 0, 5], ["AN", 5, 1, 6], ["SP", 4, 0, 1536, [4], 1], ["AN", 4, 0, 5], ["AN", 4, 1, 6], ["AN", 1, 0, 5], ["PR", 1, 0, "auto_unroll_max_step$512"], ["PR", 4, 0, "auto_unroll_max_step$0"]]]], "r": [[2.03291e-05], 0, 1.90128, 1680133951], "v": "v0.6"}
{"i": [["[\"4b5e216f8244b4e8f7b6543c4a9087e5\", [1536, 128], [1536, 128]]", "cuda -keys=cuda,gpu -arch=sm_75 -max_num_threads=1024 -model=2080ti -thread_warp_size=32", [-1, 16, 64, 49152, 2147483647, 1024, 8, 32], "", 0, []], [[], [["CI", 3], ["CI", 2], ["SP", 1, 1, 128, [16], 1], ["AN", 1, 2, 6], ["FU", 5, [0, 1]], ["SP", 5, 0, 196608, [32], 1], ["AN", 5, 0, 5], ["AN", 5, 1, 6], ["SP", 4, 0, 1536, [2], 1], ["AN", 4, 0, 5], ["AN", 4, 1, 6], ["AN", 1, 0, 5], ["PR", 1, 0, "auto_unroll_max_step$512"], ["PR", 4, 0, "auto_unroll_max_step$16"]]]], "r": [[2.33965e-05], 0, 2.00896, 1680133952], "v": "v0.6"}
{"i": [["[\"4b5e216f8244b4e8f7b6543c4a9087e5\", [1536, 128], [1536, 128]]", "cuda -keys=cuda,gpu -arch=sm_75 -max_num_threads=1024 -model=2080ti -thread_warp_size=32", [-1, 16, 64, 49152, 2147483647, 1024, 8, 32], "", 0, []], [[], [["CI", 3], ["CI", 2], ["SP", 1, 1, 128, [32], 1], ["AN", 1, 2, 6], ["FU", 5, [0, 1]], ["SP", 5, 0, 196608, [2], 1], ["AN", 5, 0, 5], ["AN", 5, 1, 6], ["SP", 4, 0, 1536, [64], 1], ["AN", 4, 0, 5], ["AN", 4, 1, 6], ["AN", 1, 0, 5], ["PR", 1, 0, "auto_unroll_max_step$64"], ["PR", 4, 0, "auto_unroll_max_step$0"]]]], "r": [[9.97914e-05], 0, 2.10646, 1680133954], "v": "v0.6"}
{"i": [["[\"4b5e216f8244b4e8f7b6543c4a9087e5\", [1536, 128], [1536, 128]]", "cuda -keys=cuda,gpu -arch=sm_75 -max_num_threads=1024 -model=2080ti -thread_warp_size=32", [-1, 16, 64, 49152, 2147483647, 1024, 8, 32], "", 0, []], [[], [["SP", 5, 1, 128, [64], 1], ["AN", 5, 2, 6], ["FSP", 4, 1, 0, 1], ["AN", 4, 2, 6], ["CA", 4, 5, 0], ["CI", 3], ["CI", 2], ["AN", 5, 0, 5], ["SP", 1, 0, 1536, [32], 1], ["AN", 1, 0, 5], ["AN", 1, 1, 6], ["PR", 1, 0, "auto_unroll_max_step$16"], ["PR", 4, 0, "auto_unroll_max_step$0"]]]], "r": [[1.30716e-05], 0, 1.84662, 1680133955], "v": "v0.6"}
{"i": [["[\"4b5e216f8244b4e8f7b6543c4a9087e5\", [1536, 128], [1536, 128]]", "cuda -keys=cuda,gpu -arch=sm_75 -max_num_threads=1024 -model=2080ti -thread_warp_size=32", [-1, 16, 64, 49152, 2147483647, 1024, 8, 32], "", 0, []], [[], [["CI", 3], ["CI", 2], ["SP", 1, 1, 128, [4], 1], ["AN", 1, 2, 6], ["FU", 5, [0, 1]], ["SP", 5, 0, 196608, [32], 1], ["AN", 5, 0, 5], ["AN", 5, 1, 6], ["SP", 4, 0, 1536, [48], 1], ["AN", 4, 0, 5], ["AN", 4, 1, 6], ["AN", 1, 0, 5], ["PR", 1, 0, "auto_unroll_max_step$0"], ["PR", 4, 0, "auto_unroll_max_step$0"]]]], "r": [[2.16699e-05], 0, 1.92134, 1680133956], "v": "v0.6"}
{"i": [["[\"4b5e216f8244b4e8f7b6543c4a9087e5\", [1536, 128], [1536, 128]]", "cuda -keys=cuda,gpu -arch=sm_75 -max_num_threads=1024 -model=2080ti -thread_warp_size=32", [-1, 16, 64, 49152, 2147483647, 1024, 8, 32], "", 0, []], [[], [["CI", 3], ["CI", 2], ["FU", 5, [0, 1]], ["SP", 5, 0, 196608, [1], 1], ["AN", 5, 0, 5], ["AN", 5, 1, 6], ["SP", 4, 0, 1536, [32], 1], ["AN", 4, 0, 5], ["AN", 4, 1, 6], ["SP", 1, 0, 1536, [8], 1], ["AN", 1, 0, 5], ["AN", 1, 1, 6], ["PR", 1, 0, "auto_unroll_max_step$0"], ["PR", 4, 0, "auto_unroll_max_step$16"]]]], "r": [[0.000185412], 0, 2.01351, 1680133958], "v": "v0.6"}
{"i": [["[\"4b5e216f8244b4e8f7b6543c4a9087e5\", [1536, 128], [1536, 128]]", "cuda -keys=cuda,gpu -arch=sm_75 -max_num_threads=1024 -model=2080ti -thread_warp_size=32", [-1, 16, 64, 49152, 2147483647, 1024, 8, 32], "", 0, []], [[], [["CI", 3], ["CI", 2], ["SP", 1, 1, 128, [32], 1], ["AN", 1, 2, 6], ["FU", 5, [0, 1]], ["SP", 5, 0, 196608, [64], 1], ["AN", 5, 0, 5], ["AN", 5, 1, 6], ["SP", 4, 0, 1536, [32], 1], ["AN", 4, 0, 5], ["AN", 4, 1, 6], ["AN", 1, 0, 5], ["PR", 1, 0, "auto_unroll_max_step$512"], ["PR", 4, 0, "auto_unroll_max_step$0"]]]], "r": [[2.09701e-05], 0, 1.81817, 1680133959], "v": "v0.6"}
{"i": [["[\"4b5e216f8244b4e8f7b6543c4a9087e5\", [1536, 128], [1536, 128]]", "cuda -keys=cuda,gpu -arch=sm_75 -max_num_threads=1024 -model=2080ti -thread_warp_size=32", [-1, 16, 64, 49152, 2147483647, 1024, 8, 32], "", 0, []], [[], [["SP", 5, 1, 128, [32], 1], ["AN", 5, 2, 6], ["FSP", 4, 1, 0, 1], ["AN", 4, 2, 6], ["CA", 4, 5, 0], ["CI", 3], ["CI", 2], ["AN", 5, 0, 5], ["SP", 1, 0, 1536, [32], 1], ["AN", 1, 0, 5], ["AN", 1, 1, 6], ["PR", 1, 0, "auto_unroll_max_step$0"], ["PR", 4, 0, "auto_unroll_max_step$64"]]]], "r": [[1.39628e-05], 0, 1.93637, 1680133960], "v": "v0.6"}
{"i": [["[\"4b5e216f8244b4e8f7b6543c4a9087e5\", [1536, 128], [1536, 128]]", "cuda -keys=cuda,gpu -arch=sm_75 -max_num_threads=1024 -model=2080ti -thread_warp_size=32", [-1, 16, 64, 49152, 2147483647, 1024, 8, 32], "", 0, []], [[], [["CI", 3], ["CI", 2], ["SP", 1, 1, 128, [4], 1], ["AN", 1, 2, 6], ["FU", 5, [0, 1]], ["SP", 5, 0, 196608, [32], 1], ["AN", 5, 0, 5], ["AN", 5, 1, 6], ["SP", 4, 0, 1536, [64], 1], ["AN", 4, 0, 5], ["AN", 4, 1, 6], ["AN", 1, 0, 5], ["PR", 1, 0, "auto_unroll_max_step$64"], ["PR", 4, 0, "auto_unroll_max_step$0"]]]], "r": [[2.22026e-05], 0, 1.99579, 1680133961], "v": "v0.6"}
{"i": [["[\"4b5e216f8244b4e8f7b6543c4a9087e5\", [1536, 128], [1536, 128]]", "cuda -keys=cuda,gpu -arch=sm_75 -max_num_threads=1024 -model=2080ti -thread_warp_size=32", [-1, 16, 64, 49152, 2147483647, 1024, 8, 32], "", 0, []], [[], [["CI", 3], ["CI", 2], ["FU", 5, [0, 1]], ["SP", 5, 0, 196608, [32], 1], ["AN", 5, 0, 5], ["AN", 5, 1, 6], ["SP", 4, 0, 1536, [64], 1], ["AN", 4, 0, 5], ["AN", 4, 1, 6], ["SP", 1, 0, 1536, [32], 1], ["AN", 1, 0, 5], ["AN", 1, 1, 6], ["PR", 1, 0, "auto_unroll_max_step$0"], ["PR", 4, 0, "auto_unroll_max_step$64"]]]], "r": [[2.65985e-05], 0, 1.87657, 1680133963], "v": "v0.6"}
{"i": [["[\"4b5e216f8244b4e8f7b6543c4a9087e5\", [1536, 128], [1536, 128]]", "cuda -keys=cuda,gpu -arch=sm_75 -max_num_threads=1024 -model=2080ti -thread_warp_size=32", [-1, 16, 64, 49152, 2147483647, 1024, 8, 32], "", 0, []], [[], [["SP", 5, 1, 128, [4], 1], ["AN", 5, 2, 6], ["FSP", 4, 1, 0, 1], ["AN", 4, 2, 6], ["CA", 4, 5, 0], ["CI", 3], ["CI", 2], ["AN", 5, 0, 5], ["SP", 1, 0, 1536, [8], 1], ["AN", 1, 0, 5], ["AN", 1, 1, 6], ["PR", 1, 0, "auto_unroll_max_step$64"], ["PR", 4, 0, "auto_unroll_max_step$0"]]]], "r": [[2.96578e-05], 0, 2.01774, 1680133964], "v": "v0.6"}
{"i": [["[\"4b5e216f8244b4e8f7b6543c4a9087e5\", [1536, 128], [1536, 128]]", "cuda -keys=cuda,gpu -arch=sm_75 -max_num_threads=1024 -model=2080ti -thread_warp_size=32", [-1, 16, 64, 49152, 2147483647, 1024, 8, 32], "", 0, []], [[], [["CI", 3], ["CI", 2], ["FU", 5, [0, 1]], ["SP", 5, 0, 196608, [32], 1], ["AN", 5, 0, 5], ["AN", 5, 1, 6], ["SP", 4, 0, 1536, [2], 1], ["AN", 4, 0, 5], ["AN", 4, 1, 6], ["SP", 1, 0, 1536, [4], 1], ["AN", 1, 0, 5], ["AN", 1, 1, 6], ["PR", 1, 0, "auto_unroll_max_step$16"], ["PR", 4, 0, "auto_unroll_max_step$0"]]]], "r": [[2.66262e-05], 0, 1.85359, 1680133965], "v": "v0.6"}
{"i": [["[\"4b5e216f8244b4e8f7b6543c4a9087e5\", [1536, 128], [1536, 128]]", "cuda -keys=cuda,gpu -arch=sm_75 -max_num_threads=1024 -model=2080ti -thread_warp_size=32", [-1, 16, 64, 49152, 2147483647, 1024, 8, 32], "", 0, []], [[], [["CI", 3], ["CI", 2], ["SP", 1, 1, 128, [32], 1], ["AN", 1, 2, 6], ["FU", 5, [0, 1]], ["SP", 5, 0, 196608, [16], 1], ["AN", 5, 0, 5], ["AN", 5, 1, 6], ["SP", 4, 0, 1536, [32], 1], ["AN", 4, 0, 5], ["AN", 4, 1, 6], ["AN", 1, 0, 5], ["PR", 1, 0, "auto_unroll_max_step$16"], ["PR", 4, 0, "auto_unroll_max_step$1024"]]]], "r": [[2.89969e-05], 0, 1.96102, 1680133967], "v": "v0.6"}
{"i": [["[\"4b5e216f8244b4e8f7b6543c4a9087e5\", [1536, 128], [1536, 128]]", "cuda -keys=cuda,gpu -arch=sm_75 -max_num_threads=1024 -model=2080ti -thread_warp_size=32", [-1, 16, 64, 49152, 2147483647, 1024, 8, 32], "", 0, []], [[], [["CI", 3], ["CI", 2], ["FU", 5, [0, 1]], ["SP", 5, 0, 196608, [64], 1], ["AN", 5, 0, 5], ["AN", 5, 1, 6], ["SP", 4, 0, 1536, [64], 1], ["AN", 4, 0, 5], ["AN", 4, 1, 6], ["SP", 1, 0, 1536, [32], 1], ["AN", 1, 0, 5], ["AN", 1, 1, 6], ["PR", 1, 0, "auto_unroll_max_step$0"], ["PR", 4, 0, "auto_unroll_max_step$16"]]]], "r": [[2.38876e-05], 0, 1.91764, 1680133968], "v": "v0.6"}
{"i": [["[\"4b5e216f8244b4e8f7b6543c4a9087e5\", [1536, 128], [1536, 128]]", "cuda -keys=cuda,gpu -arch=sm_75 -max_num_threads=1024 -model=2080ti -thread_warp_size=32", [-1, 16, 64, 49152, 2147483647, 1024, 8, 32], "", 0, []], [[], [["CI", 3], ["CI", 2], ["SP", 1, 1, 128, [64], 1], ["AN", 1, 2, 6], ["FU", 5, [0, 1]], ["SP", 5, 0, 196608, [32], 1], ["AN", 5, 0, 5], ["AN", 5, 1, 6], ["SP", 4, 0, 1536, [1], 1], ["AN", 4, 0, 5], ["AN", 4, 1, 6], ["AN", 1, 0, 5], ["PR", 1, 0, "auto_unroll_max_step$16"], ["PR", 4, 0, "auto_unroll_max_step$1024"]]]], "r": [[3.19772e-05], 0, 1.88883, 1680133969], "v": "v0.6"}
{"i": [["[\"4b5e216f8244b4e8f7b6543c4a9087e5\", [1536, 128], [1536, 128]]", "cuda -keys=cuda,gpu -arch=sm_75 -max_num_threads=1024 -model=2080ti -thread_warp_size=32", [-1, 16, 64, 49152, 2147483647, 1024, 8, 32], "", 0, []], [[], [["SP", 5, 1, 128, [64], 1], ["AN", 5, 2, 6], ["FSP", 4, 1, 0, 1], ["AN", 4, 2, 6], ["CA", 4, 5, 0], ["CI", 3], ["CI", 2], ["FSP", 1, 1, 0, 1], ["AN", 1, 2, 6], ["CA", 1, 5, 0], ["AN", 5, 0, 5], ["PR", 1, 0, "auto_unroll_max_step$1024"], ["PR", 4, 0, "auto_unroll_max_step$1024"]]]], "r": [[6.11796e-06], 0, 1.76992, 1680133971], "v": "v0.6"}
{"i": [["[\"4b5e216f8244b4e8f7b6543c4a9087e5\", [1536, 128], [1536, 128]]", "cuda -keys=cuda,gpu -arch=sm_75 -max_num_threads=1024 -model=2080ti -thread_warp_size=32", [-1, 16, 64, 49152, 2147483647, 1024, 8, 32], "", 0, []], [[], [["CI", 3], ["CI", 2], ["FU", 5, [0, 1]], ["SP", 5, 0, 196608, [32], 1], ["AN", 5, 0, 5], ["AN", 5, 1, 6], ["SP", 4, 0, 1536, [32], 1], ["AN", 4, 0, 5], ["AN", 4, 1, 6], ["SP", 1, 0, 1536, [64], 1], ["AN", 1, 0, 5], ["AN", 1, 1, 6], ["PR", 1, 0, "auto_unroll_max_step$0"], ["PR", 4, 0, "auto_unroll_max_step$0"]]]], "r": [[2.87712e-05], 0, 1.82655, 1680133972], "v": "v0.6"}
{"i": [["[\"4b5e216f8244b4e8f7b6543c4a9087e5\", [1536, 128], [1536, 128]]", "cuda -keys=cuda,gpu -arch=sm_75 -max_num_threads=1024 -model=2080ti -thread_warp_size=32", [-1, 16, 64, 49152, 2147483647, 1024, 8, 32], "", 0, []], [[], [["SP", 5, 1, 128, [8], 1], ["AN", 5, 2, 6], ["FSP", 4, 1, 0, 1], ["AN", 4, 2, 6], ["CA", 4, 5, 0], ["CI", 3], ["CI", 2], ["FSP", 1, 1, 0, 1], ["AN", 1, 2, 6], ["CA", 1, 5, 0], ["AN", 5, 0, 5], ["PR", 1, 0, "auto_unroll_max_step$1024"], ["PR", 4, 0, "auto_unroll_max_step$1024"]]]], "r": [[1.2777e-05], 0, 2.22612, 1680133973], "v": "v0.6"}
{"i": [["[\"4b5e216f8244b4e8f7b6543c4a9087e5\", [1536, 128], [1536, 128]]", "cuda -keys=cuda,gpu -arch=sm_75 -max_num_threads=1024 -model=2080ti -thread_warp_size=32", [-1, 16, 64, 49152, 2147483647, 1024, 8, 32], "", 0, []], [[], [["CI", 3], ["CI", 2], ["FU", 5, [0, 1]], ["SP", 5, 0, 196608, [64], 1], ["AN", 5, 0, 5], ["AN", 5, 1, 6], ["SP", 4, 0, 1536, [32], 1], ["AN", 4, 0, 5], ["AN", 4, 1, 6], ["SP", 1, 0, 1536, [1], 1], ["AN", 1, 0, 5], ["AN", 1, 1, 6], ["PR", 1, 0, "auto_unroll_max_step$512"], ["PR", 4, 0, "auto_unroll_max_step$16"]]]], "r": [[2.49919e-05], 0, 1.81376, 1680133974], "v": "v0.6"}
{"i": [["[\"4b5e216f8244b4e8f7b6543c4a9087e5\", [1536, 128], [1536, 128]]", "cuda -keys=cuda,gpu -arch=sm_75 -max_num_threads=1024 -model=2080ti -thread_warp_size=32", [-1, 16, 64, 49152, 2147483647, 1024, 8, 32], "", 0, []], [[], [["SP", 5, 1, 128, [64], 1], ["AN", 5, 2, 6], ["FSP", 4, 1, 0, 1], ["AN", 4, 2, 6], ["CA", 4, 5, 0], ["CI", 3], ["CI", 2], ["FSP", 1, 1, 0, 1], ["AN", 1, 2, 6], ["CA", 1, 5, 0], ["AN", 5, 0, 5], ["PR", 1, 0, "auto_unroll_max_step$64"], ["PR", 4, 0, "auto_unroll_max_step$16"]]]], "r": [[6.10968e-06], 0, 1.73205, 1680133976], "v": "v0.6"}
{"i": [["[\"4b5e216f8244b4e8f7b6543c4a9087e5\", [1536, 128], [1536, 128]]", "cuda -keys=cuda,gpu -arch=sm_75 -max_num_threads=1024 -model=2080ti -thread_warp_size=32", [-1, 16, 64, 49152, 2147483647, 1024, 8, 32], "", 0, []], [[], [["CI", 3], ["CI", 2], ["SP", 1, 1, 128, [64], 1], ["AN", 1, 2, 6], ["FU", 5, [0, 1]], ["SP", 5, 0, 196608, [2], 1], ["AN", 5, 0, 5], ["AN", 5, 1, 6], ["SP", 4, 0, 1536, [64], 1], ["AN", 4, 0, 5], ["AN", 4, 1, 6], ["AN", 1, 0, 5], ["PR", 1, 0, "auto_unroll_max_step$64"], ["PR", 4, 0, "auto_unroll_max_step$0"]]]], "r": [[0.000100286], 0, 1.82463, 1680133977], "v": "v0.6"}
{"i": [["[\"4b5e216f8244b4e8f7b6543c4a9087e5\", [1536, 128], [1536, 128]]", "cuda -keys=cuda,gpu -arch=sm_75 -max_num_threads=1024 -model=2080ti -thread_warp_size=32", [-1, 16, 64, 49152, 2147483647, 1024, 8, 32], "", 0, []], [[], [["SP", 5, 1, 128, [4], 1], ["AN", 5, 2, 6], ["FSP", 4, 1, 0, 1], ["AN", 4, 2, 6], ["CA", 4, 5, 0], ["CI", 3], ["CI", 2], ["FSP", 1, 1, 0, 1], ["AN", 1, 2, 6], ["CA", 1, 5, 0], ["AN", 5, 0, 5], ["PR", 1, 0, "auto_unroll_max_step$0"], ["PR", 4, 0, "auto_unroll_max_step$512"]]]], "r": [[2.26991e-05], 0, 2.61759, 1680133978], "v": "v0.6"}
{"i": [["[\"4b5e216f8244b4e8f7b6543c4a9087e5\", [1536, 128], [1536, 128]]", "cuda -keys=cuda,gpu -arch=sm_75 -max_num_threads=1024 -model=2080ti -thread_warp_size=32", [-1, 16, 64, 49152, 2147483647, 1024, 8, 32], "", 0, []], [[], [["CI", 3], ["CI", 2], ["FU", 5, [0, 1]], ["SP", 5, 0, 196608, [4], 1], ["AN", 5, 0, 5], ["AN", 5, 1, 6], ["SP", 4, 0, 1536, [8], 1], ["AN", 4, 0, 5], ["AN", 4, 1, 6], ["SP", 1, 0, 1536, [32], 1], ["AN", 1, 0, 5], ["AN", 1, 1, 6], ["PR", 1, 0, "auto_unroll_max_step$0"], ["PR", 4, 0, "auto_unroll_max_step$64"]]]], "r": [[6.09184e-05], 0, 1.83177, 1680133980], "v": "v0.6"}
{"i": [["[\"4b5e216f8244b4e8f7b6543c4a9087e5\", [1536, 128], [1536, 128]]", "cuda -keys=cuda,gpu -arch=sm_75 -max_num_threads=1024 -model=2080ti -thread_warp_size=32", [-1, 16, 64, 49152, 2147483647, 1024, 8, 32], "", 0, []], [[], [["CI", 3], ["CI", 2], ["SP", 1, 1, 128, [64], 1], ["AN", 1, 2, 6], ["FU", 5, [0, 1]], ["SP", 5, 0, 196608, [32], 1], ["AN", 5, 0, 5], ["AN", 5, 1, 6], ["SP", 4, 0, 1536, [32], 1], ["AN", 4, 0, 5], ["AN", 4, 1, 6], ["AN", 1, 0, 5], ["PR", 1, 0, "auto_unroll_max_step$64"], ["PR", 4, 0, "auto_unroll_max_step$16"]]]], "r": [[2.41826e-05], 0, 1.86818, 1680133981], "v": "v0.6"}
{"i": [["[\"4b5e216f8244b4e8f7b6543c4a9087e5\", [1536, 128], [1536, 128]]", "cuda -keys=cuda,gpu -arch=sm_75 -max_num_threads=1024 -model=2080ti -thread_warp_size=32", [-1, 16, 64, 49152, 2147483647, 1024, 8, 32], "", 0, []], [[], [["CI", 3], ["CI", 2], ["SP", 1, 1, 128, [32], 1], ["AN", 1, 2, 6], ["FU", 5, [0, 1]], ["SP", 5, 0, 196608, [32], 1], ["AN", 5, 0, 5], ["AN", 5, 1, 6], ["SP", 4, 0, 1536, [64], 1], ["AN", 4, 0, 5], ["AN", 4, 1, 6], ["AN", 1, 0, 5], ["PR", 1, 0, "auto_unroll_max_step$0"], ["PR", 4, 0, "auto_unroll_max_step$0"]]]], "r": [[2.1748e-05], 0, 1.8304, 1680133982], "v": "v0.6"}
{"i": [["[\"4b5e216f8244b4e8f7b6543c4a9087e5\", [1536, 128], [1536, 128]]", "cuda -keys=cuda,gpu -arch=sm_75 -max_num_threads=1024 -model=2080ti -thread_warp_size=32", [-1, 16, 64, 49152, 2147483647, 1024, 8, 32], "", 0, []], [[], [["SP", 5, 1, 128, [32], 1], ["AN", 5, 2, 6], ["FSP", 4, 1, 0, 1], ["AN", 4, 2, 6], ["CA", 4, 5, 0], ["CI", 3], ["CI", 2], ["AN", 5, 0, 5], ["SP", 1, 0, 1536, [32], 1], ["AN", 1, 0, 5], ["AN", 1, 1, 6], ["PR", 1, 0, "auto_unroll_max_step$16"], ["PR", 4, 0, "auto_unroll_max_step$16"]]]], "r": [[1.39575e-05], 0, 1.77918, 1680133984], "v": "v0.6"}
{"i": [["[\"4b5e216f8244b4e8f7b6543c4a9087e5\", [1536, 128], [1536, 128]]", "cuda -keys=cuda,gpu -arch=sm_75 -max_num_threads=1024 -model=2080ti -thread_warp_size=32", [-1, 16, 64, 49152, 2147483647, 1024, 8, 32], "", 0, []], [[], [["CI", 3], ["CI", 2], ["SP", 1, 1, 128, [64], 1], ["AN", 1, 2, 6], ["FU", 5, [0, 1]], ["SP", 5, 0, 196608, [32], 1], ["AN", 5, 0, 5], ["AN", 5, 1, 6], ["SP", 4, 0, 1536, [32], 1], ["AN", 4, 0, 5], ["AN", 4, 1, 6], ["AN", 1, 0, 5], ["PR", 1, 0, "auto_unroll_max_step$512"], ["PR", 4, 0, "auto_unroll_max_step$0"]]]], "r": [[2.41799e-05], 0, 1.72501, 1680133985], "v": "v0.6"}
{"i": [["[\"4b5e216f8244b4e8f7b6543c4a9087e5\", [1536, 128], [1536, 128]]", "cuda -keys=cuda,gpu -arch=sm_75 -max_num_threads=1024 -model=2080ti -thread_warp_size=32", [-1, 16, 64, 49152, 2147483647, 1024, 8, 32], "", 0, []], [[], [["SP", 5, 1, 128, [32], 1], ["AN", 5, 2, 6], ["FSP", 4, 1, 0, 1], ["AN", 4, 2, 6], ["CA", 4, 5, 0], ["CI", 3], ["CI", 2], ["FSP", 1, 1, 0, 1], ["AN", 1, 2, 6], ["CA", 1, 5, 0], ["AN", 5, 0, 5], ["PR", 1, 0, "auto_unroll_max_step$16"], ["PR", 4, 0, "auto_unroll_max_step$64"]]]], "r": [[5.9576e-06], 0, 1.58377, 1680133986], "v": "v0.6"}
{"i": [["[\"4b5e216f8244b4e8f7b6543c4a9087e5\", [1536, 128], [1536, 128]]", "cuda -keys=cuda,gpu -arch=sm_75 -max_num_threads=1024 -model=2080ti -thread_warp_size=32", [-1, 16, 64, 49152, 2147483647, 1024, 8, 32], "", 0, []], [[], [["SP", 5, 1, 128, [1], 1], ["AN", 5, 2, 6], ["FSP", 4, 1, 0, 1], ["AN", 4, 2, 6], ["CA", 4, 5, 0], ["CI", 3], ["CI", 2], ["FSP", 1, 1, 0, 1], ["AN", 1, 2, 6], ["CA", 1, 5, 0], ["AN", 5, 0, 5], ["PR", 1, 0, "auto_unroll_max_step$1024"], ["PR", 4, 0, "auto_unroll_max_step$16"]]]], "r": [[7.85274e-05], 0, 2.04252, 1680133988], "v": "v0.6"}
{"i": [["[\"4b5e216f8244b4e8f7b6543c4a9087e5\", [1536, 128], [1536, 128]]", "cuda -keys=cuda,gpu -arch=sm_75 -max_num_threads=1024 -model=2080ti -thread_warp_size=32", [-1, 16, 64, 49152, 2147483647, 1024, 8, 32], "", 0, []], [[], [["SP", 5, 1, 128, [8], 1], ["AN", 5, 2, 6], ["FSP", 4, 1, 0, 1], ["AN", 4, 2, 6], ["CA", 4, 5, 0], ["CI", 3], ["CI", 2], ["FSP", 1, 1, 0, 1], ["AN", 1, 2, 6], ["CA", 1, 5, 0], ["AN", 5, 0, 5], ["PR", 1, 0, "auto_unroll_max_step$16"], ["PR", 4, 0, "auto_unroll_max_step$1024"]]]], "r": [[1.27755e-05], 0, 2.08706, 1680133989], "v": "v0.6"}
{"i": [["[\"4b5e216f8244b4e8f7b6543c4a9087e5\", [1536, 128], [1536, 128]]", "cuda -keys=cuda,gpu -arch=sm_75 -max_num_threads=1024 -model=2080ti -thread_warp_size=32", [-1, 16, 64, 49152, 2147483647, 1024, 8, 32], "", 0, []], [[], [["SP", 5, 1, 128, [1], 1], ["AN", 5, 2, 6], ["FSP", 4, 1, 0, 1], ["AN", 4, 2, 6], ["CA", 4, 5, 0], ["CI", 3], ["CI", 2], ["FSP", 1, 1, 0, 1], ["AN", 1, 2, 6], ["CA", 1, 5, 0], ["AN", 5, 0, 5], ["PR", 1, 0, "auto_unroll_max_step$1024"], ["PR", 4, 0, "auto_unroll_max_step$1024"]]]], "r": [[8.35162e-05], 0, 4.88839, 1680133990], "v": "v0.6"}
{"i": [["[\"4b5e216f8244b4e8f7b6543c4a9087e5\", [1536, 128], [1536, 128]]", "cuda -keys=cuda,gpu -arch=sm_75 -max_num_threads=1024 -model=2080ti -thread_warp_size=32", [-1, 16, 64, 49152, 2147483647, 1024, 8, 32], "", 0, []], [[], [["SP", 5, 1, 128, [32], 1], ["AN", 5, 2, 6], ["FSP", 4, 1, 0, 1], ["AN", 4, 2, 6], ["CA", 4, 5, 0], ["CI", 3], ["CI", 2], ["AN", 5, 0, 5], ["SP", 1, 0, 1536, [16], 1], ["AN", 1, 0, 5], ["AN", 1, 1, 6], ["PR", 1, 0, "auto_unroll_max_step$16"], ["PR", 4, 0, "auto_unroll_max_step$512"]]]], "r": [[1.24529e-05], 0, 1.75638, 1680133991], "v": "v0.6"}
{"i": [["[\"4b5e216f8244b4e8f7b6543c4a9087e5\", [1536, 128], [1536, 128]]", "cuda -keys=cuda,gpu -arch=sm_75 -max_num_threads=1024 -model=2080ti -thread_warp_size=32", [-1, 16, 64, 49152, 2147483647, 1024, 8, 32], "", 0, []], [[], [["SP", 5, 1, 128, [16], 1], ["AN", 5, 2, 6], ["FSP", 4, 1, 0, 1], ["AN", 4, 2, 6], ["CA", 4, 5, 0], ["CI", 3], ["CI", 2], ["FSP", 1, 1, 0, 1], ["AN", 1, 2, 6], ["CA", 1, 5, 0], ["AN", 5, 0, 5], ["PR", 1, 0, "auto_unroll_max_step$1024"], ["PR", 4, 0, "auto_unroll_max_step$64"]]]], "r": [[8.18954e-06], 0, 1.80494, 1680133993], "v": "v0.6"}
{"i": [["[\"4b5e216f8244b4e8f7b6543c4a9087e5\", [1536, 128], [1536, 128]]", "cuda -keys=cuda,gpu -arch=sm_75 -max_num_threads=1024 -model=2080ti -thread_warp_size=32", [-1, 16, 64, 49152, 2147483647, 1024, 8, 32], "", 0, []], [[], [["CI", 3], ["CI", 2], ["SP", 1, 1, 128, [32], 1], ["AN", 1, 2, 6], ["FU", 5, [0, 1]], ["SP", 5, 0, 196608, [32], 1], ["AN", 5, 0, 5], ["AN", 5, 1, 6], ["SP", 4, 0, 1536, [32], 1], ["AN", 4, 0, 5], ["AN", 4, 1, 6], ["AN", 1, 0, 5], ["PR", 1, 0, "auto_unroll_max_step$64"], ["PR", 4, 0, "auto_unroll_max_step$512"]]]], "r": [[2.36757e-05], 0, 1.69438, 1680133994], "v": "v0.6"}
{"i": [["[\"4b5e216f8244b4e8f7b6543c4a9087e5\", [1536, 128], [1536, 128]]", "cuda -keys=cuda,gpu -arch=sm_75 -max_num_threads=1024 -model=2080ti -thread_warp_size=32", [-1, 16, 64, 49152, 2147483647, 1024, 8, 32], "", 0, []], [[], [["CI", 3], ["CI", 2], ["FU", 5, [0, 1]], ["SP", 5, 0, 196608, [32], 1], ["AN", 5, 0, 5], ["AN", 5, 1, 6], ["SP", 4, 0, 1536, [64], 1], ["AN", 4, 0, 5], ["AN", 4, 1, 6], ["SP", 1, 0, 1536, [32], 1], ["AN", 1, 0, 5], ["AN", 1, 1, 6], ["PR", 1, 0, "auto_unroll_max_step$512"], ["PR", 4, 0, "auto_unroll_max_step$64"]]]], "r": [[2.65794e-05], 0, 1.84304, 1680133995], "v": "v0.6"}
{"i": [["[\"4b5e216f8244b4e8f7b6543c4a9087e5\", [1536, 128], [1536, 128]]", "cuda -keys=cuda,gpu -arch=sm_75 -max_num_threads=1024 -model=2080ti -thread_warp_size=32", [-1, 16, 64, 49152, 2147483647, 1024, 8, 32], "", 0, []], [[], [["CI", 3], ["CI", 2], ["SP", 1, 1, 128, [32], 1], ["AN", 1, 2, 6], ["FU", 5, [0, 1]], ["SP", 5, 0, 196608, [32], 1], ["AN", 5, 0, 5], ["AN", 5, 1, 6], ["SP", 4, 0, 1536, [32], 1], ["AN", 4, 0, 5], ["AN", 4, 1, 6], ["AN", 1, 0, 5], ["PR", 1, 0, "auto_unroll_max_step$16"], ["PR", 4, 0, "auto_unroll_max_step$0"]]]], "r": [[2.36673e-05], 0, 1.78587, 1680133997], "v": "v0.6"}
{"i": [["[\"4b5e216f8244b4e8f7b6543c4a9087e5\", [1536, 128], [1536, 128]]", "cuda -keys=cuda,gpu -arch=sm_75 -max_num_threads=1024 -model=2080ti -thread_warp_size=32", [-1, 16, 64, 49152, 2147483647, 1024, 8, 32], "", 0, []], [[], [["CI", 3], ["CI", 2], ["SP", 1, 1, 128, [32], 1], ["AN", 1, 2, 6], ["FU", 5, [0, 1]], ["SP", 5, 0, 196608, [32], 1], ["AN", 5, 0, 5], ["AN", 5, 1, 6], ["SP", 4, 0, 1536, [32], 1], ["AN", 4, 0, 5], ["AN", 4, 1, 6], ["AN", 1, 0, 5], ["PR", 1, 0, "auto_unroll_max_step$512"], ["PR", 4, 0, "auto_unroll_max_step$16"]]]], "r": [[2.36828e-05], 0, 1.7616, 1680133998], "v": "v0.6"}
{"i": [["[\"4b5e216f8244b4e8f7b6543c4a9087e5\", [1536, 128], [1536, 128]]", "cuda -keys=cuda,gpu -arch=sm_75 -max_num_threads=1024 -model=2080ti -thread_warp_size=32", [-1, 16, 64, 49152, 2147483647, 1024, 8, 32], "", 0, []], [[], [["SP", 5, 1, 128, [32], 1], ["AN", 5, 2, 6], ["FSP", 4, 1, 0, 1], ["AN", 4, 2, 6], ["CA", 4, 5, 0], ["CI", 3], ["CI", 2], ["FSP", 1, 1, 0, 1], ["AN", 1, 2, 6], ["CA", 1, 5, 0], ["AN", 5, 0, 5], ["PR", 1, 0, "auto_unroll_max_step$512"], ["PR", 4, 0, "auto_unroll_max_step$64"]]]], "r": [[5.96194e-06], 0, 1.67264, 1680133999], "v": "v0.6"}
{"i": [["[\"5b1e704ad5950c6ef36e46f1856366cd\", [1, 768], [768, 768], [1, 768], [1, 768]]", "cuda -keys=cuda,gpu -arch=sm_75 -max_num_threads=1024 -model=2080ti -thread_warp_size=32", [-1, 16, 64, 49152, 2147483647, 1024, 8, 32], "", 0, []], [[], [["CI", 6], ["CI", 5], ["CI", 4], ["SP", 2, 0, 1, [1, 1, 1, 1], 1], ["SP", 2, 5, 768, [1, 96, 1, 2], 1], ["SP", 2, 10, 768, [8, 2], 1], ["RE", 2, [0, 5, 1, 6, 2, 7, 10, 11, 3, 8, 12, 4, 9]], ["FSP", 7, 0, 3, 3], ["FSP", 7, 4, 4, 3], ["RE", 7, [0, 4, 1, 5, 2, 6, 3, 7]], ["CA", 2, 7, 5], ["CHR", 1, "shared", [2]], ["CA", 2, 3, 6], ["CHR", 0, "shared", [3]], ["CA", 1, 4, 6], ["FU", 9, [0, 1]], ["AN", 9, 0, 5], ["FU", 9, [1, 2]], ["AN", 9, 1, 4], ["FU", 9, [2, 3]], ["AN", 9, 2, 6], ["FU", 3, [0, 1]], ["SP", 3, 0, 32, [4], 1], ["AN", 3, 1, 2], ["FFSP", 3, 0, [4, 3], 1, 1], ["AN", 3, 1, 6], ["FU", 1, [0, 1]], ["SP", 1, 0, 16, [1], 1], ["AN", 1, 1, 2], ["FFSP", 1, 0, [4, 3], 1, 1], ["AN", 1, 1, 6], ["PR", 4, 0, "auto_unroll_max_step$16"]]]], "r": [[6.07281e-05], 0, 1.94486, 1680134039], "v": "v0.6"}
{"i": [["[\"5b1e704ad5950c6ef36e46f1856366cd\", [1, 768], [768, 768], [1, 768], [1, 768]]", "cuda -keys=cuda,gpu -arch=sm_75 -max_num_threads=1024 -model=2080ti -thread_warp_size=32", [-1, 16, 64, 49152, 2147483647, 1024, 8, 32], "", 0, []], [[], [["CI", 6], ["CI", 5], ["CI", 4], ["SP", 2, 0, 1, [1, 1, 1, 1], 1], ["SP", 2, 5, 768, [1, 48, 1, 2], 1], ["SP", 2, 10, 768, [96, 1], 1], ["RE", 2, [0, 5, 1, 6, 2, 7, 10, 11, 3, 8, 12, 4, 9]], ["FSP", 7, 0, 3, 3], ["FSP", 7, 4, 4, 3], ["RE", 7, [0, 4, 1, 5, 2, 6, 3, 7]], ["CA", 2, 7, 5], ["CHR", 1, "shared", [2]], ["CA", 2, 3, 6], ["CHR", 0, "shared", [3]], ["CA", 1, 4, 6], ["FU", 9, [0, 1]], ["AN", 9, 0, 5], ["FU", 9, [1, 2]], ["AN", 9, 1, 4], ["FU", 9, [2, 3]], ["AN", 9, 2, 6], ["FU", 3, [0, 1]], ["SP", 3, 0, 24, [1], 1], ["AN", 3, 1, 2], ["FFSP", 3, 0, [4, 3], 1, 1], ["AN", 3, 1, 6], ["FU", 1, [0, 1]], ["SP", 1, 0, 12, [1], 1], ["AN", 1, 1, 2], ["FFSP", 1, 0, [4, 3], 1, 1], ["AN", 1, 1, 6], ["PR", 4, 0, "auto_unroll_max_step$512"]]]], "r": [[3.45243e-05], 0, 3.25326, 1680134041], "v": "v0.6"}
{"i": [["[\"5b1e704ad5950c6ef36e46f1856366cd\", [1, 768], [768, 768], [1, 768], [1, 768]]", "cuda -keys=cuda,gpu -arch=sm_75 -max_num_threads=1024 -model=2080ti -thread_warp_size=32", [-1, 16, 64, 49152, 2147483647, 1024, 8, 32], "", 0, []], [[], [["CI", 6], ["CI", 5], ["CI", 4], ["SP", 2, 0, 1, [1, 1, 1, 1], 1], ["SP", 2, 5, 768, [1, 4, 1, 16], 1], ["SP", 2, 10, 768, [8, 6], 1], ["RE", 2, [0, 5, 1, 6, 2, 7, 10, 11, 3, 8, 12, 4, 9]], ["FSP", 7, 0, 3, 3], ["FSP", 7, 4, 4, 3], ["RE", 7, [0, 4, 1, 5, 2, 6, 3, 7]], ["CA", 2, 7, 5], ["CHR", 1, "shared", [2]], ["CA", 2, 3, 6], ["CHR", 0, "shared", [3]], ["CA", 1, 4, 6], ["FU", 9, [0, 1]], ["AN", 9, 0, 5], ["FU", 9, [1, 2]], ["AN", 9, 1, 4], ["FU", 9, [2, 3]], ["AN", 9, 2, 6], ["FU", 3, [0, 1]], ["SP", 3, 0, 96, [1], 1], ["AN", 3, 1, 2], ["FFSP", 3, 0, [4, 3], 1, 1], ["AN", 3, 1, 6], ["FU", 1, [0, 1]], ["SP", 1, 0, 48, [1], 1], ["AN", 1, 1, 2], ["FFSP", 1, 0, [4, 3], 1, 1], ["AN", 1, 1, 6], ["PR", 4, 0, "auto_unroll_max_step$1024"]]]], "r": [[0.000116815], 0, 8.69937, 1680134042], "v": "v0.6"}
{"i": [["[\"5b1e704ad5950c6ef36e46f1856366cd\", [1, 768], [768, 768], [1, 768], [1, 768]]", "cuda -keys=cuda,gpu -arch=sm_75 -max_num_threads=1024 -model=2080ti -thread_warp_size=32", [-1, 16, 64, 49152, 2147483647, 1024, 8, 32], "", 0, []], [[], [["CI", 6], ["CI", 5], ["CI", 4], ["SP", 2, 0, 1, [1, 1, 1, 1], 1], ["SP", 2, 5, 768, [3, 32, 1, 1], 1], ["SP", 2, 10, 768, [1, 12], 1], ["RE", 2, [0, 5, 1, 6, 2, 7, 10, 11, 3, 8, 12, 4, 9]], ["FSP", 7, 0, 3, 3], ["FSP", 7, 4, 4, 3], ["RE", 7, [0, 4, 1, 5, 2, 6, 3, 7]], ["CA", 2, 7, 5], ["CHR", 1, "shared", [2]], ["CA", 2, 3, 6], ["CHR", 0, "shared", [3]], ["CA", 1, 4, 6], ["FU", 9, [0, 1]], ["AN", 9, 0, 5], ["FU", 9, [1, 2]], ["AN", 9, 1, 4], ["FU", 9, [2, 3]], ["AN", 9, 2, 6], ["FU", 3, [0, 1]], ["SP", 3, 0, 24, [1], 1], ["AN", 3, 1, 2], ["FFSP", 3, 0, [4, 3], 1, 1], ["AN", 3, 1, 6], ["FU", 1, [0, 1]], ["SP", 1, 0, 12, [3], 1], ["AN", 1, 1, 2], ["FFSP", 1, 0, [4, 3], 1, 1], ["AN", 1, 1, 6], ["PR", 4, 0, "auto_unroll_max_step$1024"]]]], "r": [[4.22472e-05], 0, 2.38941, 1680134044], "v": "v0.6"}
{"i": [["[\"5b1e704ad5950c6ef36e46f1856366cd\", [1, 768], [768, 768], [1, 768], [1, 768]]", "cuda -keys=cuda,gpu -arch=sm_75 -max_num_threads=1024 -model=2080ti -thread_warp_size=32", [-1, 16, 64, 49152, 2147483647, 1024, 8, 32], "", 0, []], [[], [["CI", 6], ["CI", 5], ["CI", 4], ["SP", 2, 0, 1, [1, 1, 1, 1], 1], ["SP", 2, 5, 768, [1, 768, 1, 1], 1], ["SP", 2, 10, 768, [1, 1], 1], ["RE", 2, [0, 5, 1, 6, 2, 7, 10, 11, 3, 8, 12, 4, 9]], ["FSP", 7, 0, 3, 3], ["FSP", 7, 4, 4, 3], ["RE", 7, [0, 4, 1, 5, 2, 6, 3, 7]], ["CA", 2, 7, 5], ["CHR", 1, "shared", [2]], ["CA", 2, 3, 6], ["CHR", 0, "shared", [3]], ["CA", 1, 4, 6], ["FU", 9, [0, 1]], ["AN", 9, 0, 5], ["FU", 9, [1, 2]], ["AN", 9, 1, 4], ["FU", 9, [2, 3]], ["AN", 9, 2, 6], ["FU", 3, [0, 1]], ["SP", 3, 0, 3, [1], 1], ["AN", 3, 1, 2], ["FFSP", 3, 0, [4, 3], 1, 1], ["AN", 3, 1, 6], ["FU", 1, [0, 1]], ["SP", 1, 0, 3, [1], 1], ["AN", 1, 1, 2], ["FFSP", 1, 0, [4, 3], 1, 1], ["AN", 1, 1, 6], ["PR", 4, 0, "auto_unroll_max_step$0"]]]], "r": [[0.000678505], 0, 1.9501, 1680134045], "v": "v0.6"}
{"i": [["[\"5b1e704ad5950c6ef36e46f1856366cd\", [1, 768], [768, 768], [1, 768], [1, 768]]", "cuda -keys=cuda,gpu -arch=sm_75 -max_num_threads=1024 -model=2080ti -thread_warp_size=32", [-1, 16, 64, 49152, 2147483647, 1024, 8, 32], "", 0, []], [[], [["CI", 6], ["CI", 5], ["CI", 4], ["SP", 2, 0, 1, [1, 1, 1, 1], 1], ["SP", 2, 5, 768, [1, 64, 1, 1], 1], ["SP", 2, 10, 768, [6, 8], 1], ["RE", 2, [0, 5, 1, 6, 2, 7, 10, 11, 3, 8, 12, 4, 9]], ["FSP", 7, 0, 3, 3], ["FSP", 7, 4, 4, 3], ["RE", 7, [0, 4, 1, 5, 2, 6, 3, 7]], ["CA", 2, 7, 5], ["CHR", 1, "shared", [2]], ["CA", 2, 3, 6], ["CHR", 0, "shared", [3]], ["CA", 1, 4, 6], ["FU", 9, [0, 1]], ["AN", 9, 0, 5], ["FU", 9, [1, 2]], ["AN", 9, 1, 4], ["FU", 9, [2, 3]], ["AN", 9, 2, 6], ["FU", 3, [0, 1]], ["SP", 3, 0, 48, [1], 1], ["AN", 3, 1, 2], ["FFSP", 3, 0, [4, 3], 1, 1], ["AN", 3, 1, 6], ["FU", 1, [0, 1]], ["SP", 1, 0, 48, [1], 1], ["AN", 1, 1, 2], ["FFSP", 1, 0, [4, 3], 1, 1], ["AN", 1, 1, 6], ["PR", 4, 0, "auto_unroll_max_step$512"]]]], "r": [[1.85688e-05], 0, 2.3365, 1680134046], "v": "v0.6"}
{"i": [["[\"5b1e704ad5950c6ef36e46f1856366cd\", [1, 768], [768, 768], [1, 768], [1, 768]]", "cuda -keys=cuda,gpu -arch=sm_75 -max_num_threads=1024 -model=2080ti -thread_warp_size=32", [-1, 16, 64, 49152, 2147483647, 1024, 8, 32], "", 0, []], [[], [["CI", 6], ["CI", 5], ["CI", 4], ["SP", 2, 0, 1, [1, 1, 1, 1], 1], ["SP", 2, 5, 768, [1, 96, 8, 1], 1], ["SP", 2, 10, 768, [1, 3], 1], ["RE", 2, [0, 5, 1, 6, 2, 7, 10, 11, 3, 8, 12, 4, 9]], ["FSP", 7, 0, 3, 3], ["FSP", 7, 4, 4, 3], ["RE", 7, [0, 4, 1, 5, 2, 6, 3, 7]], ["CA", 2, 7, 5], ["CHR", 1, "shared", [2]], ["CA", 2, 3, 6], ["CHR", 0, "shared", [3]], ["CA", 1, 4, 6], ["FU", 9, [0, 1]], ["AN", 9, 0, 5], ["FU", 9, [1, 2]], ["AN", 9, 1, 4], ["FU", 9, [2, 3]], ["AN", 9, 2, 6], ["FU", 3, [0, 1]], ["SP", 3, 0, 24, [1], 1], ["AN", 3, 1, 2], ["FFSP", 3, 0, [4, 3], 1, 1], ["AN", 3, 1, 6], ["FU", 1, [0, 1]], ["SP", 1, 0, 3, [1], 1], ["AN", 1, 1, 2], ["FFSP", 1, 0, [4, 3], 1, 1], ["AN", 1, 1, 6], ["PR", 4, 0, "auto_unroll_max_step$0"]]]], "r": [[0.000381577], 0, 1.91286, 1680134048], "v": "v0.6"}
{"i": [["[\"5b1e704ad5950c6ef36e46f1856366cd\", [1, 768], [768, 768], [1, 768], [1, 768]]", "cuda -keys=cuda,gpu -arch=sm_75 -max_num_threads=1024 -model=2080ti -thread_warp_size=32", [-1, 16, 64, 49152, 2147483647, 1024, 8, 32], "", 0, []], [[], [["CI", 6], ["CI", 5], ["CI", 4], ["SP", 2, 0, 1, [1, 1, 1, 1], 1], ["SP", 2, 5, 768, [1, 64, 6, 1], 1], ["SP", 2, 10, 768, [6, 2], 1], ["RE", 2, [0, 5, 1, 6, 2, 7, 10, 11, 3, 8, 12, 4, 9]], ["FSP", 7, 0, 3, 3], ["FSP", 7, 4, 4, 3], ["RE", 7, [0, 4, 1, 5, 2, 6, 3, 7]], ["CA", 2, 7, 5], ["CHR", 1, "shared", [2]], ["CA", 2, 3, 6], ["CHR", 0, "shared", [3]], ["CA", 1, 4, 6], ["FU", 9, [0, 1]], ["AN", 9, 0, 5], ["FU", 9, [1, 2]], ["AN", 9, 1, 4], ["FU", 9, [2, 3]], ["AN", 9, 2, 6], ["FU", 3, [0, 1]], ["SP", 3, 0, 72, [1], 1], ["AN", 3, 1, 2], ["FFSP", 3, 0, [4, 3], 1, 1], ["AN", 3, 1, 6], ["FU", 1, [0, 1]], ["SP", 1, 0, 12, [1], 1], ["AN", 1, 1, 2], ["FFSP", 1, 0, [4, 3], 1, 1], ["AN", 1, 1, 6], ["PR", 4, 0, "auto_unroll_max_step$64"]]]], "r": [[0.000220643], 0, 2.08224, 1680134049], "v": "v0.6"}
{"i": [["[\"5b1e704ad5950c6ef36e46f1856366cd\", [1, 768], [768, 768], [1, 768], [1, 768]]", "cuda -keys=cuda,gpu -arch=sm_75 -max_num_threads=1024 -model=2080ti -thread_warp_size=32", [-1, 16, 64, 49152, 2147483647, 1024, 8, 32], "", 0, []], [[], [["CI", 6], ["CI", 5], ["CI", 4], ["SP", 2, 0, 1, [1, 1, 1, 1], 1], ["SP", 2, 5, 768, [1, 32, 1, 2], 1], ["SP", 2, 10, 768, [2, 16], 1], ["RE", 2, [0, 5, 1, 6, 2, 7, 10, 11, 3, 8, 12, 4, 9]], ["FSP", 7, 0, 3, 3], ["FSP", 7, 4, 4, 3], ["RE", 7, [0, 4, 1, 5, 2, 6, 3, 7]], ["CA", 2, 7, 5], ["CHR", 1, "shared", [2]], ["CA", 2, 3, 6], ["CHR", 0, "shared", [3]], ["CA", 1, 4, 6], ["FU", 9, [0, 1]], ["AN", 9, 0, 5], ["FU", 9, [1, 2]], ["AN", 9, 1, 4], ["FU", 9, [2, 3]], ["AN", 9, 2, 6], ["FU", 3, [0, 1]], ["SP", 3, 0, 64, [4], 1], ["AN", 3, 1, 2], ["FFSP", 3, 0, [4, 3], 1, 1], ["AN", 3, 1, 6], ["FU", 1, [0, 1]], ["SP", 1, 0, 32, [1], 1], ["AN", 1, 1, 2], ["FFSP", 1, 0, [4, 3], 1, 1], ["AN", 1, 1, 6], ["PR", 4, 0, "auto_unroll_max_step$0"]]]], "r": [[3.49284e-05], 0, 1.97399, 1680134051], "v": "v0.6"}
{"i": [["[\"5b1e704ad5950c6ef36e46f1856366cd\", [1, 768], [768, 768], [1, 768], [1, 768]]", "cuda -keys=cuda,gpu -arch=sm_75 -max_num_threads=1024 -model=2080ti -thread_warp_size=32", [-1, 16, 64, 49152, 2147483647, 1024, 8, 32], "", 0, []], [[], [["CI", 6], ["CI", 5], ["CI", 4], ["SP", 2, 0, 1, [1, 1, 1, 1], 1], ["SP", 2, 5, 768, [4, 192, 1, 1], 1], ["SP", 2, 10, 768, [2, 6], 1], ["RE", 2, [0, 5, 1, 6, 2, 7, 10, 11, 3, 8, 12, 4, 9]], ["FSP", 7, 0, 3, 3], ["FSP", 7, 4, 4, 3], ["RE", 7, [0, 4, 1, 5, 2, 6, 3, 7]], ["CA", 2, 7, 5], ["CHR", 1, "shared", [2]], ["CA", 2, 3, 6], ["CHR", 0, "shared", [3]], ["CA", 1, 4, 6], ["FU", 9, [0, 1]], ["AN", 9, 0, 5], ["FU", 9, [1, 2]], ["AN", 9, 1, 4], ["FU", 9, [2, 3]], ["AN", 9, 2, 6], ["FU", 3, [0, 1]], ["SP", 3, 0, 24, [1], 1], ["AN", 3, 1, 2], ["FFSP", 3, 0, [4, 3], 1, 1], ["AN", 3, 1, 6], ["FU", 1, [0, 1]], ["SP", 1, 0, 12, [1], 1], ["AN", 1, 1, 2], ["FFSP", 1, 0, [4, 3], 1, 1], ["AN", 1, 1, 6], ["PR", 4, 0, "auto_unroll_max_step$1024"]]]], "r": [[0.000142005], 0, 2.39481, 1680134052], "v": "v0.6"}
{"i": [["[\"5b1e704ad5950c6ef36e46f1856366cd\", [1, 768], [768, 768], [1, 768], [1, 768]]", "cuda -keys=cuda,gpu -arch=sm_75 -max_num_threads=1024 -model=2080ti -thread_warp_size=32", [-1, 16, 64, 49152, 2147483647, 1024, 8, 32], "", 0, []], [[], [["CI", 6], ["CI", 5], ["CI", 4], ["SP", 2, 0, 1, [1, 1, 1, 1], 1], ["SP", 2, 5, 768, [1, 128, 1, 3], 1], ["SP", 2, 10, 768, [8, 2], 1], ["RE", 2, [0, 5, 1, 6, 2, 7, 10, 11, 3, 8, 12, 4, 9]], ["FSP", 7, 0, 3, 3], ["FSP", 7, 4, 4, 3], ["RE", 7, [0, 4, 1, 5, 2, 6, 3, 7]], ["CA", 2, 7, 5], ["CHR", 1, "shared", [2]], ["CA", 2, 3, 6], ["CHR", 0, "shared", [3]], ["CA", 1, 4, 6], ["FU", 9, [0, 1]], ["AN", 9, 0, 5], ["FU", 9, [1, 2]], ["AN", 9, 1, 4], ["FU", 9, [2, 3]], ["AN", 9, 2, 6], ["FU", 3, [0, 1]], ["SP", 3, 0, 48, [1], 1], ["AN", 3, 1, 2], ["FFSP", 3, 0, [4, 3], 1, 1], ["AN", 3, 1, 6], ["FU", 1, [0, 1]], ["SP", 1, 0, 16, [2], 1], ["AN", 1, 1, 2], ["FFSP", 1, 0, [4, 3], 1, 1], ["AN", 1, 1, 6], ["PR", 4, 0, "auto_unroll_max_step$64"]]]], "r": [[8.5286e-05], 0, 2.4453, 1680134053], "v": "v0.6"}
{"i": [["[\"5b1e704ad5950c6ef36e46f1856366cd\", [1, 768], [768, 768], [1, 768], [1, 768]]", "cuda -keys=cuda,gpu -arch=sm_75 -max_num_threads=1024 -model=2080ti -thread_warp_size=32", [-1, 16, 64, 49152, 2147483647, 1024, 8, 32], "", 0, []], [[], [["CI", 6], ["CI", 5], ["CI", 4], ["SP", 2, 0, 1, [1, 1, 1, 1], 1], ["SP", 2, 5, 768, [1, 32, 4, 6], 1], ["SP", 2, 10, 768, [1, 8], 1], ["RE", 2, [0, 5, 1, 6, 2, 7, 10, 11, 3, 8, 12, 4, 9]], ["FSP", 7, 0, 3, 3], ["FSP", 7, 4, 4, 3], ["RE", 7, [0, 4, 1, 5, 2, 6, 3, 7]], ["CA", 2, 7, 5], ["CHR", 1, "shared", [2]], ["CA", 2, 3, 6], ["CHR", 0, "shared", [3]], ["CA", 1, 4, 6], ["FU", 9, [0, 1]], ["AN", 9, 0, 5], ["FU", 9, [1, 2]], ["AN", 9, 1, 4], ["FU", 9, [2, 3]], ["AN", 9, 2, 6], ["FU", 3, [0, 1]], ["SP", 3, 0, 192, [1], 1], ["AN", 3, 1, 2], ["FFSP", 3, 0, [4, 3], 1, 1], ["AN", 3, 1, 6], ["FU", 1, [0, 1]], ["SP", 1, 0, 8, [1], 1], ["AN", 1, 1, 2], ["FFSP", 1, 0, [4, 3], 1, 1], ["AN", 1, 1, 6], ["PR", 4, 0, "auto_unroll_max_step$16"]]]], "r": [[0.000439139], 0, 2.22919, 1680134055], "v": "v0.6"}
{"i": [["[\"5b1e704ad5950c6ef36e46f1856366cd\", [1, 768], [768, 768], [1, 768], [1, 768]]", "cuda -keys=cuda,gpu -arch=sm_75 -max_num_threads=1024 -model=2080ti -thread_warp_size=32", [-1, 16, 64, 49152, 2147483647, 1024, 8, 32], "", 0, []], [[], [["CI", 6], ["CI", 5], ["CI", 4], ["SP", 2, 0, 1, [1, 1, 1, 1], 1], ["SP", 2, 5, 768, [1, 192, 1, 1], 1], ["SP", 2, 10, 768, [3, 1], 1], ["RE", 2, [0, 5, 1, 6, 2, 7, 10, 11, 3, 8, 12, 4, 9]], ["FSP", 7, 0, 3, 3], ["FSP", 7, 4, 4, 3], ["RE", 7, [0, 4, 1, 5, 2, 6, 3, 7]], ["CA", 2, 7, 5], ["CHR", 1, "shared", [2]], ["CA", 2, 3, 6], ["CHR", 0, "shared", [3]], ["CA", 1, 4, 6], ["FU", 9, [0, 1]], ["AN", 9, 0, 5], ["FU", 9, [1, 2]], ["AN", 9, 1, 4], ["FU", 9, [2, 3]], ["AN", 9, 2, 6], ["FU", 3, [0, 1]], ["SP", 3, 0, 3, [3], 1], ["AN", 3, 1, 2], ["FFSP", 3, 0, [4, 3], 1, 1], ["AN", 3, 1, 6], ["FU", 1, [0, 1]], ["SP", 1, 0, 3, [3], 1], ["AN", 1, 1, 2], ["FFSP", 1, 0, [4, 3], 1, 1], ["AN", 1, 1, 6], ["PR", 4, 0, "auto_unroll_max_step$16"]]]], "r": [[0.00016541], 0, 2.13059, 1680134056], "v": "v0.6"}
{"i": [["[\"5b1e704ad5950c6ef36e46f1856366cd\", [1, 768], [768, 768], [1, 768], [1, 768]]", "cuda -keys=cuda,gpu -arch=sm_75 -max_num_threads=1024 -model=2080ti -thread_warp_size=32", [-1, 16, 64, 49152, 2147483647, 1024, 8, 32], "", 0, []], [[], [["CI", 6], ["CI", 5], ["CI", 4], ["SP", 2, 0, 1, [1, 1, 1, 1], 1], ["SP", 2, 5, 768, [6, 128, 1, 1], 1], ["SP", 2, 10, 768, [1, 3], 1], ["RE", 2, [0, 5, 1, 6, 2, 7, 10, 11, 3, 8, 12, 4, 9]], ["FSP", 7, 0, 3, 3], ["FSP", 7, 4, 4, 3], ["RE", 7, [0, 4, 1, 5, 2, 6, 3, 7]], ["CA", 2, 7, 5], ["CHR", 1, "shared", [2]], ["CA", 2, 3, 6], ["CHR", 0, "shared", [3]], ["CA", 1, 4, 6], ["FU", 9, [0, 1]], ["AN", 9, 0, 5], ["FU", 9, [1, 2]], ["AN", 9, 1, 4], ["FU", 9, [2, 3]], ["AN", 9, 2, 6], ["FU", 3, [0, 1]], ["SP", 3, 0, 12, [1], 1], ["AN", 3, 1, 2], ["FFSP", 3, 0, [4, 3], 1, 1], ["AN", 3, 1, 6], ["FU", 1, [0, 1]], ["SP", 1, 0, 6, [1], 1], ["AN", 1, 1, 2], ["FFSP", 1, 0, [4, 3], 1, 1], ["AN", 1, 1, 6], ["PR", 4, 0, "auto_unroll_max_step$16"]]]], "r": [[0.000372311], 0, 2.20789, 1680134058], "v": "v0.6"}
{"i": [["[\"5b1e704ad5950c6ef36e46f1856366cd\", [1, 768], [768, 768], [1, 768], [1, 768]]", "cuda -keys=cuda,gpu -arch=sm_75 -max_num_threads=1024 -model=2080ti -thread_warp_size=32", [-1, 16, 64, 49152, 2147483647, 1024, 8, 32], "", 0, []], [[], [["CI", 6], ["CI", 5], ["CI", 4], ["SP", 2, 0, 1, [1, 1, 1, 1], 1], ["SP", 2, 5, 768, [1, 4, 2, 1], 1], ["SP", 2, 10, 768, [2, 24], 1], ["RE", 2, [0, 5, 1, 6, 2, 7, 10, 11, 3, 8, 12, 4, 9]], ["FSP", 7, 0, 3, 3], ["FSP", 7, 4, 4, 3], ["RE", 7, [0, 4, 1, 5, 2, 6, 3, 7]], ["CA", 2, 7, 5], ["CHR", 1, "shared", [2]], ["CA", 2, 3, 6], ["CHR", 0, "shared", [3]], ["CA", 1, 4, 6], ["FU", 9, [0, 1]], ["AN", 9, 0, 5], ["FU", 9, [1, 2]], ["AN", 9, 1, 4], ["FU", 9, [2, 3]], ["AN", 9, 2, 6], ["FU", 3, [0, 1]], ["SP", 3, 0, 96, [1], 1], ["AN", 3, 1, 2], ["FFSP", 3, 0, [4, 3], 1, 1], ["AN", 3, 1, 6], ["FU", 1, [0, 1]], ["SP", 1, 0, 48, [1], 1], ["AN", 1, 1, 2], ["FFSP", 1, 0, [4, 3], 1, 1], ["AN", 1, 1, 6], ["PR", 4, 0, "auto_unroll_max_step$0"]]]], "r": [[2.37702e-05], 0, 2.07827, 1680134059], "v": "v0.6"}
{"i": [["[\"5b1e704ad5950c6ef36e46f1856366cd\", [1, 768], [768, 768], [1, 768], [1, 768]]", "cuda -keys=cuda,gpu -arch=sm_75 -max_num_threads=1024 -model=2080ti -thread_warp_size=32", [-1, 16, 64, 49152, 2147483647, 1024, 8, 32], "", 0, []], [[], [["CI", 6], ["CI", 5], ["CI", 4], ["SP", 2, 0, 1, [1, 1, 1, 1], 1], ["SP", 2, 5, 768, [2, 96, 1, 2], 1], ["SP", 2, 10, 768, [4, 4], 1], ["RE", 2, [0, 5, 1, 6, 2, 7, 10, 11, 3, 8, 12, 4, 9]], ["FSP", 7, 0, 3, 3], ["FSP", 7, 4, 4, 3], ["RE", 7, [0, 4, 1, 5, 2, 6, 3, 7]], ["CA", 2, 7, 5], ["CHR", 1, "shared", [2]], ["CA", 2, 3, 6], ["CHR", 0, "shared", [3]], ["CA", 1, 4, 6], ["FU", 9, [0, 1]], ["AN", 9, 0, 5], ["FU", 9, [1, 2]], ["AN", 9, 1, 4], ["FU", 9, [2, 3]], ["AN", 9, 2, 6], ["FU", 3, [0, 1]], ["SP", 3, 0, 32, [1], 1], ["AN", 3, 1, 2], ["FFSP", 3, 0, [4, 3], 1, 1], ["AN", 3, 1, 6], ["FU", 1, [0, 1]], ["SP", 1, 0, 16, [1], 1], ["AN", 1, 1, 2], ["FFSP", 1, 0, [4, 3], 1, 1], ["AN", 1, 1, 6], ["PR", 4, 0, "auto_unroll_max_step$16"]]]], "r": [[0.000115345], 0, 2.17675, 1680134060], "v": "v0.6"}
{"i": [["[\"5b1e704ad5950c6ef36e46f1856366cd\", [1, 768], [768, 768], [1, 768], [1, 768]]", "cuda -keys=cuda,gpu -arch=sm_75 -max_num_threads=1024 -model=2080ti -thread_warp_size=32", [-1, 16, 64, 49152, 2147483647, 1024, 8, 32], "", 0, []], [[], [["CI", 6], ["CI", 5], ["CI", 4], ["SP", 2, 0, 1, [1, 1, 1, 1], 1], ["SP", 2, 5, 768, [2, 96, 4, 1], 1], ["SP", 2, 10, 768, [6, 2], 1], ["RE", 2, [0, 5, 1, 6, 2, 7, 10, 11, 3, 8, 12, 4, 9]], ["FSP", 7, 0, 3, 3], ["FSP", 7, 4, 4, 3], ["RE", 7, [0, 4, 1, 5, 2, 6, 3, 7]], ["CA", 2, 7, 5], ["CHR", 1, "shared", [2]], ["CA", 2, 3, 6], ["CHR", 0, "shared", [3]], ["CA", 1, 4, 6], ["FU", 9, [0, 1]], ["AN", 9, 0, 5], ["FU", 9, [1, 2]], ["AN", 9, 1, 4], ["FU", 9, [2, 3]], ["AN", 9, 2, 6], ["FU", 3, [0, 1]], ["SP", 3, 0, 24, [4], 1], ["AN", 3, 1, 2], ["FFSP", 3, 0, [4, 3], 1, 1], ["AN", 3, 1, 6], ["FU", 1, [0, 1]], ["SP", 1, 0, 12, [1], 1], ["AN", 1, 1, 2], ["FFSP", 1, 0, [4, 3], 1, 1], ["AN", 1, 1, 6], ["PR", 4, 0, "auto_unroll_max_step$64"]]]], "r": [[0.000176084], 0, 2.2761, 1680134062], "v": "v0.6"}
{"i": [["[\"5b1e704ad5950c6ef36e46f1856366cd\", [1, 768], [768, 768], [1, 768], [1, 768]]", "cuda -keys=cuda,gpu -arch=sm_75 -max_num_threads=1024 -model=2080ti -thread_warp_size=32", [-1, 16, 64, 49152, 2147483647, 1024, 8, 32], "", 0, []], [[], [["CI", 6], ["CI", 5], ["CI", 4], ["SP", 2, 0, 1, [1, 1, 1, 1], 1], ["SP", 2, 5, 768, [1, 32, 12, 2], 1], ["SP", 2, 10, 768, [1, 2], 1], ["RE", 2, [0, 5, 1, 6, 2, 7, 10, 11, 3, 8, 12, 4, 9]], ["FSP", 7, 0, 3, 3], ["FSP", 7, 4, 4, 3], ["RE", 7, [0, 4, 1, 5, 2, 6, 3, 7]], ["CA", 2, 7, 5], ["CHR", 1, "shared", [2]], ["CA", 2, 3, 6], ["CHR", 0, "shared", [3]], ["CA", 1, 4, 6], ["FU", 9, [0, 1]], ["AN", 9, 0, 5], ["FU", 9, [1, 2]], ["AN", 9, 1, 4], ["FU", 9, [2, 3]], ["AN", 9, 2, 6], ["FU", 3, [0, 1]], ["SP", 3, 0, 288, [1], 1], ["AN", 3, 1, 2], ["FFSP", 3, 0, [4, 3], 1, 1], ["AN", 3, 1, 6], ["FU", 1, [0, 1]], ["SP", 1, 0, 12, [12], 1], ["AN", 1, 1, 2], ["FFSP", 1, 0, [4, 3], 1, 1], ["AN", 1, 1, 6], ["PR", 4, 0, "auto_unroll_max_step$0"]]]], "r": [[0.000701683], 0, 2.05158, 1680134063], "v": "v0.6"}
{"i": [["[\"5b1e704ad5950c6ef36e46f1856366cd\", [1, 768], [768, 768], [1, 768], [1, 768]]", "cuda -keys=cuda,gpu -arch=sm_75 -max_num_threads=1024 -model=2080ti -thread_warp_size=32", [-1, 16, 64, 49152, 2147483647, 1024, 8, 32], "", 0, []], [[], [["CI", 6], ["CI", 5], ["CI", 4], ["SP", 2, 0, 1, [1, 1, 1, 1], 1], ["SP", 2, 5, 768, [6, 16, 1, 2], 1], ["SP", 2, 10, 768, [16, 2], 1], ["RE", 2, [0, 5, 1, 6, 2, 7, 10, 11, 3, 8, 12, 4, 9]], ["FSP", 7, 0, 3, 3], ["FSP", 7, 4, 4, 3], ["RE", 7, [0, 4, 1, 5, 2, 6, 3, 7]], ["CA", 2, 7, 5], ["CHR", 1, "shared", [2]], ["CA", 2, 3, 6], ["CHR", 0, "shared", [3]], ["CA", 1, 4, 6], ["FU", 9, [0, 1]], ["AN", 9, 0, 5], ["FU", 9, [1, 2]], ["AN", 9, 1, 4], ["FU", 9, [2, 3]], ["AN", 9, 2, 6], ["FU", 3, [0, 1]], ["SP", 3, 0, 4, [1], 1], ["AN", 3, 1, 2], ["FFSP", 3, 0, [4, 3], 1, 1], ["AN", 3, 1, 6], ["FU", 1, [0, 1]], ["SP", 1, 0, 4, [4], 1], ["AN", 1, 1, 2], ["FFSP", 1, 0, [4, 3], 1, 1], ["AN", 1, 1, 6], ["PR", 4, 0, "auto_unroll_max_step$0"]]]], "r": [[0.000453781], 0, 2.50527, 1680134065], "v": "v0.6"}
{"i": [["[\"5b1e704ad5950c6ef36e46f1856366cd\", [1, 768], [768, 768], [1, 768], [1, 768]]", "cuda -keys=cuda,gpu -arch=sm_75 -max_num_threads=1024 -model=2080ti -thread_warp_size=32", [-1, 16, 64, 49152, 2147483647, 1024, 8, 32], "", 0, []], [[], [["CI", 6], ["CI", 5], ["CI", 4], ["SP", 2, 0, 1, [1, 1, 1, 1], 1], ["SP", 2, 5, 768, [1, 768, 1, 1], 1], ["SP", 2, 10, 768, [2, 2], 1], ["RE", 2, [0, 5, 1, 6, 2, 7, 10, 11, 3, 8, 12, 4, 9]], ["FSP", 7, 0, 3, 3], ["FSP", 7, 4, 4, 3], ["RE", 7, [0, 4, 1, 5, 2, 6, 3, 7]], ["CA", 2, 7, 5], ["CHR", 1, "shared", [2]], ["CA", 2, 3, 6], ["CHR", 0, "shared", [3]], ["CA", 1, 4, 6], ["FU", 9, [0, 1]], ["AN", 9, 0, 5], ["FU", 9, [1, 2]], ["AN", 9, 1, 4], ["FU", 9, [2, 3]], ["AN", 9, 2, 6], ["FU", 3, [0, 1]], ["SP", 3, 0, 4, [1], 1], ["AN", 3, 1, 2], ["FFSP", 3, 0, [4, 3], 1, 1], ["AN", 3, 1, 6], ["FU", 1, [0, 1]], ["SP", 1, 0, 4, [1], 1], ["AN", 1, 1, 2], ["FFSP", 1, 0, [4, 3], 1, 1], ["AN", 1, 1, 6], ["PR", 4, 0, "auto_unroll_max_step$16"]]]], "r": [[0.00020283], 0, 2.06684, 1680134066], "v": "v0.6"}
{"i": [["[\"5b1e704ad5950c6ef36e46f1856366cd\", [1, 768], [768, 768], [1, 768], [1, 768]]", "cuda -keys=cuda,gpu -arch=sm_75 -max_num_threads=1024 -model=2080ti -thread_warp_size=32", [-1, 16, 64, 49152, 2147483647, 1024, 8, 32], "", 0, []], [[], [["CI", 6], ["CI", 5], ["CI", 4], ["SP", 2, 0, 1, [1, 1, 1, 1], 1], ["SP", 2, 5, 768, [1, 64, 1, 1], 1], ["SP", 2, 10, 768, [24, 2], 1], ["RE", 2, [0, 5, 1, 6, 2, 7, 10, 11, 3, 8, 12, 4, 9]], ["FSP", 7, 0, 3, 3], ["FSP", 7, 4, 4, 3], ["RE", 7, [0, 4, 1, 5, 2, 6, 3, 7]], ["CA", 2, 7, 5], ["CHR", 1, "shared", [2]], ["CA", 2, 3, 6], ["CHR", 0, "shared", [3]], ["CA", 1, 4, 6], ["FU", 9, [0, 1]], ["AN", 9, 0, 5], ["FU", 9, [1, 2]], ["AN", 9, 1, 4], ["FU", 9, [2, 3]], ["AN", 9, 2, 6], ["FU", 3, [0, 1]], ["SP", 3, 0, 48, [1], 1], ["AN", 3, 1, 2], ["FFSP", 3, 0, [4, 3], 1, 1], ["AN", 3, 1, 6], ["FU", 1, [0, 1]], ["SP", 1, 0, 48, [1], 1], ["AN", 1, 1, 2], ["FFSP", 1, 0, [4, 3], 1, 1], ["AN", 1, 1, 6], ["PR", 4, 0, "auto_unroll_max_step$16"]]]], "r": [[4.57342e-05], 0, 1.97316, 1680134068], "v": "v0.6"}
{"i": [["[\"5b1e704ad5950c6ef36e46f1856366cd\", [1, 768], [768, 768], [1, 768], [1, 768]]", "cuda -keys=cuda,gpu -arch=sm_75 -max_num_threads=1024 -model=2080ti -thread_warp_size=32", [-1, 16, 64, 49152, 2147483647, 1024, 8, 32], "", 0, []], [[], [["CI", 6], ["CI", 5], ["CI", 4], ["SP", 2, 0, 1, [1, 1, 1, 1], 1], ["SP", 2, 5, 768, [1, 192, 2, 1], 1], ["SP", 2, 10, 768, [1, 3], 1], ["RE", 2, [0, 5, 1, 6, 2, 7, 10, 11, 3, 8, 12, 4, 9]], ["FSP", 7, 0, 3, 3], ["FSP", 7, 4, 4, 3], ["RE", 7, [0, 4, 1, 5, 2, 6, 3, 7]], ["CA", 2, 7, 5], ["CHR", 1, "shared", [2]], ["CA", 2, 3, 6], ["CHR", 0, "shared", [3]], ["CA", 1, 4, 6], ["FU", 9, [0, 1]], ["AN", 9, 0, 5], ["FU", 9, [1, 2]], ["AN", 9, 1, 4], ["FU", 9, [2, 3]], ["AN", 9, 2, 6], ["FU", 3, [0, 1]], ["SP", 3, 0, 3, [1], 1], ["AN", 3, 1, 2], ["FFSP", 3, 0, [4, 3], 1, 1], ["AN", 3, 1, 6], ["FU", 1, [0, 1]], ["SP", 1, 0, 3, [1], 1], ["AN", 1, 1, 2], ["FFSP", 1, 0, [4, 3], 1, 1], ["AN", 1, 1, 6], ["PR", 4, 0, "auto_unroll_max_step$16"]]]], "r": [[0.000145823], 0, 2.18379, 1680134069], "v": "v0.6"}
{"i": [["[\"5b1e704ad5950c6ef36e46f1856366cd\", [1, 768], [768, 768], [1, 768], [1, 768]]", "cuda -keys=cuda,gpu -arch=sm_75 -max_num_threads=1024 -model=2080ti -thread_warp_size=32", [-1, 16, 64, 49152, 2147483647, 1024, 8, 32], "", 0, []], [[], [["CI", 6], ["CI", 5], ["CI", 4], ["SP", 2, 0, 1, [1, 1, 1, 1], 1], ["SP", 2, 5, 768, [1, 96, 1, 2], 1], ["SP", 2, 10, 768, [1, 3], 1], ["RE", 2, [0, 5, 1, 6, 2, 7, 10, 11, 3, 8, 12, 4, 9]], ["FSP", 7, 0, 3, 3], ["FSP", 7, 4, 4, 3], ["RE", 7, [0, 4, 1, 5, 2, 6, 3, 7]], ["CA", 2, 7, 5], ["CHR", 1, "shared", [2]], ["CA", 2, 3, 6], ["CHR", 0, "shared", [3]], ["CA", 1, 4, 6], ["FU", 9, [0, 1]], ["AN", 9, 0, 5], ["FU", 9, [1, 2]], ["AN", 9, 1, 4], ["FU", 9, [2, 3]], ["AN", 9, 2, 6], ["FU", 3, [0, 1]], ["SP", 3, 0, 6, [3], 1], ["AN", 3, 1, 2], ["FFSP", 3, 0, [4, 3], 1, 1], ["AN", 3, 1, 6], ["FU", 1, [0, 1]], ["SP", 1, 0, 3, [3], 1], ["AN", 1, 1, 2], ["FFSP", 1, 0, [4, 3], 1, 1], ["AN", 1, 1, 6], ["PR", 4, 0, "auto_unroll_max_step$512"]]]], "r": [[0.000160381], 0, 2.0669, 1680134070], "v": "v0.6"}
{"i": [["[\"5b1e704ad5950c6ef36e46f1856366cd\", [1, 768], [768, 768], [1, 768], [1, 768]]", "cuda -keys=cuda,gpu -arch=sm_75 -max_num_threads=1024 -model=2080ti -thread_warp_size=32", [-1, 16, 64, 49152, 2147483647, 1024, 8, 32], "", 0, []], [[], [["CI", 6], ["CI", 5], ["CI", 4], ["SP", 2, 0, 1, [1, 1, 1, 1], 1], ["SP", 2, 5, 768, [1, 256, 1, 3], 1], ["SP", 2, 10, 768, [1, 2], 1], ["RE", 2, [0, 5, 1, 6, 2, 7, 10, 11, 3, 8, 12, 4, 9]], ["FSP", 7, 0, 3, 3], ["FSP", 7, 4, 4, 3], ["RE", 7, [0, 4, 1, 5, 2, 6, 3, 7]], ["CA", 2, 7, 5], ["CHR", 1, "shared", [2]], ["CA", 2, 3, 6], ["CHR", 0, "shared", [3]], ["CA", 1, 4, 6], ["FU", 9, [0, 1]], ["AN", 9, 0, 5], ["FU", 9, [1, 2]], ["AN", 9, 1, 4], ["FU", 9, [2, 3]], ["AN", 9, 2, 6], ["FU", 3, [0, 1]], ["SP", 3, 0, 2, [2], 1], ["AN", 3, 1, 2], ["FFSP", 3, 0, [4, 3], 1, 1], ["AN", 3, 1, 6], ["FU", 1, [0, 1]], ["SP", 1, 0, 2, [1], 1], ["AN", 1, 1, 2], ["FFSP", 1, 0, [4, 3], 1, 1], ["AN", 1, 1, 6], ["PR", 4, 0, "auto_unroll_max_step$1024"]]]], "r": [[0.00032691], 0, 2.05789, 1680134072], "v": "v0.6"}
