saved_logs/Ansor-2023-03-28/autoscheduler/2080ti/bert-B1-float32.json
{"i": [["[\"4b5e216f8244b4e8f7b6543c4a9087e5\", [1536, 128], [1536, 128]]", "cuda -keys=cuda,gpu -arch=sm_75 -max_num_threads=1024 -model=2080ti -thread_warp_size=32", [-1, 16, 64, 49152, 2147483647, 1024, 8, 32], "", 0, []], [[], [["SP", 5, 1, 128, [32], 1], ["AN", 5, 2, 6], ["FSP", 4, 1, 0, 1], ["AN", 4, 2, 6], ["CA", 4, 5, 0], ["CI", 3], ["CI", 2], ["FSP", 1, 1, 0, 1], ["AN", 1, 2, 6], ["CA", 1, 5, 0], ["AN", 5, 0, 5], ["PR", 1, 0, "auto_unroll_max_step$0"], ["PR", 4, 0, "auto_unroll_max_step$1024"]]]], "r": [[5.97363e-06], 0, 1.82886, 1680067902], "v": "v0.6"}
{"i": [["[\"4b5e216f8244b4e8f7b6543c4a9087e5\", [1536, 128], [1536, 128]]", "cuda -keys=cuda,gpu -arch=sm_75 -max_num_threads=1024 -model=2080ti -thread_warp_size=32", [-1, 16, 64, 49152, 2147483647, 1024, 8, 32], "", 0, []], [[], [["CI", 3], ["CI", 2], ["SP", 1, 1, 128, [64], 1], ["AN", 1, 2, 6], ["FU", 5, [0, 1]], ["SP", 5, 0, 196608, [32], 1], ["AN", 5, 0, 5], ["AN", 5, 1, 6], ["SP", 4, 0, 1536, [64], 1], ["AN", 4, 0, 5], ["AN", 4, 1, 6], ["AN", 1, 0, 5], ["PR", 1, 0, "auto_unroll_max_step$16"], ["PR", 4, 0, "auto_unroll_max_step$512"]]]], "r": [[2.22691e-05], 0, 1.91367, 1680067903], "v": "v0.6"}
{"i": [["[\"4b5e216f8244b4e8f7b6543c4a9087e5\", [1536, 128], [1536, 128]]", "cuda -keys=cuda,gpu -arch=sm_75 -max_num_threads=1024 -model=2080ti -thread_warp_size=32", [-1, 16, 64, 49152, 2147483647, 1024, 8, 32], "", 0, []], [[], [["CI", 3], ["CI", 2], ["FU", 5, [0, 1]], ["SP", 5, 0, 196608, [32], 1], ["AN", 5, 0, 5], ["AN", 5, 1, 6], ["SP", 4, 0, 1536, [32], 1], ["AN", 4, 0, 5], ["AN", 4, 1, 6], ["SP", 1, 0, 1536, [32], 1], ["AN", 1, 0, 5], ["AN", 1, 1, 6], ["PR", 1, 0, "auto_unroll_max_step$0"], ["PR", 4, 0, "auto_unroll_max_step$16"]]]], "r": [[2.84197e-05], 0, 2.02242, 1680067904], "v": "v0.6"}
{"i": [["[\"4b5e216f8244b4e8f7b6543c4a9087e5\", [1536, 128], [1536, 128]]", "cuda -keys=cuda,gpu -arch=sm_75 -max_num_threads=1024 -model=2080ti -thread_warp_size=32", [-1, 16, 64, 49152, 2147483647, 1024, 8, 32], "", 0, []], [[], [["CI", 3], ["CI", 2], ["FU", 5, [0, 1]], ["SP", 5, 0, 196608, [32], 1], ["AN", 5, 0, 5], ["AN", 5, 1, 6], ["SP", 4, 0, 1536, [32], 1], ["AN", 4, 0, 5], ["AN", 4, 1, 6], ["SP", 1, 0, 1536, [4], 1], ["AN", 1, 0, 5], ["AN", 1, 1, 6], ["PR", 1, 0, "auto_unroll_max_step$0"], ["PR", 4, 0, "auto_unroll_max_step$64"]]]], "r": [[2.69285e-05], 0, 1.95719, 1680067906], "v": "v0.6"}
{"i": [["[\"4b5e216f8244b4e8f7b6543c4a9087e5\", [1536, 128], [1536, 128]]", "cuda -keys=cuda,gpu -arch=sm_75 -max_num_threads=1024 -model=2080ti -thread_warp_size=32", [-1, 16, 64, 49152, 2147483647, 1024, 8, 32], "", 0, []], [[], [["CI", 3], ["CI", 2], ["FU", 5, [0, 1]], ["SP", 5, 0, 196608, [32], 1], ["AN", 5, 0, 5], ["AN", 5, 1, 6], ["SP", 4, 0, 1536, [64], 1], ["AN", 4, 0, 5], ["AN", 4, 1, 6], ["SP", 1, 0, 1536, [64], 1], ["AN", 1, 0, 5], ["AN", 1, 1, 6], ["PR", 1, 0, "auto_unroll_max_step$512"], ["PR", 4, 0, "auto_unroll_max_step$0"]]]], "r": [[2.68456e-05], 0, 2.03117, 1680067907], "v": "v0.6"}
{"i": [["[\"4b5e216f8244b4e8f7b6543c4a9087e5\", [1536, 128], [1536, 128]]", "cuda -keys=cuda,gpu -arch=sm_75 -max_num_threads=1024 -model=2080ti -thread_warp_size=32", [-1, 16, 64, 49152, 2147483647, 1024, 8, 32], "", 0, []], [[], [["CI", 3], ["CI", 2], ["SP", 1, 1, 128, [32], 1], ["AN", 1, 2, 6], ["FU", 5, [0, 1]], ["SP", 5, 0, 196608, [32], 1], ["AN", 5, 0, 5], ["AN", 5, 1, 6], ["SP", 4, 0, 1536, [32], 1], ["AN", 4, 0, 5], ["AN", 4, 1, 6], ["AN", 1, 0, 5], ["PR", 1, 0, "auto_unroll_max_step$16"], ["PR", 4, 0, "auto_unroll_max_step$0"]]]], "r": [[2.36835e-05], 0, 1.89097, 1680067908], "v": "v0.6"}
{"i": [["[\"4b5e216f8244b4e8f7b6543c4a9087e5\", [1536, 128], [1536, 128]]", "cuda -keys=cuda,gpu -arch=sm_75 -max_num_threads=1024 -model=2080ti -thread_warp_size=32", [-1, 16, 64, 49152, 2147483647, 1024, 8, 32], "", 0, []], [[], [["CI", 3], ["CI", 2], ["SP", 1, 1, 128, [64], 1], ["AN", 1, 2, 6], ["FU", 5, [0, 1]], ["SP", 5, 0, 196608, [64], 1], ["AN", 5, 0, 5], ["AN", 5, 1, 6], ["SP", 4, 0, 1536, [32], 1], ["AN", 4, 0, 5], ["AN", 4, 1, 6], ["AN", 1, 0, 5], ["PR", 1, 0, "auto_unroll_max_step$64"], ["PR", 4, 0, "auto_unroll_max_step$64"]]]], "r": [[2.14825e-05], 0, 1.86658, 1680067910], "v": "v0.6"}
{"i": [["[\"4b5e216f8244b4e8f7b6543c4a9087e5\", [1536, 128], [1536, 128]]", "cuda -keys=cuda,gpu -arch=sm_75 -max_num_threads=1024 -model=2080ti -thread_warp_size=32", [-1, 16, 64, 49152, 2147483647, 1024, 8, 32], "", 0, []], [[], [["SP", 5, 1, 128, [16], 1], ["AN", 5, 2, 6], ["FSP", 4, 1, 0, 1], ["AN", 4, 2, 6], ["CA", 4, 5, 0], ["CI", 3], ["CI", 2], ["FSP", 1, 1, 0, 1], ["AN", 1, 2, 6], ["CA", 1, 5, 0], ["AN", 5, 0, 5], ["PR", 1, 0, "auto_unroll_max_step$64"], ["PR", 4, 0, "auto_unroll_max_step$512"]]]], "r": [[8.19133e-06], 0, 1.96751, 1680067911], "v": "v0.6"}
{"i": [["[\"4b5e216f8244b4e8f7b6543c4a9087e5\", [1536, 128], [1536, 128]]", "cuda -keys=cuda,gpu -arch=sm_75 -max_num_threads=1024 -model=2080ti -thread_warp_size=32", [-1, 16, 64, 49152, 2147483647, 1024, 8, 32], "", 0, []], [[], [["CI", 3], ["CI", 2], ["FU", 5, [0, 1]], ["SP", 5, 0, 196608, [8], 1], ["AN", 5, 0, 5], ["AN", 5, 1, 6], ["SP", 4, 0, 1536, [64], 1], ["AN", 4, 0, 5], ["AN", 4, 1, 6], ["SP", 1, 0, 1536, [64], 1], ["AN", 1, 0, 5], ["AN", 1, 1, 6], ["PR", 1, 0, "auto_unroll_max_step$1024"], ["PR", 4, 0, "auto_unroll_max_step$1024"]]]], "r": [[4.24608e-05], 0, 1.93034, 1680067912], "v": "v0.6"}
{"i": [["[\"4b5e216f8244b4e8f7b6543c4a9087e5\", [1536, 128], [1536, 128]]", "cuda -keys=cuda,gpu -arch=sm_75 -max_num_threads=1024 -model=2080ti -thread_warp_size=32", [-1, 16, 64, 49152, 2147483647, 1024, 8, 32], "", 0, []], [[], [["CI", 3], ["CI", 2], ["SP", 1, 1, 128, [64], 1], ["AN", 1, 2, 6], ["FU", 5, [0, 1]], ["SP", 5, 0, 196608, [32], 1], ["AN", 5, 0, 5], ["AN", 5, 1, 6], ["SP", 4, 0, 1536, [2], 1], ["AN", 4, 0, 5], ["AN", 4, 1, 6], ["AN", 1, 0, 5], ["PR", 1, 0, "auto_unroll_max_step$64"], ["PR", 4, 0, "auto_unroll_max_step$64"]]]], "r": [[2.38866e-05], 0, 1.97605, 1680067914], "v": "v0.6"}
{"i": [["[\"4b5e216f8244b4e8f7b6543c4a9087e5\", [1536, 128], [1536, 128]]", "cuda -keys=cuda,gpu -arch=sm_75 -max_num_threads=1024 -model=2080ti -thread_warp_size=32", [-1, 16, 64, 49152, 2147483647, 1024, 8, 32], "", 0, []], [[], [["CI", 3], ["CI", 2], ["SP", 1, 1, 128, [32], 1], ["AN", 1, 2, 6], ["FU", 5, [0, 1]], ["SP", 5, 0, 196608, [32], 1], ["AN", 5, 0, 5], ["AN", 5, 1, 6], ["SP", 4, 0, 1536, [16], 1], ["AN", 4, 0, 5], ["AN", 4, 1, 6], ["AN", 1, 0, 5], ["PR", 1, 0, "auto_unroll_max_step$512"], ["PR", 4, 0, "auto_unroll_max_step$16"]]]], "r": [[2.05709e-05], 0, 1.96116, 1680067915], "v": "v0.6"}
{"i": [["[\"4b5e216f8244b4e8f7b6543c4a9087e5\", [1536, 128], [1536, 128]]", "cuda -keys=cuda,gpu -arch=sm_75 -max_num_threads=1024 -model=2080ti -thread_warp_size=32", [-1, 16, 64, 49152, 2147483647, 1024, 8, 32], "", 0, []], [[], [["SP", 5, 1, 128, [64], 1], ["AN", 5, 2, 6], ["FSP", 4, 1, 0, 1], ["AN", 4, 2, 6], ["CA", 4, 5, 0], ["CI", 3], ["CI", 2], ["FSP", 1, 1, 0, 1], ["AN", 1, 2, 6], ["CA", 1, 5, 0], ["AN", 5, 0, 5], ["PR", 1, 0, "auto_unroll_max_step$512"], ["PR", 4, 0, "auto_unroll_max_step$64"]]]], "r": [[6.1187e-06], 0, 1.65731, 1680067916], "v": "v0.6"}
{"i": [["[\"4b5e216f8244b4e8f7b6543c4a9087e5\", [1536, 128], [1536, 128]]", "cuda -keys=cuda,gpu -arch=sm_75 -max_num_threads=1024 -model=2080ti -thread_warp_size=32", [-1, 16, 64, 49152, 2147483647, 1024, 8, 32], "", 0, []], [[], [["SP", 5, 1, 128, [16], 1], ["AN", 5, 2, 6], ["FSP", 4, 1, 0, 1], ["AN", 4, 2, 6], ["CA", 4, 5, 0], ["CI", 3], ["CI", 2], ["AN", 5, 0, 5], ["SP", 1, 0, 1536, [64], 1], ["AN", 1, 0, 5], ["AN", 1, 1, 6], ["PR", 1, 0, "auto_unroll_max_step$1024"], ["PR", 4, 0, "auto_unroll_max_step$64"]]]], "r": [[1.63846e-05], 0, 2.21772, 1680067917], "v": "v0.6"}
{"i": [["[\"4b5e216f8244b4e8f7b6543c4a9087e5\", [1536, 128], [1536, 128]]", "cuda -keys=cuda,gpu -arch=sm_75 -max_num_threads=1024 -model=2080ti -thread_warp_size=32", [-1, 16, 64, 49152, 2147483647, 1024, 8, 32], "", 0, []], [[], [["SP", 5, 1, 128, [64], 1], ["AN", 5, 2, 6], ["FSP", 4, 1, 0, 1], ["AN", 4, 2, 6], ["CA", 4, 5, 0], ["CI", 3], ["CI", 2], ["AN", 5, 0, 5], ["SP", 1, 0, 1536, [16], 1], ["AN", 1, 0, 5], ["AN", 1, 1, 6], ["PR", 1, 0, "auto_unroll_max_step$1024"], ["PR", 4, 0, "auto_unroll_max_step$64"]]]], "r": [[1.15283e-05], 0, 1.84272, 1680067919], "v": "v0.6"}
{"i": [["[\"4b5e216f8244b4e8f7b6543c4a9087e5\", [1536, 128], [1536, 128]]", "cuda -keys=cuda,gpu -arch=sm_75 -max_num_threads=1024 -model=2080ti -thread_warp_size=32", [-1, 16, 64, 49152, 2147483647, 1024, 8, 32], "", 0, []], [[], [["SP", 5, 1, 128, [4], 1], ["AN", 5, 2, 6], ["FSP", 4, 1, 0, 1], ["AN", 4, 2, 6], ["CA", 4, 5, 0], ["CI", 3], ["CI", 2], ["FSP", 1, 1, 0, 1], ["AN", 1, 2, 6], ["CA", 1, 5, 0], ["AN", 5, 0, 5], ["PR", 1, 0, "auto_unroll_max_step$512"], ["PR", 4, 0, "auto_unroll_max_step$64"]]]], "r": [[2.26914e-05], 0, 3.04344, 1680067920], "v": "v0.6"}
{"i": [["[\"4b5e216f8244b4e8f7b6543c4a9087e5\", [1536, 128], [1536, 128]]", "cuda -keys=cuda,gpu -arch=sm_75 -max_num_threads=1024 -model=2080ti -thread_warp_size=32", [-1, 16, 64, 49152, 2147483647, 1024, 8, 32], "", 0, []], [[], [["CI", 3], ["CI", 2], ["SP", 1, 1, 128, [32], 1], ["AN", 1, 2, 6], ["FU", 5, [0, 1]], ["SP", 5, 0, 196608, [32], 1], ["AN", 5, 0, 5], ["AN", 5, 1, 6], ["SP", 4, 0, 1536, [64], 1], ["AN", 4, 0, 5], ["AN", 4, 1, 6], ["AN", 1, 0, 5], ["PR", 1, 0, "auto_unroll_max_step$0"], ["PR", 4, 0, "auto_unroll_max_step$16"]]]], "r": [[2.17646e-05], 0, 1.89941, 1680067921], "v": "v0.6"}
{"i": [["[\"4b5e216f8244b4e8f7b6543c4a9087e5\", [1536, 128], [1536, 128]]", "cuda -keys=cuda,gpu -arch=sm_75 -max_num_threads=1024 -model=2080ti -thread_warp_size=32", [-1, 16, 64, 49152, 2147483647, 1024, 8, 32], "", 0, []], [[], [["CI", 3], ["CI", 2], ["FU", 5, [0, 1]], ["SP", 5, 0, 196608, [2], 1], ["AN", 5, 0, 5], ["AN", 5, 1, 6], ["SP", 4, 0, 1536, [64], 1], ["AN", 4, 0, 5], ["AN", 4, 1, 6], ["SP", 1, 0, 1536, [32], 1], ["AN", 1, 0, 5], ["AN", 1, 1, 6], ["PR", 1, 0, "auto_unroll_max_step$16"], ["PR", 4, 0, "auto_unroll_max_step$16"]]]], "r": [[0.000104613], 0, 2.05743, 1680067923], "v": "v0.6"}
{"i": [["[\"4b5e216f8244b4e8f7b6543c4a9087e5\", [1536, 128], [1536, 128]]", "cuda -keys=cuda,gpu -arch=sm_75 -max_num_threads=1024 -model=2080ti -thread_warp_size=32", [-1, 16, 64, 49152, 2147483647, 1024, 8, 32], "", 0, []], [[], [["SP", 5, 1, 128, [32], 1], ["AN", 5, 2, 6], ["FSP", 4, 1, 0, 1], ["AN", 4, 2, 6], ["CA", 4, 5, 0], ["CI", 3], ["CI", 2], ["AN", 5, 0, 5], ["SP", 1, 0, 1536, [1], 1], ["AN", 1, 0, 5], ["AN", 1, 1, 6], ["PR", 1, 0, "auto_unroll_max_step$0"], ["PR", 4, 0, "auto_unroll_max_step$1024"]]]], "r": [[1.31367e-05], 0, 2.0655, 1680067924], "v": "v0.6"}
{"i": [["[\"4b5e216f8244b4e8f7b6543c4a9087e5\", [1536, 128], [1536, 128]]", "cuda -keys=cuda,gpu -arch=sm_75 -max_num_threads=1024 -model=2080ti -thread_warp_size=32", [-1, 16, 64, 49152, 2147483647, 1024, 8, 32], "", 0, []], [[], [["CI", 3], ["CI", 2], ["SP", 1, 1, 128, [32], 1], ["AN", 1, 2, 6], ["FU", 5, [0, 1]], ["SP", 5, 0, 196608, [32], 1], ["AN", 5, 0, 5], ["AN", 5, 1, 6], ["SP", 4, 0, 1536, [1], 1], ["AN", 4, 0, 5], ["AN", 4, 1, 6], ["AN", 1, 0, 5], ["PR", 1, 0, "auto_unroll_max_step$512"], ["PR", 4, 0, "auto_unroll_max_step$512"]]]], "r": [[3.14716e-05], 0, 2.04408, 1680067925], "v": "v0.6"}
{"i": [["[\"4b5e216f8244b4e8f7b6543c4a9087e5\", [1536, 128], [1536, 128]]", "cuda -keys=cuda,gpu -arch=sm_75 -max_num_threads=1024 -model=2080ti -thread_warp_size=32", [-1, 16, 64, 49152, 2147483647, 1024, 8, 32], "", 0, []], [[], [["SP", 5, 1, 128, [16], 1], ["AN", 5, 2, 6], ["FSP", 4, 1, 0, 1], ["AN", 4, 2, 6], ["CA", 4, 5, 0], ["CI", 3], ["CI", 2], ["FSP", 1, 1, 0, 1], ["AN", 1, 2, 6], ["CA", 1, 5, 0], ["AN", 5, 0, 5], ["PR", 1, 0, "auto_unroll_max_step$512"], ["PR", 4, 0, "auto_unroll_max_step$16"]]]], "r": [[8.19257e-06], 0, 2.08843, 1680067926], "v": "v0.6"}
{"i": [["[\"4b5e216f8244b4e8f7b6543c4a9087e5\", [1536, 128], [1536, 128]]", "cuda -keys=cuda,gpu -arch=sm_75 -max_num_threads=1024 -model=2080ti -thread_warp_size=32", [-1, 16, 64, 49152, 2147483647, 1024, 8, 32], "", 0, []], [[], [["SP", 5, 1, 128, [64], 1], ["AN", 5, 2, 6], ["FSP", 4, 1, 0, 1], ["AN", 4, 2, 6], ["CA", 4, 5, 0], ["CI", 3], ["CI", 2], ["AN", 5, 0, 5], ["SP", 1, 0, 1536, [4], 1], ["AN", 1, 0, 5], ["AN", 1, 1, 6], ["PR", 1, 0, "auto_unroll_max_step$64"], ["PR", 4, 0, "auto_unroll_max_step$512"]]]], "r": [[1.14598e-05], 0, 1.83301, 1680067928], "v": "v0.6"}
{"i": [["[\"4b5e216f8244b4e8f7b6543c4a9087e5\", [1536, 128], [1536, 128]]", "cuda -keys=cuda,gpu -arch=sm_75 -max_num_threads=1024 -model=2080ti -thread_warp_size=32", [-1, 16, 64, 49152, 2147483647, 1024, 8, 32], "", 0, []], [[], [["SP", 5, 1, 128, [8], 1], ["AN", 5, 2, 6], ["FSP", 4, 1, 0, 1], ["AN", 4, 2, 6], ["CA", 4, 5, 0], ["CI", 3], ["CI", 2], ["FSP", 1, 1, 0, 1], ["AN", 1, 2, 6], ["CA", 1, 5, 0], ["AN", 5, 0, 5], ["PR", 1, 0, "auto_unroll_max_step$1024"], ["PR", 4, 0, "auto_unroll_max_step$512"]]]], "r": [[1.27754e-05], 0, 2.5139, 1680067929], "v": "v0.6"}
{"i": [["[\"4b5e216f8244b4e8f7b6543c4a9087e5\", [1536, 128], [1536, 128]]", "cuda -keys=cuda,gpu -arch=sm_75 -max_num_threads=1024 -model=2080ti -thread_warp_size=32", [-1, 16, 64, 49152, 2147483647, 1024, 8, 32], "", 0, []], [[], [["SP", 5, 1, 128, [4], 1], ["AN", 5, 2, 6], ["FSP", 4, 1, 0, 1], ["AN", 4, 2, 6], ["CA", 4, 5, 0], ["CI", 3], ["CI", 2], ["AN", 5, 0, 5], ["SP", 1, 0, 1536, [32], 1], ["AN", 1, 0, 5], ["AN", 1, 1, 6], ["PR", 1, 0, "auto_unroll_max_step$1024"], ["PR", 4, 0, "auto_unroll_max_step$64"]]]], "r": [[3.02223e-05], 0, 3.1822, 1680067930], "v": "v0.6"}
{"i": [["[\"4b5e216f8244b4e8f7b6543c4a9087e5\", [1536, 128], [1536, 128]]", "cuda -keys=cuda,gpu -arch=sm_75 -max_num_threads=1024 -model=2080ti -thread_warp_size=32", [-1, 16, 64, 49152, 2147483647, 1024, 8, 32], "", 0, []], [[], [["SP", 5, 1, 128, [8], 1], ["AN", 5, 2, 6], ["FSP", 4, 1, 0, 1], ["AN", 4, 2, 6], ["CA", 4, 5, 0], ["CI", 3], ["CI", 2], ["FSP", 1, 1, 0, 1], ["AN", 1, 2, 6], ["CA", 1, 5, 0], ["AN", 5, 0, 5], ["PR", 1, 0, "auto_unroll_max_step$64"], ["PR", 4, 0, "auto_unroll_max_step$0"]]]], "r": [[1.32601e-05], 0, 1.91357, 1680067931], "v": "v0.6"}
{"i": [["[\"4b5e216f8244b4e8f7b6543c4a9087e5\", [1536, 128], [1536, 128]]", "cuda -keys=cuda,gpu -arch=sm_75 -max_num_threads=1024 -model=2080ti -thread_warp_size=32", [-1, 16, 64, 49152, 2147483647, 1024, 8, 32], "", 0, []], [[], [["CI", 3], ["CI", 2], ["SP", 1, 1, 128, [64], 1], ["AN", 1, 2, 6], ["FU", 5, [0, 1]], ["SP", 5, 0, 196608, [32], 1], ["AN", 5, 0, 5], ["AN", 5, 1, 6], ["SP", 4, 0, 1536, [64], 1], ["AN", 4, 0, 5], ["AN", 4, 1, 6], ["AN", 1, 0, 5], ["PR", 1, 0, "auto_unroll_max_step$16"], ["PR", 4, 0, "auto_unroll_max_step$1024"]]]], "r": [[2.2265e-05], 0, 1.95144, 1680067933], "v": "v0.6"}
{"i": [["[\"4b5e216f8244b4e8f7b6543c4a9087e5\", [1536, 128], [1536, 128]]", "cuda -keys=cuda,gpu -arch=sm_75 -max_num_threads=1024 -model=2080ti -thread_warp_size=32", [-1, 16, 64, 49152, 2147483647, 1024, 8, 32], "", 0, []], [[], [["SP", 5, 1, 128, [32], 1], ["AN", 5, 2, 6], ["FSP", 4, 1, 0, 1], ["AN", 4, 2, 6], ["CA", 4, 5, 0], ["CI", 3], ["CI", 2], ["FSP", 1, 1, 0, 1], ["AN", 1, 2, 6], ["CA", 1, 5, 0], ["AN", 5, 0, 5], ["PR", 1, 0, "auto_unroll_max_step$0"], ["PR", 4, 0, "auto_unroll_max_step$0"]]]], "r": [[5.9932e-06], 0, 1.76363, 1680067934], "v": "v0.6"}
{"i": [["[\"4b5e216f8244b4e8f7b6543c4a9087e5\", [1536, 128], [1536, 128]]", "cuda -keys=cuda,gpu -arch=sm_75 -max_num_threads=1024 -model=2080ti -thread_warp_size=32", [-1, 16, 64, 49152, 2147483647, 1024, 8, 32], "", 0, []], [[], [["SP", 5, 1, 128, [2], 1], ["AN", 5, 2, 6], ["FSP", 4, 1, 0, 1], ["AN", 4, 2, 6], ["CA", 4, 5, 0], ["CI", 3], ["CI", 2], ["AN", 5, 0, 5], ["SP", 1, 0, 1536, [32], 1], ["AN", 1, 0, 5], ["AN", 1, 1, 6], ["PR", 1, 0, "auto_unroll_max_step$0"], ["PR", 4, 0, "auto_unroll_max_step$0"]]]], "r": [[5.12442e-05], 0, 2.11397, 1680067935], "v": "v0.6"}
{"i": [["[\"4b5e216f8244b4e8f7b6543c4a9087e5\", [1536, 128], [1536, 128]]", "cuda -keys=cuda,gpu -arch=sm_75 -max_num_threads=1024 -model=2080ti -thread_warp_size=32", [-1, 16, 64, 49152, 2147483647, 1024, 8, 32], "", 0, []], [[], [["CI", 3], ["CI", 2], ["SP", 1, 1, 128, [32], 1], ["AN", 1, 2, 6], ["FU", 5, [0, 1]], ["SP", 5, 0, 196608, [64], 1], ["AN", 5, 0, 5], ["AN", 5, 1, 6], ["SP", 4, 0, 1536, [64], 1], ["AN", 4, 0, 5], ["AN", 4, 1, 6], ["AN", 1, 0, 5], ["PR", 1, 0, "auto_unroll_max_step$64"], ["PR", 4, 0, "auto_unroll_max_step$64"]]]], "r": [[1.90715e-05], 0, 1.90206, 1680067937], "v": "v0.6"}
{"i": [["[\"4b5e216f8244b4e8f7b6543c4a9087e5\", [1536, 128], [1536, 128]]", "cuda -keys=cuda,gpu -arch=sm_75 -max_num_threads=1024 -model=2080ti -thread_warp_size=32", [-1, 16, 64, 49152, 2147483647, 1024, 8, 32], "", 0, []], [[], [["SP", 5, 1, 128, [32], 1], ["AN", 5, 2, 6], ["FSP", 4, 1, 0, 1], ["AN", 4, 2, 6], ["CA", 4, 5, 0], ["CI", 3], ["CI", 2], ["FSP", 1, 1, 0, 1], ["AN", 1, 2, 6], ["CA", 1, 5, 0], ["AN", 5, 0, 5], ["PR", 1, 0, "auto_unroll_max_step$16"], ["PR", 4, 0, "auto_unroll_max_step$1024"]]]], "r": [[5.97073e-06], 0, 1.96046, 1680067938], "v": "v0.6"}
{"i": [["[\"4b5e216f8244b4e8f7b6543c4a9087e5\", [1536, 128], [1536, 128]]", "cuda -keys=cuda,gpu -arch=sm_75 -max_num_threads=1024 -model=2080ti -thread_warp_size=32", [-1, 16, 64, 49152, 2147483647, 1024, 8, 32], "", 0, []], [[], [["CI", 3], ["CI", 2], ["FU", 5, [0, 1]], ["SP", 5, 0, 196608, [4], 1], ["AN", 5, 0, 5], ["AN", 5, 1, 6], ["SP", 4, 0, 1536, [64], 1], ["AN", 4, 0, 5], ["AN", 4, 1, 6], ["SP", 1, 0, 1536, [64], 1], ["AN", 1, 0, 5], ["AN", 1, 1, 6], ["PR", 1, 0, "auto_unroll_max_step$16"], ["PR", 4, 0, "auto_unroll_max_step$16"]]]], "r": [[6.33814e-05], 0, 2.05102, 1680067939], "v": "v0.6"}
{"i": [["[\"4b5e216f8244b4e8f7b6543c4a9087e5\", [1536, 128], [1536, 128]]", "cuda -keys=cuda,gpu -arch=sm_75 -max_num_threads=1024 -model=2080ti -thread_warp_size=32", [-1, 16, 64, 49152, 2147483647, 1024, 8, 32], "", 0, []], [[], [["CI", 3], ["CI", 2], ["SP", 1, 1, 128, [32], 1], ["AN", 1, 2, 6], ["FU", 5, [0, 1]], ["SP", 5, 0, 196608, [32], 1], ["AN", 5, 0, 5], ["AN", 5, 1, 6], ["SP", 4, 0, 1536, [32], 1], ["AN", 4, 0, 5], ["AN", 4, 1, 6], ["AN", 1, 0, 5], ["PR", 1, 0, "auto_unroll_max_step$64"], ["PR", 4, 0, "auto_unroll_max_step$64"]]]], "r": [[2.36721e-05], 0, 2.04278, 1680067940], "v": "v0.6"}
{"i": [["[\"4b5e216f8244b4e8f7b6543c4a9087e5\", [1536, 128], [1536, 128]]", "cuda -keys=cuda,gpu -arch=sm_75 -max_num_threads=1024 -model=2080ti -thread_warp_size=32", [-1, 16, 64, 49152, 2147483647, 1024, 8, 32], "", 0, []], [[], [["SP", 5, 1, 128, [1], 1], ["AN", 5, 2, 6], ["FSP", 4, 1, 0, 1], ["AN", 4, 2, 6], ["CA", 4, 5, 0], ["CI", 3], ["CI", 2], ["FSP", 1, 1, 0, 1], ["AN", 1, 2, 6], ["CA", 1, 5, 0], ["AN", 5, 0, 5], ["PR", 1, 0, "auto_unroll_max_step$16"], ["PR", 4, 0, "auto_unroll_max_step$64"]]]], "r": [[7.91996e-05], 0, 1.93223, 1680067942], "v": "v0.6"}
{"i": [["[\"4b5e216f8244b4e8f7b6543c4a9087e5\", [1536, 128], [1536, 128]]", "cuda -keys=cuda,gpu -arch=sm_75 -max_num_threads=1024 -model=2080ti -thread_warp_size=32", [-1, 16, 64, 49152, 2147483647, 1024, 8, 32], "", 0, []], [[], [["SP", 5, 1, 128, [64], 1], ["AN", 5, 2, 6], ["FSP", 4, 1, 0, 1], ["AN", 4, 2, 6], ["CA", 4, 5, 0], ["CI", 3], ["CI", 2], ["AN", 5, 0, 5], ["SP", 1, 0, 1536, [32], 1], ["AN", 1, 0, 5], ["AN", 1, 1, 6], ["PR", 1, 0, "auto_unroll_max_step$1024"], ["PR", 4, 0, "auto_unroll_max_step$64"]]]], "r": [[1.30728e-05], 0, 1.87491, 1680067943], "v": "v0.6"}
{"i": [["[\"4b5e216f8244b4e8f7b6543c4a9087e5\", [1536, 128], [1536, 128]]", "cuda -keys=cuda,gpu -arch=sm_75 -max_num_threads=1024 -model=2080ti -thread_warp_size=32", [-1, 16, 64, 49152, 2147483647, 1024, 8, 32], "", 0, []], [[], [["SP", 5, 1, 128, [4], 1], ["AN", 5, 2, 6], ["FSP", 4, 1, 0, 1], ["AN", 4, 2, 6], ["CA", 4, 5, 0], ["CI", 3], ["CI", 2], ["AN", 5, 0, 5], ["SP", 1, 0, 1536, [32], 1], ["AN", 1, 0, 5], ["AN", 1, 1, 6], ["PR", 1, 0, "auto_unroll_max_step$64"], ["PR", 4, 0, "auto_unroll_max_step$1024"]]]], "r": [[3.02182e-05], 0, 2.846, 1680067944], "v": "v0.6"}
{"i": [["[\"4b5e216f8244b4e8f7b6543c4a9087e5\", [1536, 128], [1536, 128]]", "cuda -keys=cuda,gpu -arch=sm_75 -max_num_threads=1024 -model=2080ti -thread_warp_size=32", [-1, 16, 64, 49152, 2147483647, 1024, 8, 32], "", 0, []], [[], [["SP", 5, 1, 128, [1], 1], ["AN", 5, 2, 6], ["FSP", 4, 1, 0, 1], ["AN", 4, 2, 6], ["CA", 4, 5, 0], ["CI", 3], ["CI", 2], ["FSP", 1, 1, 0, 1], ["AN", 1, 2, 6], ["CA", 1, 5, 0], ["AN", 5, 0, 5], ["PR", 1, 0, "auto_unroll_max_step$512"], ["PR", 4, 0, "auto_unroll_max_step$0"]]]], "r": [[7.85477e-05], 0, 2.20371, 1680067946], "v": "v0.6"}
{"i": [["[\"4b5e216f8244b4e8f7b6543c4a9087e5\", [1536, 128], [1536, 128]]", "cuda -keys=cuda,gpu -arch=sm_75 -max_num_threads=1024 -model=2080ti -thread_warp_size=32", [-1, 16, 64, 49152, 2147483647, 1024, 8, 32], "", 0, []], [[], [["CI", 3], ["CI", 2], ["SP", 1, 1, 128, [16], 1], ["AN", 1, 2, 6], ["FU", 5, [0, 1]], ["SP", 5, 0, 196608, [32], 1], ["AN", 5, 0, 5], ["AN", 5, 1, 6], ["SP", 4, 0, 1536, [32], 1], ["AN", 4, 0, 5], ["AN", 4, 1, 6], ["AN", 1, 0, 5], ["PR", 1, 0, "auto_unroll_max_step$16"], ["PR", 4, 0, "auto_unroll_max_step$512"]]]], "r": [[2.3699e-05], 0, 2.039, 1680067947], "v": "v0.6"}
{"i": [["[\"4b5e216f8244b4e8f7b6543c4a9087e5\", [1536, 128], [1536, 128]]", "cuda -keys=cuda,gpu -arch=sm_75 -max_num_threads=1024 -model=2080ti -thread_warp_size=32", [-1, 16, 64, 49152, 2147483647, 1024, 8, 32], "", 0, []], [[], [["SP", 5, 1, 128, [8], 1], ["AN", 5, 2, 6], ["FSP", 4, 1, 0, 1], ["AN", 4, 2, 6], ["CA", 4, 5, 0], ["CI", 3], ["CI", 2], ["FSP", 1, 1, 0, 1], ["AN", 1, 2, 6], ["CA", 1, 5, 0], ["AN", 5, 0, 5], ["PR", 1, 0, "auto_unroll_max_step$1024"], ["PR", 4, 0, "auto_unroll_max_step$64"]]]], "r": [[1.2769e-05], 0, 2.21472, 1680067948], "v": "v0.6"}
{"i": [["[\"4b5e216f8244b4e8f7b6543c4a9087e5\", [1536, 128], [1536, 128]]", "cuda -keys=cuda,gpu -arch=sm_75 -max_num_threads=1024 -model=2080ti -thread_warp_size=32", [-1, 16, 64, 49152, 2147483647, 1024, 8, 32], "", 0, []], [[], [["SP", 5, 1, 128, [64], 1], ["AN", 5, 2, 6], ["FSP", 4, 1, 0, 1], ["AN", 4, 2, 6], ["CA", 4, 5, 0], ["CI", 3], ["CI", 2], ["FSP", 1, 1, 0, 1], ["AN", 1, 2, 6], ["CA", 1, 5, 0], ["AN", 5, 0, 5], ["PR", 1, 0, "auto_unroll_max_step$16"], ["PR", 4, 0, "auto_unroll_max_step$512"]]]], "r": [[6.10483e-06], 0, 1.72321, 1680067950], "v": "v0.6"}
{"i": [["[\"4b5e216f8244b4e8f7b6543c4a9087e5\", [1536, 128], [1536, 128]]", "cuda -keys=cuda,gpu -arch=sm_75 -max_num_threads=1024 -model=2080ti -thread_warp_size=32", [-1, 16, 64, 49152, 2147483647, 1024, 8, 32], "", 0, []], [[], [["CI", 3], ["CI", 2], ["SP", 1, 1, 128, [32], 1], ["AN", 1, 2, 6], ["FU", 5, [0, 1]], ["SP", 5, 0, 196608, [1], 1], ["AN", 5, 0, 5], ["AN", 5, 1, 6], ["SP", 4, 0, 1536, [32], 1], ["AN", 4, 0, 5], ["AN", 4, 1, 6], ["AN", 1, 0, 5], ["PR", 1, 0, "auto_unroll_max_step$16"], ["PR", 4, 0, "auto_unroll_max_step$64"]]]], "r": [[0.000182168], 0, 2.05883, 1680067951], "v": "v0.6"}
{"i": [["[\"4b5e216f8244b4e8f7b6543c4a9087e5\", [1536, 128], [1536, 128]]", "cuda -keys=cuda,gpu -arch=sm_75 -max_num_threads=1024 -model=2080ti -thread_warp_size=32", [-1, 16, 64, 49152, 2147483647, 1024, 8, 32], "", 0, []], [[], [["CI", 3], ["CI", 2], ["SP", 1, 1, 128, [32], 1], ["AN", 1, 2, 6], ["FU", 5, [0, 1]], ["SP", 5, 0, 196608, [32], 1], ["AN", 5, 0, 5], ["AN", 5, 1, 6], ["SP", 4, 0, 1536, [32], 1], ["AN", 4, 0, 5], ["AN", 4, 1, 6], ["AN", 1, 0, 5], ["PR", 1, 0, "auto_unroll_max_step$512"], ["PR", 4, 0, "auto_unroll_max_step$64"]]]], "r": [[2.3669e-05], 0, 1.9126, 1680067952], "v": "v0.6"}
{"i": [["[\"4b5e216f8244b4e8f7b6543c4a9087e5\", [1536, 128], [1536, 128]]", "cuda -keys=cuda,gpu -arch=sm_75 -max_num_threads=1024 -model=2080ti -thread_warp_size=32", [-1, 16, 64, 49152, 2147483647, 1024, 8, 32], "", 0, []], [[], [["SP", 5, 1, 128, [1], 1], ["AN", 5, 2, 6], ["FSP", 4, 1, 0, 1], ["AN", 4, 2, 6], ["CA", 4, 5, 0], ["CI", 3], ["CI", 2], ["FSP", 1, 1, 0, 1], ["AN", 1, 2, 6], ["CA", 1, 5, 0], ["AN", 5, 0, 5], ["PR", 1, 0, "auto_unroll_max_step$64"], ["PR", 4, 0, "auto_unroll_max_step$1024"]]]], "r": [[8.35329e-05], 0, 5.00486, 1680067954], "v": "v0.6"}
{"i": [["[\"4b5e216f8244b4e8f7b6543c4a9087e5\", [1536, 128], [1536, 128]]", "cuda -keys=cuda,gpu -arch=sm_75 -max_num_threads=1024 -model=2080ti -thread_warp_size=32", [-1, 16, 64, 49152, 2147483647, 1024, 8, 32], "", 0, []], [[], [["SP", 5, 1, 128, [32], 1], ["AN", 5, 2, 6], ["FSP", 4, 1, 0, 1], ["AN", 4, 2, 6], ["CA", 4, 5, 0], ["CI", 3], ["CI", 2], ["AN", 5, 0, 5], ["SP", 1, 0, 1536, [2], 1], ["AN", 1, 0, 5], ["AN", 1, 1, 6], ["PR", 1, 0, "auto_unroll_max_step$64"], ["PR", 4, 0, "auto_unroll_max_step$64"]]]], "r": [[1.2324e-05], 0, 2.00089, 1680067955], "v": "v0.6"}
{"i": [["[\"4b5e216f8244b4e8f7b6543c4a9087e5\", [1536, 128], [1536, 128]]", "cuda -keys=cuda,gpu -arch=sm_75 -max_num_threads=1024 -model=2080ti -thread_warp_size=32", [-1, 16, 64, 49152, 2147483647, 1024, 8, 32], "", 0, []], [[], [["SP", 5, 1, 128, [32], 1], ["AN", 5, 2, 6], ["FSP", 4, 1, 0, 1], ["AN", 4, 2, 6], ["CA", 4, 5, 0], ["CI", 3], ["CI", 2], ["AN", 5, 0, 5], ["SP", 1, 0, 1536, [1], 1], ["AN", 1, 0, 5], ["AN", 1, 1, 6], ["PR", 1, 0, "auto_unroll_max_step$512"], ["PR", 4, 0, "auto_unroll_max_step$16"]]]], "r": [[1.31394e-05], 0, 1.81158, 1680067956], "v": "v0.6"}
{"i": [["[\"4b5e216f8244b4e8f7b6543c4a9087e5\", [1536, 128], [1536, 128]]", "cuda -keys=cuda,gpu -arch=sm_75 -max_num_threads=1024 -model=2080ti -thread_warp_size=32", [-1, 16, 64, 49152, 2147483647, 1024, 8, 32], "", 0, []], [[], [["CI", 3], ["CI", 2], ["SP", 1, 1, 128, [32], 1], ["AN", 1, 2, 6], ["FU", 5, [0, 1]], ["SP", 5, 0, 196608, [2], 1], ["AN", 5, 0, 5], ["AN", 5, 1, 6], ["SP", 4, 0, 1536, [32], 1], ["AN", 4, 0, 5], ["AN", 4, 1, 6], ["AN", 1, 0, 5], ["PR", 1, 0, "auto_unroll_max_step$0"], ["PR", 4, 0, "auto_unroll_max_step$16"]]]], "r": [[0.000101732], 0, 2.08305, 1680067958], "v": "v0.6"}
{"i": [["[\"4b5e216f8244b4e8f7b6543c4a9087e5\", [1536, 128], [1536, 128]]", "cuda -keys=cuda,gpu -arch=sm_75 -max_num_threads=1024 -model=2080ti -thread_warp_size=32", [-1, 16, 64, 49152, 2147483647, 1024, 8, 32], "", 0, []], [[], [["SP", 5, 1, 128, [4], 1], ["AN", 5, 2, 6], ["FSP", 4, 1, 0, 1], ["AN", 4, 2, 6], ["CA", 4, 5, 0], ["CI", 3], ["CI", 2], ["AN", 5, 0, 5], ["SP", 1, 0, 1536, [8], 1], ["AN", 1, 0, 5], ["AN", 1, 1, 6], ["PR", 1, 0, "auto_unroll_max_step$16"], ["PR", 4, 0, "auto_unroll_max_step$512"]]]], "r": [[2.86316e-05], 0, 2.698, 1680067959], "v": "v0.6"}
{"i": [["[\"4b5e216f8244b4e8f7b6543c4a9087e5\", [1536, 128], [1536, 128]]", "cuda -keys=cuda,gpu -arch=sm_75 -max_num_threads=1024 -model=2080ti -thread_warp_size=32", [-1, 16, 64, 49152, 2147483647, 1024, 8, 32], "", 0, []], [[], [["CI", 3], ["CI", 2], ["SP", 1, 1, 128, [32], 1], ["AN", 1, 2, 6], ["FU", 5, [0, 1]], ["SP", 5, 0, 196608, [32], 1], ["AN", 5, 0, 5], ["AN", 5, 1, 6], ["SP", 4, 0, 1536, [1], 1], ["AN", 4, 0, 5], ["AN", 4, 1, 6], ["AN", 1, 0, 5], ["PR", 1, 0, "auto_unroll_max_step$16"], ["PR", 4, 0, "auto_unroll_max_step$0"]]]], "r": [[3.14685e-05], 0, 1.77204, 1680067960], "v": "v0.6"}
{"i": [["[\"4b5e216f8244b4e8f7b6543c4a9087e5\", [1536, 128], [1536, 128]]", "cuda -keys=cuda,gpu -arch=sm_75 -max_num_threads=1024 -model=2080ti -thread_warp_size=32", [-1, 16, 64, 49152, 2147483647, 1024, 8, 32], "", 0, []], [[], [["SP", 5, 1, 128, [32], 1], ["AN", 5, 2, 6], ["FSP", 4, 1, 0, 1], ["AN", 4, 2, 6], ["CA", 4, 5, 0], ["CI", 3], ["CI", 2], ["FSP", 1, 1, 0, 1], ["AN", 1, 2, 6], ["CA", 1, 5, 0], ["AN", 5, 0, 5], ["PR", 1, 0, "auto_unroll_max_step$16"], ["PR", 4, 0, "auto_unroll_max_step$512"]]]], "r": [[5.96287e-06], 0, 1.85065, 1680067961], "v": "v0.6"}
{"i": [["[\"4b5e216f8244b4e8f7b6543c4a9087e5\", [1536, 128], [1536, 128]]", "cuda -keys=cuda,gpu -arch=sm_75 -max_num_threads=1024 -model=2080ti -thread_warp_size=32", [-1, 16, 64, 49152, 2147483647, 1024, 8, 32], "", 0, []], [[], [["SP", 5, 1, 128, [32], 1], ["AN", 5, 2, 6], ["FSP", 4, 1, 0, 1], ["AN", 4, 2, 6], ["CA", 4, 5, 0], ["CI", 3], ["CI", 2], ["AN", 5, 0, 5], ["SP", 1, 0, 1536, [32], 1], ["AN", 1, 0, 5], ["AN", 1, 1, 6], ["PR", 1, 0, "auto_unroll_max_step$512"], ["PR", 4, 0, "auto_unroll_max_step$16"]]]], "r": [[1.39568e-05], 0, 1.98955, 1680067963], "v": "v0.6"}
{"i": [["[\"4b5e216f8244b4e8f7b6543c4a9087e5\", [1536, 128], [1536, 128]]", "cuda -keys=cuda,gpu -arch=sm_75 -max_num_threads=1024 -model=2080ti -thread_warp_size=32", [-1, 16, 64, 49152, 2147483647, 1024, 8, 32], "", 0, []], [[], [["CI", 3], ["CI", 2], ["FU", 5, [0, 1]], ["SP", 5, 0, 196608, [64], 1], ["AN", 5, 0, 5], ["AN", 5, 1, 6], ["SP", 4, 0, 1536, [32], 1], ["AN", 4, 0, 5], ["AN", 4, 1, 6], ["SP", 1, 0, 1536, [2], 1], ["AN", 1, 0, 5], ["AN", 1, 1, 6], ["PR", 1, 0, "auto_unroll_max_step$1024"], ["PR", 4, 0, "auto_unroll_max_step$0"]]]], "r": [[2.41848e-05], 0, 1.96935, 1680067964], "v": "v0.6"}
{"i": [["[\"4b5e216f8244b4e8f7b6543c4a9087e5\", [1536, 128], [1536, 128]]", "cuda -keys=cuda,gpu -arch=sm_75 -max_num_threads=1024 -model=2080ti -thread_warp_size=32", [-1, 16, 64, 49152, 2147483647, 1024, 8, 32], "", 0, []], [[], [["CI", 3], ["CI", 2], ["FU", 5, [0, 1]], ["SP", 5, 0, 196608, [64], 1], ["AN", 5, 0, 5], ["AN", 5, 1, 6], ["SP", 4, 0, 1536, [32], 1], ["AN", 4, 0, 5], ["AN", 4, 1, 6], ["SP", 1, 0, 1536, [2], 1], ["AN", 1, 0, 5], ["AN", 1, 1, 6], ["PR", 1, 0, "auto_unroll_max_step$512"], ["PR", 4, 0, "auto_unroll_max_step$512"]]]], "r": [[2.41879e-05], 0, 1.80316, 1680067965], "v": "v0.6"}
{"i": [["[\"4b5e216f8244b4e8f7b6543c4a9087e5\", [1536, 128], [1536, 128]]", "cuda -keys=cuda,gpu -arch=sm_75 -max_num_threads=1024 -model=2080ti -thread_warp_size=32", [-1, 16, 64, 49152, 2147483647, 1024, 8, 32], "", 0, []], [[], [["SP", 5, 1, 128, [1], 1], ["AN", 5, 2, 6], ["FSP", 4, 1, 0, 1], ["AN", 4, 2, 6], ["CA", 4, 5, 0], ["CI", 3], ["CI", 2], ["FSP", 1, 1, 0, 1], ["AN", 1, 2, 6], ["CA", 1, 5, 0], ["AN", 5, 0, 5], ["PR", 1, 0, "auto_unroll_max_step$0"], ["PR", 4, 0, "auto_unroll_max_step$1024"]]]], "r": [[8.35222e-05], 0, 4.88562, 1680067967], "v": "v0.6"}
{"i": [["[\"4b5e216f8244b4e8f7b6543c4a9087e5\", [1536, 128], [1536, 128]]", "cuda -keys=cuda,gpu -arch=sm_75 -max_num_threads=1024 -model=2080ti -thread_warp_size=32", [-1, 16, 64, 49152, 2147483647, 1024, 8, 32], "", 0, []], [[], [["CI", 3], ["CI", 2], ["SP", 1, 1, 128, [64], 1], ["AN", 1, 2, 6], ["FU", 5, [0, 1]], ["SP", 5, 0, 196608, [32], 1], ["AN", 5, 0, 5], ["AN", 5, 1, 6], ["SP", 4, 0, 1536, [64], 1], ["AN", 4, 0, 5], ["AN", 4, 1, 6], ["AN", 1, 0, 5], ["PR", 1, 0, "auto_unroll_max_step$64"], ["PR", 4, 0, "auto_unroll_max_step$64"]]]], "r": [[2.22694e-05], 0, 1.97994, 1680067968], "v": "v0.6"}
{"i": [["[\"4b5e216f8244b4e8f7b6543c4a9087e5\", [1536, 128], [1536, 128]]", "cuda -keys=cuda,gpu -arch=sm_75 -max_num_threads=1024 -model=2080ti -thread_warp_size=32", [-1, 16, 64, 49152, 2147483647, 1024, 8, 32], "", 0, []], [[], [["SP", 5, 1, 128, [16], 1], ["AN", 5, 2, 6], ["FSP", 4, 1, 0, 1], ["AN", 4, 2, 6], ["CA", 4, 5, 0], ["CI", 3], ["CI", 2], ["FSP", 1, 1, 0, 1], ["AN", 1, 2, 6], ["CA", 1, 5, 0], ["AN", 5, 0, 5], ["PR", 1, 0, "auto_unroll_max_step$0"], ["PR", 4, 0, "auto_unroll_max_step$0"]]]], "r": [[8.31831e-06], 0, 1.82627, 1680067969], "v": "v0.6"}
{"i": [["[\"4b5e216f8244b4e8f7b6543c4a9087e5\", [1536, 128], [1536, 128]]", "cuda -keys=cuda,gpu -arch=sm_75 -max_num_threads=1024 -model=2080ti -thread_warp_size=32", [-1, 16, 64, 49152, 2147483647, 1024, 8, 32], "", 0, []], [[], [["SP", 5, 1, 128, [32], 1], ["AN", 5, 2, 6], ["FSP", 4, 1, 0, 1], ["AN", 4, 2, 6], ["CA", 4, 5, 0], ["CI", 3], ["CI", 2], ["AN", 5, 0, 5], ["SP", 1, 0, 1536, [64], 1], ["AN", 1, 0, 5], ["AN", 1, 1, 6], ["PR", 1, 0, "auto_unroll_max_step$0"], ["PR", 4, 0, "auto_unroll_max_step$16"]]]], "r": [[1.42292e-05], 0, 1.71349, 1680067970], "v": "v0.6"}
{"i": [["[\"4b5e216f8244b4e8f7b6543c4a9087e5\", [1536, 128], [1536, 128]]", "cuda -keys=cuda,gpu -arch=sm_75 -max_num_threads=1024 -model=2080ti -thread_warp_size=32", [-1, 16, 64, 49152, 2147483647, 1024, 8, 32], "", 0, []], [[], [["SP", 5, 1, 128, [64], 1], ["AN", 5, 2, 6], ["FSP", 4, 1, 0, 1], ["AN", 4, 2, 6], ["CA", 4, 5, 0], ["CI", 3], ["CI", 2], ["AN", 5, 0, 5], ["SP", 1, 0, 1536, [16], 1], ["AN", 1, 0, 5], ["AN", 1, 1, 6], ["PR", 1, 0, "auto_unroll_max_step$64"], ["PR", 4, 0, "auto_unroll_max_step$512"]]]], "r": [[1.15151e-05], 0, 1.80786, 1680067972], "v": "v0.6"}
{"i": [["[\"4b5e216f8244b4e8f7b6543c4a9087e5\", [1536, 128], [1536, 128]]", "cuda -keys=cuda,gpu -arch=sm_75 -max_num_threads=1024 -model=2080ti -thread_warp_size=32", [-1, 16, 64, 49152, 2147483647, 1024, 8, 32], "", 0, []], [[], [["SP", 5, 1, 128, [64], 1], ["AN", 5, 2, 6], ["FSP", 4, 1, 0, 1], ["AN", 4, 2, 6], ["CA", 4, 5, 0], ["CI", 3], ["CI", 2], ["AN", 5, 0, 5], ["SP", 1, 0, 1536, [2], 1], ["AN", 1, 0, 5], ["AN", 1, 1, 6], ["PR", 1, 0, "auto_unroll_max_step$16"], ["PR", 4, 0, "auto_unroll_max_step$16"]]]], "r": [[1.13987e-05], 0, 1.85194, 1680067973], "v": "v0.6"}
{"i": [["[\"4b5e216f8244b4e8f7b6543c4a9087e5\", [1536, 128], [1536, 128]]", "cuda -keys=cuda,gpu -arch=sm_75 -max_num_threads=1024 -model=2080ti -thread_warp_size=32", [-1, 16, 64, 49152, 2147483647, 1024, 8, 32], "", 0, []], [[], [["CI", 3], ["CI", 2], ["FU", 5, [0, 1]], ["SP", 5, 0, 196608, [12], 1], ["AN", 5, 0, 5], ["AN", 5, 1, 6], ["SP", 4, 0, 1536, [32], 1], ["AN", 4, 0, 5], ["AN", 4, 1, 6], ["SP", 1, 0, 1536, [2], 1], ["AN", 1, 0, 5], ["AN", 1, 1, 6], ["PR", 1, 0, "auto_unroll_max_step$512"], ["PR", 4, 0, "auto_unroll_max_step$512"]]]], "r": [[3.57181e-05], 0, 1.92187, 1680067974], "v": "v0.6"}
{"i": [["[\"4b5e216f8244b4e8f7b6543c4a9087e5\", [1536, 128], [1536, 128]]", "cuda -keys=cuda,gpu -arch=sm_75 -max_num_threads=1024 -model=2080ti -thread_warp_size=32", [-1, 16, 64, 49152, 2147483647, 1024, 8, 32], "", 0, []], [[], [["SP", 5, 1, 128, [1], 1], ["AN", 5, 2, 6], ["FSP", 4, 1, 0, 1], ["AN", 4, 2, 6], ["CA", 4, 5, 0], ["CI", 3], ["CI", 2], ["FSP", 1, 1, 0, 1], ["AN", 1, 2, 6], ["CA", 1, 5, 0], ["AN", 5, 0, 5], ["PR", 1, 0, "auto_unroll_max_step$16"], ["PR", 4, 0, "auto_unroll_max_step$16"]]]], "r": [[7.91918e-05], 0, 1.7516, 1680067976], "v": "v0.6"}
{"i": [["[\"4b5e216f8244b4e8f7b6543c4a9087e5\", [1536, 128], [1536, 128]]", "cuda -keys=cuda,gpu -arch=sm_75 -max_num_threads=1024 -model=2080ti -thread_warp_size=32", [-1, 16, 64, 49152, 2147483647, 1024, 8, 32], "", 0, []], [[], [["CI", 3], ["CI", 2], ["SP", 1, 1, 128, [32], 1], ["AN", 1, 2, 6], ["FU", 5, [0, 1]], ["SP", 5, 0, 196608, [32], 1], ["AN", 5, 0, 5], ["AN", 5, 1, 6], ["SP", 4, 0, 1536, [32], 1], ["AN", 4, 0, 5], ["AN", 4, 1, 6], ["AN", 1, 0, 5], ["PR", 1, 0, "auto_unroll_max_step$64"], ["PR", 4, 0, "auto_unroll_max_step$512"]]]], "r": [[2.36846e-05], 0, 1.88648, 1680067977], "v": "v0.6"}
{"i": [["[\"4b5e216f8244b4e8f7b6543c4a9087e5\", [1536, 128], [1536, 128]]", "cuda -keys=cuda,gpu -arch=sm_75 -max_num_threads=1024 -model=2080ti -thread_warp_size=32", [-1, 16, 64, 49152, 2147483647, 1024, 8, 32], "", 0, []], [[], [["CI", 3], ["CI", 2], ["FU", 5, [0, 1]], ["SP", 5, 0, 196608, [32], 1], ["AN", 5, 0, 5], ["AN", 5, 1, 6], ["SP", 4, 0, 1536, [24], 1], ["AN", 4, 0, 5], ["AN", 4, 1, 6], ["SP", 1, 0, 1536, [64], 1], ["AN", 1, 0, 5], ["AN", 1, 1, 6], ["PR", 1, 0, "auto_unroll_max_step$512"], ["PR", 4, 0, "auto_unroll_max_step$1024"]]]], "r": [[2.73322e-05], 0, 1.83961, 1680067978], "v": "v0.6"}
{"i": [["[\"4b5e216f8244b4e8f7b6543c4a9087e5\", [1536, 128], [1536, 128]]", "cuda -keys=cuda,gpu -arch=sm_75 -max_num_threads=1024 -model=2080ti -thread_warp_size=32", [-1, 16, 64, 49152, 2147483647, 1024, 8, 32], "", 0, []], [[], [["SP", 5, 1, 128, [64], 1], ["AN", 5, 2, 6], ["FSP", 4, 1, 0, 1], ["AN", 4, 2, 6], ["CA", 4, 5, 0], ["CI", 3], ["CI", 2], ["AN", 5, 0, 5], ["SP", 1, 0, 1536, [32], 1], ["AN", 1, 0, 5], ["AN", 1, 1, 6], ["PR", 1, 0, "auto_unroll_max_step$64"], ["PR", 4, 0, "auto_unroll_max_step$0"]]]], "r": [[1.30577e-05], 0, 1.8298, 1680067980], "v": "v0.6"}
{"i": [["[\"4b5e216f8244b4e8f7b6543c4a9087e5\", [1536, 128], [1536, 128]]", "cuda -keys=cuda,gpu -arch=sm_75 -max_num_threads=1024 -model=2080ti -thread_warp_size=32", [-1, 16, 64, 49152, 2147483647, 1024, 8, 32], "", 0, []], [[], [["SP", 5, 1, 128, [32], 1], ["AN", 5, 2, 6], ["FSP", 4, 1, 0, 1], ["AN", 4, 2, 6], ["CA", 4, 5, 0], ["CI", 3], ["CI", 2], ["FSP", 1, 1, 0, 1], ["AN", 1, 2, 6], ["CA", 1, 5, 0], ["AN", 5, 0, 5], ["PR", 1, 0, "auto_unroll_max_step$1024"], ["PR", 4, 0, "auto_unroll_max_step$0"]]]], "r": [[5.98428e-06], 0, 1.7221, 1680067981], "v": "v0.6"}
{"i": [["[\"4b5e216f8244b4e8f7b6543c4a9087e5\", [1536, 128], [1536, 128]]", "cuda -keys=cuda,gpu -arch=sm_75 -max_num_threads=1024 -model=2080ti -thread_warp_size=32", [-1, 16, 64, 49152, 2147483647, 1024, 8, 32], "", 0, []], [[], [["SP", 5, 1, 128, [32], 1], ["AN", 5, 2, 6], ["FSP", 4, 1, 0, 1], ["AN", 4, 2, 6], ["CA", 4, 5, 0], ["CI", 3], ["CI", 2], ["FSP", 1, 1, 0, 1], ["AN", 1, 2, 6], ["CA", 1, 5, 0], ["AN", 5, 0, 5], ["PR", 1, 0, "auto_unroll_max_step$1024"], ["PR", 4, 0, "auto_unroll_max_step$512"]]]], "r": [[5.96358e-06], 0, 1.56707, 1680067982], "v": "v0.6"}
{"i": [["[\"4b5e216f8244b4e8f7b6543c4a9087e5\", [1536, 128], [1536, 128]]", "cuda -keys=cuda,gpu -arch=sm_75 -max_num_threads=1024 -model=2080ti -thread_warp_size=32", [-1, 16, 64, 49152, 2147483647, 1024, 8, 32], "", 0, []], [[], [["CI", 3], ["CI", 2], ["FU", 5, [0, 1]], ["SP", 5, 0, 196608, [32], 1], ["AN", 5, 0, 5], ["AN", 5, 1, 6], ["SP", 4, 0, 1536, [32], 1], ["AN", 4, 0, 5], ["AN", 4, 1, 6], ["SP", 1, 0, 1536, [32], 1], ["AN", 1, 0, 5], ["AN", 1, 1, 6], ["PR", 1, 0, "auto_unroll_max_step$64"], ["PR", 4, 0, "auto_unroll_max_step$1024"]]]], "r": [[2.84081e-05], 0, 1.72994, 1680067983], "v": "v0.6"}
{"i": [["[\"5b1e704ad5950c6ef36e46f1856366cd\", [1, 768], [768, 768], [1, 768], [1, 768]]", "cuda -keys=cuda,gpu -arch=sm_75 -max_num_threads=1024 -model=2080ti -thread_warp_size=32", [-1, 16, 64, 49152, 2147483647, 1024, 8, 32], "", 0, []], [[], [["CI", 6], ["CI", 5], ["CI", 4], ["SP", 2, 0, 1, [1, 1, 1, 1], 1], ["SP", 2, 5, 768, [4, 32, 6, 1], 1], ["SP", 2, 10, 768, [3, 2], 1], ["RE", 2, [0, 5, 1, 6, 2, 7, 10, 11, 3, 8, 12, 4, 9]], ["FSP", 7, 0, 3, 3], ["FSP", 7, 4, 4, 3], ["RE", 7, [0, 4, 1, 5, 2, 6, 3, 7]], ["CA", 2, 7, 5], ["CHR", 1, "shared", [2]], ["CA", 2, 3, 6], ["CHR", 0, "shared", [3]], ["CA", 1, 4, 6], ["FU", 9, [0, 1]], ["AN", 9, 0, 5], ["FU", 9, [1, 2]], ["AN", 9, 1, 4], ["FU", 9, [2, 3]], ["AN", 9, 2, 6], ["FU", 3, [0, 1]], ["SP", 3, 0, 36, [1], 1], ["AN", 3, 1, 2], ["FFSP", 3, 0, [4, 3], 1, 1], ["AN", 3, 1, 6], ["FU", 1, [0, 1]], ["SP", 1, 0, 6, [1], 1], ["AN", 1, 1, 2], ["FFSP", 1, 0, [4, 3], 1, 1], ["AN", 1, 1, 6], ["PR", 4, 0, "auto_unroll_max_step$64"]]]], "r": [[0.000840486], 0, 2.24282, 1680068022], "v": "v0.6"}
{"i": [["[\"5b1e704ad5950c6ef36e46f1856366cd\", [1, 768], [768, 768], [1, 768], [1, 768]]", "cuda -keys=cuda,gpu -arch=sm_75 -max_num_threads=1024 -model=2080ti -thread_warp_size=32", [-1, 16, 64, 49152, 2147483647, 1024, 8, 32], "", 0, []], [[], [["CI", 6], ["CI", 5], ["CI", 4], ["SP", 2, 0, 1, [1, 1, 1, 1], 1], ["SP", 2, 5, 768, [1, 64, 1, 1], 1], ["SP", 2, 10, 768, [4, 2], 1], ["RE", 2, [0, 5, 1, 6, 2, 7, 10, 11, 3, 8, 12, 4, 9]], ["FSP", 7, 0, 3, 3], ["FSP", 7, 4, 4, 3], ["RE", 7, [0, 4, 1, 5, 2, 6, 3, 7]], ["CA", 2, 7, 5], ["CHR", 1, "shared", [2]], ["CA", 2, 3, 6], ["CHR", 0, "shared", [3]], ["CA", 1, 4, 6], ["FU", 9, [0, 1]], ["AN", 9, 0, 5], ["FU", 9, [1, 2]], ["AN", 9, 1, 4], ["FU", 9, [2, 3]], ["AN", 9, 2, 6], ["FU", 3, [0, 1]], ["SP", 3, 0, 16, [1], 1], ["AN", 3, 1, 2], ["FFSP", 3, 0, [4, 3], 1, 1], ["AN", 3, 1, 6], ["FU", 1, [0, 1]], ["SP", 1, 0, 8, [1], 1], ["AN", 1, 1, 2], ["FFSP", 1, 0, [4, 3], 1, 1], ["AN", 1, 1, 6], ["PR", 4, 0, "auto_unroll_max_step$0"]]]], "r": [[3.69342e-05], 0, 1.91787, 1680068024], "v": "v0.6"}
{"i": [["[\"5b1e704ad5950c6ef36e46f1856366cd\", [1, 768], [768, 768], [1, 768], [1, 768]]", "cuda -keys=cuda,gpu -arch=sm_75 -max_num_threads=1024 -model=2080ti -thread_warp_size=32", [-1, 16, 64, 49152, 2147483647, 1024, 8, 32], "", 0, []], [[], [["CI", 6], ["CI", 5], ["CI", 4], ["SP", 2, 0, 1, [1, 1, 1, 1], 1], ["SP", 2, 5, 768, [1, 192, 1, 1], 1], ["SP", 2, 10, 768, [3, 4], 1], ["RE", 2, [0, 5, 1, 6, 2, 7, 10, 11, 3, 8, 12, 4, 9]], ["FSP", 7, 0, 3, 3], ["FSP", 7, 4, 4, 3], ["RE", 7, [0, 4, 1, 5, 2, 6, 3, 7]], ["CA", 2, 7, 5], ["CHR", 1, "shared", [2]], ["CA", 2, 3, 6], ["CHR", 0, "shared", [3]], ["CA", 1, 4, 6], ["FU", 9, [0, 1]], ["AN", 9, 0, 5], ["FU", 9, [1, 2]], ["AN", 9, 1, 4], ["FU", 9, [2, 3]], ["AN", 9, 2, 6], ["FU", 3, [0, 1]], ["SP", 3, 0, 24, [1], 1], ["AN", 3, 1, 2], ["FFSP", 3, 0, [4, 3], 1, 1], ["AN", 3, 1, 6], ["FU", 1, [0, 1]], ["SP", 1, 0, 12, [1], 1], ["AN", 1, 1, 2], ["FFSP", 1, 0, [4, 3], 1, 1], ["AN", 1, 1, 6], ["PR", 4, 0, "auto_unroll_max_step$0"]]]], "r": [[5.05548e-05], 0, 2.00967, 1680068025], "v": "v0.6"}
{"i": [["[\"5b1e704ad5950c6ef36e46f1856366cd\", [1, 768], [768, 768], [1, 768], [1, 768]]", "cuda -keys=cuda,gpu -arch=sm_75 -max_num_threads=1024 -model=2080ti -thread_warp_size=32", [-1, 16, 64, 49152, 2147483647, 1024, 8, 32], "", 0, []], [[], [["CI", 6], ["CI", 5], ["CI", 4], ["SP", 2, 0, 1, [1, 1, 1, 1], 1], ["SP", 2, 5, 768, [3, 32, 4, 1], 1], ["SP", 2, 10, 768, [6, 2], 1], ["RE", 2, [0, 5, 1, 6, 2, 7, 10, 11, 3, 8, 12, 4, 9]], ["FSP", 7, 0, 3, 3], ["FSP", 7, 4, 4, 3], ["RE", 7, [0, 4, 1, 5, 2, 6, 3, 7]], ["CA", 2, 7, 5], ["CHR", 1, "shared", [2]], ["CA", 2, 3, 6], ["CHR", 0, "shared", [3]], ["CA", 1, 4, 6], ["FU", 9, [0, 1]], ["AN", 9, 0, 5], ["FU", 9, [1, 2]], ["AN", 9, 1, 4], ["FU", 9, [2, 3]], ["AN", 9, 2, 6], ["FU", 3, [0, 1]], ["SP", 3, 0, 48, [4], 1], ["AN", 3, 1, 2], ["FFSP", 3, 0, [4, 3], 1, 1], ["AN", 3, 1, 6], ["FU", 1, [0, 1]], ["SP", 1, 0, 12, [1], 1], ["AN", 1, 1, 2], ["FFSP", 1, 0, [4, 3], 1, 1], ["AN", 1, 1, 6], ["PR", 4, 0, "auto_unroll_max_step$64"]]]], "r": [[0.000139751], 0, 2.73958, 1680068026], "v": "v0.6"}
{"i": [["[\"5b1e704ad5950c6ef36e46f1856366cd\", [1, 768], [768, 768], [1, 768], [1, 768]]", "cuda -keys=cuda,gpu -arch=sm_75 -max_num_threads=1024 -model=2080ti -thread_warp_size=32", [-1, 16, 64, 49152, 2147483647, 1024, 8, 32], "", 0, []], [[], [["CI", 6], ["CI", 5], ["CI", 4], ["SP", 2, 0, 1, [1, 1, 1, 1], 1], ["SP", 2, 5, 768, [6, 64, 1, 1], 1], ["SP", 2, 10, 768, [1, 1], 1], ["RE", 2, [0, 5, 1, 6, 2, 7, 10, 11, 3, 8, 12, 4, 9]], ["FSP", 7, 0, 3, 3], ["FSP", 7, 4, 4, 3], ["RE", 7, [0, 4, 1, 5, 2, 6, 3, 7]], ["CA", 2, 7, 5], ["CHR", 1, "shared", [2]], ["CA", 2, 3, 6], ["CHR", 0, "shared", [3]], ["CA", 1, 4, 6], ["FU", 9, [0, 1]], ["AN", 9, 0, 5], ["FU", 9, [1, 2]], ["AN", 9, 1, 4], ["FU", 9, [2, 3]], ["AN", 9, 2, 6], ["FU", 3, [0, 1]], ["SP", 3, 0, 3, [1], 1], ["AN", 3, 1, 2], ["FFSP", 3, 0, [4, 3], 1, 1], ["AN", 3, 1, 6], ["FU", 1, [0, 1]], ["SP", 1, 0, 3, [1], 1], ["AN", 1, 1, 2], ["FFSP", 1, 0, [4, 3], 1, 1], ["AN", 1, 1, 6], ["PR", 4, 0, "auto_unroll_max_step$512"]]]], "r": [[0.000359521], 0, 2.30892, 1680068028], "v": "v0.6"}
{"i": [["[\"5b1e704ad5950c6ef36e46f1856366cd\", [1, 768], [768, 768], [1, 768], [1, 768]]", "cuda -keys=cuda,gpu -arch=sm_75 -max_num_threads=1024 -model=2080ti -thread_warp_size=32", [-1, 16, 64, 49152, 2147483647, 1024, 8, 32], "", 0, []], [[], [["CI", 6], ["CI", 5], ["CI", 4], ["SP", 2, 0, 1, [1, 1, 1, 1], 1], ["SP", 2, 5, 768, [1, 64, 1, 6], 1], ["SP", 2, 10, 768, [2, 12], 1], ["RE", 2, [0, 5, 1, 6, 2, 7, 10, 11, 3, 8, 12, 4, 9]], ["FSP", 7, 0, 3, 3], ["FSP", 7, 4, 4, 3], ["RE", 7, [0, 4, 1, 5, 2, 6, 3, 7]], ["CA", 2, 7, 5], ["CHR", 1, "shared", [2]], ["CA", 2, 3, 6], ["CHR", 0, "shared", [3]], ["CA", 1, 4, 6], ["FU", 9, [0, 1]], ["AN", 9, 0, 5], ["FU", 9, [1, 2]], ["AN", 9, 1, 4], ["FU", 9, [2, 3]], ["AN", 9, 2, 6], ["FU", 3, [0, 1]], ["SP", 3, 0, 48, [1], 1], ["AN", 3, 1, 2], ["FFSP", 3, 0, [4, 3], 1, 1], ["AN", 3, 1, 6], ["FU", 1, [0, 1]], ["SP", 1, 0, 8, [4], 1], ["AN", 1, 1, 2], ["FFSP", 1, 0, [4, 3], 1, 1], ["AN", 1, 1, 6], ["PR", 4, 0, "auto_unroll_max_step$64"]]]], "r": [[0.00022476], 0, 2.19355, 1680068029], "v": "v0.6"}
{"i": [["[\"5b1e704ad5950c6ef36e46f1856366cd\", [1, 768], [768, 768], [1, 768], [1, 768]]", "cuda -keys=cuda,gpu -arch=sm_75 -max_num_threads=1024 -model=2080ti -thread_warp_size=32", [-1, 16, 64, 49152, 2147483647, 1024, 8, 32], "", 0, []], [[], [["CI", 6], ["CI", 5], ["CI", 4], ["SP", 2, 0, 1, [1, 1, 1, 1], 1], ["SP", 2, 5, 768, [2, 32, 2, 6], 1], ["SP", 2, 10, 768, [2, 1], 1], ["RE", 2, [0, 5, 1, 6, 2, 7, 10, 11, 3, 8, 12, 4, 9]], ["FSP", 7, 0, 3, 3], ["FSP", 7, 4, 4, 3], ["RE", 7, [0, 4, 1, 5, 2, 6, 3, 7]], ["CA", 2, 7, 5], ["CHR", 1, "shared", [2]], ["CA", 2, 3, 6], ["CHR", 0, "shared", [3]], ["CA", 1, 4, 6], ["FU", 9, [0, 1]], ["AN", 9, 0, 5], ["FU", 9, [1, 2]], ["AN", 9, 1, 4], ["FU", 9, [2, 3]], ["AN", 9, 2, 6], ["FU", 3, [0, 1]], ["SP", 3, 0, 24, [1], 1], ["AN", 3, 1, 2], ["FFSP", 3, 0, [4, 3], 1, 1], ["AN", 3, 1, 6], ["FU", 1, [0, 1]], ["SP", 1, 0, 2, [2], 1], ["AN", 1, 1, 2], ["FFSP", 1, 0, [4, 3], 1, 1], ["AN", 1, 1, 6], ["PR", 4, 0, "auto_unroll_max_step$16"]]]], "r": [[0.000592922], 0, 2.3049, 1680068031], "v": "v0.6"}
{"i": [["[\"5b1e704ad5950c6ef36e46f1856366cd\", [1, 768], [768, 768], [1, 768], [1, 768]]", "cuda -keys=cuda,gpu -arch=sm_75 -max_num_threads=1024 -model=2080ti -thread_warp_size=32", [-1, 16, 64, 49152, 2147483647, 1024, 8, 32], "", 0, []], [[], [["CI", 6], ["CI", 5], ["CI", 4], ["SP", 2, 0, 1, [1, 1, 1, 1], 1], ["SP", 2, 5, 768, [1, 384, 1, 1], 1], ["SP", 2, 10, 768, [12, 1], 1], ["RE", 2, [0, 5, 1, 6, 2, 7, 10, 11, 3, 8, 12, 4, 9]], ["FSP", 7, 0, 3, 3], ["FSP", 7, 4, 4, 3], ["RE", 7, [0, 4, 1, 5, 2, 6, 3, 7]], ["CA", 2, 7, 5], ["CHR", 1, "shared", [2]], ["CA", 2, 3, 6], ["CHR", 0, "shared", [3]], ["CA", 1, 4, 6], ["FU", 9, [0, 1]], ["AN", 9, 0, 5], ["FU", 9, [1, 2]], ["AN", 9, 1, 4], ["FU", 9, [2, 3]], ["AN", 9, 2, 6], ["FU", 3, [0, 1]], ["SP", 3, 0, 24, [1], 1], ["AN", 3, 1, 2], ["FFSP", 3, 0, [4, 3], 1, 1], ["AN", 3, 1, 6], ["FU", 1, [0, 1]], ["SP", 1, 0, 24, [1], 1], ["AN", 1, 1, 2], ["FFSP", 1, 0, [4, 3], 1, 1], ["AN", 1, 1, 6], ["PR", 4, 0, "auto_unroll_max_step$64"]]]], "r": [[7.95725e-05], 0, 2.19098, 1680068032], "v": "v0.6"}
{"i": [["[\"5b1e704ad5950c6ef36e46f1856366cd\", [1, 768], [768, 768], [1, 768], [1, 768]]", "cuda -keys=cuda,gpu -arch=sm_75 -max_num_threads=1024 -model=2080ti -thread_warp_size=32", [-1, 16, 64, 49152, 2147483647, 1024, 8, 32], "", 0, []], [[], [["CI", 6], ["CI", 5], ["CI", 4], ["SP", 2, 0, 1, [1, 1, 1, 1], 1], ["SP", 2, 5, 768, [1, 32, 3, 2], 1], ["SP", 2, 10, 768, [1, 12], 1], ["RE", 2, [0, 5, 1, 6, 2, 7, 10, 11, 3, 8, 12, 4, 9]], ["FSP", 7, 0, 3, 3], ["FSP", 7, 4, 4, 3], ["RE", 7, [0, 4, 1, 5, 2, 6, 3, 7]], ["CA", 2, 7, 5], ["CHR", 1, "shared", [2]], ["CA", 2, 3, 6], ["CHR", 0, "shared", [3]], ["CA", 1, 4, 6], ["FU", 9, [0, 1]], ["AN", 9, 0, 5], ["FU", 9, [1, 2]], ["AN", 9, 1, 4], ["FU", 9, [2, 3]], ["AN", 9, 2, 6], ["FU", 3, [0, 1]], ["SP", 3, 0, 72, [1], 1], ["AN", 3, 1, 2], ["FFSP", 3, 0, [4, 3], 1, 1], ["AN", 3, 1, 6], ["FU", 1, [0, 1]], ["SP", 1, 0, 12, [1], 1], ["AN", 1, 1, 2], ["FFSP", 1, 0, [4, 3], 1, 1], ["AN", 1, 1, 6], ["PR", 4, 0, "auto_unroll_max_step$1024"]]]], "r": [[7.30336e-05], 0, 2.68689, 1680068033], "v": "v0.6"}
{"i": [["[\"5b1e704ad5950c6ef36e46f1856366cd\", [1, 768], [768, 768], [1, 768], [1, 768]]", "cuda -keys=cuda,gpu -arch=sm_75 -max_num_threads=1024 -model=2080ti -thread_warp_size=32", [-1, 16, 64, 49152, 2147483647, 1024, 8, 32], "", 0, []], [[], [["CI", 6], ["CI", 5], ["CI", 4], ["SP", 2, 0, 1, [1, 1, 1, 1], 1], ["SP", 2, 5, 768, [2, 96, 4, 1], 1], ["SP", 2, 10, 768, [6, 1], 1], ["RE", 2, [0, 5, 1, 6, 2, 7, 10, 11, 3, 8, 12, 4, 9]], ["FSP", 7, 0, 3, 3], ["FSP", 7, 4, 4, 3], ["RE", 7, [0, 4, 1, 5, 2, 6, 3, 7]], ["CA", 2, 7, 5], ["CHR", 1, "shared", [2]], ["CA", 2, 3, 6], ["CHR", 0, "shared", [3]], ["CA", 1, 4, 6], ["FU", 9, [0, 1]], ["AN", 9, 0, 5], ["FU", 9, [1, 2]], ["AN", 9, 1, 4], ["FU", 9, [2, 3]], ["AN", 9, 2, 6], ["FU", 3, [0, 1]], ["SP", 3, 0, 24, [1], 1], ["AN", 3, 1, 2], ["FFSP", 3, 0, [4, 3], 1, 1], ["AN", 3, 1, 6], ["FU", 1, [0, 1]], ["SP", 1, 0, 6, [1], 1], ["AN", 1, 1, 2], ["FFSP", 1, 0, [4, 3], 1, 1], ["AN", 1, 1, 6], ["PR", 4, 0, "auto_unroll_max_step$512"]]]], "r": [[0.000241233], 0, 2.29628, 1680068035], "v": "v0.6"}
{"i": [["[\"5b1e704ad5950c6ef36e46f1856366cd\", [1, 768], [768, 768], [1, 768], [1, 768]]", "cuda -keys=cuda,gpu -arch=sm_75 -max_num_threads=1024 -model=2080ti -thread_warp_size=32", [-1, 16, 64, 49152, 2147483647, 1024, 8, 32], "", 0, []], [[], [["CI", 6], ["CI", 5], ["CI", 4], ["SP", 2, 0, 1, [1, 1, 1, 1], 1], ["SP", 2, 5, 768, [1, 32, 12, 2], 1], ["SP", 2, 10, 768, [12, 1], 1], ["RE", 2, [0, 5, 1, 6, 2, 7, 10, 11, 3, 8, 12, 4, 9]], ["FSP", 7, 0, 3, 3], ["FSP", 7, 4, 4, 3], ["RE", 7, [0, 4, 1, 5, 2, 6, 3, 7]], ["CA", 2, 7, 5], ["CHR", 1, "shared", [2]], ["CA", 2, 3, 6], ["CHR", 0, "shared", [3]], ["CA", 1, 4, 6], ["FU", 9, [0, 1]], ["AN", 9, 0, 5], ["FU", 9, [1, 2]], ["AN", 9, 1, 4], ["FU", 9, [2, 3]], ["AN", 9, 2, 6], ["FU", 3, [0, 1]], ["SP", 3, 0, 24, [1], 1], ["AN", 3, 1, 2], ["FFSP", 3, 0, [4, 3], 1, 1], ["AN", 3, 1, 6], ["FU", 1, [0, 1]], ["SP", 1, 0, 1, [1], 1], ["AN", 1, 1, 2], ["FFSP", 1, 0, [4, 3], 1, 1], ["AN", 1, 1, 6], ["PR", 4, 0, "auto_unroll_max_step$64"]]]], "r": [[0.00165123], 0, 2.10568, 1680068036], "v": "v0.6"}
{"i": [["[\"5b1e704ad5950c6ef36e46f1856366cd\", [1, 768], [768, 768], [1, 768], [1, 768]]", "cuda -keys=cuda,gpu -arch=sm_75 -max_num_threads=1024 -model=2080ti -thread_warp_size=32", [-1, 16, 64, 49152, 2147483647, 1024, 8, 32], "", 0, []], [[], [["CI", 6], ["CI", 5], ["CI", 4], ["SP", 2, 0, 1, [1, 1, 1, 1], 1], ["SP", 2, 5, 768, [1, 128, 1, 1], 1], ["SP", 2, 10, 768, [1, 16], 1], ["RE", 2, [0, 5, 1, 6, 2, 7, 10, 11, 3, 8, 12, 4, 9]], ["FSP", 7, 0, 3, 3], ["FSP", 7, 4, 4, 3], ["RE", 7, [0, 4, 1, 5, 2, 6, 3, 7]], ["CA", 2, 7, 5], ["CHR", 1, "shared", [2]], ["CA", 2, 3, 6], ["CHR", 0, "shared", [3]], ["CA", 1, 4, 6], ["FU", 9, [0, 1]], ["AN", 9, 0, 5], ["FU", 9, [1, 2]], ["AN", 9, 1, 4], ["FU", 9, [2, 3]], ["AN", 9, 2, 6], ["FU", 3, [0, 1]], ["SP", 3, 0, 32, [4], 1], ["AN", 3, 1, 2], ["FFSP", 3, 0, [4, 3], 1, 1], ["AN", 3, 1, 6], ["FU", 1, [0, 1]], ["SP", 1, 0, 16, [1], 1], ["AN", 1, 1, 2], ["FFSP", 1, 0, [4, 3], 1, 1], ["AN", 1, 1, 6], ["PR", 4, 0, "auto_unroll_max_step$64"]]]], "r": [[3.1254e-05], 0, 1.92757, 1680068038], "v": "v0.6"}
{"i": [["[\"5b1e704ad5950c6ef36e46f1856366cd\", [1, 768], [768, 768], [1, 768], [1, 768]]", "cuda -keys=cuda,gpu -arch=sm_75 -max_num_threads=1024 -model=2080ti -thread_warp_size=32", [-1, 16, 64, 49152, 2147483647, 1024, 8, 32], "", 0, []], [[], [["CI", 6], ["CI", 5], ["CI", 4], ["SP", 2, 0, 1, [1, 1, 1, 1], 1], ["SP", 2, 5, 768, [4, 32, 1, 1], 1], ["SP", 2, 10, 768, [4, 3], 1], ["RE", 2, [0, 5, 1, 6, 2, 7, 10, 11, 3, 8, 12, 4, 9]], ["FSP", 7, 0, 3, 3], ["FSP", 7, 4, 4, 3], ["RE", 7, [0, 4, 1, 5, 2, 6, 3, 7]], ["CA", 2, 7, 5], ["CHR", 1, "shared", [2]], ["CA", 2, 3, 6], ["CHR", 0, "shared", [3]], ["CA", 1, 4, 6], ["FU", 9, [0, 1]], ["AN", 9, 0, 5], ["FU", 9, [1, 2]], ["AN", 9, 1, 4], ["FU", 9, [2, 3]], ["AN", 9, 2, 6], ["FU", 3, [0, 1]], ["SP", 3, 0, 12, [1], 1], ["AN", 3, 1, 2], ["FFSP", 3, 0, [4, 3], 1, 1], ["AN", 3, 1, 6], ["FU", 1, [0, 1]], ["SP", 1, 0, 12, [4], 1], ["AN", 1, 1, 2], ["FFSP", 1, 0, [4, 3], 1, 1], ["AN", 1, 1, 6], ["PR", 4, 0, "auto_unroll_max_step$64"]]]], "r": [[5.16927e-05], 0, 2.84563, 1680068039], "v": "v0.6"}
{"i": [["[\"5b1e704ad5950c6ef36e46f1856366cd\", [1, 768], [768, 768], [1, 768], [1, 768]]", "cuda -keys=cuda,gpu -arch=sm_75 -max_num_threads=1024 -model=2080ti -thread_warp_size=32", [-1, 16, 64, 49152, 2147483647, 1024, 8, 32], "", 0, []], [[], [["CI", 6], ["CI", 5], ["CI", 4], ["SP", 2, 0, 1, [1, 1, 1, 1], 1], ["SP", 2, 5, 768, [1, 48, 16, 1], 1], ["SP", 2, 10, 768, [1, 12], 1], ["RE", 2, [0, 5, 1, 6, 2, 7, 10, 11, 3, 8, 12, 4, 9]], ["FSP", 7, 0, 3, 3], ["FSP", 7, 4, 4, 3], ["RE", 7, [0, 4, 1, 5, 2, 6, 3, 7]], ["CA", 2, 7, 5], ["CHR", 1, "shared", [2]], ["CA", 2, 3, 6], ["CHR", 0, "shared", [3]], ["CA", 1, 4, 6], ["FU", 9, [0, 1]], ["AN", 9, 0, 5], ["FU", 9, [1, 2]], ["AN", 9, 1, 4], ["FU", 9, [2, 3]], ["AN", 9, 2, 6], ["FU", 3, [0, 1]], ["SP", 3, 0, 192, [1], 1], ["AN", 3, 1, 2], ["FFSP", 3, 0, [4, 3], 1, 1], ["AN", 3, 1, 6], ["FU", 1, [0, 1]], ["SP", 1, 0, 12, [1], 1], ["AN", 1, 1, 2], ["FFSP", 1, 0, [4, 3], 1, 1], ["AN", 1, 1, 6], ["PR", 4, 0, "auto_unroll_max_step$0"]]]], "r": [[0.000364747], 0, 2.11804, 1680068041], "v": "v0.6"}
{"i": [["[\"5b1e704ad5950c6ef36e46f1856366cd\", [1, 768], [768, 768], [1, 768], [1, 768]]", "cuda -keys=cuda,gpu -arch=sm_75 -max_num_threads=1024 -model=2080ti -thread_warp_size=32", [-1, 16, 64, 49152, 2147483647, 1024, 8, 32], "", 0, []], [[], [["CI", 6], ["CI", 5], ["CI", 4], ["SP", 2, 0, 1, [1, 1, 1, 1], 1], ["SP", 2, 5, 768, [4, 32, 1, 2], 1], ["SP", 2, 10, 768, [6, 4], 1], ["RE", 2, [0, 5, 1, 6, 2, 7, 10, 11, 3, 8, 12, 4, 9]], ["FSP", 7, 0, 3, 3], ["FSP", 7, 4, 4, 3], ["RE", 7, [0, 4, 1, 5, 2, 6, 3, 7]], ["CA", 2, 7, 5], ["CHR", 1, "shared", [2]], ["CA", 2, 3, 6], ["CHR", 0, "shared", [3]], ["CA", 1, 4, 6], ["FU", 9, [0, 1]], ["AN", 9, 0, 5], ["FU", 9, [1, 2]], ["AN", 9, 1, 4], ["FU", 9, [2, 3]], ["AN", 9, 2, 6], ["FU", 3, [0, 1]], ["SP", 3, 0, 48, [3], 1], ["AN", 3, 1, 2], ["FFSP", 3, 0, [4, 3], 1, 1], ["AN", 3, 1, 6], ["FU", 1, [0, 1]], ["SP", 1, 0, 24, [1], 1], ["AN", 1, 1, 2], ["FFSP", 1, 0, [4, 3], 1, 1], ["AN", 1, 1, 6], ["PR", 4, 0, "auto_unroll_max_step$512"]]]], "r": [[9.39056e-05], 0, 3.29547, 1680068042], "v": "v0.6"}
{"i": [["[\"5b1e704ad5950c6ef36e46f1856366cd\", [1, 768], [768, 768], [1, 768], [1, 768]]", "cuda -keys=cuda,gpu -arch=sm_75 -max_num_threads=1024 -model=2080ti -thread_warp_size=32", [-1, 16, 64, 49152, 2147483647, 1024, 8, 32], "", 0, []], [[], [["CI", 6], ["CI", 5], ["CI", 4], ["SP", 2, 0, 1, [1, 1, 1, 1], 1], ["SP", 2, 5, 768, [2, 128, 3, 1], 1], ["SP", 2, 10, 768, [1, 6], 1], ["RE", 2, [0, 5, 1, 6, 2, 7, 10, 11, 3, 8, 12, 4, 9]], ["FSP", 7, 0, 3, 3], ["FSP", 7, 4, 4, 3], ["RE", 7, [0, 4, 1, 5, 2, 6, 3, 7]], ["CA", 2, 7, 5], ["CHR", 1, "shared", [2]], ["CA", 2, 3, 6], ["CHR", 0, "shared", [3]], ["CA", 1, 4, 6], ["FU", 9, [0, 1]], ["AN", 9, 0, 5], ["FU", 9, [1, 2]], ["AN", 9, 1, 4], ["FU", 9, [2, 3]], ["AN", 9, 2, 6], ["FU", 3, [0, 1]], ["SP", 3, 0, 36, [1], 1], ["AN", 3, 1, 2], ["FFSP", 3, 0, [4, 3], 1, 1], ["AN", 3, 1, 6], ["FU", 1, [0, 1]], ["SP", 1, 0, 6, [1], 1], ["AN", 1, 1, 2], ["FFSP", 1, 0, [4, 3], 1, 1], ["AN", 1, 1, 6], ["PR", 4, 0, "auto_unroll_max_step$512"]]]], "r": [[0.000222468], 0, 2.51411, 1680068043], "v": "v0.6"}
{"i": [["[\"5b1e704ad5950c6ef36e46f1856366cd\", [1, 768], [768, 768], [1, 768], [1, 768]]", "cuda -keys=cuda,gpu -arch=sm_75 -max_num_threads=1024 -model=2080ti -thread_warp_size=32", [-1, 16, 64, 49152, 2147483647, 1024, 8, 32], "", 0, []], [[], [["CI", 6], ["CI", 5], ["CI", 4], ["SP", 2, 0, 1, [1, 1, 1, 1], 1], ["SP", 2, 5, 768, [1, 32, 4, 2], 1], ["SP", 2, 10, 768, [1, 4], 1], ["RE", 2, [0, 5, 1, 6, 2, 7, 10, 11, 3, 8, 12, 4, 9]], ["FSP", 7, 0, 3, 3], ["FSP", 7, 4, 4, 3], ["RE", 7, [0, 4, 1, 5, 2, 6, 3, 7]], ["CA", 2, 7, 5], ["CHR", 1, "shared", [2]], ["CA", 2, 3, 6], ["CHR", 0, "shared", [3]], ["CA", 1, 4, 6], ["FU", 9, [0, 1]], ["AN", 9, 0, 5], ["FU", 9, [1, 2]], ["AN", 9, 1, 4], ["FU", 9, [2, 3]], ["AN", 9, 2, 6], ["FU", 3, [0, 1]], ["SP", 3, 0, 32, [1], 1], ["AN", 3, 1, 2], ["FFSP", 3, 0, [4, 3], 1, 1], ["AN", 3, 1, 6], ["FU", 1, [0, 1]], ["SP", 1, 0, 4, [1], 1], ["AN", 1, 1, 2], ["FFSP", 1, 0, [4, 3], 1, 1], ["AN", 1, 1, 6], ["PR", 4, 0, "auto_unroll_max_step$1024"]]]], "r": [[0.000203217], 0, 2.21744, 1680068045], "v": "v0.6"}
{"i": [["[\"5b1e704ad5950c6ef36e46f1856366cd\", [1, 768], [768, 768], [1, 768], [1, 768]]", "cuda -keys=cuda,gpu -arch=sm_75 -max_num_threads=1024 -model=2080ti -thread_warp_size=32", [-1, 16, 64, 49152, 2147483647, 1024, 8, 32], "", 0, []], [[], [["CI", 6], ["CI", 5], ["CI", 4], ["SP", 2, 0, 1, [1, 1, 1, 1], 1], ["SP", 2, 5, 768, [1, 32, 6, 1], 1], ["SP", 2, 10, 768, [48, 1], 1], ["RE", 2, [0, 5, 1, 6, 2, 7, 10, 11, 3, 8, 12, 4, 9]], ["FSP", 7, 0, 3, 3], ["FSP", 7, 4, 4, 3], ["RE", 7, [0, 4, 1, 5, 2, 6, 3, 7]], ["CA", 2, 7, 5], ["CHR", 1, "shared", [2]], ["CA", 2, 3, 6], ["CHR", 0, "shared", [3]], ["CA", 1, 4, 6], ["FU", 9, [0, 1]], ["AN", 9, 0, 5], ["FU", 9, [1, 2]], ["AN", 9, 1, 4], ["FU", 9, [2, 3]], ["AN", 9, 2, 6], ["FU", 3, [0, 1]], ["SP", 3, 0, 288, [1], 1], ["AN", 3, 1, 2], ["FFSP", 3, 0, [4, 3], 1, 1], ["AN", 3, 1, 6], ["FU", 1, [0, 1]], ["SP", 1, 0, 48, [1], 1], ["AN", 1, 1, 2], ["FFSP", 1, 0, [4, 3], 1, 1], ["AN", 1, 1, 6], ["PR", 4, 0, "auto_unroll_max_step$512"]]]], "r": [[0.000108462], 0, 5.64895, 1680068046], "v": "v0.6"}
{"i": [["[\"5b1e704ad5950c6ef36e46f1856366cd\", [1, 768], [768, 768], [1, 768], [1, 768]]", "cuda -keys=cuda,gpu -arch=sm_75 -max_num_threads=1024 -model=2080ti -thread_warp_size=32", [-1, 16, 64, 49152, 2147483647, 1024, 8, 32], "", 0, []], [[], [["CI", 6], ["CI", 5], ["CI", 4], ["SP", 2, 0, 1, [1, 1, 1, 1], 1], ["SP", 2, 5, 768, [4, 96, 1, 1], 1], ["SP", 2, 10, 768, [2, 2], 1], ["RE", 2, [0, 5, 1, 6, 2, 7, 10, 11, 3, 8, 12, 4, 9]], ["FSP", 7, 0, 3, 3], ["FSP", 7, 4, 4, 3], ["RE", 7, [0, 4, 1, 5, 2, 6, 3, 7]], ["CA", 2, 7, 5], ["CHR", 1, "shared", [2]], ["CA", 2, 3, 6], ["CHR", 0, "shared", [3]], ["CA", 1, 4, 6], ["FU", 9, [0, 1]], ["AN", 9, 0, 5], ["FU", 9, [1, 2]], ["AN", 9, 1, 4], ["FU", 9, [2, 3]], ["AN", 9, 2, 6], ["FU", 3, [0, 1]], ["SP", 3, 0, 4, [4], 1], ["AN", 3, 1, 2], ["FFSP", 3, 0, [4, 3], 1, 1], ["AN", 3, 1, 6], ["FU", 1, [0, 1]], ["SP", 1, 0, 4, [1], 1], ["AN", 1, 1, 2], ["FFSP", 1, 0, [4, 3], 1, 1], ["AN", 1, 1, 6], ["PR", 4, 0, "auto_unroll_max_step$1024"]]]], "r": [[0.000138887], 0, 2.23635, 1680068048], "v": "v0.6"}
{"i": [["[\"5b1e704ad5950c6ef36e46f1856366cd\", [1, 768], [768, 768], [1, 768], [1, 768]]", "cuda -keys=cuda,gpu -arch=sm_75 -max_num_threads=1024 -model=2080ti -thread_warp_size=32", [-1, 16, 64, 49152, 2147483647, 1024, 8, 32], "", 0, []], [[], [["CI", 6], ["CI", 5], ["CI", 4], ["SP", 2, 0, 1, [1, 1, 1, 1], 1], ["SP", 2, 5, 768, [1, 768, 1, 1], 1], ["SP", 2, 10, 768, [12, 1], 1], ["RE", 2, [0, 5, 1, 6, 2, 7, 10, 11, 3, 8, 12, 4, 9]], ["FSP", 7, 0, 3, 3], ["FSP", 7, 4, 4, 3], ["RE", 7, [0, 4, 1, 5, 2, 6, 3, 7]], ["CA", 2, 7, 5], ["CHR", 1, "shared", [2]], ["CA", 2, 3, 6], ["CHR", 0, "shared", [3]], ["CA", 1, 4, 6], ["FU", 9, [0, 1]], ["AN", 9, 0, 5], ["FU", 9, [1, 2]], ["AN", 9, 1, 4], ["FU", 9, [2, 3]], ["AN", 9, 2, 6], ["FU", 3, [0, 1]], ["SP", 3, 0, 24, [1], 1], ["AN", 3, 1, 2], ["FFSP", 3, 0, [4, 3], 1, 1], ["AN", 3, 1, 6], ["FU", 1, [0, 1]], ["SP", 1, 0, 24, [1], 1], ["AN", 1, 1, 2], ["FFSP", 1, 0, [4, 3], 1, 1], ["AN", 1, 1, 6], ["PR", 4, 0, "auto_unroll_max_step$64"]]]], "r": [[0.000144328], 0, 2.011, 1680068049], "v": "v0.6"}
{"i": [["[\"5b1e704ad5950c6ef36e46f1856366cd\", [1, 768], [768, 768], [1, 768], [1, 768]]", "cuda -keys=cuda,gpu -arch=sm_75 -max_num_threads=1024 -model=2080ti -thread_warp_size=32", [-1, 16, 64, 49152, 2147483647, 1024, 8, 32], "", 0, []], [[], [["CI", 6], ["CI", 5], ["CI", 4], ["SP", 2, 0, 1, [1, 1, 1, 1], 1], ["SP", 2, 5, 768, [4, 96, 2, 1], 1], ["SP", 2, 10, 768, [1, 4], 1], ["RE", 2, [0, 5, 1, 6, 2, 7, 10, 11, 3, 8, 12, 4, 9]], ["FSP", 7, 0, 3, 3], ["FSP", 7, 4, 4, 3], ["RE", 7, [0, 4, 1, 5, 2, 6, 3, 7]], ["CA", 2, 7, 5], ["CHR", 1, "shared", [2]], ["CA", 2, 3, 6], ["CHR", 0, "shared", [3]], ["CA", 1, 4, 6], ["FU", 9, [0, 1]], ["AN", 9, 0, 5], ["FU", 9, [1, 2]], ["AN", 9, 1, 4], ["FU", 9, [2, 3]], ["AN", 9, 2, 6], ["FU", 3, [0, 1]], ["SP", 3, 0, 4, [1], 1], ["AN", 3, 1, 2], ["FFSP", 3, 0, [4, 3], 1, 1], ["AN", 3, 1, 6], ["FU", 1, [0, 1]], ["SP", 1, 0, 4, [1], 1], ["AN", 1, 1, 2], ["FFSP", 1, 0, [4, 3], 1, 1], ["AN", 1, 1, 6], ["PR", 4, 0, "auto_unroll_max_step$64"]]]], "r": [[0.000262997], 0, 2.41845, 1680068051], "v": "v0.6"}
{"i": [["[\"5b1e704ad5950c6ef36e46f1856366cd\", [1, 768], [768, 768], [1, 768], [1, 768]]", "cuda -keys=cuda,gpu -arch=sm_75 -max_num_threads=1024 -model=2080ti -thread_warp_size=32", [-1, 16, 64, 49152, 2147483647, 1024, 8, 32], "", 0, []], [[], [["CI", 6], ["CI", 5], ["CI", 4], ["SP", 2, 0, 1, [1, 1, 1, 1], 1], ["SP", 2, 5, 768, [3, 32, 4, 1], 1], ["SP", 2, 10, 768, [6, 2], 1], ["RE", 2, [0, 5, 1, 6, 2, 7, 10, 11, 3, 8, 12, 4, 9]], ["FSP", 7, 0, 3, 3], ["FSP", 7, 4, 4, 3], ["RE", 7, [0, 4, 1, 5, 2, 6, 3, 7]], ["CA", 2, 7, 5], ["CHR", 1, "shared", [2]], ["CA", 2, 3, 6], ["CHR", 0, "shared", [3]], ["CA", 1, 4, 6], ["FU", 9, [0, 1]], ["AN", 9, 0, 5], ["FU", 9, [1, 2]], ["AN", 9, 1, 4], ["FU", 9, [2, 3]], ["AN", 9, 2, 6], ["FU", 3, [0, 1]], ["SP", 3, 0, 48, [1], 1], ["AN", 3, 1, 2], ["FFSP", 3, 0, [4, 3], 1, 1], ["AN", 3, 1, 6], ["FU", 1, [0, 1]], ["SP", 1, 0, 12, [1], 1], ["AN", 1, 1, 2], ["FFSP", 1, 0, [4, 3], 1, 1], ["AN", 1, 1, 6], ["PR", 4, 0, "auto_unroll_max_step$512"]]]], "r": [[0.000154661], 0, 3.58891, 1680068052], "v": "v0.6"}
{"i": [["[\"5b1e704ad5950c6ef36e46f1856366cd\", [1, 768], [768, 768], [1, 768], [1, 768]]", "cuda -keys=cuda,gpu -arch=sm_75 -max_num_threads=1024 -model=2080ti -thread_warp_size=32", [-1, 16, 64, 49152, 2147483647, 1024, 8, 32], "", 0, []], [[], [["CI", 6], ["CI", 5], ["CI", 4], ["SP", 2, 0, 1, [1, 1, 1, 1], 1], ["SP", 2, 5, 768, [3, 32, 4, 1], 1], ["SP", 2, 10, 768, [2, 6], 1], ["RE", 2, [0, 5, 1, 6, 2, 7, 10, 11, 3, 8, 12, 4, 9]], ["FSP", 7, 0, 3, 3], ["FSP", 7, 4, 4, 3], ["RE", 7, [0, 4, 1, 5, 2, 6, 3, 7]], ["CA", 2, 7, 5], ["CHR", 1, "shared", [2]], ["CA", 2, 3, 6], ["CHR", 0, "shared", [3]], ["CA", 1, 4, 6], ["FU", 9, [0, 1]], ["AN", 9, 0, 5], ["FU", 9, [1, 2]], ["AN", 9, 1, 4], ["FU", 9, [2, 3]], ["AN", 9, 2, 6], ["FU", 3, [0, 1]], ["SP", 3, 0, 48, [2], 1], ["AN", 3, 1, 2], ["FFSP", 3, 0, [4, 3], 1, 1], ["AN", 3, 1, 6], ["FU", 1, [0, 1]], ["SP", 1, 0, 12, [1], 1], ["AN", 1, 1, 2], ["FFSP", 1, 0, [4, 3], 1, 1], ["AN", 1, 1, 6], ["PR", 4, 0, "auto_unroll_max_step$0"]]]], "r": [[0.0002902], 0, 2.61037, 1680068053], "v": "v0.6"}
{"i": [["[\"5b1e704ad5950c6ef36e46f1856366cd\", [1, 768], [768, 768], [1, 768], [1, 768]]", "cuda -keys=cuda,gpu -arch=sm_75 -max_num_threads=1024 -model=2080ti -thread_warp_size=32", [-1, 16, 64, 49152, 2147483647, 1024, 8, 32], "", 0, []], [[], [["CI", 6], ["CI", 5], ["CI", 4], ["SP", 2, 0, 1, [1, 1, 1, 1], 1], ["SP", 2, 5, 768, [3, 32, 8, 1], 1], ["SP", 2, 10, 768, [6, 2], 1], ["RE", 2, [0, 5, 1, 6, 2, 7, 10, 11, 3, 8, 12, 4, 9]], ["FSP", 7, 0, 3, 3], ["FSP", 7, 4, 4, 3], ["RE", 7, [0, 4, 1, 5, 2, 6, 3, 7]], ["CA", 2, 7, 5], ["CHR", 1, "shared", [2]], ["CA", 2, 3, 6], ["CHR", 0, "shared", [3]], ["CA", 1, 4, 6], ["FU", 9, [0, 1]], ["AN", 9, 0, 5], ["FU", 9, [1, 2]], ["AN", 9, 1, 4], ["FU", 9, [2, 3]], ["AN", 9, 2, 6], ["FU", 3, [0, 1]], ["SP", 3, 0, 48, [1], 1], ["AN", 3, 1, 2], ["FFSP", 3, 0, [4, 3], 1, 1], ["AN", 3, 1, 6], ["FU", 1, [0, 1]], ["SP", 1, 0, 12, [1], 1], ["AN", 1, 1, 2], ["FFSP", 1, 0, [4, 3], 1, 1], ["AN", 1, 1, 6], ["PR", 4, 0, "auto_unroll_max_step$512"]]]], "r": [[0.000503749], 0, 5.24029, 1680068059], "v": "v0.6"}
{"i": [["[\"5b1e704ad5950c6ef36e46f1856366cd\", [1, 768], [768, 768], [1, 768], [1, 768]]", "cuda -keys=cuda,gpu -arch=sm_75 -max_num_threads=1024 -model=2080ti -thread_warp_size=32", [-1, 16, 64, 49152, 2147483647, 1024, 8, 32], "", 0, []], [[], [["CI", 6], ["CI", 5], ["CI", 4], ["SP", 2, 0, 1, [1, 1, 1, 1], 1], ["SP", 2, 5, 768, [1, 1, 4, 64], 1], ["SP", 2, 10, 768, [4, 1], 1], ["RE", 2, [0, 5, 1, 6, 2, 7, 10, 11, 3, 8, 12, 4, 9]], ["FSP", 7, 0, 3, 3], ["FSP", 7, 4, 4, 3], ["RE", 7, [0, 4, 1, 5, 2, 6, 3, 7]], ["CA", 2, 7, 5], ["CHR", 1, "shared", [2]], ["CA", 2, 3, 6], ["CHR", 0, "shared", [3]], ["CA", 1, 4, 6], ["FU", 9, [0, 1]], ["AN", 9, 0, 5], ["FU", 9, [1, 2]], ["AN", 9, 1, 4], ["FU", 9, [2, 3]], ["AN", 9, 2, 6], ["FU", 3, [0, 1]], ["SP", 3, 0, 32, [1], 1], ["AN", 3, 1, 2], ["FFSP", 3, 0, [4, 3], 1, 1], ["AN", 3, 1, 6], ["FU", 1, [0, 1]], ["SP", 1, 0, 4, [1], 1], ["AN", 1, 1, 2], ["FFSP", 1, 0, [4, 3], 1, 1], ["AN", 1, 1, 6], ["PR", 4, 0, "auto_unroll_max_step$1024"]]]], "r": [[0.00492203], 0, 8.56293, 1680068060], "v": "v0.6"}
