saved_logs/1000trials/default-Ansor/5/autoscheduler/2080ti/bert-B1-float32.json
{"i": [["[\"4b5e216f8244b4e8f7b6543c4a9087e5\", [1536, 128], [1536, 128]]", "cuda -keys=cuda,gpu -arch=sm_75 -max_num_threads=1024 -model=2080ti -thread_warp_size=32", [-1, 16, 64, 49152, 2147483647, 1024, 8, 32], "", 0, []], [[], [["CI", 3], ["CI", 2], ["SP", 1, 1, 128, [64], 1], ["AN", 1, 2, 6], ["FU", 5, [0, 1]], ["SP", 5, 0, 196608, [32], 1], ["AN", 5, 0, 5], ["AN", 5, 1, 6], ["SP", 4, 0, 1536, [2], 1], ["AN", 4, 0, 5], ["AN", 4, 1, 6], ["AN", 1, 0, 5], ["PR", 1, 0, "auto_unroll_max_step$64"], ["PR", 4, 0, "auto_unroll_max_step$64"]]]], "r": [[2.39037e-05], 0, 1.84334, 1680263513], "v": "v0.6"}
{"i": [["[\"4b5e216f8244b4e8f7b6543c4a9087e5\", [1536, 128], [1536, 128]]", "cuda -keys=cuda,gpu -arch=sm_75 -max_num_threads=1024 -model=2080ti -thread_warp_size=32", [-1, 16, 64, 49152, 2147483647, 1024, 8, 32], "", 0, []], [[], [["CI", 3], ["CI", 2], ["FU", 5, [0, 1]], ["SP", 5, 0, 196608, [64], 1], ["AN", 5, 0, 5], ["AN", 5, 1, 6], ["SP", 4, 0, 1536, [32], 1], ["AN", 4, 0, 5], ["AN", 4, 1, 6], ["SP", 1, 0, 1536, [64], 1], ["AN", 1, 0, 5], ["AN", 1, 1, 6], ["PR", 1, 0, "auto_unroll_max_step$16"], ["PR", 4, 0, "auto_unroll_max_step$512"]]]], "r": [[2.61486e-05], 0, 1.95994, 1680263514], "v": "v0.6"}
{"i": [["[\"4b5e216f8244b4e8f7b6543c4a9087e5\", [1536, 128], [1536, 128]]", "cuda -keys=cuda,gpu -arch=sm_75 -max_num_threads=1024 -model=2080ti -thread_warp_size=32", [-1, 16, 64, 49152, 2147483647, 1024, 8, 32], "", 0, []], [[], [["CI", 3], ["CI", 2], ["SP", 1, 1, 128, [1], 1], ["AN", 1, 2, 6], ["FU", 5, [0, 1]], ["SP", 5, 0, 196608, [32], 1], ["AN", 5, 0, 5], ["AN", 5, 1, 6], ["SP", 4, 0, 1536, [32], 1], ["AN", 4, 0, 5], ["AN", 4, 1, 6], ["AN", 1, 0, 5], ["PR", 1, 0, "auto_unroll_max_step$0"], ["PR", 4, 0, "auto_unroll_max_step$64"]]]], "r": [[2.76417e-05], 0, 1.96671, 1680263515], "v": "v0.6"}
{"i": [["[\"4b5e216f8244b4e8f7b6543c4a9087e5\", [1536, 128], [1536, 128]]", "cuda -keys=cuda,gpu -arch=sm_75 -max_num_threads=1024 -model=2080ti -thread_warp_size=32", [-1, 16, 64, 49152, 2147483647, 1024, 8, 32], "", 0, []], [[], [["CI", 3], ["CI", 2], ["FU", 5, [0, 1]], ["SP", 5, 0, 196608, [16], 1], ["AN", 5, 0, 5], ["AN", 5, 1, 6], ["SP", 4, 0, 1536, [4], 1], ["AN", 4, 0, 5], ["AN", 4, 1, 6], ["SP", 1, 0, 1536, [32], 1], ["AN", 1, 0, 5], ["AN", 1, 1, 6], ["PR", 1, 0, "auto_unroll_max_step$1024"], ["PR", 4, 0, "auto_unroll_max_step$1024"]]]], "r": [[3.04961e-05], 0, 1.98209, 1680263517], "v": "v0.6"}
{"i": [["[\"4b5e216f8244b4e8f7b6543c4a9087e5\", [1536, 128], [1536, 128]]", "cuda -keys=cuda,gpu -arch=sm_75 -max_num_threads=1024 -model=2080ti -thread_warp_size=32", [-1, 16, 64, 49152, 2147483647, 1024, 8, 32], "", 0, []], [[], [["CI", 3], ["CI", 2], ["SP", 1, 1, 128, [64], 1], ["AN", 1, 2, 6], ["FU", 5, [0, 1]], ["SP", 5, 0, 196608, [32], 1], ["AN", 5, 0, 5], ["AN", 5, 1, 6], ["SP", 4, 0, 1536, [64], 1], ["AN", 4, 0, 5], ["AN", 4, 1, 6], ["AN", 1, 0, 5], ["PR", 1, 0, "auto_unroll_max_step$0"], ["PR", 4, 0, "auto_unroll_max_step$0"]]]], "r": [[2.22594e-05], 0, 1.96108, 1680263518], "v": "v0.6"}
{"i": [["[\"4b5e216f8244b4e8f7b6543c4a9087e5\", [1536, 128], [1536, 128]]", "cuda -keys=cuda,gpu -arch=sm_75 -max_num_threads=1024 -model=2080ti -thread_warp_size=32", [-1, 16, 64, 49152, 2147483647, 1024, 8, 32], "", 0, []], [[], [["SP", 5, 1, 128, [8], 1], ["AN", 5, 2, 6], ["FSP", 4, 1, 0, 1], ["AN", 4, 2, 6], ["CA", 4, 5, 0], ["CI", 3], ["CI", 2], ["FSP", 1, 1, 0, 1], ["AN", 1, 2, 6], ["CA", 1, 5, 0], ["AN", 5, 0, 5], ["PR", 1, 0, "auto_unroll_max_step$512"], ["PR", 4, 0, "auto_unroll_max_step$512"]]]], "r": [[1.27776e-05], 0, 2.75095, 1680263519], "v": "v0.6"}
{"i": [["[\"4b5e216f8244b4e8f7b6543c4a9087e5\", [1536, 128], [1536, 128]]", "cuda -keys=cuda,gpu -arch=sm_75 -max_num_threads=1024 -model=2080ti -thread_warp_size=32", [-1, 16, 64, 49152, 2147483647, 1024, 8, 32], "", 0, []], [[], [["CI", 3], ["CI", 2], ["SP", 1, 1, 128, [2], 1], ["AN", 1, 2, 6], ["FU", 5, [0, 1]], ["SP", 5, 0, 196608, [1], 1], ["AN", 5, 0, 5], ["AN", 5, 1, 6], ["SP", 4, 0, 1536, [2], 1], ["AN", 4, 0, 5], ["AN", 4, 1, 6], ["AN", 1, 0, 5], ["PR", 1, 0, "auto_unroll_max_step$16"], ["PR", 4, 0, "auto_unroll_max_step$64"]]]], "r": [[0.000183287], 0, 1.94641, 1680263521], "v": "v0.6"}
{"i": [["[\"4b5e216f8244b4e8f7b6543c4a9087e5\", [1536, 128], [1536, 128]]", "cuda -keys=cuda,gpu -arch=sm_75 -max_num_threads=1024 -model=2080ti -thread_warp_size=32", [-1, 16, 64, 49152, 2147483647, 1024, 8, 32], "", 0, []], [[], [["SP", 5, 1, 128, [32], 1], ["AN", 5, 2, 6], ["FSP", 4, 1, 0, 1], ["AN", 4, 2, 6], ["CA", 4, 5, 0], ["CI", 3], ["CI", 2], ["AN", 5, 0, 5], ["SP", 1, 0, 1536, [4], 1], ["AN", 1, 0, 5], ["AN", 1, 1, 6], ["PR", 1, 0, "auto_unroll_max_step$0"], ["PR", 4, 0, "auto_unroll_max_step$0"]]]], "r": [[1.24073e-05], 0, 2.02816, 1680263522], "v": "v0.6"}
{"i": [["[\"4b5e216f8244b4e8f7b6543c4a9087e5\", [1536, 128], [1536, 128]]", "cuda -keys=cuda,gpu -arch=sm_75 -max_num_threads=1024 -model=2080ti -thread_warp_size=32", [-1, 16, 64, 49152, 2147483647, 1024, 8, 32], "", 0, []], [[], [["CI", 3], ["CI", 2], ["FU", 5, [0, 1]], ["SP", 5, 0, 196608, [8], 1], ["AN", 5, 0, 5], ["AN", 5, 1, 6], ["SP", 4, 0, 1536, [64], 1], ["AN", 4, 0, 5], ["AN", 4, 1, 6], ["SP", 1, 0, 1536, [32], 1], ["AN", 1, 0, 5], ["AN", 1, 1, 6], ["PR", 1, 0, "auto_unroll_max_step$512"], ["PR", 4, 0, "auto_unroll_max_step$16"]]]], "r": [[4.21981e-05], 0, 2.14658, 1680263523], "v": "v0.6"}
{"i": [["[\"4b5e216f8244b4e8f7b6543c4a9087e5\", [1536, 128], [1536, 128]]", "cuda -keys=cuda,gpu -arch=sm_75 -max_num_threads=1024 -model=2080ti -thread_warp_size=32", [-1, 16, 64, 49152, 2147483647, 1024, 8, 32], "", 0, []], [[], [["SP", 5, 1, 128, [64], 1], ["AN", 5, 2, 6], ["FSP", 4, 1, 0, 1], ["AN", 4, 2, 6], ["CA", 4, 5, 0], ["CI", 3], ["CI", 2], ["FSP", 1, 1, 0, 1], ["AN", 1, 2, 6], ["CA", 1, 5, 0], ["AN", 5, 0, 5], ["PR", 1, 0, "auto_unroll_max_step$16"], ["PR", 4, 0, "auto_unroll_max_step$1024"]]]], "r": [[6.12275e-06], 0, 1.88088, 1680263524], "v": "v0.6"}
{"i": [["[\"4b5e216f8244b4e8f7b6543c4a9087e5\", [1536, 128], [1536, 128]]", "cuda -keys=cuda,gpu -arch=sm_75 -max_num_threads=1024 -model=2080ti -thread_warp_size=32", [-1, 16, 64, 49152, 2147483647, 1024, 8, 32], "", 0, []], [[], [["CI", 3], ["CI", 2], ["FU", 5, [0, 1]], ["SP", 5, 0, 196608, [2], 1], ["AN", 5, 0, 5], ["AN", 5, 1, 6], ["SP", 4, 0, 1536, [32], 1], ["AN", 4, 0, 5], ["AN", 4, 1, 6], ["SP", 1, 0, 1536, [32], 1], ["AN", 1, 0, 5], ["AN", 1, 1, 6], ["PR", 1, 0, "auto_unroll_max_step$512"], ["PR", 4, 0, "auto_unroll_max_step$1024"]]]], "r": [[0.000106576], 0, 2.02166, 1680263526], "v": "v0.6"}
{"i": [["[\"4b5e216f8244b4e8f7b6543c4a9087e5\", [1536, 128], [1536, 128]]", "cuda -keys=cuda,gpu -arch=sm_75 -max_num_threads=1024 -model=2080ti -thread_warp_size=32", [-1, 16, 64, 49152, 2147483647, 1024, 8, 32], "", 0, []], [[], [["SP", 5, 1, 128, [2], 1], ["AN", 5, 2, 6], ["FSP", 4, 1, 0, 1], ["AN", 4, 2, 6], ["CA", 4, 5, 0], ["CI", 3], ["CI", 2], ["FSP", 1, 1, 0, 1], ["AN", 1, 2, 6], ["CA", 1, 5, 0], ["AN", 5, 0, 5], ["PR", 1, 0, "auto_unroll_max_step$512"], ["PR", 4, 0, "auto_unroll_max_step$0"]]]], "r": [[4.44505e-05], 0, 2.14128, 1680263527], "v": "v0.6"}
{"i": [["[\"4b5e216f8244b4e8f7b6543c4a9087e5\", [1536, 128], [1536, 128]]", "cuda -keys=cuda,gpu -arch=sm_75 -max_num_threads=1024 -model=2080ti -thread_warp_size=32", [-1, 16, 64, 49152, 2147483647, 1024, 8, 32], "", 0, []], [[], [["SP", 5, 1, 128, [32], 1], ["AN", 5, 2, 6], ["FSP", 4, 1, 0, 1], ["AN", 4, 2, 6], ["CA", 4, 5, 0], ["CI", 3], ["CI", 2], ["AN", 5, 0, 5], ["SP", 1, 0, 1536, [16], 1], ["AN", 1, 0, 5], ["AN", 1, 1, 6], ["PR", 1, 0, "auto_unroll_max_step$512"], ["PR", 4, 0, "auto_unroll_max_step$1024"]]]], "r": [[1.24525e-05], 0, 2.04219, 1680263528], "v": "v0.6"}
{"i": [["[\"4b5e216f8244b4e8f7b6543c4a9087e5\", [1536, 128], [1536, 128]]", "cuda -keys=cuda,gpu -arch=sm_75 -max_num_threads=1024 -model=2080ti -thread_warp_size=32", [-1, 16, 64, 49152, 2147483647, 1024, 8, 32], "", 0, []], [[], [["CI", 3], ["CI", 2], ["SP", 1, 1, 128, [32], 1], ["AN", 1, 2, 6], ["FU", 5, [0, 1]], ["SP", 5, 0, 196608, [16], 1], ["AN", 5, 0, 5], ["AN", 5, 1, 6], ["SP", 4, 0, 1536, [32], 1], ["AN", 4, 0, 5], ["AN", 4, 1, 6], ["AN", 1, 0, 5], ["PR", 1, 0, "auto_unroll_max_step$16"], ["PR", 4, 0, "auto_unroll_max_step$64"]]]], "r": [[2.90383e-05], 0, 1.9765, 1680263530], "v": "v0.6"}
{"i": [["[\"4b5e216f8244b4e8f7b6543c4a9087e5\", [1536, 128], [1536, 128]]", "cuda -keys=cuda,gpu -arch=sm_75 -max_num_threads=1024 -model=2080ti -thread_warp_size=32", [-1, 16, 64, 49152, 2147483647, 1024, 8, 32], "", 0, []], [[], [["CI", 3], ["CI", 2], ["SP", 1, 1, 128, [32], 1], ["AN", 1, 2, 6], ["FU", 5, [0, 1]], ["SP", 5, 0, 196608, [32], 1], ["AN", 5, 0, 5], ["AN", 5, 1, 6], ["SP", 4, 0, 1536, [64], 1], ["AN", 4, 0, 5], ["AN", 4, 1, 6], ["AN", 1, 0, 5], ["PR", 1, 0, "auto_unroll_max_step$0"], ["PR", 4, 0, "auto_unroll_max_step$1024"]]]], "r": [[2.1735e-05], 0, 1.95971, 1680263531], "v": "v0.6"}
{"i": [["[\"4b5e216f8244b4e8f7b6543c4a9087e5\", [1536, 128], [1536, 128]]", "cuda -keys=cuda,gpu -arch=sm_75 -max_num_threads=1024 -model=2080ti -thread_warp_size=32", [-1, 16, 64, 49152, 2147483647, 1024, 8, 32], "", 0, []], [[], [["SP", 5, 1, 128, [8], 1], ["AN", 5, 2, 6], ["FSP", 4, 1, 0, 1], ["AN", 4, 2, 6], ["CA", 4, 5, 0], ["CI", 3], ["CI", 2], ["FSP", 1, 1, 0, 1], ["AN", 1, 2, 6], ["CA", 1, 5, 0], ["AN", 5, 0, 5], ["PR", 1, 0, "auto_unroll_max_step$1024"], ["PR", 4, 0, "auto_unroll_max_step$0"]]]], "r": [[1.32522e-05], 0, 1.92938, 1680263532], "v": "v0.6"}
{"i": [["[\"4b5e216f8244b4e8f7b6543c4a9087e5\", [1536, 128], [1536, 128]]", "cuda -keys=cuda,gpu -arch=sm_75 -max_num_threads=1024 -model=2080ti -thread_warp_size=32", [-1, 16, 64, 49152, 2147483647, 1024, 8, 32], "", 0, []], [[], [["CI", 3], ["CI", 2], ["SP", 1, 1, 128, [32], 1], ["AN", 1, 2, 6], ["FU", 5, [0, 1]], ["SP", 5, 0, 196608, [32], 1], ["AN", 5, 0, 5], ["AN", 5, 1, 6], ["SP", 4, 0, 1536, [32], 1], ["AN", 4, 0, 5], ["AN", 4, 1, 6], ["AN", 1, 0, 5], ["PR", 1, 0, "auto_unroll_max_step$16"], ["PR", 4, 0, "auto_unroll_max_step$512"]]]], "r": [[2.37175e-05], 0, 2.14395, 1680263534], "v": "v0.6"}
{"i": [["[\"4b5e216f8244b4e8f7b6543c4a9087e5\", [1536, 128], [1536, 128]]", "cuda -keys=cuda,gpu -arch=sm_75 -max_num_threads=1024 -model=2080ti -thread_warp_size=32", [-1, 16, 64, 49152, 2147483647, 1024, 8, 32], "", 0, []], [[], [["CI", 3], ["CI", 2], ["SP", 1, 1, 128, [32], 1], ["AN", 1, 2, 6], ["FU", 5, [0, 1]], ["SP", 5, 0, 196608, [32], 1], ["AN", 5, 0, 5], ["AN", 5, 1, 6], ["SP", 4, 0, 1536, [32], 1], ["AN", 4, 0, 5], ["AN", 4, 1, 6], ["AN", 1, 0, 5], ["PR", 1, 0, "auto_unroll_max_step$16"], ["PR", 4, 0, "auto_unroll_max_step$1024"]]]], "r": [[2.37388e-05], 0, 2.0908, 1680263535], "v": "v0.6"}
{"i": [["[\"4b5e216f8244b4e8f7b6543c4a9087e5\", [1536, 128], [1536, 128]]", "cuda -keys=cuda,gpu -arch=sm_75 -max_num_threads=1024 -model=2080ti -thread_warp_size=32", [-1, 16, 64, 49152, 2147483647, 1024, 8, 32], "", 0, []], [[], [["CI", 3], ["CI", 2], ["FU", 5, [0, 1]], ["SP", 5, 0, 196608, [32], 1], ["AN", 5, 0, 5], ["AN", 5, 1, 6], ["SP", 4, 0, 1536, [64], 1], ["AN", 4, 0, 5], ["AN", 4, 1, 6], ["SP", 1, 0, 1536, [32], 1], ["AN", 1, 0, 5], ["AN", 1, 1, 6], ["PR", 1, 0, "auto_unroll_max_step$1024"], ["PR", 4, 0, "auto_unroll_max_step$1024"]]]], "r": [[2.658e-05], 0, 1.93907, 1680263536], "v": "v0.6"}
{"i": [["[\"4b5e216f8244b4e8f7b6543c4a9087e5\", [1536, 128], [1536, 128]]", "cuda -keys=cuda,gpu -arch=sm_75 -max_num_threads=1024 -model=2080ti -thread_warp_size=32", [-1, 16, 64, 49152, 2147483647, 1024, 8, 32], "", 0, []], [[], [["CI", 3], ["CI", 2], ["SP", 1, 1, 128, [32], 1], ["AN", 1, 2, 6], ["FU", 5, [0, 1]], ["SP", 5, 0, 196608, [4], 1], ["AN", 5, 0, 5], ["AN", 5, 1, 6], ["SP", 4, 0, 1536, [8], 1], ["AN", 4, 0, 5], ["AN", 4, 1, 6], ["AN", 1, 0, 5], ["PR", 1, 0, "auto_unroll_max_step$0"], ["PR", 4, 0, "auto_unroll_max_step$0"]]]], "r": [[5.61425e-05], 0, 2.0723, 1680263538], "v": "v0.6"}
{"i": [["[\"4b5e216f8244b4e8f7b6543c4a9087e5\", [1536, 128], [1536, 128]]", "cuda -keys=cuda,gpu -arch=sm_75 -max_num_threads=1024 -model=2080ti -thread_warp_size=32", [-1, 16, 64, 49152, 2147483647, 1024, 8, 32], "", 0, []], [[], [["SP", 5, 1, 128, [1], 1], ["AN", 5, 2, 6], ["FSP", 4, 1, 0, 1], ["AN", 4, 2, 6], ["CA", 4, 5, 0], ["CI", 3], ["CI", 2], ["FSP", 1, 1, 0, 1], ["AN", 1, 2, 6], ["CA", 1, 5, 0], ["AN", 5, 0, 5], ["PR", 1, 0, "auto_unroll_max_step$16"], ["PR", 4, 0, "auto_unroll_max_step$0"]]]], "r": [[7.91935e-05], 0, 1.98868, 1680263539], "v": "v0.6"}
{"i": [["[\"4b5e216f8244b4e8f7b6543c4a9087e5\", [1536, 128], [1536, 128]]", "cuda -keys=cuda,gpu -arch=sm_75 -max_num_threads=1024 -model=2080ti -thread_warp_size=32", [-1, 16, 64, 49152, 2147483647, 1024, 8, 32], "", 0, []], [[], [["CI", 3], ["CI", 2], ["FU", 5, [0, 1]], ["SP", 5, 0, 196608, [2], 1], ["AN", 5, 0, 5], ["AN", 5, 1, 6], ["SP", 4, 0, 1536, [32], 1], ["AN", 4, 0, 5], ["AN", 4, 1, 6], ["SP", 1, 0, 1536, [64], 1], ["AN", 1, 0, 5], ["AN", 1, 1, 6], ["PR", 1, 0, "auto_unroll_max_step$64"], ["PR", 4, 0, "auto_unroll_max_step$64"]]]], "r": [[0.000106839], 0, 2.15009, 1680263540], "v": "v0.6"}
{"i": [["[\"4b5e216f8244b4e8f7b6543c4a9087e5\", [1536, 128], [1536, 128]]", "cuda -keys=cuda,gpu -arch=sm_75 -max_num_threads=1024 -model=2080ti -thread_warp_size=32", [-1, 16, 64, 49152, 2147483647, 1024, 8, 32], "", 0, []], [[], [["SP", 5, 1, 128, [64], 1], ["AN", 5, 2, 6], ["FSP", 4, 1, 0, 1], ["AN", 4, 2, 6], ["CA", 4, 5, 0], ["CI", 3], ["CI", 2], ["AN", 5, 0, 5], ["SP", 1, 0, 1536, [64], 1], ["AN", 1, 0, 5], ["AN", 1, 1, 6], ["PR", 1, 0, "auto_unroll_max_step$16"], ["PR", 4, 0, "auto_unroll_max_step$1024"]]]], "r": [[1.33206e-05], 0, 1.90018, 1680263542], "v": "v0.6"}
{"i": [["[\"4b5e216f8244b4e8f7b6543c4a9087e5\", [1536, 128], [1536, 128]]", "cuda -keys=cuda,gpu -arch=sm_75 -max_num_threads=1024 -model=2080ti -thread_warp_size=32", [-1, 16, 64, 49152, 2147483647, 1024, 8, 32], "", 0, []], [[], [["SP", 5, 1, 128, [32], 1], ["AN", 5, 2, 6], ["FSP", 4, 1, 0, 1], ["AN", 4, 2, 6], ["CA", 4, 5, 0], ["CI", 3], ["CI", 2], ["AN", 5, 0, 5], ["SP", 1, 0, 1536, [16], 1], ["AN", 1, 0, 5], ["AN", 1, 1, 6], ["PR", 1, 0, "auto_unroll_max_step$512"], ["PR", 4, 0, "auto_unroll_max_step$0"]]]], "r": [[1.24876e-05], 0, 1.88027, 1680263543], "v": "v0.6"}
{"i": [["[\"4b5e216f8244b4e8f7b6543c4a9087e5\", [1536, 128], [1536, 128]]", "cuda -keys=cuda,gpu -arch=sm_75 -max_num_threads=1024 -model=2080ti -thread_warp_size=32", [-1, 16, 64, 49152, 2147483647, 1024, 8, 32], "", 0, []], [[], [["CI", 3], ["CI", 2], ["FU", 5, [0, 1]], ["SP", 5, 0, 196608, [2], 1], ["AN", 5, 0, 5], ["AN", 5, 1, 6], ["SP", 4, 0, 1536, [64], 1], ["AN", 4, 0, 5], ["AN", 4, 1, 6], ["SP", 1, 0, 1536, [32], 1], ["AN", 1, 0, 5], ["AN", 1, 1, 6], ["PR", 1, 0, "auto_unroll_max_step$512"], ["PR", 4, 0, "auto_unroll_max_step$1024"]]]], "r": [[0.000104601], 0, 2.18989, 1680263544], "v": "v0.6"}
{"i": [["[\"4b5e216f8244b4e8f7b6543c4a9087e5\", [1536, 128], [1536, 128]]", "cuda -keys=cuda,gpu -arch=sm_75 -max_num_threads=1024 -model=2080ti -thread_warp_size=32", [-1, 16, 64, 49152, 2147483647, 1024, 8, 32], "", 0, []], [[], [["CI", 3], ["CI", 2], ["FU", 5, [0, 1]], ["SP", 5, 0, 196608, [32], 1], ["AN", 5, 0, 5], ["AN", 5, 1, 6], ["SP", 4, 0, 1536, [1], 1], ["AN", 4, 0, 5], ["AN", 4, 1, 6], ["SP", 1, 0, 1536, [1], 1], ["AN", 1, 0, 5], ["AN", 1, 1, 6], ["PR", 1, 0, "auto_unroll_max_step$1024"], ["PR", 4, 0, "auto_unroll_max_step$1024"]]]], "r": [[3.54793e-05], 0, 1.88703, 1680263546], "v": "v0.6"}
{"i": [["[\"4b5e216f8244b4e8f7b6543c4a9087e5\", [1536, 128], [1536, 128]]", "cuda -keys=cuda,gpu -arch=sm_75 -max_num_threads=1024 -model=2080ti -thread_warp_size=32", [-1, 16, 64, 49152, 2147483647, 1024, 8, 32], "", 0, []], [[], [["SP", 5, 1, 128, [2], 1], ["AN", 5, 2, 6], ["FSP", 4, 1, 0, 1], ["AN", 4, 2, 6], ["CA", 4, 5, 0], ["CI", 3], ["CI", 2], ["AN", 5, 0, 5], ["SP", 1, 0, 1536, [32], 1], ["AN", 1, 0, 5], ["AN", 1, 1, 6], ["PR", 1, 0, "auto_unroll_max_step$0"], ["PR", 4, 0, "auto_unroll_max_step$512"]]]], "r": [[4.93156e-05], 0, 4.02169, 1680263547], "v": "v0.6"}
{"i": [["[\"4b5e216f8244b4e8f7b6543c4a9087e5\", [1536, 128], [1536, 128]]", "cuda -keys=cuda,gpu -arch=sm_75 -max_num_threads=1024 -model=2080ti -thread_warp_size=32", [-1, 16, 64, 49152, 2147483647, 1024, 8, 32], "", 0, []], [[], [["SP", 5, 1, 128, [4], 1], ["AN", 5, 2, 6], ["FSP", 4, 1, 0, 1], ["AN", 4, 2, 6], ["CA", 4, 5, 0], ["CI", 3], ["CI", 2], ["FSP", 1, 1, 0, 1], ["AN", 1, 2, 6], ["CA", 1, 5, 0], ["AN", 5, 0, 5], ["PR", 1, 0, "auto_unroll_max_step$1024"], ["PR", 4, 0, "auto_unroll_max_step$16"]]]], "r": [[2.35643e-05], 0, 2.00819, 1680263548], "v": "v0.6"}
{"i": [["[\"4b5e216f8244b4e8f7b6543c4a9087e5\", [1536, 128], [1536, 128]]", "cuda -keys=cuda,gpu -arch=sm_75 -max_num_threads=1024 -model=2080ti -thread_warp_size=32", [-1, 16, 64, 49152, 2147483647, 1024, 8, 32], "", 0, []], [[], [["SP", 5, 1, 128, [64], 1], ["AN", 5, 2, 6], ["FSP", 4, 1, 0, 1], ["AN", 4, 2, 6], ["CA", 4, 5, 0], ["CI", 3], ["CI", 2], ["AN", 5, 0, 5], ["SP", 1, 0, 1536, [32], 1], ["AN", 1, 0, 5], ["AN", 1, 1, 6], ["PR", 1, 0, "auto_unroll_max_step$64"], ["PR", 4, 0, "auto_unroll_max_step$0"]]]], "r": [[1.30897e-05], 0, 1.92075, 1680263550], "v": "v0.6"}
{"i": [["[\"4b5e216f8244b4e8f7b6543c4a9087e5\", [1536, 128], [1536, 128]]", "cuda -keys=cuda,gpu -arch=sm_75 -max_num_threads=1024 -model=2080ti -thread_warp_size=32", [-1, 16, 64, 49152, 2147483647, 1024, 8, 32], "", 0, []], [[], [["CI", 3], ["CI", 2], ["FU", 5, [0, 1]], ["SP", 5, 0, 196608, [64], 1], ["AN", 5, 0, 5], ["AN", 5, 1, 6], ["SP", 4, 0, 1536, [32], 1], ["AN", 4, 0, 5], ["AN", 4, 1, 6], ["SP", 1, 0, 1536, [64], 1], ["AN", 1, 0, 5], ["AN", 1, 1, 6], ["PR", 1, 0, "auto_unroll_max_step$512"], ["PR", 4, 0, "auto_unroll_max_step$16"]]]], "r": [[2.61531e-05], 0, 2.03057, 1680263551], "v": "v0.6"}
{"i": [["[\"4b5e216f8244b4e8f7b6543c4a9087e5\", [1536, 128], [1536, 128]]", "cuda -keys=cuda,gpu -arch=sm_75 -max_num_threads=1024 -model=2080ti -thread_warp_size=32", [-1, 16, 64, 49152, 2147483647, 1024, 8, 32], "", 0, []], [[], [["CI", 3], ["CI", 2], ["SP", 1, 1, 128, [2], 1], ["AN", 1, 2, 6], ["FU", 5, [0, 1]], ["SP", 5, 0, 196608, [32], 1], ["AN", 5, 0, 5], ["AN", 5, 1, 6], ["SP", 4, 0, 1536, [1], 1], ["AN", 4, 0, 5], ["AN", 4, 1, 6], ["AN", 1, 0, 5], ["PR", 1, 0, "auto_unroll_max_step$512"], ["PR", 4, 0, "auto_unroll_max_step$1024"]]]], "r": [[3.28959e-05], 0, 1.91768, 1680263552], "v": "v0.6"}
{"i": [["[\"4b5e216f8244b4e8f7b6543c4a9087e5\", [1536, 128], [1536, 128]]", "cuda -keys=cuda,gpu -arch=sm_75 -max_num_threads=1024 -model=2080ti -thread_warp_size=32", [-1, 16, 64, 49152, 2147483647, 1024, 8, 32], "", 0, []], [[], [["SP", 5, 1, 128, [32], 1], ["AN", 5, 2, 6], ["FSP", 4, 1, 0, 1], ["AN", 4, 2, 6], ["CA", 4, 5, 0], ["CI", 3], ["CI", 2], ["FSP", 1, 1, 0, 1], ["AN", 1, 2, 6], ["CA", 1, 5, 0], ["AN", 5, 0, 5], ["PR", 1, 0, "auto_unroll_max_step$16"], ["PR", 4, 0, "auto_unroll_max_step$512"]]]], "r": [[5.96491e-06], 0, 1.90092, 1680263553], "v": "v0.6"}
{"i": [["[\"4b5e216f8244b4e8f7b6543c4a9087e5\", [1536, 128], [1536, 128]]", "cuda -keys=cuda,gpu -arch=sm_75 -max_num_threads=1024 -model=2080ti -thread_warp_size=32", [-1, 16, 64, 49152, 2147483647, 1024, 8, 32], "", 0, []], [[], [["SP", 5, 1, 128, [32], 1], ["AN", 5, 2, 6], ["FSP", 4, 1, 0, 1], ["AN", 4, 2, 6], ["CA", 4, 5, 0], ["CI", 3], ["CI", 2], ["AN", 5, 0, 5], ["SP", 1, 0, 1536, [64], 1], ["AN", 1, 0, 5], ["AN", 1, 1, 6], ["PR", 1, 0, "auto_unroll_max_step$1024"], ["PR", 4, 0, "auto_unroll_max_step$0"]]]], "r": [[1.42747e-05], 0, 1.87343, 1680263555], "v": "v0.6"}
{"i": [["[\"4b5e216f8244b4e8f7b6543c4a9087e5\", [1536, 128], [1536, 128]]", "cuda -keys=cuda,gpu -arch=sm_75 -max_num_threads=1024 -model=2080ti -thread_warp_size=32", [-1, 16, 64, 49152, 2147483647, 1024, 8, 32], "", 0, []], [[], [["CI", 3], ["CI", 2], ["SP", 1, 1, 128, [32], 1], ["AN", 1, 2, 6], ["FU", 5, [0, 1]], ["SP", 5, 0, 196608, [2], 1], ["AN", 5, 0, 5], ["AN", 5, 1, 6], ["SP", 4, 0, 1536, [4], 1], ["AN", 4, 0, 5], ["AN", 4, 1, 6], ["AN", 1, 0, 5], ["PR", 1, 0, "auto_unroll_max_step$16"], ["PR", 4, 0, "auto_unroll_max_step$16"]]]], "r": [[9.84207e-05], 0, 1.9766, 1680263556], "v": "v0.6"}
{"i": [["[\"4b5e216f8244b4e8f7b6543c4a9087e5\", [1536, 128], [1536, 128]]", "cuda -keys=cuda,gpu -arch=sm_75 -max_num_threads=1024 -model=2080ti -thread_warp_size=32", [-1, 16, 64, 49152, 2147483647, 1024, 8, 32], "", 0, []], [[], [["SP", 5, 1, 128, [32], 1], ["AN", 5, 2, 6], ["FSP", 4, 1, 0, 1], ["AN", 4, 2, 6], ["CA", 4, 5, 0], ["CI", 3], ["CI", 2], ["AN", 5, 0, 5], ["SP", 1, 0, 1536, [2], 1], ["AN", 1, 0, 5], ["AN", 1, 1, 6], ["PR", 1, 0, "auto_unroll_max_step$512"], ["PR", 4, 0, "auto_unroll_max_step$512"]]]], "r": [[1.23352e-05], 0, 1.83593, 1680263557], "v": "v0.6"}
{"i": [["[\"4b5e216f8244b4e8f7b6543c4a9087e5\", [1536, 128], [1536, 128]]", "cuda -keys=cuda,gpu -arch=sm_75 -max_num_threads=1024 -model=2080ti -thread_warp_size=32", [-1, 16, 64, 49152, 2147483647, 1024, 8, 32], "", 0, []], [[], [["CI", 3], ["CI", 2], ["FU", 5, [0, 1]], ["SP", 5, 0, 196608, [64], 1], ["AN", 5, 0, 5], ["AN", 5, 1, 6], ["SP", 4, 0, 1536, [32], 1], ["AN", 4, 0, 5], ["AN", 4, 1, 6], ["SP", 1, 0, 1536, [32], 1], ["AN", 1, 0, 5], ["AN", 1, 1, 6], ["PR", 1, 0, "auto_unroll_max_step$64"], ["PR", 4, 0, "auto_unroll_max_step$1024"]]]], "r": [[2.58219e-05], 0, 1.99964, 1680263559], "v": "v0.6"}
{"i": [["[\"4b5e216f8244b4e8f7b6543c4a9087e5\", [1536, 128], [1536, 128]]", "cuda -keys=cuda,gpu -arch=sm_75 -max_num_threads=1024 -model=2080ti -thread_warp_size=32", [-1, 16, 64, 49152, 2147483647, 1024, 8, 32], "", 0, []], [[], [["CI", 3], ["CI", 2], ["SP", 1, 1, 128, [64], 1], ["AN", 1, 2, 6], ["FU", 5, [0, 1]], ["SP", 5, 0, 196608, [64], 1], ["AN", 5, 0, 5], ["AN", 5, 1, 6], ["SP", 4, 0, 1536, [1], 1], ["AN", 4, 0, 5], ["AN", 4, 1, 6], ["AN", 1, 0, 5], ["PR", 1, 0, "auto_unroll_max_step$0"], ["PR", 4, 0, "auto_unroll_max_step$0"]]]], "r": [[2.92826e-05], 0, 1.89979, 1680263560], "v": "v0.6"}
{"i": [["[\"4b5e216f8244b4e8f7b6543c4a9087e5\", [1536, 128], [1536, 128]]", "cuda -keys=cuda,gpu -arch=sm_75 -max_num_threads=1024 -model=2080ti -thread_warp_size=32", [-1, 16, 64, 49152, 2147483647, 1024, 8, 32], "", 0, []], [[], [["CI", 3], ["CI", 2], ["FU", 5, [0, 1]], ["SP", 5, 0, 196608, [32], 1], ["AN", 5, 0, 5], ["AN", 5, 1, 6], ["SP", 4, 0, 1536, [1], 1], ["AN", 4, 0, 5], ["AN", 4, 1, 6], ["SP", 1, 0, 1536, [2], 1], ["AN", 1, 0, 5], ["AN", 1, 1, 6], ["PR", 1, 0, "auto_unroll_max_step$0"], ["PR", 4, 0, "auto_unroll_max_step$512"]]]], "r": [[3.46752e-05], 0, 1.92398, 1680263561], "v": "v0.6"}
{"i": [["[\"4b5e216f8244b4e8f7b6543c4a9087e5\", [1536, 128], [1536, 128]]", "cuda -keys=cuda,gpu -arch=sm_75 -max_num_threads=1024 -model=2080ti -thread_warp_size=32", [-1, 16, 64, 49152, 2147483647, 1024, 8, 32], "", 0, []], [[], [["CI", 3], ["CI", 2], ["FU", 5, [0, 1]], ["SP", 5, 0, 196608, [32], 1], ["AN", 5, 0, 5], ["AN", 5, 1, 6], ["SP", 4, 0, 1536, [32], 1], ["AN", 4, 0, 5], ["AN", 4, 1, 6], ["SP", 1, 0, 1536, [64], 1], ["AN", 1, 0, 5], ["AN", 1, 1, 6], ["PR", 1, 0, "auto_unroll_max_step$0"], ["PR", 4, 0, "auto_unroll_max_step$16"]]]], "r": [[2.88403e-05], 0, 1.89925, 1680263563], "v": "v0.6"}
{"i": [["[\"4b5e216f8244b4e8f7b6543c4a9087e5\", [1536, 128], [1536, 128]]", "cuda -keys=cuda,gpu -arch=sm_75 -max_num_threads=1024 -model=2080ti -thread_warp_size=32", [-1, 16, 64, 49152, 2147483647, 1024, 8, 32], "", 0, []], [[], [["CI", 3], ["CI", 2], ["SP", 1, 1, 128, [1], 1], ["AN", 1, 2, 6], ["FU", 5, [0, 1]], ["SP", 5, 0, 196608, [32], 1], ["AN", 5, 0, 5], ["AN", 5, 1, 6], ["SP", 4, 0, 1536, [32], 1], ["AN", 4, 0, 5], ["AN", 4, 1, 6], ["AN", 1, 0, 5], ["PR", 1, 0, "auto_unroll_max_step$0"], ["PR", 4, 0, "auto_unroll_max_step$1024"]]]], "r": [[2.765e-05], 0, 1.7475, 1680263564], "v": "v0.6"}
{"i": [["[\"4b5e216f8244b4e8f7b6543c4a9087e5\", [1536, 128], [1536, 128]]", "cuda -keys=cuda,gpu -arch=sm_75 -max_num_threads=1024 -model=2080ti -thread_warp_size=32", [-1, 16, 64, 49152, 2147483647, 1024, 8, 32], "", 0, []], [[], [["SP", 5, 1, 128, [1], 1], ["AN", 5, 2, 6], ["FSP", 4, 1, 0, 1], ["AN", 4, 2, 6], ["CA", 4, 5, 0], ["CI", 3], ["CI", 2], ["AN", 5, 0, 5], ["SP", 1, 0, 1536, [32], 1], ["AN", 1, 0, 5], ["AN", 1, 1, 6], ["PR", 1, 0, "auto_unroll_max_step$16"], ["PR", 4, 0, "auto_unroll_max_step$1024"]]]], "r": [[8.31004e-05], 0, 4.86455, 1680263565], "v": "v0.6"}
{"i": [["[\"4b5e216f8244b4e8f7b6543c4a9087e5\", [1536, 128], [1536, 128]]", "cuda -keys=cuda,gpu -arch=sm_75 -max_num_threads=1024 -model=2080ti -thread_warp_size=32", [-1, 16, 64, 49152, 2147483647, 1024, 8, 32], "", 0, []], [[], [["CI", 3], ["CI", 2], ["SP", 1, 1, 128, [32], 1], ["AN", 1, 2, 6], ["FU", 5, [0, 1]], ["SP", 5, 0, 196608, [1], 1], ["AN", 5, 0, 5], ["AN", 5, 1, 6], ["SP", 4, 0, 1536, [8], 1], ["AN", 4, 0, 5], ["AN", 4, 1, 6], ["AN", 1, 0, 5], ["PR", 1, 0, "auto_unroll_max_step$0"], ["PR", 4, 0, "auto_unroll_max_step$1024"]]]], "r": [[0.000178115], 0, 2.10442, 1680263567], "v": "v0.6"}
{"i": [["[\"4b5e216f8244b4e8f7b6543c4a9087e5\", [1536, 128], [1536, 128]]", "cuda -keys=cuda,gpu -arch=sm_75 -max_num_threads=1024 -model=2080ti -thread_warp_size=32", [-1, 16, 64, 49152, 2147483647, 1024, 8, 32], "", 0, []], [[], [["CI", 3], ["CI", 2], ["SP", 1, 1, 128, [64], 1], ["AN", 1, 2, 6], ["FU", 5, [0, 1]], ["SP", 5, 0, 196608, [4], 1], ["AN", 5, 0, 5], ["AN", 5, 1, 6], ["SP", 4, 0, 1536, [32], 1], ["AN", 4, 0, 5], ["AN", 4, 1, 6], ["AN", 1, 0, 5], ["PR", 1, 0, "auto_unroll_max_step$0"], ["PR", 4, 0, "auto_unroll_max_step$64"]]]], "r": [[6.0721e-05], 0, 1.81749, 1680263568], "v": "v0.6"}
{"i": [["[\"4b5e216f8244b4e8f7b6543c4a9087e5\", [1536, 128], [1536, 128]]", "cuda -keys=cuda,gpu -arch=sm_75 -max_num_threads=1024 -model=2080ti -thread_warp_size=32", [-1, 16, 64, 49152, 2147483647, 1024, 8, 32], "", 0, []], [[], [["CI", 3], ["CI", 2], ["FU", 5, [0, 1]], ["SP", 5, 0, 196608, [32], 1], ["AN", 5, 0, 5], ["AN", 5, 1, 6], ["SP", 4, 0, 1536, [32], 1], ["AN", 4, 0, 5], ["AN", 4, 1, 6], ["SP", 1, 0, 1536, [16], 1], ["AN", 1, 0, 5], ["AN", 1, 1, 6], ["PR", 1, 0, "auto_unroll_max_step$1024"], ["PR", 4, 0, "auto_unroll_max_step$64"]]]], "r": [[2.70387e-05], 0, 1.84488, 1680263570], "v": "v0.6"}
{"i": [["[\"4b5e216f8244b4e8f7b6543c4a9087e5\", [1536, 128], [1536, 128]]", "cuda -keys=cuda,gpu -arch=sm_75 -max_num_threads=1024 -model=2080ti -thread_warp_size=32", [-1, 16, 64, 49152, 2147483647, 1024, 8, 32], "", 0, []], [[], [["CI", 3], ["CI", 2], ["SP", 1, 1, 128, [32], 1], ["AN", 1, 2, 6], ["FU", 5, [0, 1]], ["SP", 5, 0, 196608, [32], 1], ["AN", 5, 0, 5], ["AN", 5, 1, 6], ["SP", 4, 0, 1536, [2], 1], ["AN", 4, 0, 5], ["AN", 4, 1, 6], ["AN", 1, 0, 5], ["PR", 1, 0, "auto_unroll_max_step$0"], ["PR", 4, 0, "auto_unroll_max_step$1024"]]]], "r": [[2.33821e-05], 0, 2.01621, 1680263571], "v": "v0.6"}
{"i": [["[\"4b5e216f8244b4e8f7b6543c4a9087e5\", [1536, 128], [1536, 128]]", "cuda -keys=cuda,gpu -arch=sm_75 -max_num_threads=1024 -model=2080ti -thread_warp_size=32", [-1, 16, 64, 49152, 2147483647, 1024, 8, 32], "", 0, []], [[], [["SP", 5, 1, 128, [1], 1], ["AN", 5, 2, 6], ["FSP", 4, 1, 0, 1], ["AN", 4, 2, 6], ["CA", 4, 5, 0], ["CI", 3], ["CI", 2], ["AN", 5, 0, 5], ["SP", 1, 0, 1536, [32], 1], ["AN", 1, 0, 5], ["AN", 1, 1, 6], ["PR", 1, 0, "auto_unroll_max_step$512"], ["PR", 4, 0, "auto_unroll_max_step$16"]]]], "r": [[8.54236e-05], 0, 2.02974, 1680263572], "v": "v0.6"}
{"i": [["[\"4b5e216f8244b4e8f7b6543c4a9087e5\", [1536, 128], [1536, 128]]", "cuda -keys=cuda,gpu -arch=sm_75 -max_num_threads=1024 -model=2080ti -thread_warp_size=32", [-1, 16, 64, 49152, 2147483647, 1024, 8, 32], "", 0, []], [[], [["CI", 3], ["CI", 2], ["SP", 1, 1, 128, [32], 1], ["AN", 1, 2, 6], ["FU", 5, [0, 1]], ["SP", 5, 0, 196608, [4], 1], ["AN", 5, 0, 5], ["AN", 5, 1, 6], ["SP", 4, 0, 1536, [16], 1], ["AN", 4, 0, 5], ["AN", 4, 1, 6], ["AN", 1, 0, 5], ["PR", 1, 0, "auto_unroll_max_step$16"], ["PR", 4, 0, "auto_unroll_max_step$16"]]]], "r": [[5.71436e-05], 0, 1.97, 1680263574], "v": "v0.6"}
{"i": [["[\"4b5e216f8244b4e8f7b6543c4a9087e5\", [1536, 128], [1536, 128]]", "cuda -keys=cuda,gpu -arch=sm_75 -max_num_threads=1024 -model=2080ti -thread_warp_size=32", [-1, 16, 64, 49152, 2147483647, 1024, 8, 32], "", 0, []], [[], [["SP", 5, 1, 128, [1], 1], ["AN", 5, 2, 6], ["FSP", 4, 1, 0, 1], ["AN", 4, 2, 6], ["CA", 4, 5, 0], ["CI", 3], ["CI", 2], ["FSP", 1, 1, 0, 1], ["AN", 1, 2, 6], ["CA", 1, 5, 0], ["AN", 5, 0, 5], ["PR", 1, 0, "auto_unroll_max_step$16"], ["PR", 4, 0, "auto_unroll_max_step$512"]]]], "r": [[8.35153e-05], 0, 4.95639, 1680263575], "v": "v0.6"}
{"i": [["[\"4b5e216f8244b4e8f7b6543c4a9087e5\", [1536, 128], [1536, 128]]", "cuda -keys=cuda,gpu -arch=sm_75 -max_num_threads=1024 -model=2080ti -thread_warp_size=32", [-1, 16, 64, 49152, 2147483647, 1024, 8, 32], "", 0, []], [[], [["CI", 3], ["CI", 2], ["SP", 1, 1, 128, [32], 1], ["AN", 1, 2, 6], ["FU", 5, [0, 1]], ["SP", 5, 0, 196608, [32], 1], ["AN", 5, 0, 5], ["AN", 5, 1, 6], ["SP", 4, 0, 1536, [4], 1], ["AN", 4, 0, 5], ["AN", 4, 1, 6], ["AN", 1, 0, 5], ["PR", 1, 0, "auto_unroll_max_step$512"], ["PR", 4, 0, "auto_unroll_max_step$64"]]]], "r": [[2.03477e-05], 0, 1.70318, 1680263576], "v": "v0.6"}
{"i": [["[\"4b5e216f8244b4e8f7b6543c4a9087e5\", [1536, 128], [1536, 128]]", "cuda -keys=cuda,gpu -arch=sm_75 -max_num_threads=1024 -model=2080ti -thread_warp_size=32", [-1, 16, 64, 49152, 2147483647, 1024, 8, 32], "", 0, []], [[], [["CI", 3], ["CI", 2], ["FU", 5, [0, 1]], ["SP", 5, 0, 196608, [32], 1], ["AN", 5, 0, 5], ["AN", 5, 1, 6], ["SP", 4, 0, 1536, [32], 1], ["AN", 4, 0, 5], ["AN", 4, 1, 6], ["SP", 1, 0, 1536, [32], 1], ["AN", 1, 0, 5], ["AN", 1, 1, 6], ["PR", 1, 0, "auto_unroll_max_step$0"], ["PR", 4, 0, "auto_unroll_max_step$512"]]]], "r": [[2.8539e-05], 0, 1.91934, 1680263578], "v": "v0.6"}
{"i": [["[\"4b5e216f8244b4e8f7b6543c4a9087e5\", [1536, 128], [1536, 128]]", "cuda -keys=cuda,gpu -arch=sm_75 -max_num_threads=1024 -model=2080ti -thread_warp_size=32", [-1, 16, 64, 49152, 2147483647, 1024, 8, 32], "", 0, []], [[], [["SP", 5, 1, 128, [4], 1], ["AN", 5, 2, 6], ["FSP", 4, 1, 0, 1], ["AN", 4, 2, 6], ["CA", 4, 5, 0], ["CI", 3], ["CI", 2], ["AN", 5, 0, 5], ["SP", 1, 0, 1536, [32], 1], ["AN", 1, 0, 5], ["AN", 1, 1, 6], ["PR", 1, 0, "auto_unroll_max_step$64"], ["PR", 4, 0, "auto_unroll_max_step$512"]]]], "r": [[3.02387e-05], 0, 2.7267, 1680263579], "v": "v0.6"}
{"i": [["[\"4b5e216f8244b4e8f7b6543c4a9087e5\", [1536, 128], [1536, 128]]", "cuda -keys=cuda,gpu -arch=sm_75 -max_num_threads=1024 -model=2080ti -thread_warp_size=32", [-1, 16, 64, 49152, 2147483647, 1024, 8, 32], "", 0, []], [[], [["SP", 5, 1, 128, [2], 1], ["AN", 5, 2, 6], ["FSP", 4, 1, 0, 1], ["AN", 4, 2, 6], ["CA", 4, 5, 0], ["CI", 3], ["CI", 2], ["AN", 5, 0, 5], ["SP", 1, 0, 1536, [32], 1], ["AN", 1, 0, 5], ["AN", 1, 1, 6], ["PR", 1, 0, "auto_unroll_max_step$1024"], ["PR", 4, 0, "auto_unroll_max_step$16"]]]], "r": [[5.12522e-05], 0, 1.94314, 1680263580], "v": "v0.6"}
{"i": [["[\"4b5e216f8244b4e8f7b6543c4a9087e5\", [1536, 128], [1536, 128]]", "cuda -keys=cuda,gpu -arch=sm_75 -max_num_threads=1024 -model=2080ti -thread_warp_size=32", [-1, 16, 64, 49152, 2147483647, 1024, 8, 32], "", 0, []], [[], [["SP", 5, 1, 128, [4], 1], ["AN", 5, 2, 6], ["FSP", 4, 1, 0, 1], ["AN", 4, 2, 6], ["CA", 4, 5, 0], ["CI", 3], ["CI", 2], ["FSP", 1, 1, 0, 1], ["AN", 1, 2, 6], ["CA", 1, 5, 0], ["AN", 5, 0, 5], ["PR", 1, 0, "auto_unroll_max_step$0"], ["PR", 4, 0, "auto_unroll_max_step$0"]]]], "r": [[2.35681e-05], 0, 1.72695, 1680263582], "v": "v0.6"}
{"i": [["[\"4b5e216f8244b4e8f7b6543c4a9087e5\", [1536, 128], [1536, 128]]", "cuda -keys=cuda,gpu -arch=sm_75 -max_num_threads=1024 -model=2080ti -thread_warp_size=32", [-1, 16, 64, 49152, 2147483647, 1024, 8, 32], "", 0, []], [[], [["CI", 3], ["CI", 2], ["FU", 5, [0, 1]], ["SP", 5, 0, 196608, [64], 1], ["AN", 5, 0, 5], ["AN", 5, 1, 6], ["SP", 4, 0, 1536, [32], 1], ["AN", 4, 0, 5], ["AN", 4, 1, 6], ["SP", 1, 0, 1536, [32], 1], ["AN", 1, 0, 5], ["AN", 1, 1, 6], ["PR", 1, 0, "auto_unroll_max_step$1024"], ["PR", 4, 0, "auto_unroll_max_step$16"]]]], "r": [[2.58316e-05], 0, 1.78423, 1680263583], "v": "v0.6"}
{"i": [["[\"4b5e216f8244b4e8f7b6543c4a9087e5\", [1536, 128], [1536, 128]]", "cuda -keys=cuda,gpu -arch=sm_75 -max_num_threads=1024 -model=2080ti -thread_warp_size=32", [-1, 16, 64, 49152, 2147483647, 1024, 8, 32], "", 0, []], [[], [["SP", 5, 1, 128, [64], 1], ["AN", 5, 2, 6], ["FSP", 4, 1, 0, 1], ["AN", 4, 2, 6], ["CA", 4, 5, 0], ["CI", 3], ["CI", 2], ["FSP", 1, 1, 0, 1], ["AN", 1, 2, 6], ["CA", 1, 5, 0], ["AN", 5, 0, 5], ["PR", 1, 0, "auto_unroll_max_step$512"], ["PR", 4, 0, "auto_unroll_max_step$1024"]]]], "r": [[6.10812e-06], 0, 1.64117, 1680263584], "v": "v0.6"}
{"i": [["[\"4b5e216f8244b4e8f7b6543c4a9087e5\", [1536, 128], [1536, 128]]", "cuda -keys=cuda,gpu -arch=sm_75 -max_num_threads=1024 -model=2080ti -thread_warp_size=32", [-1, 16, 64, 49152, 2147483647, 1024, 8, 32], "", 0, []], [[], [["SP", 5, 1, 128, [8], 1], ["AN", 5, 2, 6], ["FSP", 4, 1, 0, 1], ["AN", 4, 2, 6], ["CA", 4, 5, 0], ["CI", 3], ["CI", 2], ["AN", 5, 0, 5], ["SP", 1, 0, 1536, [48], 1], ["AN", 1, 0, 5], ["AN", 1, 1, 6], ["PR", 1, 0, "auto_unroll_max_step$512"], ["PR", 4, 0, "auto_unroll_max_step$512"]]]], "r": [[1.93937e-05], 0, 2.1993, 1680263585], "v": "v0.6"}
{"i": [["[\"4b5e216f8244b4e8f7b6543c4a9087e5\", [1536, 128], [1536, 128]]", "cuda -keys=cuda,gpu -arch=sm_75 -max_num_threads=1024 -model=2080ti -thread_warp_size=32", [-1, 16, 64, 49152, 2147483647, 1024, 8, 32], "", 0, []], [[], [["SP", 5, 1, 128, [16], 1], ["AN", 5, 2, 6], ["FSP", 4, 1, 0, 1], ["AN", 4, 2, 6], ["CA", 4, 5, 0], ["CI", 3], ["CI", 2], ["FSP", 1, 1, 0, 1], ["AN", 1, 2, 6], ["CA", 1, 5, 0], ["AN", 5, 0, 5], ["PR", 1, 0, "auto_unroll_max_step$512"], ["PR", 4, 0, "auto_unroll_max_step$0"]]]], "r": [[8.33091e-06], 0, 1.70006, 1680263587], "v": "v0.6"}
{"i": [["[\"4b5e216f8244b4e8f7b6543c4a9087e5\", [1536, 128], [1536, 128]]", "cuda -keys=cuda,gpu -arch=sm_75 -max_num_threads=1024 -model=2080ti -thread_warp_size=32", [-1, 16, 64, 49152, 2147483647, 1024, 8, 32], "", 0, []], [[], [["SP", 5, 1, 128, [32], 1], ["AN", 5, 2, 6], ["FSP", 4, 1, 0, 1], ["AN", 4, 2, 6], ["CA", 4, 5, 0], ["CI", 3], ["CI", 2], ["AN", 5, 0, 5], ["SP", 1, 0, 1536, [16], 1], ["AN", 1, 0, 5], ["AN", 1, 1, 6], ["PR", 1, 0, "auto_unroll_max_step$64"], ["PR", 4, 0, "auto_unroll_max_step$1024"]]]], "r": [[1.24556e-05], 0, 1.76368, 1680263588], "v": "v0.6"}
{"i": [["[\"4b5e216f8244b4e8f7b6543c4a9087e5\", [1536, 128], [1536, 128]]", "cuda -keys=cuda,gpu -arch=sm_75 -max_num_threads=1024 -model=2080ti -thread_warp_size=32", [-1, 16, 64, 49152, 2147483647, 1024, 8, 32], "", 0, []], [[], [["SP", 5, 1, 128, [64], 1], ["AN", 5, 2, 6], ["FSP", 4, 1, 0, 1], ["AN", 4, 2, 6], ["CA", 4, 5, 0], ["CI", 3], ["CI", 2], ["AN", 5, 0, 5], ["SP", 1, 0, 1536, [64], 1], ["AN", 1, 0, 5], ["AN", 1, 1, 6], ["PR", 1, 0, "auto_unroll_max_step$64"], ["PR", 4, 0, "auto_unroll_max_step$512"]]]], "r": [[1.33242e-05], 0, 1.63554, 1680263589], "v": "v0.6"}
{"i": [["[\"4b5e216f8244b4e8f7b6543c4a9087e5\", [1536, 128], [1536, 128]]", "cuda -keys=cuda,gpu -arch=sm_75 -max_num_threads=1024 -model=2080ti -thread_warp_size=32", [-1, 16, 64, 49152, 2147483647, 1024, 8, 32], "", 0, []], [[], [["CI", 3], ["CI", 2], ["SP", 1, 1, 128, [64], 1], ["AN", 1, 2, 6], ["FU", 5, [0, 1]], ["SP", 5, 0, 196608, [32], 1], ["AN", 5, 0, 5], ["AN", 5, 1, 6], ["SP", 4, 0, 1536, [2], 1], ["AN", 4, 0, 5], ["AN", 4, 1, 6], ["AN", 1, 0, 5], ["PR", 1, 0, "auto_unroll_max_step$512"], ["PR", 4, 0, "auto_unroll_max_step$16"]]]], "r": [[2.38912e-05], 0, 1.86119, 1680263590], "v": "v0.6"}
{"i": [["[\"4b5e216f8244b4e8f7b6543c4a9087e5\", [1536, 128], [1536, 128]]", "cuda -keys=cuda,gpu -arch=sm_75 -max_num_threads=1024 -model=2080ti -thread_warp_size=32", [-1, 16, 64, 49152, 2147483647, 1024, 8, 32], "", 0, []], [[], [["CI", 3], ["CI", 2], ["FU", 5, [0, 1]], ["SP", 5, 0, 196608, [32], 1], ["AN", 5, 0, 5], ["AN", 5, 1, 6], ["SP", 4, 0, 1536, [32], 1], ["AN", 4, 0, 5], ["AN", 4, 1, 6], ["SP", 1, 0, 1536, [32], 1], ["AN", 1, 0, 5], ["AN", 1, 1, 6], ["PR", 1, 0, "auto_unroll_max_step$1024"], ["PR", 4, 0, "auto_unroll_max_step$1024"]]]], "r": [[2.85345e-05], 0, 1.81252, 1680263592], "v": "v0.6"}
{"i": [["[\"4b5e216f8244b4e8f7b6543c4a9087e5\", [1536, 128], [1536, 128]]", "cuda -keys=cuda,gpu -arch=sm_75 -max_num_threads=1024 -model=2080ti -thread_warp_size=32", [-1, 16, 64, 49152, 2147483647, 1024, 8, 32], "", 0, []], [[], [["CI", 3], ["CI", 2], ["FU", 5, [0, 1]], ["SP", 5, 0, 196608, [32], 1], ["AN", 5, 0, 5], ["AN", 5, 1, 6], ["SP", 4, 0, 1536, [32], 1], ["AN", 4, 0, 5], ["AN", 4, 1, 6], ["SP", 1, 0, 1536, [32], 1], ["AN", 1, 0, 5], ["AN", 1, 1, 6], ["PR", 1, 0, "auto_unroll_max_step$64"], ["PR", 4, 0, "auto_unroll_max_step$16"]]]], "r": [[2.85332e-05], 0, 1.77756, 1680263593], "v": "v0.6"}
{"i": [["[\"4b5e216f8244b4e8f7b6543c4a9087e5\", [1536, 128], [1536, 128]]", "cuda -keys=cuda,gpu -arch=sm_75 -max_num_threads=1024 -model=2080ti -thread_warp_size=32", [-1, 16, 64, 49152, 2147483647, 1024, 8, 32], "", 0, []], [[], [["SP", 5, 1, 128, [32], 1], ["AN", 5, 2, 6], ["FSP", 4, 1, 0, 1], ["AN", 4, 2, 6], ["CA", 4, 5, 0], ["CI", 3], ["CI", 2], ["AN", 5, 0, 5], ["SP", 1, 0, 1536, [32], 1], ["AN", 1, 0, 5], ["AN", 1, 1, 6], ["PR", 1, 0, "auto_unroll_max_step$16"], ["PR", 4, 0, "auto_unroll_max_step$16"]]]], "r": [[1.39688e-05], 0, 1.84097, 1680263594], "v": "v0.6"}
{"i": [["[\"4b5e216f8244b4e8f7b6543c4a9087e5\", [1536, 128], [1536, 128]]", "cuda -keys=cuda,gpu -arch=sm_75 -max_num_threads=1024 -model=2080ti -thread_warp_size=32", [-1, 16, 64, 49152, 2147483647, 1024, 8, 32], "", 0, []], [[], [["SP", 5, 1, 128, [32], 1], ["AN", 5, 2, 6], ["FSP", 4, 1, 0, 1], ["AN", 4, 2, 6], ["CA", 4, 5, 0], ["CI", 3], ["CI", 2], ["FSP", 1, 1, 0, 1], ["AN", 1, 2, 6], ["CA", 1, 5, 0], ["AN", 5, 0, 5], ["PR", 1, 0, "auto_unroll_max_step$64"], ["PR", 4, 0, "auto_unroll_max_step$16"]]]], "r": [[5.96215e-06], 0, 1.57218, 1680263596], "v": "v0.6"}
{"i": [["[\"5b1e704ad5950c6ef36e46f1856366cd\", [1, 768], [768, 768], [1, 768], [1, 768]]", "cuda -keys=cuda,gpu -arch=sm_75 -max_num_threads=1024 -model=2080ti -thread_warp_size=32", [-1, 16, 64, 49152, 2147483647, 1024, 8, 32], "", 0, []], [[], [["CI", 6], ["CI", 5], ["CI", 4], ["SP", 2, 0, 1, [1, 1, 1, 1], 1], ["SP", 2, 5, 768, [1, 192, 1, 2], 1], ["SP", 2, 10, 768, [1, 1], 1], ["RE", 2, [0, 5, 1, 6, 2, 7, 10, 11, 3, 8, 12, 4, 9]], ["FSP", 7, 0, 3, 3], ["FSP", 7, 4, 4, 3], ["RE", 7, [0, 4, 1, 5, 2, 6, 3, 7]], ["CA", 2, 7, 5], ["CHR", 1, "shared", [2]], ["CA", 2, 3, 6], ["CHR", 0, "shared", [3]], ["CA", 1, 4, 6], ["FU", 9, [0, 1]], ["AN", 9, 0, 5], ["FU", 9, [1, 2]], ["AN", 9, 1, 4], ["FU", 9, [2, 3]], ["AN", 9, 2, 6], ["FU", 3, [0, 1]], ["SP", 3, 0, 6, [3], 1], ["AN", 3, 1, 2], ["FFSP", 3, 0, [4, 3], 1, 1], ["AN", 3, 1, 6], ["FU", 1, [0, 1]], ["SP", 1, 0, 3, [1], 1], ["AN", 1, 1, 2], ["FFSP", 1, 0, [4, 3], 1, 1], ["AN", 1, 1, 6], ["PR", 4, 0, "auto_unroll_max_step$512"]]]], "r": [[0.000354987], 0, 1.93513, 1680263632], "v": "v0.6"}
{"i": [["[\"5b1e704ad5950c6ef36e46f1856366cd\", [1, 768], [768, 768], [1, 768], [1, 768]]", "cuda -keys=cuda,gpu -arch=sm_75 -max_num_threads=1024 -model=2080ti -thread_warp_size=32", [-1, 16, 64, 49152, 2147483647, 1024, 8, 32], "", 0, []], [[], [["CI", 6], ["CI", 5], ["CI", 4], ["SP", 2, 0, 1, [1, 1, 1, 1], 1], ["SP", 2, 5, 768, [2, 48, 1, 4], 1], ["SP", 2, 10, 768, [4, 4], 1], ["RE", 2, [0, 5, 1, 6, 2, 7, 10, 11, 3, 8, 12, 4, 9]], ["FSP", 7, 0, 3, 3], ["FSP", 7, 4, 4, 3], ["RE", 7, [0, 4, 1, 5, 2, 6, 3, 7]], ["CA", 2, 7, 5], ["CHR", 1, "shared", [2]], ["CA", 2, 3, 6], ["CHR", 0, "shared", [3]], ["CA", 1, 4, 6], ["FU", 9, [0, 1]], ["AN", 9, 0, 5], ["FU", 9, [1, 2]], ["AN", 9, 1, 4], ["FU", 9, [2, 3]], ["AN", 9, 2, 6], ["FU", 3, [0, 1]], ["SP", 3, 0, 64, [1], 1], ["AN", 3, 1, 2], ["FFSP", 3, 0, [4, 3], 1, 1], ["AN", 3, 1, 6], ["FU", 1, [0, 1]], ["SP", 1, 0, 16, [1], 1], ["AN", 1, 1, 2], ["FFSP", 1, 0, [4, 3], 1, 1], ["AN", 1, 1, 6], ["PR", 4, 0, "auto_unroll_max_step$64"]]]], "r": [[0.000148439], 0, 2.45109, 1680263634], "v": "v0.6"}
{"i": [["[\"5b1e704ad5950c6ef36e46f1856366cd\", [1, 768], [768, 768], [1, 768], [1, 768]]", "cuda -keys=cuda,gpu -arch=sm_75 -max_num_threads=1024 -model=2080ti -thread_warp_size=32", [-1, 16, 64, 49152, 2147483647, 1024, 8, 32], "", 0, []], [[], [["CI", 6], ["CI", 5], ["CI", 4], ["SP", 2, 0, 1, [1, 1, 1, 1], 1], ["SP", 2, 5, 768, [4, 32, 3, 1], 1], ["SP", 2, 10, 768, [1, 6], 1], ["RE", 2, [0, 5, 1, 6, 2, 7, 10, 11, 3, 8, 12, 4, 9]], ["FSP", 7, 0, 3, 3], ["FSP", 7, 4, 4, 3], ["RE", 7, [0, 4, 1, 5, 2, 6, 3, 7]], ["CA", 2, 7, 5], ["CHR", 1, "shared", [2]], ["CA", 2, 3, 6], ["CHR", 0, "shared", [3]], ["CA", 1, 4, 6], ["FU", 9, [0, 1]], ["AN", 9, 0, 5], ["FU", 9, [1, 2]], ["AN", 9, 1, 4], ["FU", 9, [2, 3]], ["AN", 9, 2, 6], ["FU", 3, [0, 1]], ["SP", 3, 0, 18, [2], 1], ["AN", 3, 1, 2], ["FFSP", 3, 0, [4, 3], 1, 1], ["AN", 3, 1, 6], ["FU", 1, [0, 1]], ["SP", 1, 0, 6, [3], 1], ["AN", 1, 1, 2], ["FFSP", 1, 0, [4, 3], 1, 1], ["AN", 1, 1, 6], ["PR", 4, 0, "auto_unroll_max_step$16"]]]], "r": [[0.000284805], 0, 2.70848, 1680263635], "v": "v0.6"}
{"i": [["[\"5b1e704ad5950c6ef36e46f1856366cd\", [1, 768], [768, 768], [1, 768], [1, 768]]", "cuda -keys=cuda,gpu -arch=sm_75 -max_num_threads=1024 -model=2080ti -thread_warp_size=32", [-1, 16, 64, 49152, 2147483647, 1024, 8, 32], "", 0, []], [[], [["CI", 6], ["CI", 5], ["CI", 4], ["SP", 2, 0, 1, [1, 1, 1, 1], 1], ["SP", 2, 5, 768, [1, 192, 1, 2], 1], ["SP", 2, 10, 768, [1, 12], 1], ["RE", 2, [0, 5, 1, 6, 2, 7, 10, 11, 3, 8, 12, 4, 9]], ["FSP", 7, 0, 3, 3], ["FSP", 7, 4, 4, 3], ["RE", 7, [0, 4, 1, 5, 2, 6, 3, 7]], ["CA", 2, 7, 5], ["CHR", 1, "shared", [2]], ["CA", 2, 3, 6], ["CHR", 0, "shared", [3]], ["CA", 1, 4, 6], ["FU", 9, [0, 1]], ["AN", 9, 0, 5], ["FU", 9, [1, 2]], ["AN", 9, 1, 4], ["FU", 9, [2, 3]], ["AN", 9, 2, 6], ["FU", 3, [0, 1]], ["SP", 3, 0, 6, [1], 1], ["AN", 3, 1, 2], ["FFSP", 3, 0, [4, 3], 1, 1], ["AN", 3, 1, 6], ["FU", 1, [0, 1]], ["SP", 1, 0, 3, [1], 1], ["AN", 1, 1, 2], ["FFSP", 1, 0, [4, 3], 1, 1], ["AN", 1, 1, 6], ["PR", 4, 0, "auto_unroll_max_step$512"]]]], "r": [[8.66073e-05], 0, 2.30778, 1680263636], "v": "v0.6"}
{"i": [["[\"5b1e704ad5950c6ef36e46f1856366cd\", [1, 768], [768, 768], [1, 768], [1, 768]]", "cuda -keys=cuda,gpu -arch=sm_75 -max_num_threads=1024 -model=2080ti -thread_warp_size=32", [-1, 16, 64, 49152, 2147483647, 1024, 8, 32], "", 0, []], [[], [["CI", 6], ["CI", 5], ["CI", 4], ["SP", 2, 0, 1, [1, 1, 1, 1], 1], ["SP", 2, 5, 768, [6, 64, 1, 2], 1], ["SP", 2, 10, 768, [3, 4], 1], ["RE", 2, [0, 5, 1, 6, 2, 7, 10, 11, 3, 8, 12, 4, 9]], ["FSP", 7, 0, 3, 3], ["FSP", 7, 4, 4, 3], ["RE", 7, [0, 4, 1, 5, 2, 6, 3, 7]], ["CA", 2, 7, 5], ["CHR", 1, "shared", [2]], ["CA", 2, 3, 6], ["CHR", 0, "shared", [3]], ["CA", 1, 4, 6], ["FU", 9, [0, 1]], ["AN", 9, 0, 5], ["FU", 9, [1, 2]], ["AN", 9, 1, 4], ["FU", 9, [2, 3]], ["AN", 9, 2, 6], ["FU", 3, [0, 1]], ["SP", 3, 0, 24, [1], 1], ["AN", 3, 1, 2], ["FFSP", 3, 0, [4, 3], 1, 1], ["AN", 3, 1, 6], ["FU", 1, [0, 1]], ["SP", 1, 0, 12, [4], 1], ["AN", 1, 1, 2], ["FFSP", 1, 0, [4, 3], 1, 1], ["AN", 1, 1, 6], ["PR", 4, 0, "auto_unroll_max_step$1024"]]]], "r": [[0.000161977], 0, 3.61275, 1680263638], "v": "v0.6"}
{"i": [["[\"5b1e704ad5950c6ef36e46f1856366cd\", [1, 768], [768, 768], [1, 768], [1, 768]]", "cuda -keys=cuda,gpu -arch=sm_75 -max_num_threads=1024 -model=2080ti -thread_warp_size=32", [-1, 16, 64, 49152, 2147483647, 1024, 8, 32], "", 0, []], [[], [["CI", 6], ["CI", 5], ["CI", 4], ["SP", 2, 0, 1, [1, 1, 1, 1], 1], ["SP", 2, 5, 768, [4, 32, 1, 3], 1], ["SP", 2, 10, 768, [1, 4], 1], ["RE", 2, [0, 5, 1, 6, 2, 7, 10, 11, 3, 8, 12, 4, 9]], ["FSP", 7, 0, 3, 3], ["FSP", 7, 4, 4, 3], ["RE", 7, [0, 4, 1, 5, 2, 6, 3, 7]], ["CA", 2, 7, 5], ["CHR", 1, "shared", [2]], ["CA", 2, 3, 6], ["CHR", 0, "shared", [3]], ["CA", 1, 4, 6], ["FU", 9, [0, 1]], ["AN", 9, 0, 5], ["FU", 9, [1, 2]], ["AN", 9, 1, 4], ["FU", 9, [2, 3]], ["AN", 9, 2, 6], ["FU", 3, [0, 1]], ["SP", 3, 0, 18, [1], 1], ["AN", 3, 1, 2], ["FFSP", 3, 0, [4, 3], 1, 1], ["AN", 3, 1, 6], ["FU", 1, [0, 1]], ["SP", 1, 0, 6, [3], 1], ["AN", 1, 1, 2], ["FFSP", 1, 0, [4, 3], 1, 1], ["AN", 1, 1, 6], ["PR", 4, 0, "auto_unroll_max_step$16"]]]], "r": [[0.000188856], 0, 2.47632, 1680263639], "v": "v0.6"}
{"i": [["[\"5b1e704ad5950c6ef36e46f1856366cd\", [1, 768], [768, 768], [1, 768], [1, 768]]", "cuda -keys=cuda,gpu -arch=sm_75 -max_num_threads=1024 -model=2080ti -thread_warp_size=32", [-1, 16, 64, 49152, 2147483647, 1024, 8, 32], "", 0, []], [[], [["CI", 6], ["CI", 5], ["CI", 4], ["SP", 2, 0, 1, [1, 1, 1, 1], 1], ["SP", 2, 5, 768, [1, 32, 1, 8], 1], ["SP", 2, 10, 768, [1, 24], 1], ["RE", 2, [0, 5, 1, 6, 2, 7, 10, 11, 3, 8, 12, 4, 9]], ["FSP", 7, 0, 3, 3], ["FSP", 7, 4, 4, 3], ["RE", 7, [0, 4, 1, 5, 2, 6, 3, 7]], ["CA", 2, 7, 5], ["CHR", 1, "shared", [2]], ["CA", 2, 3, 6], ["CHR", 0, "shared", [3]], ["CA", 1, 4, 6], ["FU", 9, [0, 1]], ["AN", 9, 0, 5], ["FU", 9, [1, 2]], ["AN", 9, 1, 4], ["FU", 9, [2, 3]], ["AN", 9, 2, 6], ["FU", 3, [0, 1]], ["SP", 3, 0, 192, [1], 1], ["AN", 3, 1, 2], ["FFSP", 3, 0, [4, 3], 1, 1], ["AN", 3, 1, 6], ["FU", 1, [0, 1]], ["SP", 1, 0, 24, [1], 1], ["AN", 1, 1, 2], ["FFSP", 1, 0, [4, 3], 1, 1], ["AN", 1, 1, 6], ["PR", 4, 0, "auto_unroll_max_step$64"]]]], "r": [[0.00034466], 0, 2.07618, 1680263641], "v": "v0.6"}
{"i": [["[\"5b1e704ad5950c6ef36e46f1856366cd\", [1, 768], [768, 768], [1, 768], [1, 768]]", "cuda -keys=cuda,gpu -arch=sm_75 -max_num_threads=1024 -model=2080ti -thread_warp_size=32", [-1, 16, 64, 49152, 2147483647, 1024, 8, 32], "", 0, []], [[], [["CI", 6], ["CI", 5], ["CI", 4], ["SP", 2, 0, 1, [1, 1, 1, 1], 1], ["SP", 2, 5, 768, [8, 48, 1, 1], 1], ["SP", 2, 10, 768, [8, 3], 1], ["RE", 2, [0, 5, 1, 6, 2, 7, 10, 11, 3, 8, 12, 4, 9]], ["FSP", 7, 0, 3, 3], ["FSP", 7, 4, 4, 3], ["RE", 7, [0, 4, 1, 5, 2, 6, 3, 7]], ["CA", 2, 7, 5], ["CHR", 1, "shared", [2]], ["CA", 2, 3, 6], ["CHR", 0, "shared", [3]], ["CA", 1, 4, 6], ["FU", 9, [0, 1]], ["AN", 9, 0, 5], ["FU", 9, [1, 2]], ["AN", 9, 1, 4], ["FU", 9, [2, 3]], ["AN", 9, 2, 6], ["FU", 3, [0, 1]], ["SP", 3, 0, 24, [1], 1], ["AN", 3, 1, 2], ["FFSP", 3, 0, [4, 3], 1, 1], ["AN", 3, 1, 6], ["FU", 1, [0, 1]], ["SP", 1, 0, 24, [1], 1], ["AN", 1, 1, 2], ["FFSP", 1, 0, [4, 3], 1, 1], ["AN", 1, 1, 6], ["PR", 4, 0, "auto_unroll_max_step$1024"]]]], "r": [[7.93839e-05], 0, 3.62494, 1680263642], "v": "v0.6"}
{"i": [["[\"5b1e704ad5950c6ef36e46f1856366cd\", [1, 768], [768, 768], [1, 768], [1, 768]]", "cuda -keys=cuda,gpu -arch=sm_75 -max_num_threads=1024 -model=2080ti -thread_warp_size=32", [-1, 16, 64, 49152, 2147483647, 1024, 8, 32], "", 0, []], [[], [["CI", 6], ["CI", 5], ["CI", 4], ["SP", 2, 0, 1, [1, 1, 1, 1], 1], ["SP", 2, 5, 768, [3, 32, 2, 2], 1], ["SP", 2, 10, 768, [2, 2], 1], ["RE", 2, [0, 5, 1, 6, 2, 7, 10, 11, 3, 8, 12, 4, 9]], ["FSP", 7, 0, 3, 3], ["FSP", 7, 4, 4, 3], ["RE", 7, [0, 4, 1, 5, 2, 6, 3, 7]], ["CA", 2, 7, 5], ["CHR", 1, "shared", [2]], ["CA", 2, 3, 6], ["CHR", 0, "shared", [3]], ["CA", 1, 4, 6], ["FU", 9, [0, 1]], ["AN", 9, 0, 5], ["FU", 9, [1, 2]], ["AN", 9, 1, 4], ["FU", 9, [2, 3]], ["AN", 9, 2, 6], ["FU", 3, [0, 1]], ["SP", 3, 0, 16, [4], 1], ["AN", 3, 1, 2], ["FFSP", 3, 0, [4, 3], 1, 1], ["AN", 3, 1, 6], ["FU", 1, [0, 1]], ["SP", 1, 0, 4, [4], 1], ["AN", 1, 1, 2], ["FFSP", 1, 0, [4, 3], 1, 1], ["AN", 1, 1, 6], ["PR", 4, 0, "auto_unroll_max_step$16"]]]], "r": [[0.000210492], 0, 2.46967, 1680263644], "v": "v0.6"}
{"i": [["[\"5b1e704ad5950c6ef36e46f1856366cd\", [1, 768], [768, 768], [1, 768], [1, 768]]", "cuda -keys=cuda,gpu -arch=sm_75 -max_num_threads=1024 -model=2080ti -thread_warp_size=32", [-1, 16, 64, 49152, 2147483647, 1024, 8, 32], "", 0, []], [[], [["CI", 6], ["CI", 5], ["CI", 4], ["SP", 2, 0, 1, [1, 1, 1, 1], 1], ["SP", 2, 5, 768, [2, 32, 1, 2], 1], ["SP", 2, 10, 768, [4, 2], 1], ["RE", 2, [0, 5, 1, 6, 2, 7, 10, 11, 3, 8, 12, 4, 9]], ["FSP", 7, 0, 3, 3], ["FSP", 7, 4, 4, 3], ["RE", 7, [0, 4, 1, 5, 2, 6, 3, 7]], ["CA", 2, 7, 5], ["CHR", 1, "shared", [2]], ["CA", 2, 3, 6], ["CHR", 0, "shared", [3]], ["CA", 1, 4, 6], ["FU", 9, [0, 1]], ["AN", 9, 0, 5], ["FU", 9, [1, 2]], ["AN", 9, 1, 4], ["FU", 9, [2, 3]], ["AN", 9, 2, 6], ["FU", 3, [0, 1]], ["SP", 3, 0, 128, [1], 1], ["AN", 3, 1, 2], ["FFSP", 3, 0, [4, 3], 1, 1], ["AN", 3, 1, 6], ["FU", 1, [0, 1]], ["SP", 1, 0, 64, [1], 1], ["AN", 1, 1, 2], ["FFSP", 1, 0, [4, 3], 1, 1], ["AN", 1, 1, 6], ["PR", 4, 0, "auto_unroll_max_step$512"]]]], "r": [[7.10134e-05], 0, 2.31495, 1680263645], "v": "v0.6"}
{"i": [["[\"5b1e704ad5950c6ef36e46f1856366cd\", [1, 768], [768, 768], [1, 768], [1, 768]]", "cuda -keys=cuda,gpu -arch=sm_75 -max_num_threads=1024 -model=2080ti -thread_warp_size=32", [-1, 16, 64, 49152, 2147483647, 1024, 8, 32], "", 0, []], [[], [["CI", 6], ["CI", 5], ["CI", 4], ["SP", 2, 0, 1, [1, 1, 1, 1], 1], ["SP", 2, 5, 768, [3, 64, 1, 1], 1], ["SP", 2, 10, 768, [16, 1], 1], ["RE", 2, [0, 5, 1, 6, 2, 7, 10, 11, 3, 8, 12, 4, 9]], ["FSP", 7, 0, 3, 3], ["FSP", 7, 4, 4, 3], ["RE", 7, [0, 4, 1, 5, 2, 6, 3, 7]], ["CA", 2, 7, 5], ["CHR", 1, "shared", [2]], ["CA", 2, 3, 6], ["CHR", 0, "shared", [3]], ["CA", 1, 4, 6], ["FU", 9, [0, 1]], ["AN", 9, 0, 5], ["FU", 9, [1, 2]], ["AN", 9, 1, 4], ["FU", 9, [2, 3]], ["AN", 9, 2, 6], ["FU", 3, [0, 1]], ["SP", 3, 0, 16, [1], 1], ["AN", 3, 1, 2], ["FFSP", 3, 0, [4, 3], 1, 1], ["AN", 3, 1, 6], ["FU", 1, [0, 1]], ["SP", 1, 0, 16, [2], 1], ["AN", 1, 1, 2], ["FFSP", 1, 0, [4, 3], 1, 1], ["AN", 1, 1, 6], ["PR", 4, 0, "auto_unroll_max_step$1024"]]]], "r": [[5.27518e-05], 0, 2.30506, 1680263646], "v": "v0.6"}
{"i": [["[\"5b1e704ad5950c6ef36e46f1856366cd\", [1, 768], [768, 768], [1, 768], [1, 768]]", "cuda -keys=cuda,gpu -arch=sm_75 -max_num_threads=1024 -model=2080ti -thread_warp_size=32", [-1, 16, 64, 49152, 2147483647, 1024, 8, 32], "", 0, []], [[], [["CI", 6], ["CI", 5], ["CI", 4], ["SP", 2, 0, 1, [1, 1, 1, 1], 1], ["SP", 2, 5, 768, [8, 48, 1, 2], 1], ["SP", 2, 10, 768, [3, 1], 1], ["RE", 2, [0, 5, 1, 6, 2, 7, 10, 11, 3, 8, 12, 4, 9]], ["FSP", 7, 0, 3, 3], ["FSP", 7, 4, 4, 3], ["RE", 7, [0, 4, 1, 5, 2, 6, 3, 7]], ["CA", 2, 7, 5], ["CHR", 1, "shared", [2]], ["CA", 2, 3, 6], ["CHR", 0, "shared", [3]], ["CA", 1, 4, 6], ["FU", 9, [0, 1]], ["AN", 9, 0, 5], ["FU", 9, [1, 2]], ["AN", 9, 1, 4], ["FU", 9, [2, 3]], ["AN", 9, 2, 6], ["FU", 3, [0, 1]], ["SP", 3, 0, 12, [1], 1], ["AN", 3, 1, 2], ["FFSP", 3, 0, [4, 3], 1, 1], ["AN", 3, 1, 6], ["FU", 1, [0, 1]], ["SP", 1, 0, 6, [2], 1], ["AN", 1, 1, 2], ["FFSP", 1, 0, [4, 3], 1, 1], ["AN", 1, 1, 6], ["PR", 4, 0, "auto_unroll_max_step$64"]]]], "r": [[0.000386255], 0, 2.65747, 1680263648], "v": "v0.6"}
{"i": [["[\"5b1e704ad5950c6ef36e46f1856366cd\", [1, 768], [768, 768], [1, 768], [1, 768]]", "cuda -keys=cuda,gpu -arch=sm_75 -max_num_threads=1024 -model=2080ti -thread_warp_size=32", [-1, 16, 64, 49152, 2147483647, 1024, 8, 32], "", 0, []], [[], [["CI", 6], ["CI", 5], ["CI", 4], ["SP", 2, 0, 1, [1, 1, 1, 1], 1], ["SP", 2, 5, 768, [1, 32, 1, 1], 1], ["SP", 2, 10, 768, [1, 8], 1], ["RE", 2, [0, 5, 1, 6, 2, 7, 10, 11, 3, 8, 12, 4, 9]], ["FSP", 7, 0, 3, 3], ["FSP", 7, 4, 4, 3], ["RE", 7, [0, 4, 1, 5, 2, 6, 3, 7]], ["CA", 2, 7, 5], ["CHR", 1, "shared", [2]], ["CA", 2, 3, 6], ["CHR", 0, "shared", [3]], ["CA", 1, 4, 6], ["FU", 9, [0, 1]], ["AN", 9, 0, 5], ["FU", 9, [1, 2]], ["AN", 9, 1, 4], ["FU", 9, [2, 3]], ["AN", 9, 2, 6], ["FU", 3, [0, 1]], ["SP", 3, 0, 48, [1], 1], ["AN", 3, 1, 2], ["FFSP", 3, 0, [4, 3], 1, 1], ["AN", 3, 1, 6], ["FU", 1, [0, 1]], ["SP", 1, 0, 16, [1], 1], ["AN", 1, 1, 2], ["FFSP", 1, 0, [4, 3], 1, 1], ["AN", 1, 1, 6], ["PR", 4, 0, "auto_unroll_max_step$0"]]]], "r": [[3.41857e-05], 0, 1.98701, 1680263649], "v": "v0.6"}
{"i": [["[\"5b1e704ad5950c6ef36e46f1856366cd\", [1, 768], [768, 768], [1, 768], [1, 768]]", "cuda -keys=cuda,gpu -arch=sm_75 -max_num_threads=1024 -model=2080ti -thread_warp_size=32", [-1, 16, 64, 49152, 2147483647, 1024, 8, 32], "", 0, []], [[], [["CI", 6], ["CI", 5], ["CI", 4], ["SP", 2, 0, 1, [1, 1, 1, 1], 1], ["SP", 2, 5, 768, [2, 48, 1, 4], 1], ["SP", 2, 10, 768, [12, 1], 1], ["RE", 2, [0, 5, 1, 6, 2, 7, 10, 11, 3, 8, 12, 4, 9]], ["FSP", 7, 0, 3, 3], ["FSP", 7, 4, 4, 3], ["RE", 7, [0, 4, 1, 5, 2, 6, 3, 7]], ["CA", 2, 7, 5], ["CHR", 1, "shared", [2]], ["CA", 2, 3, 6], ["CHR", 0, "shared", [3]], ["CA", 1, 4, 6], ["FU", 9, [0, 1]], ["AN", 9, 0, 5], ["FU", 9, [1, 2]], ["AN", 9, 1, 4], ["FU", 9, [2, 3]], ["AN", 9, 2, 6], ["FU", 3, [0, 1]], ["SP", 3, 0, 192, [1], 1], ["AN", 3, 1, 2], ["FFSP", 3, 0, [4, 3], 1, 1], ["AN", 3, 1, 6], ["FU", 1, [0, 1]], ["SP", 1, 0, 24, [1], 1], ["AN", 1, 1, 2], ["FFSP", 1, 0, [4, 3], 1, 1], ["AN", 1, 1, 6], ["PR", 4, 0, "auto_unroll_max_step$64"]]]], "r": [[0.000123251], 0, 2.32112, 1680263651], "v": "v0.6"}
{"i": [["[\"5b1e704ad5950c6ef36e46f1856366cd\", [1, 768], [768, 768], [1, 768], [1, 768]]", "cuda -keys=cuda,gpu -arch=sm_75 -max_num_threads=1024 -model=2080ti -thread_warp_size=32", [-1, 16, 64, 49152, 2147483647, 1024, 8, 32], "", 0, []], [[], [["CI", 6], ["CI", 5], ["CI", 4], ["SP", 2, 0, 1, [1, 1, 1, 1], 1], ["SP", 2, 5, 768, [1, 32, 8, 1], 1], ["SP", 2, 10, 768, [12, 2], 1], ["RE", 2, [0, 5, 1, 6, 2, 7, 10, 11, 3, 8, 12, 4, 9]], ["FSP", 7, 0, 3, 3], ["FSP", 7, 4, 4, 3], ["RE", 7, [0, 4, 1, 5, 2, 6, 3, 7]], ["CA", 2, 7, 5], ["CHR", 1, "shared", [2]], ["CA", 2, 3, 6], ["CHR", 0, "shared", [3]], ["CA", 1, 4, 6], ["FU", 9, [0, 1]], ["AN", 9, 0, 5], ["FU", 9, [1, 2]], ["AN", 9, 1, 4], ["FU", 9, [2, 3]], ["AN", 9, 2, 6], ["FU", 3, [0, 1]], ["SP", 3, 0, 96, [1], 1], ["AN", 3, 1, 2], ["FFSP", 3, 0, [4, 3], 1, 1], ["AN", 3, 1, 6], ["FU", 1, [0, 1]], ["SP", 1, 0, 12, [1], 1], ["AN", 1, 1, 2], ["FFSP", 1, 0, [4, 3], 1, 1], ["AN", 1, 1, 6], ["PR", 4, 0, "auto_unroll_max_step$16"]]]], "r": [[0.000344091], 0, 2.26623, 1680263652], "v": "v0.6"}
{"i": [["[\"5b1e704ad5950c6ef36e46f1856366cd\", [1, 768], [768, 768], [1, 768], [1, 768]]", "cuda -keys=cuda,gpu -arch=sm_75 -max_num_threads=1024 -model=2080ti -thread_warp_size=32", [-1, 16, 64, 49152, 2147483647, 1024, 8, 32], "", 0, []], [[], [["CI", 6], ["CI", 5], ["CI", 4], ["SP", 2, 0, 1, [1, 1, 1, 1], 1], ["SP", 2, 5, 768, [8, 48, 1, 2], 1], ["SP", 2, 10, 768, [3, 2], 1], ["RE", 2, [0, 5, 1, 6, 2, 7, 10, 11, 3, 8, 12, 4, 9]], ["FSP", 7, 0, 3, 3], ["FSP", 7, 4, 4, 3], ["RE", 7, [0, 4, 1, 5, 2, 6, 3, 7]], ["CA", 2, 7, 5], ["CHR", 1, "shared", [2]], ["CA", 2, 3, 6], ["CHR", 0, "shared", [3]], ["CA", 1, 4, 6], ["FU", 9, [0, 1]], ["AN", 9, 0, 5], ["FU", 9, [1, 2]], ["AN", 9, 1, 4], ["FU", 9, [2, 3]], ["AN", 9, 2, 6], ["FU", 3, [0, 1]], ["SP", 3, 0, 12, [1], 1], ["AN", 3, 1, 2], ["FFSP", 3, 0, [4, 3], 1, 1], ["AN", 3, 1, 6], ["FU", 1, [0, 1]], ["SP", 1, 0, 6, [3], 1], ["AN", 1, 1, 2], ["FFSP", 1, 0, [4, 3], 1, 1], ["AN", 1, 1, 6], ["PR", 4, 0, "auto_unroll_max_step$16"]]]], "r": [[0.000252822], 0, 2.62218, 1680263653], "v": "v0.6"}
{"i": [["[\"5b1e704ad5950c6ef36e46f1856366cd\", [1, 768], [768, 768], [1, 768], [1, 768]]", "cuda -keys=cuda,gpu -arch=sm_75 -max_num_threads=1024 -model=2080ti -thread_warp_size=32", [-1, 16, 64, 49152, 2147483647, 1024, 8, 32], "", 0, []], [[], [["CI", 6], ["CI", 5], ["CI", 4], ["SP", 2, 0, 1, [1, 1, 1, 1], 1], ["SP", 2, 5, 768, [1, 32, 2, 1], 1], ["SP", 2, 10, 768, [32, 2], 1], ["RE", 2, [0, 5, 1, 6, 2, 7, 10, 11, 3, 8, 12, 4, 9]], ["FSP", 7, 0, 3, 3], ["FSP", 7, 4, 4, 3], ["RE", 7, [0, 4, 1, 5, 2, 6, 3, 7]], ["CA", 2, 7, 5], ["CHR", 1, "shared", [2]], ["CA", 2, 3, 6], ["CHR", 0, "shared", [3]], ["CA", 1, 4, 6], ["FU", 9, [0, 1]], ["AN", 9, 0, 5], ["FU", 9, [1, 2]], ["AN", 9, 1, 4], ["FU", 9, [2, 3]], ["AN", 9, 2, 6], ["FU", 3, [0, 1]], ["SP", 3, 0, 128, [2], 1], ["AN", 3, 1, 2], ["FFSP", 3, 0, [4, 3], 1, 1], ["AN", 3, 1, 6], ["FU", 1, [0, 1]], ["SP", 1, 0, 64, [1], 1], ["AN", 1, 1, 2], ["FFSP", 1, 0, [4, 3], 1, 1], ["AN", 1, 1, 6], ["PR", 4, 0, "auto_unroll_max_step$512"]]]], "r": [[3.25132e-05], 0, 2.54551, 1680263655], "v": "v0.6"}
{"i": [["[\"5b1e704ad5950c6ef36e46f1856366cd\", [1, 768], [768, 768], [1, 768], [1, 768]]", "cuda -keys=cuda,gpu -arch=sm_75 -max_num_threads=1024 -model=2080ti -thread_warp_size=32", [-1, 16, 64, 49152, 2147483647, 1024, 8, 32], "", 0, []], [[], [["CI", 6], ["CI", 5], ["CI", 4], ["SP", 2, 0, 1, [1, 1, 1, 1], 1], ["SP", 2, 5, 768, [1, 256, 1, 3], 1], ["SP", 2, 10, 768, [3, 4], 1], ["RE", 2, [0, 5, 1, 6, 2, 7, 10, 11, 3, 8, 12, 4, 9]], ["FSP", 7, 0, 3, 3], ["FSP", 7, 4, 4, 3], ["RE", 7, [0, 4, 1, 5, 2, 6, 3, 7]], ["CA", 2, 7, 5], ["CHR", 1, "shared", [2]], ["CA", 2, 3, 6], ["CHR", 0, "shared", [3]], ["CA", 1, 4, 6], ["FU", 9, [0, 1]], ["AN", 9, 0, 5], ["FU", 9, [1, 2]], ["AN", 9, 1, 4], ["FU", 9, [2, 3]], ["AN", 9, 2, 6], ["FU", 3, [0, 1]], ["SP", 3, 0, 36, [4], 1], ["AN", 3, 1, 2], ["FFSP", 3, 0, [4, 3], 1, 1], ["AN", 3, 1, 6], ["FU", 1, [0, 1]], ["SP", 1, 0, 12, [1], 1], ["AN", 1, 1, 2], ["FFSP", 1, 0, [4, 3], 1, 1], ["AN", 1, 1, 6], ["PR", 4, 0, "auto_unroll_max_step$16"]]]], "r": [[0.00013283], 0, 2.23499, 1680263656], "v": "v0.6"}
{"i": [["[\"5b1e704ad5950c6ef36e46f1856366cd\", [1, 768], [768, 768], [1, 768], [1, 768]]", "cuda -keys=cuda,gpu -arch=sm_75 -max_num_threads=1024 -model=2080ti -thread_warp_size=32", [-1, 16, 64, 49152, 2147483647, 1024, 8, 32], "", 0, []], [[], [["CI", 6], ["CI", 5], ["CI", 4], ["SP", 2, 0, 1, [1, 1, 1, 1], 1], ["SP", 2, 5, 768, [1, 96, 2, 2], 1], ["SP", 2, 10, 768, [3, 8], 1], ["RE", 2, [0, 5, 1, 6, 2, 7, 10, 11, 3, 8, 12, 4, 9]], ["FSP", 7, 0, 3, 3], ["FSP", 7, 4, 4, 3], ["RE", 7, [0, 4, 1, 5, 2, 6, 3, 7]], ["CA", 2, 7, 5], ["CHR", 1, "shared", [2]], ["CA", 2, 3, 6], ["CHR", 0, "shared", [3]], ["CA", 1, 4, 6], ["FU", 9, [0, 1]], ["AN", 9, 0, 5], ["FU", 9, [1, 2]], ["AN", 9, 1, 4], ["FU", 9, [2, 3]], ["AN", 9, 2, 6], ["FU", 3, [0, 1]], ["SP", 3, 0, 96, [1], 1], ["AN", 3, 1, 2], ["FFSP", 3, 0, [4, 3], 1, 1], ["AN", 3, 1, 6], ["FU", 1, [0, 1]], ["SP", 1, 0, 24, [3], 1], ["AN", 1, 1, 2], ["FFSP", 1, 0, [4, 3], 1, 1], ["AN", 1, 1, 6], ["PR", 4, 0, "auto_unroll_max_step$16"]]]], "r": [[0.000115307], 0, 2.20498, 1680263658], "v": "v0.6"}
{"i": [["[\"5b1e704ad5950c6ef36e46f1856366cd\", [1, 768], [768, 768], [1, 768], [1, 768]]", "cuda -keys=cuda,gpu -arch=sm_75 -max_num_threads=1024 -model=2080ti -thread_warp_size=32", [-1, 16, 64, 49152, 2147483647, 1024, 8, 32], "", 0, []], [[], [["CI", 6], ["CI", 5], ["CI", 4], ["SP", 2, 0, 1, [1, 1, 1, 1], 1], ["SP", 2, 5, 768, [1, 48, 2, 4], 1], ["SP", 2, 10, 768, [4, 4], 1], ["RE", 2, [0, 5, 1, 6, 2, 7, 10, 11, 3, 8, 12, 4, 9]], ["FSP", 7, 0, 3, 3], ["FSP", 7, 4, 4, 3], ["RE", 7, [0, 4, 1, 5, 2, 6, 3, 7]], ["CA", 2, 7, 5], ["CHR", 1, "shared", [2]], ["CA", 2, 3, 6], ["CHR", 0, "shared", [3]], ["CA", 1, 4, 6], ["FU", 9, [0, 1]], ["AN", 9, 0, 5], ["FU", 9, [1, 2]], ["AN", 9, 1, 4], ["FU", 9, [2, 3]], ["AN", 9, 2, 6], ["FU", 3, [0, 1]], ["SP", 3, 0, 64, [1], 1], ["AN", 3, 1, 2], ["FFSP", 3, 0, [4, 3], 1, 1], ["AN", 3, 1, 6], ["FU", 1, [0, 1]], ["SP", 1, 0, 16, [1], 1], ["AN", 1, 1, 2], ["FFSP", 1, 0, [4, 3], 1, 1], ["AN", 1, 1, 6], ["PR", 4, 0, "auto_unroll_max_step$64"]]]], "r": [[0.000148323], 0, 2.37949, 1680263659], "v": "v0.6"}
{"i": [["[\"5b1e704ad5950c6ef36e46f1856366cd\", [1, 768], [768, 768], [1, 768], [1, 768]]", "cuda -keys=cuda,gpu -arch=sm_75 -max_num_threads=1024 -model=2080ti -thread_warp_size=32", [-1, 16, 64, 49152, 2147483647, 1024, 8, 32], "", 0, []], [[], [["CI", 6], ["CI", 5], ["CI", 4], ["SP", 2, 0, 1, [1, 1, 1, 1], 1], ["SP", 2, 5, 768, [1, 2, 16, 24], 1], ["SP", 2, 10, 768, [1, 6], 1], ["RE", 2, [0, 5, 1, 6, 2, 7, 10, 11, 3, 8, 12, 4, 9]], ["FSP", 7, 0, 3, 3], ["FSP", 7, 4, 4, 3], ["RE", 7, [0, 4, 1, 5, 2, 6, 3, 7]], ["CA", 2, 7, 5], ["CHR", 1, "shared", [2]], ["CA", 2, 3, 6], ["CHR", 0, "shared", [3]], ["CA", 1, 4, 6], ["FU", 9, [0, 1]], ["AN", 9, 0, 5], ["FU", 9, [1, 2]], ["AN", 9, 1, 4], ["FU", 9, [2, 3]], ["AN", 9, 2, 6], ["FU", 3, [0, 1]], ["SP", 3, 0, 72, [1], 1], ["AN", 3, 1, 2], ["FFSP", 3, 0, [4, 3], 1, 1], ["AN", 3, 1, 6], ["FU", 1, [0, 1]], ["SP", 1, 0, 6, [3], 1], ["AN", 1, 1, 2], ["FFSP", 1, 0, [4, 3], 1, 1], ["AN", 1, 1, 6], ["PR", 4, 0, "auto_unroll_max_step$64"]]]], "r": [[0.00933929], 0, 2.63655, 1680263661], "v": "v0.6"}
{"i": [["[\"5b1e704ad5950c6ef36e46f1856366cd\", [1, 768], [768, 768], [1, 768], [1, 768]]", "cuda -keys=cuda,gpu -arch=sm_75 -max_num_threads=1024 -model=2080ti -thread_warp_size=32", [-1, 16, 64, 49152, 2147483647, 1024, 8, 32], "", 0, []], [[], [["CI", 6], ["CI", 5], ["CI", 4], ["SP", 2, 0, 1, [1, 1, 1, 1], 1], ["SP", 2, 5, 768, [1, 48, 1, 2], 1], ["SP", 2, 10, 768, [2, 12], 1], ["RE", 2, [0, 5, 1, 6, 2, 7, 10, 11, 3, 8, 12, 4, 9]], ["FSP", 7, 0, 3, 3], ["FSP", 7, 4, 4, 3], ["RE", 7, [0, 4, 1, 5, 2, 6, 3, 7]], ["CA", 2, 7, 5], ["CHR", 1, "shared", [2]], ["CA", 2, 3, 6], ["CHR", 0, "shared", [3]], ["CA", 1, 4, 6], ["FU", 9, [0, 1]], ["AN", 9, 0, 5], ["FU", 9, [1, 2]], ["AN", 9, 1, 4], ["FU", 9, [2, 3]], ["AN", 9, 2, 6], ["FU", 3, [0, 1]], ["SP", 3, 0, 48, [1], 1], ["AN", 3, 1, 2], ["FFSP", 3, 0, [4, 3], 1, 1], ["AN", 3, 1, 6], ["FU", 1, [0, 1]], ["SP", 1, 0, 24, [1], 1], ["AN", 1, 1, 2], ["FFSP", 1, 0, [4, 3], 1, 1], ["AN", 1, 1, 6], ["PR", 4, 0, "auto_unroll_max_step$512"]]]], "r": [[3.23503e-05], 0, 2.33846, 1680263662], "v": "v0.6"}
{"i": [["[\"5b1e704ad5950c6ef36e46f1856366cd\", [1, 768], [768, 768], [1, 768], [1, 768]]", "cuda -keys=cuda,gpu -arch=sm_75 -max_num_threads=1024 -model=2080ti -thread_warp_size=32", [-1, 16, 64, 49152, 2147483647, 1024, 8, 32], "", 0, []], [[], [["CI", 6], ["CI", 5], ["CI", 4], ["SP", 2, 0, 1, [1, 1, 1, 1], 1], ["SP", 2, 5, 768, [1, 4, 6, 1], 1], ["SP", 2, 10, 768, [32, 1], 1], ["RE", 2, [0, 5, 1, 6, 2, 7, 10, 11, 3, 8, 12, 4, 9]], ["FSP", 7, 0, 3, 3], ["FSP", 7, 4, 4, 3], ["RE", 7, [0, 4, 1, 5, 2, 6, 3, 7]], ["CA", 2, 7, 5], ["CHR", 1, "shared", [2]], ["CA", 2, 3, 6], ["CHR", 0, "shared", [3]], ["CA", 1, 4, 6], ["FU", 9, [0, 1]], ["AN", 9, 0, 5], ["FU", 9, [1, 2]], ["AN", 9, 1, 4], ["FU", 9, [2, 3]], ["AN", 9, 2, 6], ["FU", 3, [0, 1]], ["SP", 3, 0, 64, [2], 1], ["AN", 3, 1, 2], ["FFSP", 3, 0, [4, 3], 1, 1], ["AN", 3, 1, 6], ["FU", 1, [0, 1]], ["SP", 1, 0, 32, [1], 1], ["AN", 1, 1, 2], ["FFSP", 1, 0, [4, 3], 1, 1], ["AN", 1, 1, 6], ["PR", 4, 0, "auto_unroll_max_step$1024"]]]], "r": [[3.9623e-05], 0, 2.8132, 1680263663], "v": "v0.6"}
{"i": [["[\"5b1e704ad5950c6ef36e46f1856366cd\", [1, 768], [768, 768], [1, 768], [1, 768]]", "cuda -keys=cuda,gpu -arch=sm_75 -max_num_threads=1024 -model=2080ti -thread_warp_size=32", [-1, 16, 64, 49152, 2147483647, 1024, 8, 32], "", 0, []], [[], [["CI", 6], ["CI", 5], ["CI", 4], ["SP", 2, 0, 1, [1, 1, 1, 1], 1], ["SP", 2, 5, 768, [1, 768, 1, 1], 1], ["SP", 2, 10, 768, [2, 3], 1], ["RE", 2, [0, 5, 1, 6, 2, 7, 10, 11, 3, 8, 12, 4, 9]], ["FSP", 7, 0, 3, 3], ["FSP", 7, 4, 4, 3], ["RE", 7, [0, 4, 1, 5, 2, 6, 3, 7]], ["CA", 2, 7, 5], ["CHR", 1, "shared", [2]], ["CA", 2, 3, 6], ["CHR", 0, "shared", [3]], ["CA", 1, 4, 6], ["FU", 9, [0, 1]], ["AN", 9, 0, 5], ["FU", 9, [1, 2]], ["AN", 9, 1, 4], ["FU", 9, [2, 3]], ["AN", 9, 2, 6], ["FU", 3, [0, 1]], ["SP", 3, 0, 6, [1], 1], ["AN", 3, 1, 2], ["FFSP", 3, 0, [4, 3], 1, 1], ["AN", 3, 1, 6], ["FU", 1, [0, 1]], ["SP", 1, 0, 6, [1], 1], ["AN", 1, 1, 2], ["FFSP", 1, 0, [4, 3], 1, 1], ["AN", 1, 1, 6], ["PR", 4, 0, "auto_unroll_max_step$0"]]]], "r": [[0.000182206], 0, 2.06857, 1680263665], "v": "v0.6"}
