saved_logs/1000trials/default-Ansor/5/autoscheduler/2080ti/resnet_50-B1-float32.json
{"i": [["[\"4b23b0dc1d1164f464c7f5544479ae4d\", [1, 28, 28, 512], [1, 1, 512, 1024], [1, 1, 1, 1024], [1, 14, 14, 1024]]", "cuda -keys=cuda,gpu -arch=sm_75 -max_num_threads=1024 -model=2080ti -thread_warp_size=32", [-1, 16, 64, 49152, 2147483647, 1024, 8, 32], "", 0, []], [[], [["SP", 3, 0, 1, [1, 1, 1, 1], 1], ["SP", 3, 5, 14, [2, 1, 7, 1], 1], ["SP", 3, 10, 14, [2, 7, 1, 1], 1], ["SP", 3, 15, 1024, [1, 128, 8, 1], 1], ["SP", 3, 20, 1, [1, 1], 1], ["SP", 3, 23, 1, [1, 1], 1], ["SP", 3, 26, 512, [2, 2], 1], ["RE", 3, [0, 5, 10, 15, 1, 6, 11, 16, 2, 7, 12, 17, 20, 23, 26, 21, 24, 27, 3, 8, 13, 18, 22, 25, 28, 4, 9, 14, 19]], ["FSP", 5, 0, 0, 3], ["FSP", 5, 4, 1, 3], ["FSP", 5, 8, 2, 3], ["FSP", 5, 12, 3, 3], ["RE", 5, [0, 4, 8, 12, 1, 5, 9, 13, 2, 6, 10, 14, 3, 7, 11, 15]], ["CA", 3, 5, 11], ["CHR", 2, "shared", [3]], ["CA", 3, 4, 14], ["CHR", 1, "shared", [4]], ["CA", 2, 5, 14], ["CI", 1], ["FU", 7, [0, 1, 2, 3]], ["AN", 7, 0, 5], ["FU", 7, [1, 2, 3, 4]], ["AN", 7, 1, 4], ["FU", 7, [2, 3, 4, 5]], ["AN", 7, 2, 6], ["FU", 4, [0, 1, 2, 3]], ["SP", 4, 0, 32, [1], 1], ["AN", 4, 1, 2], ["FFSP", 4, 0, [3, 2, 1, 0], 1, 1], ["AN", 4, 1, 6], ["FU", 2, [0, 1, 2, 3]], ["SP", 2, 0, 52, [52], 1], ["AN", 2, 1, 2], ["FFSP", 2, 0, [3, 2, 1, 0], 1, 1], ["AN", 2, 1, 6], ["PR", 5, 0, "auto_unroll_max_step$16"]]]], "r": [[0.00808531], 0, 1.44928, 1680256737], "v": "v0.6"}
{"i": [["[\"4b23b0dc1d1164f464c7f5544479ae4d\", [1, 28, 28, 512], [1, 1, 512, 1024], [1, 1, 1, 1024], [1, 14, 14, 1024]]", "cuda -keys=cuda,gpu -arch=sm_75 -max_num_threads=1024 -model=2080ti -thread_warp_size=32", [-1, 16, 64, 49152, 2147483647, 1024, 8, 32], "", 0, []], [[], [["SP", 3, 0, 1, [1, 1, 1, 1], 1], ["SP", 3, 5, 14, [1, 2, 1, 1], 1], ["SP", 3, 10, 14, [1, 1, 14, 1], 1], ["SP", 3, 15, 1024, [4, 256, 1, 1], 1], ["SP", 3, 20, 1, [1, 1], 1], ["SP", 3, 23, 1, [1, 1], 1], ["SP", 3, 26, 512, [1, 1], 1], ["RE", 3, [0, 5, 10, 15, 1, 6, 11, 16, 2, 7, 12, 17, 20, 23, 26, 21, 24, 27, 3, 8, 13, 18, 22, 25, 28, 4, 9, 14, 19]], ["FSP", 5, 0, 0, 3], ["FSP", 5, 4, 1, 3], ["FSP", 5, 8, 2, 3], ["FSP", 5, 12, 3, 3], ["RE", 5, [0, 4, 8, 12, 1, 5, 9, 13, 2, 6, 10, 14, 3, 7, 11, 15]], ["CA", 3, 5, 11], ["CHR", 2, "shared", [3]], ["CA", 3, 4, 14], ["CHR", 1, "shared", [4]], ["CA", 2, 5, 14], ["CI", 1], ["FU", 7, [0, 1, 2, 3]], ["AN", 7, 0, 5], ["FU", 7, [1, 2, 3, 4]], ["AN", 7, 1, 4], ["FU", 7, [2, 3, 4, 5]], ["AN", 7, 2, 6], ["FU", 4, [0, 1, 2, 3]], ["SP", 4, 0, 2, [1], 1], ["AN", 4, 1, 2], ["FFSP", 4, 0, [3, 2, 1, 0], 1, 1], ["AN", 4, 1, 6], ["FU", 2, [0, 1, 2, 3]], ["SP", 2, 0, 351, [1], 1], ["AN", 2, 1, 2], ["FFSP", 2, 0, [3, 2, 1, 0], 1, 1], ["AN", 2, 1, 6], ["PR", 5, 0, "auto_unroll_max_step$64"]]]], "r": [[0.00058175], 0, 1.84888, 1680256738], "v": "v0.6"}
{"i": [["[\"4b23b0dc1d1164f464c7f5544479ae4d\", [1, 28, 28, 512], [1, 1, 512, 1024], [1, 1, 1, 1024], [1, 14, 14, 1024]]", "cuda -keys=cuda,gpu -arch=sm_75 -max_num_threads=1024 -model=2080ti -thread_warp_size=32", [-1, 16, 64, 49152, 2147483647, 1024, 8, 32], "", 0, []], [[], [["SP", 3, 0, 1, [1, 1, 1, 1], 1], ["SP", 3, 5, 14, [1, 2, 1, 7], 1], ["SP", 3, 10, 14, [1, 1, 1, 2], 1], ["SP", 3, 15, 1024, [4, 32, 1, 2], 1], ["SP", 3, 20, 1, [1, 1], 1], ["SP", 3, 23, 1, [1, 1], 1], ["SP", 3, 26, 512, [1, 4], 1], ["RE", 3, [0, 5, 10, 15, 1, 6, 11, 16, 2, 7, 12, 17, 20, 23, 26, 21, 24, 27, 3, 8, 13, 18, 22, 25, 28, 4, 9, 14, 19]], ["FSP", 5, 0, 0, 3], ["FSP", 5, 4, 1, 3], ["FSP", 5, 8, 2, 3], ["FSP", 5, 12, 3, 3], ["RE", 5, [0, 4, 8, 12, 1, 5, 9, 13, 2, 6, 10, 14, 3, 7, 11, 15]], ["CA", 3, 5, 11], ["CHR", 2, "shared", [3]], ["CA", 3, 4, 14], ["CHR", 1, "shared", [4]], ["CA", 2, 5, 14], ["CI", 1], ["FU", 7, [0, 1, 2, 3]], ["AN", 7, 0, 5], ["FU", 7, [1, 2, 3, 4]], ["AN", 7, 1, 4], ["FU", 7, [2, 3, 4, 5]], ["AN", 7, 2, 6], ["FU", 4, [0, 1, 2, 3]], ["SP", 4, 0, 8, [2], 1], ["AN", 4, 1, 2], ["FFSP", 4, 0, [3, 2, 1, 0], 1, 1], ["AN", 4, 1, 6], ["FU", 2, [0, 1, 2, 3]], ["SP", 2, 0, 1404, [1], 1], ["AN", 2, 1, 2], ["FFSP", 2, 0, [3, 2, 1, 0], 1, 1], ["AN", 2, 1, 6], ["PR", 5, 0, "auto_unroll_max_step$0"]]]], "r": [[0.000310899], 0, 1.86201, 1680256739], "v": "v0.6"}
{"i": [["[\"4b23b0dc1d1164f464c7f5544479ae4d\", [1, 28, 28, 512], [1, 1, 512, 1024], [1, 1, 1, 1024], [1, 14, 14, 1024]]", "cuda -keys=cuda,gpu -arch=sm_75 -max_num_threads=1024 -model=2080ti -thread_warp_size=32", [-1, 16, 64, 49152, 2147483647, 1024, 8, 32], "", 0, []], [[], [["SP", 3, 0, 1, [1, 1, 1, 1], 1], ["SP", 3, 5, 14, [1, 1, 1, 1], 1], ["SP", 3, 10, 14, [1, 14, 1, 1], 1], ["SP", 3, 15, 1024, [1, 8, 4, 16], 1], ["SP", 3, 20, 1, [1, 1], 1], ["SP", 3, 23, 1, [1, 1], 1], ["SP", 3, 26, 512, [2, 8], 1], ["RE", 3, [0, 5, 10, 15, 1, 6, 11, 16, 2, 7, 12, 17, 20, 23, 26, 21, 24, 27, 3, 8, 13, 18, 22, 25, 28, 4, 9, 14, 19]], ["FSP", 5, 0, 0, 3], ["FSP", 5, 4, 1, 3], ["FSP", 5, 8, 2, 3], ["FSP", 5, 12, 3, 3], ["RE", 5, [0, 4, 8, 12, 1, 5, 9, 13, 2, 6, 10, 14, 3, 7, 11, 15]], ["CA", 3, 5, 11], ["CHR", 2, "shared", [3]], ["CA", 3, 4, 14], ["CHR", 1, "shared", [4]], ["CA", 2, 5, 14], ["CI", 1], ["FU", 7, [0, 1, 2, 3]], ["AN", 7, 0, 5], ["FU", 7, [1, 2, 3, 4]], ["AN", 7, 1, 4], ["FU", 7, [2, 3, 4, 5]], ["AN", 7, 2, 6], ["FU", 4, [0, 1, 2, 3]], ["SP", 4, 0, 1024, [1], 1], ["AN", 4, 1, 2], ["FFSP", 4, 0, [3, 2, 1, 0], 1, 1], ["AN", 4, 1, 6], ["FU", 2, [0, 1, 2, 3]], ["SP", 2, 0, 48, [1], 1], ["AN", 2, 1, 2], ["FFSP", 2, 0, [3, 2, 1, 0], 1, 1], ["AN", 2, 1, 6], ["PR", 5, 0, "auto_unroll_max_step$64"]]]], "r": [[0.0012914], 0, 2.22171, 1680256740], "v": "v0.6"}
{"i": [["[\"4b23b0dc1d1164f464c7f5544479ae4d\", [1, 28, 28, 512], [1, 1, 512, 1024], [1, 1, 1, 1024], [1, 14, 14, 1024]]", "cuda -keys=cuda,gpu -arch=sm_75 -max_num_threads=1024 -model=2080ti -thread_warp_size=32", [-1, 16, 64, 49152, 2147483647, 1024, 8, 32], "", 0, []], [[], [["SP", 3, 0, 1, [1, 1, 1, 1], 1], ["SP", 3, 5, 14, [1, 2, 1, 7], 1], ["SP", 3, 10, 14, [1, 7, 1, 1], 1], ["SP", 3, 15, 1024, [2, 32, 4, 2], 1], ["SP", 3, 20, 1, [1, 1], 1], ["SP", 3, 23, 1, [1, 1], 1], ["SP", 3, 26, 512, [1, 1], 1], ["RE", 3, [0, 5, 10, 15, 1, 6, 11, 16, 2, 7, 12, 17, 20, 23, 26, 21, 24, 27, 3, 8, 13, 18, 22, 25, 28, 4, 9, 14, 19]], ["FSP", 5, 0, 0, 3], ["FSP", 5, 4, 1, 3], ["FSP", 5, 8, 2, 3], ["FSP", 5, 12, 3, 3], ["RE", 5, [0, 4, 8, 12, 1, 5, 9, 13, 2, 6, 10, 14, 3, 7, 11, 15]], ["CA", 3, 5, 11], ["CHR", 2, "shared", [3]], ["CA", 3, 4, 14], ["CHR", 1, "shared", [4]], ["CA", 2, 5, 14], ["CI", 1], ["FU", 7, [0, 1, 2, 3]], ["AN", 7, 0, 5], ["FU", 7, [1, 2, 3, 4]], ["AN", 7, 1, 4], ["FU", 7, [2, 3, 4, 5]], ["AN", 7, 2, 6], ["FU", 4, [0, 1, 2, 3]], ["SP", 4, 0, 8, [1], 1], ["AN", 4, 1, 2], ["FFSP", 4, 0, [3, 2, 1, 0], 1, 1], ["AN", 4, 1, 6], ["FU", 2, [0, 1, 2, 3]], ["SP", 2, 0, 81, [1], 1], ["AN", 2, 1, 2], ["FFSP", 2, 0, [3, 2, 1, 0], 1, 1], ["AN", 2, 1, 6], ["PR", 5, 0, "auto_unroll_max_step$0"]]]], "r": [[0.00129916], 0, 1.83089, 1680256741], "v": "v0.6"}
{"i": [["[\"4b23b0dc1d1164f464c7f5544479ae4d\", [1, 28, 28, 512], [1, 1, 512, 1024], [1, 1, 1, 1024], [1, 14, 14, 1024]]", "cuda -keys=cuda,gpu -arch=sm_75 -max_num_threads=1024 -model=2080ti -thread_warp_size=32", [-1, 16, 64, 49152, 2147483647, 1024, 8, 32], "", 0, []], [[], [["SP", 3, 0, 1, [1, 1, 1, 1], 1], ["SP", 3, 5, 14, [1, 1, 7, 1], 1], ["SP", 3, 10, 14, [1, 7, 1, 2], 1], ["SP", 3, 15, 1024, [1, 64, 4, 1], 1], ["SP", 3, 20, 1, [1, 1], 1], ["SP", 3, 23, 1, [1, 1], 1], ["SP", 3, 26, 512, [4, 2], 1], ["RE", 3, [0, 5, 10, 15, 1, 6, 11, 16, 2, 7, 12, 17, 20, 23, 26, 21, 24, 27, 3, 8, 13, 18, 22, 25, 28, 4, 9, 14, 19]], ["FSP", 5, 0, 0, 3], ["FSP", 5, 4, 1, 3], ["FSP", 5, 8, 2, 3], ["FSP", 5, 12, 3, 3], ["RE", 5, [0, 4, 8, 12, 1, 5, 9, 13, 2, 6, 10, 14, 3, 7, 11, 15]], ["CA", 3, 5, 11], ["CHR", 2, "shared", [3]], ["CA", 3, 4, 14], ["CHR", 1, "shared", [4]], ["CA", 2, 5, 14], ["CI", 1], ["FU", 7, [0, 1, 2, 3]], ["AN", 7, 0, 5], ["FU", 7, [1, 2, 3, 4]], ["AN", 7, 1, 4], ["FU", 7, [2, 3, 4, 5]], ["AN", 7, 2, 6], ["FU", 4, [0, 1, 2, 3]], ["SP", 4, 0, 8, [1], 1], ["AN", 4, 1, 2], ["FFSP", 4, 0, [3, 2, 1, 0], 1, 1], ["AN", 4, 1, 6], ["FU", 2, [0, 1, 2, 3]], ["SP", 2, 0, 78, [1], 1], ["AN", 2, 1, 2], ["FFSP", 2, 0, [3, 2, 1, 0], 1, 1], ["AN", 2, 1, 6], ["PR", 5, 0, "auto_unroll_max_step$512"]]]], "r": [[0.00027907], 0, 3.4428, 1680256742], "v": "v0.6"}
{"i": [["[\"4b23b0dc1d1164f464c7f5544479ae4d\", [1, 28, 28, 512], [1, 1, 512, 1024], [1, 1, 1, 1024], [1, 14, 14, 1024]]", "cuda -keys=cuda,gpu -arch=sm_75 -max_num_threads=1024 -model=2080ti -thread_warp_size=32", [-1, 16, 64, 49152, 2147483647, 1024, 8, 32], "", 0, []], [[], [["SP", 3, 0, 1, [1, 1, 1, 1], 1], ["SP", 3, 5, 14, [1, 1, 14, 1], 1], ["SP", 3, 10, 14, [1, 2, 1, 1], 1], ["SP", 3, 15, 1024, [2, 128, 1, 1], 1], ["SP", 3, 20, 1, [1, 1], 1], ["SP", 3, 23, 1, [1, 1], 1], ["SP", 3, 26, 512, [1, 32], 1], ["RE", 3, [0, 5, 10, 15, 1, 6, 11, 16, 2, 7, 12, 17, 20, 23, 26, 21, 24, 27, 3, 8, 13, 18, 22, 25, 28, 4, 9, 14, 19]], ["FSP", 5, 0, 0, 3], ["FSP", 5, 4, 1, 3], ["FSP", 5, 8, 2, 3], ["FSP", 5, 12, 3, 3], ["RE", 5, [0, 4, 8, 12, 1, 5, 9, 13, 2, 6, 10, 14, 3, 7, 11, 15]], ["CA", 3, 5, 11], ["CHR", 2, "shared", [3]], ["CA", 3, 4, 14], ["CHR", 1, "shared", [4]], ["CA", 2, 5, 14], ["CI", 1], ["FU", 7, [0, 1, 2, 3]], ["AN", 7, 0, 5], ["FU", 7, [1, 2, 3, 4]], ["AN", 7, 1, 4], ["FU", 7, [2, 3, 4, 5]], ["AN", 7, 2, 6], ["FU", 4, [0, 1, 2, 3]], ["SP", 4, 0, 32, [1], 1], ["AN", 4, 1, 2], ["FFSP", 4, 0, [3, 2, 1, 0], 1, 1], ["AN", 4, 1, 6], ["FU", 2, [0, 1, 2, 3]], ["SP", 2, 0, 864, [1], 1], ["AN", 2, 1, 2], ["FFSP", 2, 0, [3, 2, 1, 0], 1, 1], ["AN", 2, 1, 6], ["PR", 5, 0, "auto_unroll_max_step$512"]]]], "r": [[0.000131715], 0, 2.26673, 1680256743], "v": "v0.6"}
{"i": [["[\"4b23b0dc1d1164f464c7f5544479ae4d\", [1, 28, 28, 512], [1, 1, 512, 1024], [1, 1, 1, 1024], [1, 14, 14, 1024]]", "cuda -keys=cuda,gpu -arch=sm_75 -max_num_threads=1024 -model=2080ti -thread_warp_size=32", [-1, 16, 64, 49152, 2147483647, 1024, 8, 32], "", 0, []], [[], [["SP", 3, 0, 1, [1, 1, 1, 1], 1], ["SP", 3, 5, 14, [1, 2, 1, 7], 1], ["SP", 3, 10, 14, [1, 1, 2, 7], 1], ["SP", 3, 15, 1024, [4, 32, 1, 2], 1], ["SP", 3, 20, 1, [1, 1], 1], ["SP", 3, 23, 1, [1, 1], 1], ["SP", 3, 26, 512, [1, 4], 1], ["RE", 3, [0, 5, 10, 15, 1, 6, 11, 16, 2, 7, 12, 17, 20, 23, 26, 21, 24, 27, 3, 8, 13, 18, 22, 25, 28, 4, 9, 14, 19]], ["FSP", 5, 0, 0, 3], ["FSP", 5, 4, 1, 3], ["FSP", 5, 8, 2, 3], ["FSP", 5, 12, 3, 3], ["RE", 5, [0, 4, 8, 12, 1, 5, 9, 13, 2, 6, 10, 14, 3, 7, 11, 15]], ["CA", 3, 5, 11], ["CHR", 2, "shared", [3]], ["CA", 3, 4, 14], ["CHR", 1, "shared", [4]], ["CA", 2, 5, 14], ["CI", 1], ["FU", 7, [0, 1, 2, 3]], ["AN", 7, 0, 5], ["FU", 7, [1, 2, 3, 4]], ["AN", 7, 1, 4], ["FU", 7, [2, 3, 4, 5]], ["AN", 7, 2, 6], ["FU", 4, [0, 1, 2, 3]], ["SP", 4, 0, 8, [1], 1], ["AN", 4, 1, 2], ["FFSP", 4, 0, [3, 2, 1, 0], 1, 1], ["AN", 4, 1, 6], ["FU", 2, [0, 1, 2, 3]], ["SP", 2, 0, 1404, [1], 1], ["AN", 2, 1, 2], ["FFSP", 2, 0, [3, 2, 1, 0], 1, 1], ["AN", 2, 1, 6], ["PR", 5, 0, "auto_unroll_max_step$0"]]]], "r": [[0.00626742], 0, 2.24888, 1680256744], "v": "v0.6"}
{"i": [["[\"4b23b0dc1d1164f464c7f5544479ae4d\", [1, 28, 28, 512], [1, 1, 512, 1024], [1, 1, 1, 1024], [1, 14, 14, 1024]]", "cuda -keys=cuda,gpu -arch=sm_75 -max_num_threads=1024 -model=2080ti -thread_warp_size=32", [-1, 16, 64, 49152, 2147483647, 1024, 8, 32], "", 0, []], [[], [["SP", 3, 0, 1, [1, 1, 1, 1], 1], ["SP", 3, 5, 14, [7, 2, 1, 1], 1], ["SP", 3, 10, 14, [1, 14, 1, 1], 1], ["SP", 3, 15, 1024, [1, 8, 4, 8], 1], ["SP", 3, 20, 1, [1, 1], 1], ["SP", 3, 23, 1, [1, 1], 1], ["SP", 3, 26, 512, [4, 2], 1], ["RE", 3, [0, 5, 10, 15, 1, 6, 11, 16, 2, 7, 12, 17, 20, 23, 26, 21, 24, 27, 3, 8, 13, 18, 22, 25, 28, 4, 9, 14, 19]], ["FSP", 5, 0, 0, 3], ["FSP", 5, 4, 1, 3], ["FSP", 5, 8, 2, 3], ["FSP", 5, 12, 3, 3], ["RE", 5, [0, 4, 8, 12, 1, 5, 9, 13, 2, 6, 10, 14, 3, 7, 11, 15]], ["CA", 3, 5, 11], ["CHR", 2, "shared", [3]], ["CA", 3, 4, 14], ["CHR", 1, "shared", [4]], ["CA", 2, 5, 14], ["CI", 1], ["FU", 7, [0, 1, 2, 3]], ["AN", 7, 0, 5], ["FU", 7, [1, 2, 3, 4]], ["AN", 7, 1, 4], ["FU", 7, [2, 3, 4, 5]], ["AN", 7, 2, 6], ["FU", 4, [0, 1, 2, 3]], ["SP", 4, 0, 256, [1], 1], ["AN", 4, 1, 2], ["FFSP", 4, 0, [3, 2, 1, 0], 1, 1], ["AN", 4, 1, 6], ["FU", 2, [0, 1, 2, 3]], ["SP", 2, 0, 24, [3], 1], ["AN", 2, 1, 2], ["FFSP", 2, 0, [3, 2, 1, 0], 1, 1], ["AN", 2, 1, 6], ["PR", 5, 0, "auto_unroll_max_step$0"]]]], "r": [[0.00246943], 0, 2.31143, 1680256745], "v": "v0.6"}
{"i": [["[\"4b23b0dc1d1164f464c7f5544479ae4d\", [1, 28, 28, 512], [1, 1, 512, 1024], [1, 1, 1, 1024], [1, 14, 14, 1024]]", "cuda -keys=cuda,gpu -arch=sm_75 -max_num_threads=1024 -model=2080ti -thread_warp_size=32", [-1, 16, 64, 49152, 2147483647, 1024, 8, 32], "", 0, []], [[], [["SP", 3, 0, 1, [1, 1, 1, 1], 1], ["SP", 3, 5, 14, [1, 7, 1, 2], 1], ["SP", 3, 10, 14, [1, 7, 2, 1], 1], ["SP", 3, 15, 1024, [2, 4, 4, 1], 1], ["SP", 3, 20, 1, [1, 1], 1], ["SP", 3, 23, 1, [1, 1], 1], ["SP", 3, 26, 512, [1, 4], 1], ["RE", 3, [0, 5, 10, 15, 1, 6, 11, 16, 2, 7, 12, 17, 20, 23, 26, 21, 24, 27, 3, 8, 13, 18, 22, 25, 28, 4, 9, 14, 19]], ["FSP", 5, 0, 0, 3], ["FSP", 5, 4, 1, 3], ["FSP", 5, 8, 2, 3], ["FSP", 5, 12, 3, 3], ["RE", 5, [0, 4, 8, 12, 1, 5, 9, 13, 2, 6, 10, 14, 3, 7, 11, 15]], ["CA", 3, 5, 11], ["CHR", 2, "shared", [3]], ["CA", 3, 4, 14], ["CHR", 1, "shared", [4]], ["CA", 2, 5, 14], ["CI", 1], ["FU", 7, [0, 1, 2, 3]], ["AN", 7, 0, 5], ["FU", 7, [1, 2, 3, 4]], ["AN", 7, 1, 4], ["FU", 7, [2, 3, 4, 5]], ["AN", 7, 2, 6], ["FU", 4, [0, 1, 2, 3]], ["SP", 4, 0, 8, [1], 1], ["AN", 4, 1, 2], ["FFSP", 4, 0, [3, 2, 1, 0], 1, 1], ["AN", 4, 1, 6], ["FU", 2, [0, 1, 2, 3]], ["SP", 2, 0, 18, [1], 1], ["AN", 2, 1, 2], ["FFSP", 2, 0, [3, 2, 1, 0], 1, 1], ["AN", 2, 1, 6], ["PR", 5, 0, "auto_unroll_max_step$0"]]]], "r": [[0.000196864], 0, 1.91899, 1680256746], "v": "v0.6"}
{"i": [["[\"4b23b0dc1d1164f464c7f5544479ae4d\", [1, 28, 28, 512], [1, 1, 512, 1024], [1, 1, 1, 1024], [1, 14, 14, 1024]]", "cuda -keys=cuda,gpu -arch=sm_75 -max_num_threads=1024 -model=2080ti -thread_warp_size=32", [-1, 16, 64, 49152, 2147483647, 1024, 8, 32], "", 0, []], [[], [["SP", 3, 0, 1, [1, 1, 1, 1], 1], ["SP", 3, 5, 14, [2, 1, 7, 1], 1], ["SP", 3, 10, 14, [1, 1, 1, 1], 1], ["SP", 3, 15, 1024, [1, 32, 8, 4], 1], ["SP", 3, 20, 1, [1, 1], 1], ["SP", 3, 23, 1, [1, 1], 1], ["SP", 3, 26, 512, [4, 1], 1], ["RE", 3, [0, 5, 10, 15, 1, 6, 11, 16, 2, 7, 12, 17, 20, 23, 26, 21, 24, 27, 3, 8, 13, 18, 22, 25, 28, 4, 9, 14, 19]], ["FSP", 5, 0, 0, 3], ["FSP", 5, 4, 1, 3], ["FSP", 5, 8, 2, 3], ["FSP", 5, 12, 3, 3], ["RE", 5, [0, 4, 8, 12, 1, 5, 9, 13, 2, 6, 10, 14, 3, 7, 11, 15]], ["CA", 3, 5, 11], ["CHR", 2, "shared", [3]], ["CA", 3, 4, 14], ["CHR", 1, "shared", [4]], ["CA", 2, 5, 14], ["CI", 1], ["FU", 7, [0, 1, 2, 3]], ["AN", 7, 0, 5], ["FU", 7, [1, 2, 3, 4]], ["AN", 7, 1, 4], ["FU", 7, [2, 3, 4, 5]], ["AN", 7, 2, 6], ["FU", 4, [0, 1, 2, 3]], ["SP", 4, 0, 64, [1], 1], ["AN", 4, 1, 2], ["FFSP", 4, 0, [3, 2, 1, 0], 1, 1], ["AN", 4, 1, 6], ["FU", 2, [0, 1, 2, 3]], ["SP", 2, 0, 104, [1], 1], ["AN", 2, 1, 2], ["FFSP", 2, 0, [3, 2, 1, 0], 1, 1], ["AN", 2, 1, 6], ["PR", 5, 0, "auto_unroll_max_step$64"]]]], "r": [[0.00240754], 0, 3.22648, 1680256747], "v": "v0.6"}
{"i": [["[\"4b23b0dc1d1164f464c7f5544479ae4d\", [1, 28, 28, 512], [1, 1, 512, 1024], [1, 1, 1, 1024], [1, 14, 14, 1024]]", "cuda -keys=cuda,gpu -arch=sm_75 -max_num_threads=1024 -model=2080ti -thread_warp_size=32", [-1, 16, 64, 49152, 2147483647, 1024, 8, 32], "", 0, []], [[], [["SP", 3, 0, 1, [1, 1, 1, 1], 1], ["SP", 3, 5, 14, [2, 7, 1, 1], 1], ["SP", 3, 10, 14, [1, 2, 7, 1], 1], ["SP", 3, 15, 1024, [4, 8, 1, 2], 1], ["SP", 3, 20, 1, [1, 1], 1], ["SP", 3, 23, 1, [1, 1], 1], ["SP", 3, 26, 512, [8, 1], 1], ["RE", 3, [0, 5, 10, 15, 1, 6, 11, 16, 2, 7, 12, 17, 20, 23, 26, 21, 24, 27, 3, 8, 13, 18, 22, 25, 28, 4, 9, 14, 19]], ["FSP", 5, 0, 0, 3], ["FSP", 5, 4, 1, 3], ["FSP", 5, 8, 2, 3], ["FSP", 5, 12, 3, 3], ["RE", 5, [0, 4, 8, 12, 1, 5, 9, 13, 2, 6, 10, 14, 3, 7, 11, 15]], ["CA", 3, 5, 11], ["CHR", 2, "shared", [3]], ["CA", 3, 4, 14], ["CHR", 1, "shared", [4]], ["CA", 2, 5, 14], ["CI", 1], ["FU", 7, [0, 1, 2, 3]], ["AN", 7, 0, 5], ["FU", 7, [1, 2, 3, 4]], ["AN", 7, 1, 4], ["FU", 7, [2, 3, 4, 5]], ["AN", 7, 2, 6], ["FU", 4, [0, 1, 2, 3]], ["SP", 4, 0, 16, [2], 1], ["AN", 4, 1, 2], ["FFSP", 4, 0, [3, 2, 1, 0], 1, 1], ["AN", 4, 1, 6], ["FU", 2, [0, 1, 2, 3]], ["SP", 2, 0, 104, [1], 1], ["AN", 2, 1, 2], ["FFSP", 2, 0, [3, 2, 1, 0], 1, 1], ["AN", 2, 1, 6], ["PR", 5, 0, "auto_unroll_max_step$16"]]]], "r": [[0.000980846], 0, 2.45257, 1680256748], "v": "v0.6"}
{"i": [["[\"4b23b0dc1d1164f464c7f5544479ae4d\", [1, 28, 28, 512], [1, 1, 512, 1024], [1, 1, 1, 1024], [1, 14, 14, 1024]]", "cuda -keys=cuda,gpu -arch=sm_75 -max_num_threads=1024 -model=2080ti -thread_warp_size=32", [-1, 16, 64, 49152, 2147483647, 1024, 8, 32], "", 0, []], [[], [["SP", 3, 0, 1, [1, 1, 1, 1], 1], ["SP", 3, 5, 14, [1, 7, 1, 2], 1], ["SP", 3, 10, 14, [1, 1, 1, 1], 1], ["SP", 3, 15, 1024, [2, 64, 4, 1], 1], ["SP", 3, 20, 1, [1, 1], 1], ["SP", 3, 23, 1, [1, 1], 1], ["SP", 3, 26, 512, [1, 8], 1], ["RE", 3, [0, 5, 10, 15, 1, 6, 11, 16, 2, 7, 12, 17, 20, 23, 26, 21, 24, 27, 3, 8, 13, 18, 22, 25, 28, 4, 9, 14, 19]], ["FSP", 5, 0, 0, 3], ["FSP", 5, 4, 1, 3], ["FSP", 5, 8, 2, 3], ["FSP", 5, 12, 3, 3], ["RE", 5, [0, 4, 8, 12, 1, 5, 9, 13, 2, 6, 10, 14, 3, 7, 11, 15]], ["CA", 3, 5, 11], ["CHR", 2, "shared", [3]], ["CA", 3, 4, 14], ["CHR", 1, "shared", [4]], ["CA", 2, 5, 14], ["CI", 1], ["FU", 7, [0, 1, 2, 3]], ["AN", 7, 0, 5], ["FU", 7, [1, 2, 3, 4]], ["AN", 7, 1, 4], ["FU", 7, [2, 3, 4, 5]], ["AN", 7, 2, 6], ["FU", 4, [0, 1, 2, 3]], ["SP", 4, 0, 32, [8], 1], ["AN", 4, 1, 2], ["FFSP", 4, 0, [3, 2, 1, 0], 1, 1], ["AN", 4, 1, 6], ["FU", 2, [0, 1, 2, 3]], ["SP", 2, 0, 24, [4], 1], ["AN", 2, 1, 2], ["FFSP", 2, 0, [3, 2, 1, 0], 1, 1], ["AN", 2, 1, 6], ["PR", 5, 0, "auto_unroll_max_step$0"]]]], "r": [[0.000191382], 0, 1.72888, 1680256749], "v": "v0.6"}
{"i": [["[\"4b23b0dc1d1164f464c7f5544479ae4d\", [1, 28, 28, 512], [1, 1, 512, 1024], [1, 1, 1, 1024], [1, 14, 14, 1024]]", "cuda -keys=cuda,gpu -arch=sm_75 -max_num_threads=1024 -model=2080ti -thread_warp_size=32", [-1, 16, 64, 49152, 2147483647, 1024, 8, 32], "", 0, []], [[], [["SP", 3, 0, 1, [1, 1, 1, 1], 1], ["SP", 3, 5, 14, [2, 7, 1, 1], 1], ["SP", 3, 10, 14, [1, 1, 1, 7], 1], ["SP", 3, 15, 1024, [1, 32, 4, 2], 1], ["SP", 3, 20, 1, [1, 1], 1], ["SP", 3, 23, 1, [1, 1], 1], ["SP", 3, 26, 512, [1, 2], 1], ["RE", 3, [0, 5, 10, 15, 1, 6, 11, 16, 2, 7, 12, 17, 20, 23, 26, 21, 24, 27, 3, 8, 13, 18, 22, 25, 28, 4, 9, 14, 19]], ["FSP", 5, 0, 0, 3], ["FSP", 5, 4, 1, 3], ["FSP", 5, 8, 2, 3], ["FSP", 5, 12, 3, 3], ["RE", 5, [0, 4, 8, 12, 1, 5, 9, 13, 2, 6, 10, 14, 3, 7, 11, 15]], ["CA", 3, 5, 11], ["CHR", 2, "shared", [3]], ["CA", 3, 4, 14], ["CHR", 1, "shared", [4]], ["CA", 2, 5, 14], ["CI", 1], ["FU", 7, [0, 1, 2, 3]], ["AN", 7, 0, 5], ["FU", 7, [1, 2, 3, 4]], ["AN", 7, 1, 4], ["FU", 7, [2, 3, 4, 5]], ["AN", 7, 2, 6], ["FU", 4, [0, 1, 2, 3]], ["SP", 4, 0, 16, [1], 1], ["AN", 4, 1, 2], ["FFSP", 4, 0, [3, 2, 1, 0], 1, 1], ["AN", 4, 1, 6], ["FU", 2, [0, 1, 2, 3]], ["SP", 2, 0, 26, [1], 1], ["AN", 2, 1, 2], ["FFSP", 2, 0, [3, 2, 1, 0], 1, 1], ["AN", 2, 1, 6], ["PR", 5, 0, "auto_unroll_max_step$1024"]]]], "r": [[0.000394195], 0, 2.78668, 1680256750], "v": "v0.6"}
{"i": [["[\"4b23b0dc1d1164f464c7f5544479ae4d\", [1, 28, 28, 512], [1, 1, 512, 1024], [1, 1, 1, 1024], [1, 14, 14, 1024]]", "cuda -keys=cuda,gpu -arch=sm_75 -max_num_threads=1024 -model=2080ti -thread_warp_size=32", [-1, 16, 64, 49152, 2147483647, 1024, 8, 32], "", 0, []], [[], [["SP", 3, 0, 1, [1, 1, 1, 1], 1], ["SP", 3, 5, 14, [1, 7, 2, 1], 1], ["SP", 3, 10, 14, [1, 1, 1, 1], 1], ["SP", 3, 15, 1024, [4, 16, 1, 4], 1], ["SP", 3, 20, 1, [1, 1], 1], ["SP", 3, 23, 1, [1, 1], 1], ["SP", 3, 26, 512, [4, 1], 1], ["RE", 3, [0, 5, 10, 15, 1, 6, 11, 16, 2, 7, 12, 17, 20, 23, 26, 21, 24, 27, 3, 8, 13, 18, 22, 25, 28, 4, 9, 14, 19]], ["FSP", 5, 0, 0, 3], ["FSP", 5, 4, 1, 3], ["FSP", 5, 8, 2, 3], ["FSP", 5, 12, 3, 3], ["RE", 5, [0, 4, 8, 12, 1, 5, 9, 13, 2, 6, 10, 14, 3, 7, 11, 15]], ["CA", 3, 5, 11], ["CHR", 2, "shared", [3]], ["CA", 3, 4, 14], ["CHR", 1, "shared", [4]], ["CA", 2, 5, 14], ["CI", 1], ["FU", 7, [0, 1, 2, 3]], ["AN", 7, 0, 5], ["FU", 7, [1, 2, 3, 4]], ["AN", 7, 1, 4], ["FU", 7, [2, 3, 4, 5]], ["AN", 7, 2, 6], ["FU", 4, [0, 1, 2, 3]], ["SP", 4, 0, 64, [1], 1], ["AN", 4, 1, 2], ["FFSP", 4, 0, [3, 2, 1, 0], 1, 1], ["AN", 4, 1, 6], ["FU", 2, [0, 1, 2, 3]], ["SP", 2, 0, 12, [1], 1], ["AN", 2, 1, 2], ["FFSP", 2, 0, [3, 2, 1, 0], 1, 1], ["AN", 2, 1, 6], ["PR", 5, 0, "auto_unroll_max_step$512"]]]], "r": [[9.95548e-05], 0, 2.26275, 1680256751], "v": "v0.6"}
{"i": [["[\"4b23b0dc1d1164f464c7f5544479ae4d\", [1, 28, 28, 512], [1, 1, 512, 1024], [1, 1, 1, 1024], [1, 14, 14, 1024]]", "cuda -keys=cuda,gpu -arch=sm_75 -max_num_threads=1024 -model=2080ti -thread_warp_size=32", [-1, 16, 64, 49152, 2147483647, 1024, 8, 32], "", 0, []], [[], [["SP", 3, 0, 1, [1, 1, 1, 1], 1], ["SP", 3, 5, 14, [2, 7, 1, 1], 1], ["SP", 3, 10, 14, [1, 2, 7, 1], 1], ["SP", 3, 15, 1024, [4, 8, 1, 2], 1], ["SP", 3, 20, 1, [1, 1], 1], ["SP", 3, 23, 1, [1, 1], 1], ["SP", 3, 26, 512, [8, 1], 1], ["RE", 3, [0, 5, 10, 15, 1, 6, 11, 16, 2, 7, 12, 17, 20, 23, 26, 21, 24, 27, 3, 8, 13, 18, 22, 25, 28, 4, 9, 14, 19]], ["FSP", 5, 0, 0, 3], ["FSP", 5, 4, 1, 3], ["FSP", 5, 8, 2, 3], ["FSP", 5, 12, 3, 3], ["RE", 5, [0, 4, 8, 12, 1, 5, 9, 13, 2, 6, 10, 14, 3, 7, 11, 15]], ["CA", 3, 5, 11], ["CHR", 2, "shared", [3]], ["CA", 3, 4, 14], ["CHR", 1, "shared", [4]], ["CA", 2, 5, 14], ["CI", 1], ["FU", 7, [0, 1, 2, 3]], ["AN", 7, 0, 5], ["FU", 7, [1, 2, 3, 4]], ["AN", 7, 1, 4], ["FU", 7, [2, 3, 4, 5]], ["AN", 7, 2, 6], ["FU", 4, [0, 1, 2, 3]], ["SP", 4, 0, 16, [1], 1], ["AN", 4, 1, 2], ["FFSP", 4, 0, [3, 2, 1, 0], 1, 1], ["AN", 4, 1, 6], ["FU", 2, [0, 1, 2, 3]], ["SP", 2, 0, 104, [4], 1], ["AN", 2, 1, 2], ["FFSP", 2, 0, [3, 2, 1, 0], 1, 1], ["AN", 2, 1, 6], ["PR", 5, 0, "auto_unroll_max_step$16"]]]], "r": [[0.000413959], 0, 2.54193, 1680256752], "v": "v0.6"}
{"i": [["[\"4b23b0dc1d1164f464c7f5544479ae4d\", [1, 28, 28, 512], [1, 1, 512, 1024], [1, 1, 1, 1024], [1, 14, 14, 1024]]", "cuda -keys=cuda,gpu -arch=sm_75 -max_num_threads=1024 -model=2080ti -thread_warp_size=32", [-1, 16, 64, 49152, 2147483647, 1024, 8, 32], "", 0, []], [[], [["SP", 3, 0, 1, [1, 1, 1, 1], 1], ["SP", 3, 5, 14, [7, 2, 1, 1], 1], ["SP", 3, 10, 14, [1, 2, 1, 7], 1], ["SP", 3, 15, 1024, [1, 32, 8, 1], 1], ["SP", 3, 20, 1, [1, 1], 1], ["SP", 3, 23, 1, [1, 1], 1], ["SP", 3, 26, 512, [2, 2], 1], ["RE", 3, [0, 5, 10, 15, 1, 6, 11, 16, 2, 7, 12, 17, 20, 23, 26, 21, 24, 27, 3, 8, 13, 18, 22, 25, 28, 4, 9, 14, 19]], ["FSP", 5, 0, 0, 3], ["FSP", 5, 4, 1, 3], ["FSP", 5, 8, 2, 3], ["FSP", 5, 12, 3, 3], ["RE", 5, [0, 4, 8, 12, 1, 5, 9, 13, 2, 6, 10, 14, 3, 7, 11, 15]], ["CA", 3, 5, 11], ["CHR", 2, "shared", [3]], ["CA", 3, 4, 14], ["CHR", 1, "shared", [4]], ["CA", 2, 5, 14], ["CI", 1], ["FU", 7, [0, 1, 2, 3]], ["AN", 7, 0, 5], ["FU", 7, [1, 2, 3, 4]], ["AN", 7, 1, 4], ["FU", 7, [2, 3, 4, 5]], ["AN", 7, 2, 6], ["FU", 4, [0, 1, 2, 3]], ["SP", 4, 0, 32, [1], 1], ["AN", 4, 1, 2], ["FFSP", 4, 0, [3, 2, 1, 0], 1, 1], ["AN", 4, 1, 6], ["FU", 2, [0, 1, 2, 3]], ["SP", 2, 0, 156, [2], 1], ["AN", 2, 1, 2], ["FFSP", 2, 0, [3, 2, 1, 0], 1, 1], ["AN", 2, 1, 6], ["PR", 5, 0, "auto_unroll_max_step$0"]]]], "r": [[0.00369211], 0, 2.48067, 1680256754], "v": "v0.6"}
{"i": [["[\"4b23b0dc1d1164f464c7f5544479ae4d\", [1, 28, 28, 512], [1, 1, 512, 1024], [1, 1, 1, 1024], [1, 14, 14, 1024]]", "cuda -keys=cuda,gpu -arch=sm_75 -max_num_threads=1024 -model=2080ti -thread_warp_size=32", [-1, 16, 64, 49152, 2147483647, 1024, 8, 32], "", 0, []], [[], [["SP", 3, 0, 1, [1, 1, 1, 1], 1], ["SP", 3, 5, 14, [1, 1, 1, 1], 1], ["SP", 3, 10, 14, [7, 1, 2, 1], 1], ["SP", 3, 15, 1024, [2, 16, 1, 8], 1], ["SP", 3, 20, 1, [1, 1], 1], ["SP", 3, 23, 1, [1, 1], 1], ["SP", 3, 26, 512, [4, 1], 1], ["RE", 3, [0, 5, 10, 15, 1, 6, 11, 16, 2, 7, 12, 17, 20, 23, 26, 21, 24, 27, 3, 8, 13, 18, 22, 25, 28, 4, 9, 14, 19]], ["FSP", 5, 0, 0, 3], ["FSP", 5, 4, 1, 3], ["FSP", 5, 8, 2, 3], ["FSP", 5, 12, 3, 3], ["RE", 5, [0, 4, 8, 12, 1, 5, 9, 13, 2, 6, 10, 14, 3, 7, 11, 15]], ["CA", 3, 5, 11], ["CHR", 2, "shared", [3]], ["CA", 3, 4, 14], ["CHR", 1, "shared", [4]], ["CA", 2, 5, 14], ["CI", 1], ["FU", 7, [0, 1, 2, 3]], ["AN", 7, 0, 5], ["FU", 7, [1, 2, 3, 4]], ["AN", 7, 1, 4], ["FU", 7, [2, 3, 4, 5]], ["AN", 7, 2, 6], ["FU", 4, [0, 1, 2, 3]], ["SP", 4, 0, 32, [1], 1], ["AN", 4, 1, 2], ["FFSP", 4, 0, [3, 2, 1, 0], 1, 1], ["AN", 4, 1, 6], ["FU", 2, [0, 1, 2, 3]], ["SP", 2, 0, 12, [1], 1], ["AN", 2, 1, 2], ["FFSP", 2, 0, [3, 2, 1, 0], 1, 1], ["AN", 2, 1, 6], ["PR", 5, 0, "auto_unroll_max_step$16"]]]], "r": [[0.000413984], 0, 2.46236, 1680256755], "v": "v0.6"}
{"i": [["[\"4b23b0dc1d1164f464c7f5544479ae4d\", [1, 28, 28, 512], [1, 1, 512, 1024], [1, 1, 1, 1024], [1, 14, 14, 1024]]", "cuda -keys=cuda,gpu -arch=sm_75 -max_num_threads=1024 -model=2080ti -thread_warp_size=32", [-1, 16, 64, 49152, 2147483647, 1024, 8, 32], "", 0, []], [[], [["SP", 3, 0, 1, [1, 1, 1, 1], 1], ["SP", 3, 5, 14, [1, 1, 14, 1], 1], ["SP", 3, 10, 14, [14, 1, 1, 1], 1], ["SP", 3, 15, 1024, [1, 128, 8, 1], 1], ["SP", 3, 20, 1, [1, 1], 1], ["SP", 3, 23, 1, [1, 1], 1], ["SP", 3, 26, 512, [1, 2], 1], ["RE", 3, [0, 5, 10, 15, 1, 6, 11, 16, 2, 7, 12, 17, 20, 23, 26, 21, 24, 27, 3, 8, 13, 18, 22, 25, 28, 4, 9, 14, 19]], ["FSP", 5, 0, 0, 3], ["FSP", 5, 4, 1, 3], ["FSP", 5, 8, 2, 3], ["FSP", 5, 12, 3, 3], ["RE", 5, [0, 4, 8, 12, 1, 5, 9, 13, 2, 6, 10, 14, 3, 7, 11, 15]], ["CA", 3, 5, 11], ["CHR", 2, "shared", [3]], ["CA", 3, 4, 14], ["CHR", 1, "shared", [4]], ["CA", 2, 5, 14], ["CI", 1], ["FU", 7, [0, 1, 2, 3]], ["AN", 7, 0, 5], ["FU", 7, [1, 2, 3, 4]], ["AN", 7, 1, 4], ["FU", 7, [2, 3, 4, 5]], ["AN", 7, 2, 6], ["FU", 4, [0, 1, 2, 3]], ["SP", 4, 0, 32, [1], 1], ["AN", 4, 1, 2], ["FFSP", 4, 0, [3, 2, 1, 0], 1, 1], ["AN", 4, 1, 6], ["FU", 2, [0, 1, 2, 3]], ["SP", 2, 0, 52, [1], 1], ["AN", 2, 1, 2], ["FFSP", 2, 0, [3, 2, 1, 0], 1, 1], ["AN", 2, 1, 6], ["PR", 5, 0, "auto_unroll_max_step$0"]]]], "r": [[0.00809061], 0, 1.80037, 1680256759], "v": "v0.6"}
{"i": [["[\"4b23b0dc1d1164f464c7f5544479ae4d\", [1, 28, 28, 512], [1, 1, 512, 1024], [1, 1, 1, 1024], [1, 14, 14, 1024]]", "cuda -keys=cuda,gpu -arch=sm_75 -max_num_threads=1024 -model=2080ti -thread_warp_size=32", [-1, 16, 64, 49152, 2147483647, 1024, 8, 32], "", 0, []], [[], [["SP", 3, 0, 1, [1, 1, 1, 1], 1], ["SP", 3, 5, 14, [2, 1, 7, 1], 1], ["SP", 3, 10, 14, [1, 7, 2, 1], 1], ["SP", 3, 15, 1024, [1, 8, 2, 2], 1], ["SP", 3, 20, 1, [1, 1], 1], ["SP", 3, 23, 1, [1, 1], 1], ["SP", 3, 26, 512, [8, 1], 1], ["RE", 3, [0, 5, 10, 15, 1, 6, 11, 16, 2, 7, 12, 17, 20, 23, 26, 21, 24, 27, 3, 8, 13, 18, 22, 25, 28, 4, 9, 14, 19]], ["FSP", 5, 0, 0, 3], ["FSP", 5, 4, 1, 3], ["FSP", 5, 8, 2, 3], ["FSP", 5, 12, 3, 3], ["RE", 5, [0, 4, 8, 12, 1, 5, 9, 13, 2, 6, 10, 14, 3, 7, 11, 15]], ["CA", 3, 5, 11], ["CHR", 2, "shared", [3]], ["CA", 3, 4, 14], ["CHR", 1, "shared", [4]], ["CA", 2, 5, 14], ["CI", 1], ["FU", 7, [0, 1, 2, 3]], ["AN", 7, 0, 5], ["FU", 7, [1, 2, 3, 4]], ["AN", 7, 1, 4], ["FU", 7, [2, 3, 4, 5]], ["AN", 7, 2, 6], ["FU", 4, [0, 1, 2, 3]], ["SP", 4, 0, 32, [1], 1], ["AN", 4, 1, 2], ["FFSP", 4, 0, [3, 2, 1, 0], 1, 1], ["AN", 4, 1, 6], ["FU", 2, [0, 1, 2, 3]], ["SP", 2, 0, 24, [1], 1], ["AN", 2, 1, 2], ["FFSP", 2, 0, [3, 2, 1, 0], 1, 1], ["AN", 2, 1, 6], ["PR", 5, 0, "auto_unroll_max_step$16"]]]], "r": [[0.00171916], 0, 2.10629, 1680256760], "v": "v0.6"}
{"i": [["[\"4b23b0dc1d1164f464c7f5544479ae4d\", [1, 28, 28, 512], [1, 1, 512, 1024], [1, 1, 1, 1024], [1, 14, 14, 1024]]", "cuda -keys=cuda,gpu -arch=sm_75 -max_num_threads=1024 -model=2080ti -thread_warp_size=32", [-1, 16, 64, 49152, 2147483647, 1024, 8, 32], "", 0, []], [[], [["SP", 3, 0, 1, [1, 1, 1, 1], 1], ["SP", 3, 5, 14, [1, 7, 1, 1], 1], ["SP", 3, 10, 14, [1, 7, 2, 1], 1], ["SP", 3, 15, 1024, [2, 4, 64, 1], 1], ["SP", 3, 20, 1, [1, 1], 1], ["SP", 3, 23, 1, [1, 1], 1], ["SP", 3, 26, 512, [1, 2], 1], ["RE", 3, [0, 5, 10, 15, 1, 6, 11, 16, 2, 7, 12, 17, 20, 23, 26, 21, 24, 27, 3, 8, 13, 18, 22, 25, 28, 4, 9, 14, 19]], ["FSP", 5, 0, 0, 3], ["FSP", 5, 4, 1, 3], ["FSP", 5, 8, 2, 3], ["FSP", 5, 12, 3, 3], ["RE", 5, [0, 4, 8, 12, 1, 5, 9, 13, 2, 6, 10, 14, 3, 7, 11, 15]], ["CA", 3, 5, 11], ["CHR", 2, "shared", [3]], ["CA", 3, 4, 14], ["CHR", 1, "shared", [4]], ["CA", 2, 5, 14], ["CI", 1], ["FU", 7, [0, 1, 2, 3]], ["AN", 7, 0, 5], ["FU", 7, [1, 2, 3, 4]], ["AN", 7, 1, 4], ["FU", 7, [2, 3, 4, 5]], ["AN", 7, 2, 6], ["FU", 4, [0, 1, 2, 3]], ["SP", 4, 0, 256, [1], 1], ["AN", 4, 1, 2], ["FFSP", 4, 0, [3, 2, 1, 0], 1, 1], ["AN", 4, 1, 6], ["FU", 2, [0, 1, 2, 3]], ["SP", 2, 0, 6, [1], 1], ["AN", 2, 1, 2], ["FFSP", 2, 0, [3, 2, 1, 0], 1, 1], ["AN", 2, 1, 6], ["PR", 5, 0, "auto_unroll_max_step$1024"]]]], "r": [[0.0018296], 0, 4.28804, 1680256761], "v": "v0.6"}
{"i": [["[\"4b23b0dc1d1164f464c7f5544479ae4d\", [1, 28, 28, 512], [1, 1, 512, 1024], [1, 1, 1, 1024], [1, 14, 14, 1024]]", "cuda -keys=cuda,gpu -arch=sm_75 -max_num_threads=1024 -model=2080ti -thread_warp_size=32", [-1, 16, 64, 49152, 2147483647, 1024, 8, 32], "", 0, []], [[], [["SP", 3, 0, 1, [1, 1, 1, 1], 1], ["SP", 3, 5, 14, [1, 7, 2, 1], 1], ["SP", 3, 10, 14, [1, 1, 14, 1], 1], ["SP", 3, 15, 1024, [1, 16, 32, 2], 1], ["SP", 3, 20, 1, [1, 1], 1], ["SP", 3, 23, 1, [1, 1], 1], ["SP", 3, 26, 512, [1, 1], 1], ["RE", 3, [0, 5, 10, 15, 1, 6, 11, 16, 2, 7, 12, 17, 20, 23, 26, 21, 24, 27, 3, 8, 13, 18, 22, 25, 28, 4, 9, 14, 19]], ["FSP", 5, 0, 0, 3], ["FSP", 5, 4, 1, 3], ["FSP", 5, 8, 2, 3], ["FSP", 5, 12, 3, 3], ["RE", 5, [0, 4, 8, 12, 1, 5, 9, 13, 2, 6, 10, 14, 3, 7, 11, 15]], ["CA", 3, 5, 11], ["CHR", 2, "shared", [3]], ["CA", 3, 4, 14], ["CHR", 1, "shared", [4]], ["CA", 2, 5, 14], ["CI", 1], ["FU", 7, [0, 1, 2, 3]], ["AN", 7, 0, 5], ["FU", 7, [1, 2, 3, 4]], ["AN", 7, 1, 4], ["FU", 7, [2, 3, 4, 5]], ["AN", 7, 2, 6], ["FU", 4, [0, 1, 2, 3]], ["SP", 4, 0, 64, [2], 1], ["AN", 4, 1, 2], ["FFSP", 4, 0, [3, 2, 1, 0], 1, 1], ["AN", 4, 1, 6], ["FU", 2, [0, 1, 2, 3]], ["SP", 2, 0, 9, [3], 1], ["AN", 2, 1, 2], ["FFSP", 2, 0, [3, 2, 1, 0], 1, 1], ["AN", 2, 1, 6], ["PR", 5, 0, "auto_unroll_max_step$512"]]]], "r": [[0.0234058], 0, 3.43147, 1680256762], "v": "v0.6"}
{"i": [["[\"4b23b0dc1d1164f464c7f5544479ae4d\", [1, 28, 28, 512], [1, 1, 512, 1024], [1, 1, 1, 1024], [1, 14, 14, 1024]]", "cuda -keys=cuda,gpu -arch=sm_75 -max_num_threads=1024 -model=2080ti -thread_warp_size=32", [-1, 16, 64, 49152, 2147483647, 1024, 8, 32], "", 0, []], [[], [["SP", 3, 0, 1, [1, 1, 1, 1], 1], ["SP", 3, 5, 14, [1, 2, 1, 1], 1], ["SP", 3, 10, 14, [1, 2, 7, 1], 1], ["SP", 3, 15, 1024, [2, 8, 1, 1], 1], ["SP", 3, 20, 1, [1, 1], 1], ["SP", 3, 23, 1, [1, 1], 1], ["SP", 3, 26, 512, [2, 2], 1], ["RE", 3, [0, 5, 10, 15, 1, 6, 11, 16, 2, 7, 12, 17, 20, 23, 26, 21, 24, 27, 3, 8, 13, 18, 22, 25, 28, 4, 9, 14, 19]], ["FSP", 5, 0, 0, 3], ["FSP", 5, 4, 1, 3], ["FSP", 5, 8, 2, 3], ["FSP", 5, 12, 3, 3], ["RE", 5, [0, 4, 8, 12, 1, 5, 9, 13, 2, 6, 10, 14, 3, 7, 11, 15]], ["CA", 3, 5, 11], ["CHR", 2, "shared", [3]], ["CA", 3, 4, 14], ["CHR", 1, "shared", [4]], ["CA", 2, 5, 14], ["CI", 1], ["FU", 7, [0, 1, 2, 3]], ["AN", 7, 0, 5], ["FU", 7, [1, 2, 3, 4]], ["AN", 7, 1, 4], ["FU", 7, [2, 3, 4, 5]], ["AN", 7, 2, 6], ["FU", 4, [0, 1, 2, 3]], ["SP", 4, 0, 128, [1], 1], ["AN", 4, 1, 2], ["FFSP", 4, 0, [3, 2, 1, 0], 1, 1], ["AN", 4, 1, 6], ["FU", 2, [0, 1, 2, 3]], ["SP", 2, 0, 676, [1], 1], ["AN", 2, 1, 2], ["FFSP", 2, 0, [3, 2, 1, 0], 1, 1], ["AN", 2, 1, 6], ["PR", 5, 0, "auto_unroll_max_step$16"]]]], "r": [[0.000173958], 0, 1.96455, 1680256763], "v": "v0.6"}
{"i": [["[\"4b23b0dc1d1164f464c7f5544479ae4d\", [1, 28, 28, 512], [1, 1, 512, 1024], [1, 1, 1, 1024], [1, 14, 14, 1024]]", "cuda -keys=cuda,gpu -arch=sm_75 -max_num_threads=1024 -model=2080ti -thread_warp_size=32", [-1, 16, 64, 49152, 2147483647, 1024, 8, 32], "", 0, []], [[], [["SP", 3, 0, 1, [1, 1, 1, 1], 1], ["SP", 3, 5, 14, [1, 7, 2, 1], 1], ["SP", 3, 10, 14, [1, 1, 1, 1], 1], ["SP", 3, 15, 1024, [8, 4, 2, 1], 1], ["SP", 3, 20, 1, [1, 1], 1], ["SP", 3, 23, 1, [1, 1], 1], ["SP", 3, 26, 512, [1, 64], 1], ["RE", 3, [0, 5, 10, 15, 1, 6, 11, 16, 2, 7, 12, 17, 20, 23, 26, 21, 24, 27, 3, 8, 13, 18, 22, 25, 28, 4, 9, 14, 19]], ["FSP", 5, 0, 0, 3], ["FSP", 5, 4, 1, 3], ["FSP", 5, 8, 2, 3], ["FSP", 5, 12, 3, 3], ["RE", 5, [0, 4, 8, 12, 1, 5, 9, 13, 2, 6, 10, 14, 3, 7, 11, 15]], ["CA", 3, 5, 11], ["CHR", 2, "shared", [3]], ["CA", 3, 4, 14], ["CHR", 1, "shared", [4]], ["CA", 2, 5, 14], ["CI", 1], ["FU", 7, [0, 1, 2, 3]], ["AN", 7, 0, 5], ["FU", 7, [1, 2, 3, 4]], ["AN", 7, 1, 4], ["FU", 7, [2, 3, 4, 5]], ["AN", 7, 2, 6], ["FU", 4, [0, 1, 2, 3]], ["SP", 4, 0, 128, [1], 1], ["AN", 4, 1, 2], ["FFSP", 4, 0, [3, 2, 1, 0], 1, 1], ["AN", 4, 1, 6], ["FU", 2, [0, 1, 2, 3]], ["SP", 2, 0, 192, [1], 1], ["AN", 2, 1, 2], ["FFSP", 2, 0, [3, 2, 1, 0], 1, 1], ["AN", 2, 1, 6], ["PR", 5, 0, "auto_unroll_max_step$64"]]]], "r": [[0.000277023], 0, 2.47035, 1680256764], "v": "v0.6"}
{"i": [["[\"4b23b0dc1d1164f464c7f5544479ae4d\", [1, 28, 28, 512], [1, 1, 512, 1024], [1, 1, 1, 1024], [1, 14, 14, 1024]]", "cuda -keys=cuda,gpu -arch=sm_75 -max_num_threads=1024 -model=2080ti -thread_warp_size=32", [-1, 16, 64, 49152, 2147483647, 1024, 8, 32], "", 0, []], [[], [["SP", 3, 0, 1, [1, 1, 1, 1], 1], ["SP", 3, 5, 14, [2, 1, 1, 1], 1], ["SP", 3, 10, 14, [1, 1, 1, 2], 1], ["SP", 3, 15, 1024, [1, 32, 4, 2], 1], ["SP", 3, 20, 1, [1, 1], 1], ["SP", 3, 23, 1, [1, 1], 1], ["SP", 3, 26, 512, [1, 32], 1], ["RE", 3, [0, 5, 10, 15, 1, 6, 11, 16, 2, 7, 12, 17, 20, 23, 26, 21, 24, 27, 3, 8, 13, 18, 22, 25, 28, 4, 9, 14, 19]], ["FSP", 5, 0, 0, 3], ["FSP", 5, 4, 1, 3], ["FSP", 5, 8, 2, 3], ["FSP", 5, 12, 3, 3], ["RE", 5, [0, 4, 8, 12, 1, 5, 9, 13, 2, 6, 10, 14, 3, 7, 11, 15]], ["CA", 3, 5, 11], ["CHR", 2, "shared", [3]], ["CA", 3, 4, 14], ["CHR", 1, "shared", [4]], ["CA", 2, 5, 14], ["CI", 1], ["FU", 7, [0, 1, 2, 3]], ["AN", 7, 0, 5], ["FU", 7, [1, 2, 3, 4]], ["AN", 7, 1, 4], ["FU", 7, [2, 3, 4, 5]], ["AN", 7, 2, 6], ["FU", 4, [0, 1, 2, 3]], ["SP", 4, 0, 16, [1], 1], ["AN", 4, 1, 2], ["FFSP", 4, 0, [3, 2, 1, 0], 1, 1], ["AN", 4, 1, 6], ["FU", 2, [0, 1, 2, 3]], ["SP", 2, 0, 26, [1], 1], ["AN", 2, 1, 2], ["FFSP", 2, 0, [3, 2, 1, 0], 1, 1], ["AN", 2, 1, 6], ["PR", 5, 0, "auto_unroll_max_step$1024"]]]], "r": [[0.000200451], 0, 4.51835, 1680256765], "v": "v0.6"}
{"i": [["[\"4b23b0dc1d1164f464c7f5544479ae4d\", [1, 28, 28, 512], [1, 1, 512, 1024], [1, 1, 1, 1024], [1, 14, 14, 1024]]", "cuda -keys=cuda,gpu -arch=sm_75 -max_num_threads=1024 -model=2080ti -thread_warp_size=32", [-1, 16, 64, 49152, 2147483647, 1024, 8, 32], "", 0, []], [[], [["SP", 3, 0, 1, [1, 1, 1, 1], 1], ["SP", 3, 5, 14, [2, 1, 7, 1], 1], ["SP", 3, 10, 14, [1, 1, 14, 1], 1], ["SP", 3, 15, 1024, [4, 64, 4, 1], 1], ["SP", 3, 20, 1, [1, 1], 1], ["SP", 3, 23, 1, [1, 1], 1], ["SP", 3, 26, 512, [2, 1], 1], ["RE", 3, [0, 5, 10, 15, 1, 6, 11, 16, 2, 7, 12, 17, 20, 23, 26, 21, 24, 27, 3, 8, 13, 18, 22, 25, 28, 4, 9, 14, 19]], ["FSP", 5, 0, 0, 3], ["FSP", 5, 4, 1, 3], ["FSP", 5, 8, 2, 3], ["FSP", 5, 12, 3, 3], ["RE", 5, [0, 4, 8, 12, 1, 5, 9, 13, 2, 6, 10, 14, 3, 7, 11, 15]], ["CA", 3, 5, 11], ["CHR", 2, "shared", [3]], ["CA", 3, 4, 14], ["CHR", 1, "shared", [4]], ["CA", 2, 5, 14], ["CI", 1], ["FU", 7, [0, 1, 2, 3]], ["AN", 7, 0, 5], ["FU", 7, [1, 2, 3, 4]], ["AN", 7, 1, 4], ["FU", 7, [2, 3, 4, 5]], ["AN", 7, 2, 6], ["FU", 4, [0, 1, 2, 3]], ["SP", 4, 0, 8, [1], 1], ["AN", 4, 1, 2], ["FFSP", 4, 0, [3, 2, 1, 0], 1, 1], ["AN", 4, 1, 6], ["FU", 2, [0, 1, 2, 3]], ["SP", 2, 0, 702, [1], 1], ["AN", 2, 1, 2], ["FFSP", 2, 0, [3, 2, 1, 0], 1, 1], ["AN", 2, 1, 6], ["PR", 5, 0, "auto_unroll_max_step$0"]]]], "r": [[0.0183192], 0, 2.05982, 1680256766], "v": "v0.6"}
{"i": [["[\"4b23b0dc1d1164f464c7f5544479ae4d\", [1, 28, 28, 512], [1, 1, 512, 1024], [1, 1, 1, 1024], [1, 14, 14, 1024]]", "cuda -keys=cuda,gpu -arch=sm_75 -max_num_threads=1024 -model=2080ti -thread_warp_size=32", [-1, 16, 64, 49152, 2147483647, 1024, 8, 32], "", 0, []], [[], [["SP", 3, 0, 1, [1, 1, 1, 1], 1], ["SP", 3, 5, 14, [1, 1, 1, 1], 1], ["SP", 3, 10, 14, [1, 14, 1, 1], 1], ["SP", 3, 15, 1024, [1, 2, 16, 8], 1], ["SP", 3, 20, 1, [1, 1], 1], ["SP", 3, 23, 1, [1, 1], 1], ["SP", 3, 26, 512, [2, 1], 1], ["RE", 3, [0, 5, 10, 15, 1, 6, 11, 16, 2, 7, 12, 17, 20, 23, 26, 21, 24, 27, 3, 8, 13, 18, 22, 25, 28, 4, 9, 14, 19]], ["FSP", 5, 0, 0, 3], ["FSP", 5, 4, 1, 3], ["FSP", 5, 8, 2, 3], ["FSP", 5, 12, 3, 3], ["RE", 5, [0, 4, 8, 12, 1, 5, 9, 13, 2, 6, 10, 14, 3, 7, 11, 15]], ["CA", 3, 5, 11], ["CHR", 2, "shared", [3]], ["CA", 3, 4, 14], ["CHR", 1, "shared", [4]], ["CA", 2, 5, 14], ["CI", 1], ["FU", 7, [0, 1, 2, 3]], ["AN", 7, 0, 5], ["FU", 7, [1, 2, 3, 4]], ["AN", 7, 1, 4], ["FU", 7, [2, 3, 4, 5]], ["AN", 7, 2, 6], ["FU", 4, [0, 1, 2, 3]], ["SP", 4, 0, 256, [1], 1], ["AN", 4, 1, 2], ["FFSP", 4, 0, [3, 2, 1, 0], 1, 1], ["AN", 4, 1, 6], ["FU", 2, [0, 1, 2, 3]], ["SP", 2, 0, 2, [1], 1], ["AN", 2, 1, 2], ["FFSP", 2, 0, [3, 2, 1, 0], 1, 1], ["AN", 2, 1, 6], ["PR", 5, 0, "auto_unroll_max_step$64"]]]], "r": [[0.000266856], 0, 2.07525, 1680256767], "v": "v0.6"}
{"i": [["[\"4b23b0dc1d1164f464c7f5544479ae4d\", [1, 28, 28, 512], [1, 1, 512, 1024], [1, 1, 1, 1024], [1, 14, 14, 1024]]", "cuda -keys=cuda,gpu -arch=sm_75 -max_num_threads=1024 -model=2080ti -thread_warp_size=32", [-1, 16, 64, 49152, 2147483647, 1024, 8, 32], "", 0, []], [[], [["SP", 3, 0, 1, [1, 1, 1, 1], 1], ["SP", 3, 5, 14, [2, 1, 1, 7], 1], ["SP", 3, 10, 14, [1, 1, 14, 1], 1], ["SP", 3, 15, 1024, [4, 64, 4, 1], 1], ["SP", 3, 20, 1, [1, 1], 1], ["SP", 3, 23, 1, [1, 1], 1], ["SP", 3, 26, 512, [2, 1], 1], ["RE", 3, [0, 5, 10, 15, 1, 6, 11, 16, 2, 7, 12, 17, 20, 23, 26, 21, 24, 27, 3, 8, 13, 18, 22, 25, 28, 4, 9, 14, 19]], ["FSP", 5, 0, 0, 3], ["FSP", 5, 4, 1, 3], ["FSP", 5, 8, 2, 3], ["FSP", 5, 12, 3, 3], ["RE", 5, [0, 4, 8, 12, 1, 5, 9, 13, 2, 6, 10, 14, 3, 7, 11, 15]], ["CA", 3, 5, 11], ["CHR", 2, "shared", [3]], ["CA", 3, 4, 14], ["CHR", 1, "shared", [4]], ["CA", 2, 5, 14], ["CI", 1], ["FU", 7, [0, 1, 2, 3]], ["AN", 7, 0, 5], ["FU", 7, [1, 2, 3, 4]], ["AN", 7, 1, 4], ["FU", 7, [2, 3, 4, 5]], ["AN", 7, 2, 6], ["FU", 4, [0, 1, 2, 3]], ["SP", 4, 0, 8, [1], 1], ["AN", 4, 1, 2], ["FFSP", 4, 0, [3, 2, 1, 0], 1, 1], ["AN", 4, 1, 6], ["FU", 2, [0, 1, 2, 3]], ["SP", 2, 0, 702, [1], 1], ["AN", 2, 1, 2], ["FFSP", 2, 0, [3, 2, 1, 0], 1, 1], ["AN", 2, 1, 6], ["PR", 5, 0, "auto_unroll_max_step$0"]]]], "r": [[0.0213881], 0, 1.99162, 1680256768], "v": "v0.6"}
{"i": [["[\"4b23b0dc1d1164f464c7f5544479ae4d\", [1, 28, 28, 512], [1, 1, 512, 1024], [1, 1, 1, 1024], [1, 14, 14, 1024]]", "cuda -keys=cuda,gpu -arch=sm_75 -max_num_threads=1024 -model=2080ti -thread_warp_size=32", [-1, 16, 64, 49152, 2147483647, 1024, 8, 32], "", 0, []], [[], [["SP", 3, 0, 1, [1, 1, 1, 1], 1], ["SP", 3, 5, 14, [1, 1, 1, 1], 1], ["SP", 3, 10, 14, [1, 7, 1, 2], 1], ["SP", 3, 15, 1024, [1, 8, 4, 16], 1], ["SP", 3, 20, 1, [1, 1], 1], ["SP", 3, 23, 1, [1, 1], 1], ["SP", 3, 26, 512, [2, 8], 1], ["RE", 3, [0, 5, 10, 15, 1, 6, 11, 16, 2, 7, 12, 17, 20, 23, 26, 21, 24, 27, 3, 8, 13, 18, 22, 25, 28, 4, 9, 14, 19]], ["FSP", 5, 0, 0, 3], ["FSP", 5, 4, 1, 3], ["FSP", 5, 8, 2, 3], ["FSP", 5, 12, 3, 3], ["RE", 5, [0, 4, 8, 12, 1, 5, 9, 13, 2, 6, 10, 14, 3, 7, 11, 15]], ["CA", 3, 5, 11], ["CHR", 2, "shared", [3]], ["CA", 3, 4, 14], ["CHR", 1, "shared", [4]], ["CA", 2, 5, 14], ["CI", 1], ["FU", 7, [0, 1, 2, 3]], ["AN", 7, 0, 5], ["FU", 7, [1, 2, 3, 4]], ["AN", 7, 1, 4], ["FU", 7, [2, 3, 4, 5]], ["AN", 7, 2, 6], ["FU", 4, [0, 1, 2, 3]], ["SP", 4, 0, 1024, [1], 1], ["AN", 4, 1, 2], ["FFSP", 4, 0, [3, 2, 1, 0], 1, 1], ["AN", 4, 1, 6], ["FU", 2, [0, 1, 2, 3]], ["SP", 2, 0, 48, [1], 1], ["AN", 2, 1, 2], ["FFSP", 2, 0, [3, 2, 1, 0], 1, 1], ["AN", 2, 1, 6], ["PR", 5, 0, "auto_unroll_max_step$512"]]]], "r": [[0.000528903], 0, 6.9247, 1680256769], "v": "v0.6"}
{"i": [["[\"4b23b0dc1d1164f464c7f5544479ae4d\", [1, 28, 28, 512], [1, 1, 512, 1024], [1, 1, 1, 1024], [1, 14, 14, 1024]]", "cuda -keys=cuda,gpu -arch=sm_75 -max_num_threads=1024 -model=2080ti -thread_warp_size=32", [-1, 16, 64, 49152, 2147483647, 1024, 8, 32], "", 0, []], [[], [["SP", 3, 0, 1, [1, 1, 1, 1], 1], ["SP", 3, 5, 14, [1, 7, 2, 1], 1], ["SP", 3, 10, 14, [1, 1, 1, 14], 1], ["SP", 3, 15, 1024, [1, 128, 1, 1], 1], ["SP", 3, 20, 1, [1, 1], 1], ["SP", 3, 23, 1, [1, 1], 1], ["SP", 3, 26, 512, [8, 1], 1], ["RE", 3, [0, 5, 10, 15, 1, 6, 11, 16, 2, 7, 12, 17, 20, 23, 26, 21, 24, 27, 3, 8, 13, 18, 22, 25, 28, 4, 9, 14, 19]], ["FSP", 5, 0, 0, 3], ["FSP", 5, 4, 1, 3], ["FSP", 5, 8, 2, 3], ["FSP", 5, 12, 3, 3], ["RE", 5, [0, 4, 8, 12, 1, 5, 9, 13, 2, 6, 10, 14, 3, 7, 11, 15]], ["CA", 3, 5, 11], ["CHR", 2, "shared", [3]], ["CA", 3, 4, 14], ["CHR", 1, "shared", [4]], ["CA", 2, 5, 14], ["CI", 1], ["FU", 7, [0, 1, 2, 3]], ["AN", 7, 0, 5], ["FU", 7, [1, 2, 3, 4]], ["AN", 7, 1, 4], ["FU", 7, [2, 3, 4, 5]], ["AN", 7, 2, 6], ["FU", 4, [0, 1, 2, 3]], ["SP", 4, 0, 8, [1], 1], ["AN", 4, 1, 2], ["FFSP", 4, 0, [3, 2, 1, 0], 1, 1], ["AN", 4, 1, 6], ["FU", 2, [0, 1, 2, 3]], ["SP", 2, 0, 72, [1], 1], ["AN", 2, 1, 2], ["FFSP", 2, 0, [3, 2, 1, 0], 1, 1], ["AN", 2, 1, 6], ["PR", 5, 0, "auto_unroll_max_step$64"]]]], "r": [[0.000700003], 0, 1.94057, 1680256770], "v": "v0.6"}
{"i": [["[\"4b23b0dc1d1164f464c7f5544479ae4d\", [1, 28, 28, 512], [1, 1, 512, 1024], [1, 1, 1, 1024], [1, 14, 14, 1024]]", "cuda -keys=cuda,gpu -arch=sm_75 -max_num_threads=1024 -model=2080ti -thread_warp_size=32", [-1, 16, 64, 49152, 2147483647, 1024, 8, 32], "", 0, []], [[], [["SP", 3, 0, 1, [1, 1, 1, 1], 1], ["SP", 3, 5, 14, [1, 7, 2, 1], 1], ["SP", 3, 10, 14, [1, 1, 7, 1], 1], ["SP", 3, 15, 1024, [4, 8, 1, 32], 1], ["SP", 3, 20, 1, [1, 1], 1], ["SP", 3, 23, 1, [1, 1], 1], ["SP", 3, 26, 512, [4, 1], 1], ["RE", 3, [0, 5, 10, 15, 1, 6, 11, 16, 2, 7, 12, 17, 20, 23, 26, 21, 24, 27, 3, 8, 13, 18, 22, 25, 28, 4, 9, 14, 19]], ["FSP", 5, 0, 0, 3], ["FSP", 5, 4, 1, 3], ["FSP", 5, 8, 2, 3], ["FSP", 5, 12, 3, 3], ["RE", 5, [0, 4, 8, 12, 1, 5, 9, 13, 2, 6, 10, 14, 3, 7, 11, 15]], ["CA", 3, 5, 11], ["CHR", 2, "shared", [3]], ["CA", 3, 4, 14], ["CHR", 1, "shared", [4]], ["CA", 2, 5, 14], ["CI", 1], ["FU", 7, [0, 1, 2, 3]], ["AN", 7, 0, 5], ["FU", 7, [1, 2, 3, 4]], ["AN", 7, 1, 4], ["FU", 7, [2, 3, 4, 5]], ["AN", 7, 2, 6], ["FU", 4, [0, 1, 2, 3]], ["SP", 4, 0, 128, [4], 1], ["AN", 4, 1, 2], ["FFSP", 4, 0, [3, 2, 1, 0], 1, 1], ["AN", 4, 1, 6], ["FU", 2, [0, 1, 2, 3]], ["SP", 2, 0, 52, [1], 1], ["AN", 2, 1, 2], ["FFSP", 2, 0, [3, 2, 1, 0], 1, 1], ["AN", 2, 1, 6], ["PR", 5, 0, "auto_unroll_max_step$512"]]]], "r": [[0.0104909], 0, 10.2726, 1680256770], "v": "v0.6"}
{"i": [["[\"4b23b0dc1d1164f464c7f5544479ae4d\", [1, 28, 28, 512], [1, 1, 512, 1024], [1, 1, 1, 1024], [1, 14, 14, 1024]]", "cuda -keys=cuda,gpu -arch=sm_75 -max_num_threads=1024 -model=2080ti -thread_warp_size=32", [-1, 16, 64, 49152, 2147483647, 1024, 8, 32], "", 0, []], [[], [["SP", 3, 0, 1, [1, 1, 1, 1], 1], ["SP", 3, 5, 14, [1, 7, 1, 1], 1], ["SP", 3, 10, 14, [2, 1, 1, 1], 1], ["SP", 3, 15, 1024, [1, 128, 2, 1], 1], ["SP", 3, 20, 1, [1, 1], 1], ["SP", 3, 23, 1, [1, 1], 1], ["SP", 3, 26, 512, [4, 8], 1], ["RE", 3, [0, 5, 10, 15, 1, 6, 11, 16, 2, 7, 12, 17, 20, 23, 26, 21, 24, 27, 3, 8, 13, 18, 22, 25, 28, 4, 9, 14, 19]], ["FSP", 5, 0, 0, 3], ["FSP", 5, 4, 1, 3], ["FSP", 5, 8, 2, 3], ["FSP", 5, 12, 3, 3], ["RE", 5, [0, 4, 8, 12, 1, 5, 9, 13, 2, 6, 10, 14, 3, 7, 11, 15]], ["CA", 3, 5, 11], ["CHR", 2, "shared", [3]], ["CA", 3, 4, 14], ["CHR", 1, "shared", [4]], ["CA", 2, 5, 14], ["CI", 1], ["FU", 7, [0, 1, 2, 3]], ["AN", 7, 0, 5], ["FU", 7, [1, 2, 3, 4]], ["AN", 7, 1, 4], ["FU", 7, [2, 3, 4, 5]], ["AN", 7, 2, 6], ["FU", 4, [0, 1, 2, 3]], ["SP", 4, 0, 64, [1], 1], ["AN", 4, 1, 2], ["FFSP", 4, 0, [3, 2, 1, 0], 1, 1], ["AN", 4, 1, 6], ["FU", 2, [0, 1, 2, 3]], ["SP", 2, 0, 32, [1], 1], ["AN", 2, 1, 2], ["FFSP", 2, 0, [3, 2, 1, 0], 1, 1], ["AN", 2, 1, 6], ["PR", 5, 0, "auto_unroll_max_step$16"]]]], "r": [[9.36822e-05], 0, 1.92764, 1680256771], "v": "v0.6"}
{"i": [["[\"4b23b0dc1d1164f464c7f5544479ae4d\", [1, 28, 28, 512], [1, 1, 512, 1024], [1, 1, 1, 1024], [1, 14, 14, 1024]]", "cuda -keys=cuda,gpu -arch=sm_75 -max_num_threads=1024 -model=2080ti -thread_warp_size=32", [-1, 16, 64, 49152, 2147483647, 1024, 8, 32], "", 0, []], [[], [["SP", 3, 0, 1, [1, 1, 1, 1], 1], ["SP", 3, 5, 14, [2, 1, 7, 1], 1], ["SP", 3, 10, 14, [1, 2, 7, 1], 1], ["SP", 3, 15, 1024, [4, 8, 4, 2], 1], ["SP", 3, 20, 1, [1, 1], 1], ["SP", 3, 23, 1, [1, 1], 1], ["SP", 3, 26, 512, [8, 1], 1], ["RE", 3, [0, 5, 10, 15, 1, 6, 11, 16, 2, 7, 12, 17, 20, 23, 26, 21, 24, 27, 3, 8, 13, 18, 22, 25, 28, 4, 9, 14, 19]], ["FSP", 5, 0, 0, 3], ["FSP", 5, 4, 1, 3], ["FSP", 5, 8, 2, 3], ["FSP", 5, 12, 3, 3], ["RE", 5, [0, 4, 8, 12, 1, 5, 9, 13, 2, 6, 10, 14, 3, 7, 11, 15]], ["CA", 3, 5, 11], ["CHR", 2, "shared", [3]], ["CA", 3, 4, 14], ["CHR", 1, "shared", [4]], ["CA", 2, 5, 14], ["CI", 1], ["FU", 7, [0, 1, 2, 3]], ["AN", 7, 0, 5], ["FU", 7, [1, 2, 3, 4]], ["AN", 7, 1, 4], ["FU", 7, [2, 3, 4, 5]], ["AN", 7, 2, 6], ["FU", 4, [0, 1, 2, 3]], ["SP", 4, 0, 16, [1], 1], ["AN", 4, 1, 2], ["FFSP", 4, 0, [3, 2, 1, 0], 1, 1], ["AN", 4, 1, 6], ["FU", 2, [0, 1, 2, 3]], ["SP", 2, 0, 104, [1], 1], ["AN", 2, 1, 2], ["FFSP", 2, 0, [3, 2, 1, 0], 1, 1], ["AN", 2, 1, 6], ["PR", 5, 0, "auto_unroll_max_step$16"]]]], "r": [[0.0139749], 0, 2.01588, 1680256772], "v": "v0.6"}
{"i": [["[\"4b23b0dc1d1164f464c7f5544479ae4d\", [1, 28, 28, 512], [1, 1, 512, 1024], [1, 1, 1, 1024], [1, 14, 14, 1024]]", "cuda -keys=cuda,gpu -arch=sm_75 -max_num_threads=1024 -model=2080ti -thread_warp_size=32", [-1, 16, 64, 49152, 2147483647, 1024, 8, 32], "", 0, []], [[], [["SP", 3, 0, 1, [1, 1, 1, 1], 1], ["SP", 3, 5, 14, [1, 7, 2, 1], 1], ["SP", 3, 10, 14, [1, 14, 1, 1], 1], ["SP", 3, 15, 1024, [1, 8, 4, 8], 1], ["SP", 3, 20, 1, [1, 1], 1], ["SP", 3, 23, 1, [1, 1], 1], ["SP", 3, 26, 512, [4, 2], 1], ["RE", 3, [0, 5, 10, 15, 1, 6, 11, 16, 2, 7, 12, 17, 20, 23, 26, 21, 24, 27, 3, 8, 13, 18, 22, 25, 28, 4, 9, 14, 19]], ["FSP", 5, 0, 0, 3], ["FSP", 5, 4, 1, 3], ["FSP", 5, 8, 2, 3], ["FSP", 5, 12, 3, 3], ["RE", 5, [0, 4, 8, 12, 1, 5, 9, 13, 2, 6, 10, 14, 3, 7, 11, 15]], ["CA", 3, 5, 11], ["CHR", 2, "shared", [3]], ["CA", 3, 4, 14], ["CHR", 1, "shared", [4]], ["CA", 2, 5, 14], ["CI", 1], ["FU", 7, [0, 1, 2, 3]], ["AN", 7, 0, 5], ["FU", 7, [1, 2, 3, 4]], ["AN", 7, 1, 4], ["FU", 7, [2, 3, 4, 5]], ["AN", 7, 2, 6], ["FU", 4, [0, 1, 2, 3]], ["SP", 4, 0, 256, [1], 1], ["AN", 4, 1, 2], ["FFSP", 4, 0, [3, 2, 1, 0], 1, 1], ["AN", 4, 1, 6], ["FU", 2, [0, 1, 2, 3]], ["SP", 2, 0, 24, [1], 1], ["AN", 2, 1, 2], ["FFSP", 2, 0, [3, 2, 1, 0], 1, 1], ["AN", 2, 1, 6], ["PR", 5, 0, "auto_unroll_max_step$512"]]]], "r": [[0.00322413], 0, 3.89159, 1680256773], "v": "v0.6"}
{"i": [["[\"4b23b0dc1d1164f464c7f5544479ae4d\", [1, 28, 28, 512], [1, 1, 512, 1024], [1, 1, 1, 1024], [1, 14, 14, 1024]]", "cuda -keys=cuda,gpu -arch=sm_75 -max_num_threads=1024 -model=2080ti -thread_warp_size=32", [-1, 16, 64, 49152, 2147483647, 1024, 8, 32], "", 0, []], [[], [["SP", 3, 0, 1, [1, 1, 1, 1], 1], ["SP", 3, 5, 14, [1, 1, 1, 1], 1], ["SP", 3, 10, 14, [1, 2, 7, 1], 1], ["SP", 3, 15, 1024, [8, 16, 4, 2], 1], ["SP", 3, 20, 1, [1, 1], 1], ["SP", 3, 23, 1, [1, 1], 1], ["SP", 3, 26, 512, [1, 1], 1], ["RE", 3, [0, 5, 10, 15, 1, 6, 11, 16, 2, 7, 12, 17, 20, 23, 26, 21, 24, 27, 3, 8, 13, 18, 22, 25, 28, 4, 9, 14, 19]], ["FSP", 5, 0, 0, 3], ["FSP", 5, 4, 1, 3], ["FSP", 5, 8, 2, 3], ["FSP", 5, 12, 3, 3], ["RE", 5, [0, 4, 8, 12, 1, 5, 9, 13, 2, 6, 10, 14, 3, 7, 11, 15]], ["CA", 3, 5, 11], ["CHR", 2, "shared", [3]], ["CA", 3, 4, 14], ["CHR", 1, "shared", [4]], ["CA", 2, 5, 14], ["CI", 1], ["FU", 7, [0, 1, 2, 3]], ["AN", 7, 0, 5], ["FU", 7, [1, 2, 3, 4]], ["AN", 7, 1, 4], ["FU", 7, [2, 3, 4, 5]], ["AN", 7, 2, 6], ["FU", 4, [0, 1, 2, 3]], ["SP", 4, 0, 8, [1], 1], ["AN", 4, 1, 2], ["FFSP", 4, 0, [3, 2, 1, 0], 1, 1], ["AN", 4, 1, 6], ["FU", 2, [0, 1, 2, 3]], ["SP", 2, 0, 13, [13], 1], ["AN", 2, 1, 2], ["FFSP", 2, 0, [3, 2, 1, 0], 1, 1], ["AN", 2, 1, 6], ["PR", 5, 0, "auto_unroll_max_step$16"]]]], "r": [[0.00294111], 0, 2.44263, 1680256774], "v": "v0.6"}
{"i": [["[\"4b23b0dc1d1164f464c7f5544479ae4d\", [1, 28, 28, 512], [1, 1, 512, 1024], [1, 1, 1, 1024], [1, 14, 14, 1024]]", "cuda -keys=cuda,gpu -arch=sm_75 -max_num_threads=1024 -model=2080ti -thread_warp_size=32", [-1, 16, 64, 49152, 2147483647, 1024, 8, 32], "", 0, []], [[], [["SP", 3, 0, 1, [1, 1, 1, 1], 1], ["SP", 3, 5, 14, [1, 1, 1, 7], 1], ["SP", 3, 10, 14, [1, 1, 14, 1], 1], ["SP", 3, 15, 1024, [8, 128, 1, 1], 1], ["SP", 3, 20, 1, [1, 1], 1], ["SP", 3, 23, 1, [1, 1], 1], ["SP", 3, 26, 512, [1, 1], 1], ["RE", 3, [0, 5, 10, 15, 1, 6, 11, 16, 2, 7, 12, 17, 20, 23, 26, 21, 24, 27, 3, 8, 13, 18, 22, 25, 28, 4, 9, 14, 19]], ["FSP", 5, 0, 0, 3], ["FSP", 5, 4, 1, 3], ["FSP", 5, 8, 2, 3], ["FSP", 5, 12, 3, 3], ["RE", 5, [0, 4, 8, 12, 1, 5, 9, 13, 2, 6, 10, 14, 3, 7, 11, 15]], ["CA", 3, 5, 11], ["CHR", 2, "shared", [3]], ["CA", 3, 4, 14], ["CHR", 1, "shared", [4]], ["CA", 2, 5, 14], ["CI", 1], ["FU", 7, [0, 1, 2, 3]], ["AN", 7, 0, 5], ["FU", 7, [1, 2, 3, 4]], ["AN", 7, 1, 4], ["FU", 7, [2, 3, 4, 5]], ["AN", 7, 2, 6], ["FU", 4, [0, 1, 2, 3]], ["SP", 4, 0, 2, [1], 1], ["AN", 4, 1, 2], ["FFSP", 4, 0, [3, 2, 1, 0], 1, 1], ["AN", 4, 1, 6], ["FU", 2, [0, 1, 2, 3]], ["SP", 2, 0, 351, [1], 1], ["AN", 2, 1, 2], ["FFSP", 2, 0, [3, 2, 1, 0], 1, 1], ["AN", 2, 1, 6], ["PR", 5, 0, "auto_unroll_max_step$1024"]]]], "r": [[0.0090414], 0, 3.63001, 1680256775], "v": "v0.6"}
{"i": [["[\"4b23b0dc1d1164f464c7f5544479ae4d\", [1, 28, 28, 512], [1, 1, 512, 1024], [1, 1, 1, 1024], [1, 14, 14, 1024]]", "cuda -keys=cuda,gpu -arch=sm_75 -max_num_threads=1024 -model=2080ti -thread_warp_size=32", [-1, 16, 64, 49152, 2147483647, 1024, 8, 32], "", 0, []], [[], [["SP", 3, 0, 1, [1, 1, 1, 1], 1], ["SP", 3, 5, 14, [2, 1, 7, 1], 1], ["SP", 3, 10, 14, [1, 1, 1, 2], 1], ["SP", 3, 15, 1024, [4, 32, 8, 1], 1], ["SP", 3, 20, 1, [1, 1], 1], ["SP", 3, 23, 1, [1, 1], 1], ["SP", 3, 26, 512, [4, 2], 1], ["RE", 3, [0, 5, 10, 15, 1, 6, 11, 16, 2, 7, 12, 17, 20, 23, 26, 21, 24, 27, 3, 8, 13, 18, 22, 25, 28, 4, 9, 14, 19]], ["FSP", 5, 0, 0, 3], ["FSP", 5, 4, 1, 3], ["FSP", 5, 8, 2, 3], ["FSP", 5, 12, 3, 3], ["RE", 5, [0, 4, 8, 12, 1, 5, 9, 13, 2, 6, 10, 14, 3, 7, 11, 15]], ["CA", 3, 5, 11], ["CHR", 2, "shared", [3]], ["CA", 3, 4, 14], ["CHR", 1, "shared", [4]], ["CA", 2, 5, 14], ["CI", 1], ["FU", 7, [0, 1, 2, 3]], ["AN", 7, 0, 5], ["FU", 7, [1, 2, 3, 4]], ["AN", 7, 1, 4], ["FU", 7, [2, 3, 4, 5]], ["AN", 7, 2, 6], ["FU", 4, [0, 1, 2, 3]], ["SP", 4, 0, 64, [2], 1], ["AN", 4, 1, 2], ["FFSP", 4, 0, [3, 2, 1, 0], 1, 1], ["AN", 4, 1, 6], ["FU", 2, [0, 1, 2, 3]], ["SP", 2, 0, 104, [1], 1], ["AN", 2, 1, 2], ["FFSP", 2, 0, [3, 2, 1, 0], 1, 1], ["AN", 2, 1, 6], ["PR", 5, 0, "auto_unroll_max_step$1024"]]]], "r": [[0.00223271], 0, 8.56229, 1680256776], "v": "v0.6"}
{"i": [["[\"4b23b0dc1d1164f464c7f5544479ae4d\", [1, 28, 28, 512], [1, 1, 512, 1024], [1, 1, 1, 1024], [1, 14, 14, 1024]]", "cuda -keys=cuda,gpu -arch=sm_75 -max_num_threads=1024 -model=2080ti -thread_warp_size=32", [-1, 16, 64, 49152, 2147483647, 1024, 8, 32], "", 0, []], [[], [["SP", 3, 0, 1, [1, 1, 1, 1], 1], ["SP", 3, 5, 14, [1, 1, 1, 7], 1], ["SP", 3, 10, 14, [1, 1, 1, 7], 1], ["SP", 3, 15, 1024, [1, 64, 1, 2], 1], ["SP", 3, 20, 1, [1, 1], 1], ["SP", 3, 23, 1, [1, 1], 1], ["SP", 3, 26, 512, [16, 1], 1], ["RE", 3, [0, 5, 10, 15, 1, 6, 11, 16, 2, 7, 12, 17, 20, 23, 26, 21, 24, 27, 3, 8, 13, 18, 22, 25, 28, 4, 9, 14, 19]], ["FSP", 5, 0, 0, 3], ["FSP", 5, 4, 1, 3], ["FSP", 5, 8, 2, 3], ["FSP", 5, 12, 3, 3], ["RE", 5, [0, 4, 8, 12, 1, 5, 9, 13, 2, 6, 10, 14, 3, 7, 11, 15]], ["CA", 3, 5, 11], ["CHR", 2, "shared", [3]], ["CA", 3, 4, 14], ["CHR", 1, "shared", [4]], ["CA", 2, 5, 14], ["CI", 1], ["FU", 7, [0, 1, 2, 3]], ["AN", 7, 0, 5], ["FU", 7, [1, 2, 3, 4]], ["AN", 7, 1, 4], ["FU", 7, [2, 3, 4, 5]], ["AN", 7, 2, 6], ["FU", 4, [0, 1, 2, 3]], ["SP", 4, 0, 256, [4], 1], ["AN", 4, 1, 2], ["FFSP", 4, 0, [3, 2, 1, 0], 1, 1], ["AN", 4, 1, 6], ["FU", 2, [0, 1, 2, 3]], ["SP", 2, 0, 2704, [1], 1], ["AN", 2, 1, 2], ["FFSP", 2, 0, [3, 2, 1, 0], 1, 1], ["AN", 2, 1, 6], ["PR", 5, 0, "auto_unroll_max_step$0"]]]], "r": [[0.000466442], 0, 1.8696, 1680256777], "v": "v0.6"}
{"i": [["[\"4b23b0dc1d1164f464c7f5544479ae4d\", [1, 28, 28, 512], [1, 1, 512, 1024], [1, 1, 1, 1024], [1, 14, 14, 1024]]", "cuda -keys=cuda,gpu -arch=sm_75 -max_num_threads=1024 -model=2080ti -thread_warp_size=32", [-1, 16, 64, 49152, 2147483647, 1024, 8, 32], "", 0, []], [[], [["SP", 3, 0, 1, [1, 1, 1, 1], 1], ["SP", 3, 5, 14, [1, 7, 1, 1], 1], ["SP", 3, 10, 14, [1, 7, 2, 1], 1], ["SP", 3, 15, 1024, [2, 16, 1, 8], 1], ["SP", 3, 20, 1, [1, 1], 1], ["SP", 3, 23, 1, [1, 1], 1], ["SP", 3, 26, 512, [1, 1], 1], ["RE", 3, [0, 5, 10, 15, 1, 6, 11, 16, 2, 7, 12, 17, 20, 23, 26, 21, 24, 27, 3, 8, 13, 18, 22, 25, 28, 4, 9, 14, 19]], ["FSP", 5, 0, 0, 3], ["FSP", 5, 4, 1, 3], ["FSP", 5, 8, 2, 3], ["FSP", 5, 12, 3, 3], ["RE", 5, [0, 4, 8, 12, 1, 5, 9, 13, 2, 6, 10, 14, 3, 7, 11, 15]], ["CA", 3, 5, 11], ["CHR", 2, "shared", [3]], ["CA", 3, 4, 14], ["CHR", 1, "shared", [4]], ["CA", 2, 5, 14], ["CI", 1], ["FU", 7, [0, 1, 2, 3]], ["AN", 7, 0, 5], ["FU", 7, [1, 2, 3, 4]], ["AN", 7, 1, 4], ["FU", 7, [2, 3, 4, 5]], ["AN", 7, 2, 6], ["FU", 4, [0, 1, 2, 3]], ["SP", 4, 0, 32, [1], 1], ["AN", 4, 1, 2], ["FFSP", 4, 0, [3, 2, 1, 0], 1, 1], ["AN", 4, 1, 6], ["FU", 2, [0, 1, 2, 3]], ["SP", 2, 0, 12, [1], 1], ["AN", 2, 1, 2], ["FFSP", 2, 0, [3, 2, 1, 0], 1, 1], ["AN", 2, 1, 6], ["PR", 5, 0, "auto_unroll_max_step$16"]]]], "r": [[0.00110074], 0, 1.9858, 1680256778], "v": "v0.6"}
{"i": [["[\"4b23b0dc1d1164f464c7f5544479ae4d\", [1, 28, 28, 512], [1, 1, 512, 1024], [1, 1, 1, 1024], [1, 14, 14, 1024]]", "cuda -keys=cuda,gpu -arch=sm_75 -max_num_threads=1024 -model=2080ti -thread_warp_size=32", [-1, 16, 64, 49152, 2147483647, 1024, 8, 32], "", 0, []], [[], [["SP", 3, 0, 1, [1, 1, 1, 1], 1], ["SP", 3, 5, 14, [1, 1, 1, 1], 1], ["SP", 3, 10, 14, [1, 1, 1, 1], 1], ["SP", 3, 15, 1024, [1, 32, 1, 8], 1], ["SP", 3, 20, 1, [1, 1], 1], ["SP", 3, 23, 1, [1, 1], 1], ["SP", 3, 26, 512, [2, 1], 1], ["RE", 3, [0, 5, 10, 15, 1, 6, 11, 16, 2, 7, 12, 17, 20, 23, 26, 21, 24, 27, 3, 8, 13, 18, 22, 25, 28, 4, 9, 14, 19]], ["FSP", 5, 0, 0, 3], ["FSP", 5, 4, 1, 3], ["FSP", 5, 8, 2, 3], ["FSP", 5, 12, 3, 3], ["RE", 5, [0, 4, 8, 12, 1, 5, 9, 13, 2, 6, 10, 14, 3, 7, 11, 15]], ["CA", 3, 5, 11], ["CHR", 2, "shared", [3]], ["CA", 3, 4, 14], ["CHR", 1, "shared", [4]], ["CA", 2, 5, 14], ["CI", 1], ["FU", 7, [0, 1, 2, 3]], ["AN", 7, 0, 5], ["FU", 7, [1, 2, 3, 4]], ["AN", 7, 1, 4], ["FU", 7, [2, 3, 4, 5]], ["AN", 7, 2, 6], ["FU", 4, [0, 1, 2, 3]], ["SP", 4, 0, 16, [1], 1], ["AN", 4, 1, 2], ["FFSP", 4, 0, [3, 2, 1, 0], 1, 1], ["AN", 4, 1, 6], ["FU", 2, [0, 1, 2, 3]], ["SP", 2, 0, 2, [1], 1], ["AN", 2, 1, 2], ["FFSP", 2, 0, [3, 2, 1, 0], 1, 1], ["AN", 2, 1, 6], ["PR", 5, 0, "auto_unroll_max_step$0"]]]], "r": [[0.000493777], 0, 1.66794, 1680256779], "v": "v0.6"}
{"i": [["[\"4b23b0dc1d1164f464c7f5544479ae4d\", [1, 28, 28, 512], [1, 1, 512, 1024], [1, 1, 1, 1024], [1, 14, 14, 1024]]", "cuda -keys=cuda,gpu -arch=sm_75 -max_num_threads=1024 -model=2080ti -thread_warp_size=32", [-1, 16, 64, 49152, 2147483647, 1024, 8, 32], "", 0, []], [[], [["SP", 3, 0, 1, [1, 1, 1, 1], 1], ["SP", 3, 5, 14, [1, 1, 1, 7], 1], ["SP", 3, 10, 14, [1, 1, 1, 7], 1], ["SP", 3, 15, 1024, [2, 32, 1, 4], 1], ["SP", 3, 20, 1, [1, 1], 1], ["SP", 3, 23, 1, [1, 1], 1], ["SP", 3, 26, 512, [4, 1], 1], ["RE", 3, [0, 5, 10, 15, 1, 6, 11, 16, 2, 7, 12, 17, 20, 23, 26, 21, 24, 27, 3, 8, 13, 18, 22, 25, 28, 4, 9, 14, 19]], ["FSP", 5, 0, 0, 3], ["FSP", 5, 4, 1, 3], ["FSP", 5, 8, 2, 3], ["FSP", 5, 12, 3, 3], ["RE", 5, [0, 4, 8, 12, 1, 5, 9, 13, 2, 6, 10, 14, 3, 7, 11, 15]], ["CA", 3, 5, 11], ["CHR", 2, "shared", [3]], ["CA", 3, 4, 14], ["CHR", 1, "shared", [4]], ["CA", 2, 5, 14], ["CI", 1], ["FU", 7, [0, 1, 2, 3]], ["AN", 7, 0, 5], ["FU", 7, [1, 2, 3, 4]], ["AN", 7, 1, 4], ["FU", 7, [2, 3, 4, 5]], ["AN", 7, 2, 6], ["FU", 4, [0, 1, 2, 3]], ["SP", 4, 0, 16, [1], 1], ["AN", 4, 1, 2], ["FFSP", 4, 0, [3, 2, 1, 0], 1, 1], ["AN", 4, 1, 6], ["FU", 2, [0, 1, 2, 3]], ["SP", 2, 0, 676, [1], 1], ["AN", 2, 1, 2], ["FFSP", 2, 0, [3, 2, 1, 0], 1, 1], ["AN", 2, 1, 6], ["PR", 5, 0, "auto_unroll_max_step$0"]]]], "r": [[0.00138632], 0, 1.98706, 1680256780], "v": "v0.6"}
{"i": [["[\"4b23b0dc1d1164f464c7f5544479ae4d\", [1, 28, 28, 512], [1, 1, 512, 1024], [1, 1, 1, 1024], [1, 14, 14, 1024]]", "cuda -keys=cuda,gpu -arch=sm_75 -max_num_threads=1024 -model=2080ti -thread_warp_size=32", [-1, 16, 64, 49152, 2147483647, 1024, 8, 32], "", 0, []], [[], [["SP", 3, 0, 1, [1, 1, 1, 1], 1], ["SP", 3, 5, 14, [7, 1, 2, 1], 1], ["SP", 3, 10, 14, [1, 14, 1, 1], 1], ["SP", 3, 15, 1024, [1, 16, 8, 1], 1], ["SP", 3, 20, 1, [1, 1], 1], ["SP", 3, 23, 1, [1, 1], 1], ["SP", 3, 26, 512, [1, 2], 1], ["RE", 3, [0, 5, 10, 15, 1, 6, 11, 16, 2, 7, 12, 17, 20, 23, 26, 21, 24, 27, 3, 8, 13, 18, 22, 25, 28, 4, 9, 14, 19]], ["FSP", 5, 0, 0, 3], ["FSP", 5, 4, 1, 3], ["FSP", 5, 8, 2, 3], ["FSP", 5, 12, 3, 3], ["RE", 5, [0, 4, 8, 12, 1, 5, 9, 13, 2, 6, 10, 14, 3, 7, 11, 15]], ["CA", 3, 5, 11], ["CHR", 2, "shared", [3]], ["CA", 3, 4, 14], ["CHR", 1, "shared", [4]], ["CA", 2, 5, 14], ["CI", 1], ["FU", 7, [0, 1, 2, 3]], ["AN", 7, 0, 5], ["FU", 7, [1, 2, 3, 4]], ["AN", 7, 1, 4], ["FU", 7, [2, 3, 4, 5]], ["AN", 7, 2, 6], ["FU", 4, [0, 1, 2, 3]], ["SP", 4, 0, 16, [1], 1], ["AN", 4, 1, 2], ["FFSP", 4, 0, [3, 2, 1, 0], 1, 1], ["AN", 4, 1, 6], ["FU", 2, [0, 1, 2, 3]], ["SP", 2, 0, 54, [1], 1], ["AN", 2, 1, 2], ["FFSP", 2, 0, [3, 2, 1, 0], 1, 1], ["AN", 2, 1, 6], ["PR", 5, 0, "auto_unroll_max_step$0"]]]], "r": [[0.000586111], 0, 2.02595, 1680256781], "v": "v0.6"}
{"i": [["[\"4b23b0dc1d1164f464c7f5544479ae4d\", [1, 28, 28, 512], [1, 1, 512, 1024], [1, 1, 1, 1024], [1, 14, 14, 1024]]", "cuda -keys=cuda,gpu -arch=sm_75 -max_num_threads=1024 -model=2080ti -thread_warp_size=32", [-1, 16, 64, 49152, 2147483647, 1024, 8, 32], "", 0, []], [[], [["SP", 3, 0, 1, [1, 1, 1, 1], 1], ["SP", 3, 5, 14, [2, 1, 7, 1], 1], ["SP", 3, 10, 14, [1, 1, 1, 1], 1], ["SP", 3, 15, 1024, [4, 32, 8, 1], 1], ["SP", 3, 20, 1, [1, 1], 1], ["SP", 3, 23, 1, [1, 1], 1], ["SP", 3, 26, 512, [4, 2], 1], ["RE", 3, [0, 5, 10, 15, 1, 6, 11, 16, 2, 7, 12, 17, 20, 23, 26, 21, 24, 27, 3, 8, 13, 18, 22, 25, 28, 4, 9, 14, 19]], ["FSP", 5, 0, 0, 3], ["FSP", 5, 4, 1, 3], ["FSP", 5, 8, 2, 3], ["FSP", 5, 12, 3, 3], ["RE", 5, [0, 4, 8, 12, 1, 5, 9, 13, 2, 6, 10, 14, 3, 7, 11, 15]], ["CA", 3, 5, 11], ["CHR", 2, "shared", [3]], ["CA", 3, 4, 14], ["CHR", 1, "shared", [4]], ["CA", 2, 5, 14], ["CI", 1], ["FU", 7, [0, 1, 2, 3]], ["AN", 7, 0, 5], ["FU", 7, [1, 2, 3, 4]], ["AN", 7, 1, 4], ["FU", 7, [2, 3, 4, 5]], ["AN", 7, 2, 6], ["FU", 4, [0, 1, 2, 3]], ["SP", 4, 0, 64, [1], 1], ["AN", 4, 1, 2], ["FFSP", 4, 0, [3, 2, 1, 0], 1, 1], ["AN", 4, 1, 6], ["FU", 2, [0, 1, 2, 3]], ["SP", 2, 0, 104, [1], 1], ["AN", 2, 1, 2], ["FFSP", 2, 0, [3, 2, 1, 0], 1, 1], ["AN", 2, 1, 6], ["PR", 5, 0, "auto_unroll_max_step$0"]]]], "r": [[0.000934081], 0, 2.00463, 1680256782], "v": "v0.6"}
{"i": [["[\"4b23b0dc1d1164f464c7f5544479ae4d\", [1, 28, 28, 512], [1, 1, 512, 1024], [1, 1, 1, 1024], [1, 14, 14, 1024]]", "cuda -keys=cuda,gpu -arch=sm_75 -max_num_threads=1024 -model=2080ti -thread_warp_size=32", [-1, 16, 64, 49152, 2147483647, 1024, 8, 32], "", 0, []], [[], [["SP", 3, 0, 1, [1, 1, 1, 1], 1], ["SP", 3, 5, 14, [1, 7, 2, 1], 1], ["SP", 3, 10, 14, [1, 1, 1, 1], 1], ["SP", 3, 15, 1024, [4, 16, 4, 4], 1], ["SP", 3, 20, 1, [1, 1], 1], ["SP", 3, 23, 1, [1, 1], 1], ["SP", 3, 26, 512, [4, 1], 1], ["RE", 3, [0, 5, 10, 15, 1, 6, 11, 16, 2, 7, 12, 17, 20, 23, 26, 21, 24, 27, 3, 8, 13, 18, 22, 25, 28, 4, 9, 14, 19]], ["FSP", 5, 0, 0, 3], ["FSP", 5, 4, 1, 3], ["FSP", 5, 8, 2, 3], ["FSP", 5, 12, 3, 3], ["RE", 5, [0, 4, 8, 12, 1, 5, 9, 13, 2, 6, 10, 14, 3, 7, 11, 15]], ["CA", 3, 5, 11], ["CHR", 2, "shared", [3]], ["CA", 3, 4, 14], ["CHR", 1, "shared", [4]], ["CA", 2, 5, 14], ["CI", 1], ["FU", 7, [0, 1, 2, 3]], ["AN", 7, 0, 5], ["FU", 7, [1, 2, 3, 4]], ["AN", 7, 1, 4], ["FU", 7, [2, 3, 4, 5]], ["AN", 7, 2, 6], ["FU", 4, [0, 1, 2, 3]], ["SP", 4, 0, 64, [1], 1], ["AN", 4, 1, 2], ["FFSP", 4, 0, [3, 2, 1, 0], 1, 1], ["AN", 4, 1, 6], ["FU", 2, [0, 1, 2, 3]], ["SP", 2, 0, 12, [1], 1], ["AN", 2, 1, 2], ["FFSP", 2, 0, [3, 2, 1, 0], 1, 1], ["AN", 2, 1, 6], ["PR", 5, 0, "auto_unroll_max_step$512"]]]], "r": [[0.000493018], 0, 2.95703, 1680256784], "v": "v0.6"}
{"i": [["[\"4b23b0dc1d1164f464c7f5544479ae4d\", [1, 28, 28, 512], [1, 1, 512, 1024], [1, 1, 1, 1024], [1, 14, 14, 1024]]", "cuda -keys=cuda,gpu -arch=sm_75 -max_num_threads=1024 -model=2080ti -thread_warp_size=32", [-1, 16, 64, 49152, 2147483647, 1024, 8, 32], "", 0, []], [[], [["SP", 3, 0, 1, [1, 1, 1, 1], 1], ["SP", 3, 5, 14, [1, 1, 1, 7], 1], ["SP", 3, 10, 14, [1, 1, 14, 1], 1], ["SP", 3, 15, 1024, [4, 128, 1, 2], 1], ["SP", 3, 20, 1, [1, 1], 1], ["SP", 3, 23, 1, [1, 1], 1], ["SP", 3, 26, 512, [1, 1], 1], ["RE", 3, [0, 5, 10, 15, 1, 6, 11, 16, 2, 7, 12, 17, 20, 23, 26, 21, 24, 27, 3, 8, 13, 18, 22, 25, 28, 4, 9, 14, 19]], ["FSP", 5, 0, 0, 3], ["FSP", 5, 4, 1, 3], ["FSP", 5, 8, 2, 3], ["FSP", 5, 12, 3, 3], ["RE", 5, [0, 4, 8, 12, 1, 5, 9, 13, 2, 6, 10, 14, 3, 7, 11, 15]], ["CA", 3, 5, 11], ["CHR", 2, "shared", [3]], ["CA", 3, 4, 14], ["CHR", 1, "shared", [4]], ["CA", 2, 5, 14], ["CI", 1], ["FU", 7, [0, 1, 2, 3]], ["AN", 7, 0, 5], ["FU", 7, [1, 2, 3, 4]], ["AN", 7, 1, 4], ["FU", 7, [2, 3, 4, 5]], ["AN", 7, 2, 6], ["FU", 4, [0, 1, 2, 3]], ["SP", 4, 0, 2, [1], 1], ["AN", 4, 1, 2], ["FFSP", 4, 0, [3, 2, 1, 0], 1, 1], ["AN", 4, 1, 6], ["FU", 2, [0, 1, 2, 3]], ["SP", 2, 0, 351, [1], 1], ["AN", 2, 1, 2], ["FFSP", 2, 0, [3, 2, 1, 0], 1, 1], ["AN", 2, 1, 6], ["PR", 5, 0, "auto_unroll_max_step$1024"]]]], "r": [[0.0110494], 0, 3.91951, 1680256784], "v": "v0.6"}
{"i": [["[\"4b23b0dc1d1164f464c7f5544479ae4d\", [1, 28, 28, 512], [1, 1, 512, 1024], [1, 1, 1, 1024], [1, 14, 14, 1024]]", "cuda -keys=cuda,gpu -arch=sm_75 -max_num_threads=1024 -model=2080ti -thread_warp_size=32", [-1, 16, 64, 49152, 2147483647, 1024, 8, 32], "", 0, []], [[], [["SP", 3, 0, 1, [1, 1, 1, 1], 1], ["SP", 3, 5, 14, [1, 1, 1, 2], 1], ["SP", 3, 10, 14, [2, 1, 7, 1], 1], ["SP", 3, 15, 1024, [1, 32, 8, 2], 1], ["SP", 3, 20, 1, [1, 1], 1], ["SP", 3, 23, 1, [1, 1], 1], ["SP", 3, 26, 512, [2, 4], 1], ["RE", 3, [0, 5, 10, 15, 1, 6, 11, 16, 2, 7, 12, 17, 20, 23, 26, 21, 24, 27, 3, 8, 13, 18, 22, 25, 28, 4, 9, 14, 19]], ["FSP", 5, 0, 0, 3], ["FSP", 5, 4, 1, 3], ["FSP", 5, 8, 2, 3], ["FSP", 5, 12, 3, 3], ["RE", 5, [0, 4, 8, 12, 1, 5, 9, 13, 2, 6, 10, 14, 3, 7, 11, 15]], ["CA", 3, 5, 11], ["CHR", 2, "shared", [3]], ["CA", 3, 4, 14], ["CHR", 1, "shared", [4]], ["CA", 2, 5, 14], ["CI", 1], ["FU", 7, [0, 1, 2, 3]], ["AN", 7, 0, 5], ["FU", 7, [1, 2, 3, 4]], ["AN", 7, 1, 4], ["FU", 7, [2, 3, 4, 5]], ["AN", 7, 2, 6], ["FU", 4, [0, 1, 2, 3]], ["SP", 4, 0, 16, [1], 1], ["AN", 4, 1, 2], ["FFSP", 4, 0, [3, 2, 1, 0], 1, 1], ["AN", 4, 1, 6], ["FU", 2, [0, 1, 2, 3]], ["SP", 2, 0, 312, [1], 1], ["AN", 2, 1, 2], ["FFSP", 2, 0, [3, 2, 1, 0], 1, 1], ["AN", 2, 1, 6], ["PR", 5, 0, "auto_unroll_max_step$64"]]]], "r": [[0.000682888], 0, 2.41379, 1680256785], "v": "v0.6"}
